ID_KA;ID_KU;ACRONYM;NAME;DATE;LOCATION;DEADLINE (unused);;CONGRESS_ID;DEADLINE
100;1000;CEVVE 2021;2021 International Conference on Electric Vehicle and Vehicle Engineering (CEVVE 2021);Sep 17, 2021 - Sep 19, 2021;Frankfurt, Germany;Jul 31, 2021;31/07/2021;1;2021-07-31
100;1000;ACNS 2021;19th International Conference on Applied Cryptography and Network Security;Jun 21, 2021 - Jun 24, 2021;Kamakura, Japan;Jan 15, 2021;15/01/2021;2;2021-01-15
100;1000;IJCIS 2021;International Journal on Cryptography and Information Security;N/A;N/A;Feb 20, 2021;20/02/2021;3;2021-02-20
100;1000;SECRYPT 2021;18th International Conference on Security and Cryptography;Jul 6, 2021 - Jul 8, 2021;Online Streaming;Apr 1, 2021;1/04/2021;4;2021-04-01
100;1000;IJNSA 2021;International Journal of Network Security & Its Applications- ERA Listed;N/A;N/A;Feb 20, 2021;20/02/2021;5;2021-02-20
100;1000;CAIJ 2021;Computer Applications: An International Journal;N/A;N/A;Feb 20, 2021;20/02/2021;6;2021-02-20
100;1000;EAI AC3 2021;EAI International Conference on Applied Cryptography in Computer and Communications;May 15, 2021 - May 16, 2021;Xiamen, People's Republic of China;Jan 7, 2021;7/01/2021;7;2021-01-07
100;1000;PDCTA 2021;10th International Conference on Parallel, Distributed Computing Technologies and Applications;May 29, 2021 - May 30, 2021;Vancouver, Canada;Feb 20, 2021;20/02/2021;8;2021-02-20
100;1000;CRIS 2021;7th International Conference on Cryptography and Information Security;Mar 27, 2021 - Mar 28, 2021;Sydney, Australia;Feb 20, 2021;20/02/2021;9;2021-02-20
100;1000;Scopus-MSME 2021;The 4th International Conference on Materials Science and Manufacturing Engineering;Nov 5, 2021 - Nov 7, 2021;Beijing, China;May 15, 2021;15/05/2021;10;2021-05-15
100;1000;CTCM 2021;7th International Conference of Control Theory and Computer Modelling;Oct 23, 2021 - Oct 24, 2021;Sydney, Australia;Feb 20, 2021;20/02/2021;11;2021-02-20
100;1000;CSEIJ 2021;Computer Science & Engineering: An International Journal;N/A;N/A;Feb 20, 2021;20/02/2021;12;2021-02-20
100;1000;CRYPIS 2021;10th International Conference on Cryptography and Information Security;Jun 26, 2021 - Jun 27, 2021;Sydney, Australia;Feb 27, 2021;27/02/2021;13;2021-02-27
100;1000;ISDFS 2021;9th International Symposium on Digital Forensics and Security;Jun 28, 2021 - Jun 29, 2021;Elazig, Turkey and Online;Apr 2, 2021;2/04/2021;14;2021-04-02
100;1000;CSP--IEEE, Scopus, Ei 2021;IEEE--2021 5th International Conference on Cryptography, Security and Privacy (CSP 2021)--Scopus, Ei Compendex;Jan 8, 2021 - Jan 10, 2021;Zhuhai, China;Nov 20, 2020;20/11/2020;15;2020-11-20
100;1000;IJITMC 2021;The International Journal of Information Technology, Modeling and Computing;N/A;N/A;Feb 20, 2021;20/02/2021;16;2021-02-20
100;1000;EMSA 2021;10th International Conference on Embedded Systems and Applications;Jun 19, 2021 - Jun 20, 2021;Copenhagen, Denmark;Feb 27, 2021;27/02/2021;17;2021-02-27
100;1000;Mal-IoT 2021;6th International Workshop on Malicious Software and Hardware in the Internet of Things;May 11, 2021 - May 11, 2021;Virtual event;Feb 20, 2021;20/02/2021;18;2021-02-20
100;1000;IEEE--CSP--Scopus, Ei Compendex 2021;IEEE--2021 5th International Conference on Cryptography, Security and Privacy (CSP 2021)--Scopus, Ei Compendex;Jan 8, 2021 - Jan 10, 2021;Zhuhai, China;Nov 20, 2020;20/11/2020;19;2020-11-20
100;1000;EEIEJ 2021;Emerging Trends in Electrical, Electronics & Instrumentation Engineering: An international Journal;N/A;N/A;Feb 20, 2021;20/02/2021;20;2021-02-20
100;1000;CST 2021;8th International Conference on Foundations of Computer Science & Technology;Dec 23, 2021 - Dec 24, 2021;Sydney, Australia;Mar 13, 2021;13/03/2021;21;2021-03-13
100;1000;IJCSITY 2021;International Journal of Computational Science and Information Technology;N/A;N/A;Feb 20, 2021;20/02/2021;22;2021-02-20
100;1000;APKC 2021;The 8th ACM ASIA Public-Key Cryptography Workshop;Jun 7, 2021 - Jun 11, 2021;Hong Kong, China;Jan 8, 2021;8/01/2021;23;2021-01-08
100;1000;IJWesT 2021;International Journal of Web & Semantic Technology;N/A;N/A;Feb 20, 2021;20/02/2021;24;2021-02-20
100;1000;Cyber Systems at HICSS 2021;Cyber Systems: Their Science, Engineering, and Security;Jan 5, 2021 - Jan 8, 2021;Kauai, HI, USA;Jun 15, 2020 (Oct 1, 2020);15/06/2020;25;2020-06-15
100;1000;IEEE OJ-CS Special Section 2021;Special Section on Cybersecurity: Privacy, Attack, and Defense;N/A;N/A;Jul 31, 2020;31/07/2020;26;2020-07-31
100;1001;EICC 2021;European Interdisciplinary Cybersecurity Conference (EICC 2021);Nov 10, 2021 - Nov 11, 2021;Targu Mures, Romania;Jun 14, 2021;14/06/2021;27;2021-06-14
100;1001;ISDFS 2021;9th International Symposium on Digital Forensics and Security;Jun 28, 2021 - Jun 29, 2021;Elazig, Turkey and Online;Apr 2, 2021;2/04/2021;28;2021-04-02
100;1001;CfW EICC 2021;Call for Workshops: European Interdisciplinary Cybersecurity Conference (EICC 2021);Nov 10, 2021 - Nov 11, 2021;Targu Mures, Romania;Mar 15, 2021;15/03/2021;29;2021-03-15
100;1001;ISC HPC 2021;ISC HIGH PERFORMANCE 2021 DIGITAL;Jun 24, 2021 - Jul 2, 2021;Digital;Dec 21, 2021 (Dec 14, 2020);21/12/2021;30;2021-12-21
100;1001;DSD 2021;Euromicro Conference on Digital System Design (DSD) 2021;Sep 6, 2021 - Sep 8, 2021;Palermo, Sicily, Italy;Apr 1, 2021;1/04/2021;31;2021-04-01
100;1001;TPDL 2021;25th International Conference on Theory and Practice of Digital Libraries;Sep 13, 2021 - Sep 17, 2021;Online;Apr 14, 2021;14/04/2021;32;2021-04-14
100;1001;IWBF 2021;9th IEEE International Workshop on Biometrics and Forensics (IWBF) 2021;May 6, 2021 - May 7, 2021;Rome, Italy;Feb 28, 2021;28/02/2021;33;2021-02-28
100;1001;JoWUA SI 2021;JoWUA Special Issue on Multidisciplinary Solutions to Modern Cybersecurity Challenges;Apr 15, 2020 - Feb 3, 2022;online;Apr 15, 2021;15/04/2021;34;2021-04-15
100;1001;ICCSE 2021;The 16th International Conference on Computer Science and Education;Aug 17, 2021 - Aug 21, 2021;Lancaster;Apr 15, 2021;15/04/2021;35;2021-04-15
100;1001;CYBER 2021;The Sixth International Conference on Cyber-Technologies and Cyber-Systems;Oct 3, 2021 - Oct 7, 2021;Barcelona, Spain;Jul 5, 2021;5/07/2021;36;2021-07-05
100;1001;ICDS 2021;The Fifteenth International Conference on Digital Society;Jul 18, 2021 - Jul 22, 2021;Nice, France;Apr 19, 2021;19/04/2021;37;2021-04-19
100;1001;ADIP--EI Compendex, Scopus 2021;2021 3rd Asia Digital Image Processing Conference (ADIP 2021)--EI Compendex, Scopus;Dec 17, 2021 - Dec 19, 2021;Kyoto, Japan;Aug 5, 2021;5/08/2021;38;2021-08-05
100;1001;ADIP--EI, Scopus 2021;2021 3rd Asia Digital Image Processing Conference (ADIP 2021)--EI Compendex, Scopus;Dec 17, 2021 - Dec 19, 2021;Kyoto, Japan;Aug 5, 2021;5/08/2021;39;2021-08-05
100;1001;MEDES 2021;The 13th International ACM Conference on Management of Digital EcoSystems;Nov 1, 2021 - Nov 3, 2021;Hammamet - Tunisia;May 24, 2021;24/05/2021;40;2021-05-24
100;1001;AI4DE 2021;Trustworthy AI for Digital Engineering Transformation - Special Issue of JIDPS - Trans. SDPS;N/A;N/A;Mar 31, 2021;31/03/2021;41;2021-03-31
100;1001;IADSDTP 2021;Interdisciplinary Approaches in Data Science and Digital Transformation Practice / in the scope of KES 2021;Sep 8, 2021 - Sep 10, 2021;Szczecin, Poland;Apr 2, 2021;2/04/2021;42;2021-04-02
100;1001;ICDIP--SPIE, Ei, Scopus 2021;SPIE--2021 The 13th International Conference on Digital Image Processing (ICDIP 2021)--Ei compendex, Scopus;May 20, 2021 - May 23, 2021;Singapore;Mar 15, 2021;15/03/2021;43;2021-03-15
100;1001;SDLDIP 2021;Special Issue on Sensors and Deep Learning for Digital Image Processing;N/A;N/A;Mar 31, 2021;31/03/2021;44;2021-03-31
100;1001;MEDES 2021;The 13th International Conference on Management of Digital EcoSystems;Nov 1, 2021 - Nov 3, 2021;Hammamet - Tunisia;May 24, 2021;24/05/2021;45;2021-05-24
100;1001;Frontiers VR 2021;Frontiers in Virtual Reality : Creating Lifelike Digital Humans;N/A;N/A;Mar 15, 2021;15/03/2021;46;2021-03-15
100;1001;ICDTE--EI and Scopus 2021;2021 5th International Conference on Digital Technology in Education (ICDTE 2021)--Ei Compendex, Scopus;Sep 15, 2021 - Sep 17, 2021;Busan, South Korea;Apr 5, 2021;5/04/2021;47;2021-04-05
100;1001;EAI CyDiP (virtual) 2021;EAI International Conference on Emerging Technologies of Cybersecurity and Digital Privacy (online conference);Oct 18, 2021 - Oct 19, 2021;Cyberspace;Apr 19, 2021;19/04/2021;48;2021-04-19
100;1001;DigEx 2021;3rd International Workshop on Transforming the Digital Customer Experience;Jun 15, 2021 - Jun 17, 2021;Hannover, Germany;Apr 20, 2021;20/04/2021;49;2021-04-20
100;1001;SPIE--ICDIP--Ei Compendex, Scopus 2021;SPIE--2021 The 13th International Conference on Digital Image Processing (ICDIP 2021)--Ei compendex, Scopus;May 20, 2021 - May 23, 2021;Singapore;Mar 15, 2021;15/03/2021;50;2021-03-15
100;1001;MoTra 2021;MoTra21: Workshop on Modelling Translation: Translatology in the Digital Age;May 31, 2021 - Jun 2, 2021;Online;Mar 22, 2021;22/03/2021;51;2021-03-22
100;1001;SCOPUS/CPCI-CGDIP 2021;5th International Conference on Computer Graphics and Digital Image Processing (CGDIP 2021);Jul 8, 2021 - Jul 10, 2021;Athens, Greece;Mar 10, 2021;10/03/2021;52;2021-03-10
100;1001;ICDTE--EI Compendex and Scopus 2021;2021 5th International Conference on Digital Technology in Education (ICDTE 2021)--Ei Compendex, Scopus;Sep 15, 2021 - Sep 17, 2021;Busan, South Korea;Apr 5, 2021;5/04/2021;53;2021-04-05
100;1001;ACM--DMIP--EI Compendex, Scopus 2021;ACM--2021 the 3rd International Conference on Digital Media and Information Processing (DMIP 2021)--EI Compendex, Scopus;Sep 24, 2021 - Sep 26, 2021;Xiamen, China;Apr 10, 2021;10/04/2021;54;2021-04-10
100;1001;DMIP--ACM, Ei and Scopus 2021;ACM--2021 the 3rd International Conference on Digital Media and Information Processing (DMIP 2021)--EI Compendex, Scopus;Sep 24, 2021 - Sep 26, 2021;Xiamen, China;Apr 10, 2021;10/04/2021;55;2021-04-10
100;1001;NIDS 2021;NOVELTIES IN INTELLIGENT DIGITAL SYSTEMS 2021;Sep 30, 2021 - Oct 1, 2021;ATHENS, GREECE;Apr 11, 2021;11/04/2021;56;2021-04-11
100;1001;Ecofeminism and Literature 2021;Routledge Handbook of Ecofeminism and Literature;Mar 25, 2021 - Mar 25, 2021;N/A;Mar 25, 2021;25/03/2021;57;2021-03-25
100;1001;Binary Modernisms 2021;Binary Modernisms: Re/Appropriations of Modernist Art in the Digital Age;N/A;N/A;Mar 14, 2021;14/03/2021;58;2021-03-14
100;1001;CGDIP-SCOPUS 2021;5th International Conference on Computer Graphics and Digital Image Processing (CGDIP 2021);Jul 8, 2021 - Jul 10, 2021;Athens, Greece;Mar 10, 2021;10/03/2021;59;2021-03-10
100;1001;SADFE 2021;Systematic Approaches to Digital Forensic Engineering (SADFE) at 2021 IEEE S&P;May 27, 2021 - May 27, 2021;Viirtual - co-hosted at IEEE 2021 S&P;Feb 5, 2021;5/02/2021;60;2021-02-05
100;1001;Polizeiinformatik 2021;The sixth conference for lecturers and researchers in computer science and information technology in law enforcement;Apr 20, 2021 - Apr 20, 2021;Virtual;Dec 13, 2020;13/12/2020;61;2020-12-13
100;1001;DFRWS EU 2021;Digital Forensics Research Workshop EU 2021 - EXTENDED DEADLINE;Mar 29, 2021 - Apr 1, 2021;Cyberspace;Oct 14, 2020;14/10/2020;62;2020-10-14
100;1002;ICDM 2021;21st IEEE International Conference on Data Mining;Dec 7, 2021 - Dec 10, 2021;Auckland, New Zealand;Jun 11, 2021;11/06/2021;63;2021-06-11
100;1002;MDPI-SI-BDHA 2021;Call for Papers: Special Issue “Big Data for eHealth Applications” (MDPI Applied Sciences, IF 2.474 – Indexed on Scopus, Web of Science);N/A;N/A;Sep 15, 2021;15/09/2021;64;2021-09-15
100;1002;DATA ANALYTICS 2021;The Tenth International Conference on Data Analytics;Oct 3, 2021 - Oct 7, 2021;Barcelona, Spain;Jul 5, 2021;5/07/2021;65;2021-07-05
100;1002;ML_BDA 2021;Special Issue on Machine Learning Technologies for Big Data Analytics;N/A;N/A;Aug 15, 2021;15/08/2021;66;2021-08-15
100;1002;IEEE DSAA 2021;8th IEEE International Conference on Data Science and Advanced Analytics;Oct 6, 2021 - Oct 9, 2021;Porto, Portugal;May 23, 2021;23/05/2021;67;2021-05-23
100;1002;BDIoT 2021;5th International Conference on Big Data and Internet of Things - BDIoT’21;Mar 17, 2021 - Mar 18, 2021;Rabat - Morocco;Dec 1, 2021;1/12/2021;68;2021-12-01
100;1002;iDSC 2021;4th International Data Science Conference;Oct 20, 2021 - Oct 22, 2021;Vienna;Jun 20, 2021;20/06/2021;69;2021-06-20
100;1002;ISC HPC 2021;ISC HIGH PERFORMANCE 2021 DIGITAL;Jun 24, 2021 - Jul 2, 2021;Digital;Dec 21, 2021 (Dec 14, 2020);21/12/2021;70;2021-12-21
100;1002;IEEE SSCI 2021;2021 IEEE Symposium Series on Computational Intelligence;Dec 5, 2021 - Dec 8, 2021;Orlando, Florida, USA;Aug 6, 2021;6/08/2021;71;2021-08-06
100;1002;ICSRS--Scopus & EI Compendex 2021;2021 5th International Conference on System Reliability and Safety (ICSRS 2021)--Scopus & EI Compendex;Nov 24, 2021 - Nov 26, 2021;Palermo, Italy;Jul 5, 2021;5/07/2021;72;2021-07-05
100;1002;ai4i 2021;Artificial Intelligence for Industries (ai4i 2021);Sep 20, 2021 - Sep 22, 2021;Laguna Hills, California, USA;Jul 1, 2021;1/07/2021;73;2021-07-01
100;1002;SOFSEM 2021;47th International Conference on Current Trends in Theory and Practice of Computer Science;Jan 25, 2021 - Jan 28, 2021;Bozen-Bolzano, Italy;Aug 3, 2021 (Jul 27, 2021);3/08/2021;74;2021-08-03
100;1002;Scopus-ICDPR 2022;The 6th International Conference on Data Processing and Robotics (ICDPR 2022);Jan 6, 2022 - Jan 8, 2022;Hokkaido, Japan;Jul 5, 2021;5/07/2021;75;2021-07-05
100;1002;Mapping_Monitoring_Wetlands 2021;[Water] (IF: 2.544, ISSN 2073-4441) Special Issue: Mapping and Monitoring of Wetlands;N/A;N/A;Nov 30, 2021;30/11/2021;76;2021-11-30
100;1002;ICBDB 2021;2021 3rd International Conference on Big Data and Blockchain(ICBDB 2021);Dec 3, 2021 - Dec 5, 2021;Beijing, China;Oct 30, 2021;30/10/2021;77;2021-10-30
100;1002;EI-WBDC 2021;2021 3rd International Workshop on Big Data and Computing(WBDC 2021);Dec 3, 2021 - Dec 5, 2021;Beijing, China;Oct 31, 2021;31/10/2021;78;2021-10-31
100;1002;AICCC--EI, Scopus 2021;2021 4th Artificial Intelligence and Cloud Computing Conference (AICCC 2021)--EI Compendex, Scopus;Dec 17, 2021 - Dec 19, 2021;Kyoto, Japan;Aug 5, 2021;5/08/2021;79;2021-08-05
100;1002;BigMM 2021;IEEE International Conference on Multimedia Big Data 2021;Nov 15, 2021 - Nov 17, 2021;Taichung, Taiwan;Aug 9, 2021;9/08/2021;80;2021-08-09
100;1002;ICBICC 2021;2021 3rd International Conference on Big Data, IoT, and Cloud Computing (ICBICC 2021);Nov 12, 2021 - Nov 14, 2021;Rome, Italy;Sep 30, 2021;30/09/2021;81;2021-09-30
100;1002;ICPM 2021;3rd International Conference on Process Mining;Oct 31, 2021 - Nov 4, 2021;Eindhoven;Jul 1, 2021 (Jun 15, 2021);1/07/2021;82;2021-07-01
100;1002;BDSIC--EI Compendex, Scopus 2021;2021 3rd International Conference on Big-data Service and Intelligent Computation (BDSIC 2021)--Ei Compendex, Scopus;Nov 19, 2021 - Nov 21, 2021;HuaQiao University, Xiamen?China;Jul 5, 2021;5/07/2021;83;2021-07-05
100;1002;BDSIC--EI, Scopus 2021;2021 3rd International Conference on Big-data Service and Intelligent Computation (BDSIC 2021)--Ei Compendex, Scopus;Nov 19, 2021 - Nov 21, 2021;HuaQiao University, Xiamen?China;Jul 5, 2021;5/07/2021;84;2021-07-05
100;1002;CCEAI-Scopus 2022;The 6th International Conference on Control Engineering and Artificial Intelligence (CCEAI 2022);Jan 6, 2022 - Jan 8, 2022;Hokkaido, Japan;Jul 5, 2021;5/07/2021;85;2021-07-05
100;1002;NCAA 2022;Topical Collection on Deep Learning for Time Series Data for Neural Computing and Applications;N/A;N/A;Jun 30, 2021;30/06/2021;86;2021-06-30
100;1002;ICAA 2021;2021 International Conference on Intelligent Computing, Automation and Applications;Jun 25, 2021 - Jun 27, 2021;Nanjing;Jun 21, 2021;21/06/2021;87;2021-06-21
100;1002;ICT-DM 2021;The 7th International Conference on Information and Communication Technologies for Disaster Management;Dec 3, 2021 - Dec 5, 2021;Hangzhou, China;Jun 20, 2021 (Jun 15, 2021);20/06/2021;88;2021-06-20
100;1002;Call for Book Chapter 2021;Blockchain and Deep Learning - Future Trends and Enabling Technologies;Feb 1, 2021 - Apr 30, 2022;Book Chapter;Jun 4, 2021 (Mar 15, 2021);4/06/2021;89;2021-06-04
100;1002;ICoIV 2021 - Ei Compendex & Scopus 2021;2021 International Conference on Intelligent Vehicles (ICoIV 2021);Jun 21, 2021 - Jun 23, 2021;Chengdu, China;May 20, 2021;20/05/2021;90;2021-05-20
100;1002;MEDES 2021;The 13th International ACM Conference on Management of Digital EcoSystems;Nov 1, 2021 - Nov 3, 2021;Hammamet - Tunisia;May 24, 2021;24/05/2021;91;2021-05-24
100;1002;MEDES 2021;The 13th International Conference on Management of Digital EcoSystems;Nov 1, 2021 - Nov 3, 2021;Hammamet - Tunisia;May 24, 2021;24/05/2021;92;2021-05-24
100;1003;ICBDB 2021;2021 3rd International Conference on Big Data and Blockchain(ICBDB 2021);Dec 3, 2021 - Dec 5, 2021;Beijing, China;Oct 30, 2021;30/10/2021;93;2021-10-30
100;1003;IARCE 2021;2021 5th International Conference on Industrial Automation, Robotics and Control Engineering (IARCE 2021);Jun 18, 2021 - Jun 20, 2021;Chengdu, China;May 20, 2021;20/05/2021;94;2021-05-20
100;1003;EI-CFAIS 2021;2021 International Conference on Frontiers of Artificial Intelligence and Statistics (CFAIS 2021);Dec 1, 2021 - Dec 3, 2021;Beijing, China;Oct 30, 2021;30/10/2021;95;2021-10-30
100;1003;SECCE 2021;2021 International Symposium on Electronics, Communications and Control Engineering (SECCE 2021);May 14, 2021 - May 16, 2021;Prague, Czech Republic;Apr 15, 2021;15/04/2021;96;2021-04-15
100;1003;SACMAT 2021;1st CfP -- ACM Symposium on Access Control Models and Technologies -- SACMAT 2021;Jun 16, 2021 - Jun 18, 2021;Barcelona, Spain;Feb 15, 2021;15/02/2021;97;2021-02-15
100;1003;SI Electronics - EV Grids 2021;Special Issue - Electric Vehicles Integration and Control in Smart Grids;N/A;N/A;Nov 30, 2021;30/11/2021;98;2021-11-30
100;1003;ISCSIC 2021;2021 5th International Symposium on Computer Science and Intelligent Control;Nov 12, 2021 - Nov 14, 2021;Rome, Italy;Oct 15, 2021;15/10/2021;99;2021-10-15
100;1003;UVS-Oman 2022;The 2nd International Conference on Unmanned Vehicle Systems (UVS-Oman 2022) - IEEE;Feb 7, 2022 - Feb 9, 2022;Muscat, Oman;Oct 15, 2021;15/10/2021;100;2021-10-15
100;1003;IARCE 2021-Ei Compendex & Scopus 2021;2021 5th International Conference on Industrial Automation, Robotics and Control Engineering (IARCE 2021);Jun 18, 2021 - Jun 20, 2021;Chengdu, China;May 20, 2021;20/05/2021;101;2021-05-20
100;1003;Scopus-CCEAI 2022;The 6th International Conference on Control Engineering and Artificial Intelligence (CCEAI 2022);Jan 6, 2022 - Jan 8, 2022;Hokkaido, Japan;Jul 5, 2021;5/07/2021;102;2021-07-05
100;1003;ICoCTA 2021;2021 2nd International Conference on Control Theory and Applications (ICoCTA 2021);Jun 18, 2021 - Jun 20, 2021;Chengdu, China;May 20, 2021;20/05/2021;103;2021-05-20
100;1003;ACM--ICSCC--EI Compendex and Scopus 2021;ACM--2021 6th International Conference on Systems, Control and Communications (ICSCC 2021)--Ei Compendex, Scopus;Oct 15, 2021 - Oct 17, 2021;Chongqing, China;May 10, 2021;10/05/2021;104;2021-05-10
100;1003;IWoSR 2021;2021 International Workshop on Service Robotics (IWoSR 2021);Jun 21, 2021 - Jun 23, 2021;Chengdu, China;May 20, 2021;20/05/2021;105;2021-05-20
100;1003;EAI FABULOUS 2021;5th EAI International Conference on Future Access Enablers of Ubiquitous and Intelligent Infrastructures;May 6, 2021 - May 7, 2021;Zagreb, Croatia;Dec 15, 2020;15/12/2020;106;2020-12-15
100;1003;ACCESS 2021;2nd International Conference on ADVANCES IN COMPUTING, COMMUNICATION, EMBEDDED AND SECURE SYSTEMS;May 26, 2021 - May 28, 2021;Kalady, Ernakulam, INDIA;Mar 5, 2021;5/03/2021;107;2021-03-05
100;1003;CCEAI-Scopus 2022;The 6th International Conference on Control Engineering and Artificial Intelligence (CCEAI 2022);Jan 6, 2022 - Jan 8, 2022;Hokkaido, Japan;Jul 5, 2021;5/07/2021;108;2021-07-05
100;1003;Scopus-CEECT 2021;The 3rd International Conference on Electrical Engineering and Control Technologies (CEECT 2021);Dec 16, 2021 - Dec 18, 2021;Macau SAR, China;Jun 15, 2021;15/06/2021;109;2021-06-15
100;1003;IEEE ICITE--EI Compendex, Scopus 2021;2021 IEEE 6th International Conference on Intelligent Transportation Engineering (IEEE ICITE 2021)--Ei Compendex, Scopus;Sep 17, 2021 - Sep 19, 2021;Beijing, China;Apr 20, 2021;20/04/2021;110;2021-04-20
100;1003;ICSCC--ACM, EI and Scopus 2021;ACM--2021 6th International Conference on Systems, Control and Communications (ICSCC 2021)--Ei Compendex, Scopus;Oct 15, 2021 - Oct 17, 2021;Chongqing, China;May 10, 2021;10/05/2021;111;2021-05-10
100;1003;SCI/EI Journal--Water Supply 2021;Water Supply Special Issue on Water Quality Control;Jul 30, 2021 - Jan 30, 2022;N/A;Jul 30, 2021;30/07/2021;112;2021-07-30
100;1003;ICAA 2021;2021 International Conference on Intelligent Computing, Automation and Applications;Jun 25, 2021 - Jun 27, 2021;Nanjing;Jun 21, 2021;21/06/2021;113;2021-06-21
100;1003;Scopus-WADCE 2021;7th International Workshop on Aircraft Design and Control Engineering (WADCE 2021);Dec 9, 2021 - Dec 12, 2021;Melbourne, Australia;Jun 10, 2021;10/06/2021;114;2021-06-10
100;1003;IEEE--IRCE--EI Compendex, Scopus 2021;IEEE--2021 4th International Conference on Intelligent Robotics and Control Engineering (IRCE 2021)--Ei Compendex, SCOPUS;Sep 18, 2021 - Sep 20, 2021;Lanzhou, China;May 5, 2021;5/05/2021;115;2021-05-05
100;1003;CEECT-Scopus 2021;The 3rd International Conference on Electrical Engineering and Control Technologies (CEECT 2021);Dec 16, 2021 - Dec 18, 2021;Macau SAR, China;Jun 15, 2021;15/06/2021;116;2021-06-15
100;1003;Scopus-WAT 2021;The 3rd International Workshop on Automation Technologies (WAT 2021);Dec 16, 2021 - Dec 18, 2021;Macau SAR, China;Jun 15, 2021;15/06/2021;117;2021-06-15
100;1003;Scopus-WPCE 2021;6th International Conference on Water Pollution Control Engineering (WPCE 2021);Dec 2, 2021 - Dec 5, 2021;Singapore;Jun 1, 2021;1/06/2021;118;2021-06-01
100;1003;CEESD-Scopus 2021;6th International Conference on Environmental Engineering and Sustainable Development (CEESD 2021);Dec 2, 2021 - Dec 5, 2021;Singapore;Jun 1, 2021;1/06/2021;119;2021-06-01
100;1003;ICACR--Ei Compendex and Scopus 2021;2021 5th International Conference on Automation, Control and Robots (ICACR 2021)--EI Compendex, Scopus;Sep 25, 2021 - Sep 27, 2021;Nanning, China;May 10, 2021;10/05/2021;120;2021-05-10
100;1003;IRCE--IEEE, EI, Scopus 2021;IEEE--2021 4th International Conference on Intelligent Robotics and Control Engineering (IRCE 2021)--Ei Compendex, SCOPUS;Sep 18, 2021 - Sep 20, 2021;Lanzhou, China;May 5, 2021;5/05/2021;121;2021-05-05
100;1003;ICACR--Ei and Scopus 2021;2021 5th International Conference on Automation, Control and Robots (ICACR 2021)--EI Compendex, Scopus;Sep 25, 2021 - Sep 27, 2021;Nanning, China;May 10, 2021;10/05/2021;122;2021-05-10
100;1003;MLMI--Ei, Scopus 2021;2021 The 4th International Conference on Machine Learning and Machine Intelligence (MLMI 2021)--Ei Compendex, Scopus;Sep 17, 2021 - Sep 19, 2021;Hangzhou Dianzi University, China;Apr 30, 2021;30/04/2021;123;2021-04-30
100;1003;ICSTCC 2021;25th International Conference on System Theory, Control and Computing;Oct 20, 2021 - Oct 23, 2021;Iasi, Romania;Apr 30, 2021;30/04/2021;124;2021-04-30
100;1003;SCI/EI Journal--AIEDAM 2021;Thematic Collection on Industrial intelligent technologies for human-robot interaction and collaboration;Mar 30, 2021 - Mar 30, 2022;N/A;Apr 30, 2021;30/04/2021;125;2021-04-30
100;1003;OPDEM 2021;Contribute a chapter to the Open Access book Demographic Analysis - Selected Concepts, Tools, and Applications;N/A;N/A;Jan 31, 2021;31/01/2021;126;2021-01-31
100;1003;IEEE OJ-CS Special Section 2021;Open Access Journal: Special Section on Resource Management in UAV-Assisted Systems;N/A;N/A;Oct 15, 2020;15/10/2020;127;2020-10-15
100;1004;EAI SecureComm 2021;17th EAI International Conference on Security and Privacy in Communication Networks (Springer, Scopus, ISI, Ei, more);Sep 6, 2021 - Sep 9, 2021;Canterbury, Great Britain;Mar 15, 2021;15/03/2021;128;2021-03-15
100;1004;VEHICULAR 2021;The Tenth International Conference on Advances in Vehicular Systems, Technologies and Applications;Jul 18, 2021 - Jul 22, 2021;Nice, France;Apr 19, 2021;19/04/2021;129;2021-04-19
100;1004;ICNP 2021;International Conference on Network Protocols;Nov 2, 2021 - Nov 5, 2021;Dallas, TX;May 24, 2021 (May 17, 2021);24/05/2021;130;2021-05-24
100;1004;SI: Advanced Technology for IE 2022;Special Issue: Secure and Advanced Technology for Intelligent Environments;Jan 1, 2021 - Jun 1, 2022;JAISE (IOS) journal;Sep 5, 2021;5/09/2021;131;2021-09-05
100;1004;NetIIoT 2021;State-of-Art of Network Architectures and Protocols for Industrial IoT;N/A;N/A;Sep 20, 2021;20/09/2021;132;2021-09-20
100;1004;ACM BSCI 2021;The 3rd ACM International Symposium on Blockchain and Secure Critical Infrastructure;Jun 7, 2021 - Jun 11, 2021;Hong Kong, China;Feb 15, 2021;15/02/2021;133;2021-02-15
100;1004;Blockchain Consensus 2021;Blockchain Consensus Protocols;N/A;N/A;Jan 31, 2021;31/01/2021;134;2021-01-31
100;1004;ICCIS--IEEE, Ei and Scopus 2021;IEEE--2021 5th International Conference on Communication and Information Systems (ICCIS 2020)--Ei Compendex, Scopus;Oct 15, 2021 - Oct 17, 2021;Chongqing, China;May 10, 2021;10/05/2021;135;2021-05-10
100;1004;SI: Energies - Climate Change 2021;Special Issue: Change But No Climate Change: Discourses and Approaches of Climate Change in the Energy Industry;N/A;N/A;Oct 15, 2021;15/10/2021;136;2021-10-15
100;1004;CCISP-Scopus 2021;The 6th International Conference on Communication, Image and Signal Processing;Nov 19, 2021 - Nov 21, 2021;Chengdu, China;Jul 20, 2021;20/07/2021;137;2021-07-20
100;1004;ACM SaT-CPS 2021;ACM Workshop on Secure and Trustworthy Cyber-Physical Systems;Apr 28, 2021 - Apr 28, 2021;Virtually, Online;Jan 8, 2021;8/01/2021;138;2021-01-08
100;1004;Scopus-CCISP 2021;The 6th International Conference on Communication, Image and Signal Processing;Nov 19, 2021 - Nov 21, 2021;Chengdu, China;Jul 20, 2021;20/07/2021;139;2021-07-20
100;1004;SOTICS 2021;The Eleventh International Conference on Social Media Technologies, Communication, and Informatics;Oct 3, 2021 - Oct 7, 2021;Barcelona, Spain;Jul 5, 2021;5/07/2021;140;2021-07-05
100;1004;ICCIS--IEEE, Ei and Scopus 2021;IEEE--2021 5th International Conference on Communication and Information Systems (ICCIS 2021)--Ei Compendex, Scopus;Oct 15, 2021 - Oct 17, 2021;Chongqing, China;May 10, 2021;10/05/2021;141;2021-05-10
100;1004;IEEE--ICCIS--Ei and Scopus 2021;IEEE--2021 5th International Conference on Communication and Information Systems (ICCIS 2020)--Ei Compendex, Scopus;Oct 15, 2021 - Oct 17, 2021;Chongqing, China;May 10, 2021;10/05/2021;142;2021-05-10
100;1004;DASC 2021;The 19th IEEE International Conference on Dependable, Autonomic & Secure Computing;Aug 23, 2021 - Aug 26, 2021;Calgary, Canada (On-site & Virtual);Apr 15, 2021;15/04/2021;143;2021-04-15
100;1004;SKM 2021;International Conference on Secure Knowledge Management;Oct 8, 2021 - Oct 9, 2021;San Antonio;Jun 21, 2021;21/06/2021;144;2021-06-21
100;1004;ICTS 2021;The 13th International Conference on Information & Communication Technology and System;Oct 20, 2021 - Oct 21, 2021;Virtual conference;Jul 8, 2021;8/07/2021;145;2021-07-08
100;1004;ICT-DM 2021;The 7th International Conference on Information and Communication Technologies for Disaster Management;Dec 3, 2021 - Dec 5, 2021;Hangzhou, China;Jun 20, 2021 (Jun 15, 2021);20/06/2021;146;2021-06-20
100;1004;IEEE--ICCIS--Ei and Scopus 2021;IEEE--2021 5th International Conference on Communication and Information Systems (ICCIS 2021)--Ei Compendex, Scopus;Oct 15, 2021 - Oct 17, 2021;Chongqing, China;May 10, 2021;10/05/2021;147;2021-05-10
100;1004;ACM-DSIT 2021;2021 4th International Conference on Data Science and Information Technology (DSIT 2021);Jul 23, 2021 - Jul 25, 2021;Shanghai, China;Mar 20, 2021;20/03/2021;148;2021-03-20
100;1004;ACM--CCCE--EI Compendex, Scopus 2021;ACM--2021 International Conference on Computer and Communication Engineering (CCCE 2021)--EI Compendex, Scopus;Apr 23, 2021 - Apr 25, 2021;Jeju Island, South Korea;Mar 15, 2021;15/03/2021;149;2021-03-15
100;1004;DSML 2021;4th International Workshop on Dependable and Secure Machine Learning;Jun 21, 2021 - Jun 21, 2021;Taiwan;Mar 7, 2021;7/03/2021;150;2021-03-07
100;1004;ACCESS 2021;2nd International Conference on ADVANCES IN COMPUTING, COMMUNICATION, EMBEDDED AND SECURE SYSTEMS;May 26, 2021 - May 28, 2021;Kalady, Ernakulam, INDIA;Mar 5, 2021;5/03/2021;151;2021-03-05
100;1004;MediAsia 2021;The 12th Asian Conference on Media, Communication & Film (MediAsia2021);Nov 9, 2021 - Nov 12, 2021;Kyoto, Japan;Jun 20, 2021;20/06/2021;152;2021-06-20
100;1004;EAI ICTCC 2021;7th EAI International Conference on Nature of Computation and Communication (Springer, Scopus, ISI, Ei, more);Oct 28, 2021 - Oct 29, 2021;Ho Chi Minh City, Vietnam;May 10, 2021;10/05/2021;153;2021-05-10
100;1004;LLL 2021;8th International Conference on Language, Literature, Linguistics 2021;Jul 26, 2021 - Jul 27, 2021;Online;May 30, 2021;30/05/2021;154;2021-05-30
100;1004;MaLeNe 2021;1st International Workshop on Machine Learning in Networking;Sep 13, 2021 - Sep 14, 2021;Lübeck, Germany;May 30, 2021;30/05/2021;155;2021-05-30
100;1004;IEEE ICICSP--EI, Scopus 2021;2021 4th IEEE International Conference on Information Communication and Signal Processing (ICICSP 2021)--Ei Compendex, Scopus;Sep 24, 2021 - Sep 26, 2021;Shanghai, China;May 10, 2021;10/05/2021;156;2021-05-10
100;1004;ICCNT--JA, SCOPUS 2021;2021 5th International Conference on Communication and Network Technology (ICCNT 2021)--JA, Scopus;Sep 25, 2021 - Sep 27, 2021;Paris, France;May 5, 2021;5/05/2021;157;2021-05-05
100;1004;ICICSP--IEEE, Ei and Scopus 2021;2021 4th IEEE International Conference on Information Communication and Signal Processing (ICICSP 2021)--Ei Compendex, Scopus;Sep 24, 2021 - Sep 26, 2021;Shanghai, China;May 10, 2021;10/05/2021;158;2021-05-10
100;1004;NOCS 2021;International Symposium on Networks-on-Chip (NOCS) 2021 Call for Papers;Oct 10, 2021 - Oct 15, 2021;Virtual Conference;May 21, 2021 (May 14, 2021);21/05/2021;159;2021-05-21
100;1004;ICCCISc 2021;International Conference on Communication, Control and Information Sciences (IEEE IAS);Jun 16, 2021 - Jun 18, 2021;Online;Apr 1, 2021;1/04/2021;160;2021-04-01
100;1004;ICCEI--JA, Scopus 2021;2021 9th International Conference on Communication and Electronics Information (ICCEI 2021)--JA, Scopus;Sep 4, 2021 - Sep 6, 2021;Fukuoka, Japan;Apr 20, 2021;20/04/2021;161;2021-04-20
100;1004;CCGE 2021;1st IEEE International Conference on Computing, Communication and Green Engineering-2021;Jul 8, 2021 - Jul 10, 2021;Pune;Apr 10, 2021;10/04/2021;162;2021-04-10
100;1004;NanoCom 2021;8th ACM International Conference on Nanoscale Computing and Communication;Sep 7, 2021 - Sep 9, 2021;Catania, Italy;Apr 15, 2021;15/04/2021;163;2021-04-15
100;1004;DACH+ EnInf 2021;DACH+ Conference and Doctoral Workshop on Energy Informatics;Sep 16, 2021 - Sep 17, 2021;Freiburg, Germany;Apr 19, 2021;19/04/2021;164;2021-04-19
100;1004;CCCE--ACM, EI, Scopus 2021;ACM--2021 International Conference on Computer and Communication Engineering (CCCE 2021)--EI Compendex, Scopus;Apr 23, 2021 - Apr 25, 2021;Jeju Island, South Korea;Mar 15, 2021;15/03/2021;165;2021-03-15
100;1004;ICEST 2021;56th International Conference on Information, Communication and Eenergy Systems and Technologies;Jun 16, 2021 - Jun 18, 2021;Sozopol, Bulgaria;Mar 31, 2021;31/03/2021;166;2021-03-31
100;1004;FlexNGIA 2021;1st IFIP/IEEE International workshop on Fully-Flexible Internet Architectures and Protocols for the Next-Generation Internet;May 17, 2021 - May 21, 2021;Bordeaux, France;Jan 29, 2021;29/01/2021;167;2021-01-29
100;1004;ATCES--SCOPUS 2021;5th International Conference on Aerospace Technology, Communications and Energy Systems (ATCES 2021);Sep 23, 2021 - Sep 25, 2021;Shanghai, China;Mar 25, 2021;25/03/2021;168;2021-03-25
100;1004;EAI HE-IoT/CPS 2021;EAI Secure Computation in Internet of Things (IoT) and Cyber Physical Systems (CPS) 2021;May 15, 2021 - May 16, 2021;Xiamen, China or Online;Jan 20, 2021;20/01/2021;169;2021-01-20
100;1004;DADS 2021;ACM Dependable, Adaptive, and Secure Distributed Systems;Mar 22, 2021 - Mar 26, 2021;Gwangju, Korea;Sep 15, 2020;15/09/2020;170;2020-09-15
100;1004;IEICE_ED_SI 2021;Special Section on the Architectures, Protocols, and Applications for the Future Internet;N/A;N/A;Aug 21, 2020;21/08/2020;171;2020-08-21
100;1005;ICDM 2021;21st IEEE International Conference on Data Mining;Dec 7, 2021 - Dec 10, 2021;Auckland, New Zealand;Jun 11, 2021;11/06/2021;172;2021-06-11
100;1005;CEVVE 2021;2021 International Conference on Electric Vehicle and Vehicle Engineering (CEVVE 2021);Sep 17, 2021 - Sep 19, 2021;Frankfurt, Germany;Jul 31, 2021;31/07/2021;173;2021-07-31
100;1005;MDPI-SI-BDHA 2021;Call for Papers: Special Issue “Big Data for eHealth Applications” (MDPI Applied Sciences, IF 2.474 – Indexed on Scopus, Web of Science);N/A;N/A;Sep 15, 2021;15/09/2021;174;2021-09-15
100;1005;DATA ANALYTICS 2021;The Tenth International Conference on Data Analytics;Oct 3, 2021 - Oct 7, 2021;Barcelona, Spain;Jul 5, 2021;5/07/2021;175;2021-07-05
100;1005;ML_BDA 2021;Special Issue on Machine Learning Technologies for Big Data Analytics;N/A;N/A;Aug 15, 2021;15/08/2021;176;2021-08-15
100;1005;IEEE DSAA 2021;8th IEEE International Conference on Data Science and Advanced Analytics;Oct 6, 2021 - Oct 9, 2021;Porto, Portugal;May 23, 2021;23/05/2021;177;2021-05-23
100;1005;BDIoT 2021;5th International Conference on Big Data and Internet of Things - BDIoT’21;Mar 17, 2021 - Mar 18, 2021;Rabat - Morocco;Dec 1, 2021;1/12/2021;178;2021-12-01
100;1005;iDSC 2021;4th International Data Science Conference;Oct 20, 2021 - Oct 22, 2021;Vienna;Jun 20, 2021;20/06/2021;179;2021-06-20
100;1005;CCNC 2021;IEEE Consumer Communications & Networking Conference;Jan 9, 2021 - Jan 12, 2021;Las Vegas, USA;Jul 10, 2021;10/07/2021;180;2021-07-10
100;1005;ISC HPC 2021;ISC HIGH PERFORMANCE 2021 DIGITAL;Jun 24, 2021 - Jul 2, 2021;Digital;Dec 21, 2021 (Dec 14, 2020);21/12/2021;181;2021-12-21
100;1005;IEEE SSCI 2021;2021 IEEE Symposium Series on Computational Intelligence;Dec 5, 2021 - Dec 8, 2021;Orlando, Florida, USA;Aug 6, 2021;6/08/2021;182;2021-08-06
100;1005;ICSRS--Scopus & EI Compendex 2021;2021 5th International Conference on System Reliability and Safety (ICSRS 2021)--Scopus & EI Compendex;Nov 24, 2021 - Nov 26, 2021;Palermo, Italy;Jul 5, 2021;5/07/2021;183;2021-07-05
100;1005;CRITIS 2021;The 16th International Conference on Critical Information Infrastructures Security;Sep 27, 2021 - Sep 29, 2021;EPFL SwissTech, Lausanne, Switzerland;May 14, 2021;14/05/2021;184;2021-05-14
100;1005;blockchain_ml_iot 2021;Network and Electronics (MDPI) Joint Special Issue - Blockchain and Machine Learning for IoT: Security and Privacy Challenges;N/A;N/A;Dec 31, 2021;31/12/2021;185;2021-12-31
100;1005;ai4i 2021;Artificial Intelligence for Industries (ai4i 2021);Sep 20, 2021 - Sep 22, 2021;Laguna Hills, California, USA;Jul 1, 2021;1/07/2021;186;2021-07-01
100;1005;SOFSEM 2021;47th International Conference on Current Trends in Theory and Practice of Computer Science;Jan 25, 2021 - Jan 28, 2021;Bozen-Bolzano, Italy;Aug 3, 2021 (Jul 27, 2021);3/08/2021;187;2021-08-03
100;1005;NISecurity 2021;2021 International Conference on Network and Information Security (NISecurity 2021);Aug 13, 2021 - Aug 15, 2021;Stockholm, Sweden;Jun 30, 2021;30/06/2021;188;2021-06-30
100;1005;Scopus-ICDPR 2022;The 6th International Conference on Data Processing and Robotics (ICDPR 2022);Jan 6, 2022 - Jan 8, 2022;Hokkaido, Japan;Jul 5, 2021;5/07/2021;189;2021-07-05
100;1005;Mapping_Monitoring_Wetlands 2021;[Water] (IF: 2.544, ISSN 2073-4441) Special Issue: Mapping and Monitoring of Wetlands;N/A;N/A;Nov 30, 2021;30/11/2021;190;2021-11-30
100;1005;ICBDB 2021;2021 3rd International Conference on Big Data and Blockchain(ICBDB 2021);Dec 3, 2021 - Dec 5, 2021;Beijing, China;Oct 30, 2021;30/10/2021;191;2021-10-30
100;1005;EI-WBDC 2021;2021 3rd International Workshop on Big Data and Computing(WBDC 2021);Dec 3, 2021 - Dec 5, 2021;Beijing, China;Oct 31, 2021;31/10/2021;192;2021-10-31
100;1005;SI: Advanced Technology for IE 2022;Special Issue: Secure and Advanced Technology for Intelligent Environments;Jan 1, 2021 - Jun 1, 2022;JAISE (IOS) journal;Sep 5, 2021;5/09/2021;193;2021-09-05
100;1005;AICCC--EI, Scopus 2021;2021 4th Artificial Intelligence and Cloud Computing Conference (AICCC 2021)--EI Compendex, Scopus;Dec 17, 2021 - Dec 19, 2021;Kyoto, Japan;Aug 5, 2021;5/08/2021;194;2021-08-05
100;1005;BigMM 2021;IEEE International Conference on Multimedia Big Data 2021;Nov 15, 2021 - Nov 17, 2021;Taichung, Taiwan;Aug 9, 2021;9/08/2021;195;2021-08-09
100;1005;CANS 2021;Cryptology and Network Security;Dec 13, 2021 - Dec 15, 2021;Vienna, Austria;Jun 1, 2021;1/06/2021;196;2021-06-01
100;1005;CLUSTER 2021;23rd IEEE Cluster Conference;Sep 7, 2021 - Sep 10, 2021;Portland, Oregon, USA;May 17, 2021 (May 10, 2021);17/05/2021;197;2021-05-17
100;1005;ICBICC 2021;2021 3rd International Conference on Big Data, IoT, and Cloud Computing (ICBICC 2021);Nov 12, 2021 - Nov 14, 2021;Rome, Italy;Sep 30, 2021;30/09/2021;198;2021-09-30
100;1005;SNSA-SI-MDPI 2021;Sensor Networks Security and Applications;N/A;N/A;Jul 31, 2021;31/07/2021;199;2021-07-31
100;1005;ICSRS--Scopus & EI 2021;2021 5th International Conference on System Reliability and Safety (ICSRS 2021)--Scopus & EI Compendex;Nov 24, 2021 - Nov 26, 2021;Palermo, Italy;Jul 5, 2021;5/07/2021;200;2021-07-05
100;1005;ICPM 2021;3rd International Conference on Process Mining;Oct 31, 2021 - Nov 4, 2021;Eindhoven;Jul 1, 2021 (Jun 15, 2021);1/07/2021;201;2021-07-01
100;1005;BDSIC--EI Compendex, Scopus 2021;2021 3rd International Conference on Big-data Service and Intelligent Computation (BDSIC 2021)--Ei Compendex, Scopus;Nov 19, 2021 - Nov 21, 2021;HuaQiao University, Xiamen?China;Jul 5, 2021;5/07/2021;202;2021-07-05
100;1005;BDSIC--EI, Scopus 2021;2021 3rd International Conference on Big-data Service and Intelligent Computation (BDSIC 2021)--Ei Compendex, Scopus;Nov 19, 2021 - Nov 21, 2021;HuaQiao University, Xiamen?China;Jul 5, 2021;5/07/2021;203;2021-07-05
100;1005;EMERGING 2021;The Thirteenth International Conference on Emerging Networks and Systems Intelligence;Oct 3, 2021 - Oct 7, 2021;Barcelona, Spain;Jul 5, 2021;5/07/2021;204;2021-07-05
100;1005;CCEAI-Scopus 2022;The 6th International Conference on Control Engineering and Artificial Intelligence (CCEAI 2022);Jan 6, 2022 - Jan 8, 2022;Hokkaido, Japan;Jul 5, 2021;5/07/2021;205;2021-07-05
100;1005;EICC 2021;European Interdisciplinary Cybersecurity Conference (EICC 2021);Nov 10, 2021 - Nov 11, 2021;Targu Mures, Romania;Jun 14, 2021;14/06/2021;206;2021-06-14
100;1005;NCAA 2022;Topical Collection on Deep Learning for Time Series Data for Neural Computing and Applications;N/A;N/A;Jun 30, 2021;30/06/2021;207;2021-06-30
100;1005;CCCI 2021;International Conference on Communications, Computing, Cybersecurity, and Informatics;Oct 15, 2021 - Oct 17, 2021;Beijing, China;Jul 24, 2021;24/07/2021;208;2021-07-24
100;1005;Scopus-WSM 2021;The 3rd International Conference on Water Security and Management ( WSM 2021);Dec 9, 2021 - Dec 11, 2021;Tokyo, Japan;Jun 10, 2021;10/06/2021;209;2021-06-10
100;1005;SI on SPIHG 2022;IEEE S&P CfP: Special Issue on Security and Privacy Issues of Home Globalization;N/A;N/A;May 15, 2021;15/05/2021;210;2021-05-15
100;1005;Elec-SI-IIDS 2021;Special Issue on Design of Intelligent Intrusion Detection Systems;N/A;N/A;May 31, 2021;31/05/2021;211;2021-05-31
100;1005;SPBP 2021;The Fourth Workshop on Security and Privacy-enhanced Business Process Management;Sep 6, 2021 - Sep 6, 2021;Rome, Italy;May 24, 2021;24/05/2021;212;2021-05-24
100;1005;HOST 2021;IEEE International Symposium on Hardware Oriented Security and Trust (HOST);Dec 5, 2021 - Dec 8, 2021;Washington Dc, USA;May 4, 2021 (Apr 27, 2021);4/05/2021;213;2021-05-04
100;1005;CYBER 2021;The Sixth International Conference on Cyber-Technologies and Cyber-Systems;Oct 3, 2021 - Oct 7, 2021;Barcelona, Spain;Jul 5, 2021;5/07/2021;214;2021-07-05
100;1005;MDPI - Risk Management - Scopus 2021;Special Issue of Journal Applied System Innovation: Risk Management;N/A;N/A;Jul 31, 2021;31/07/2021;215;2021-07-31
100;1005;ICTS 2021;The 13th International Conference on Information & Communication Technology and System;Oct 20, 2021 - Oct 21, 2021;Virtual conference;Jul 8, 2021;8/07/2021;216;2021-07-08
100;1005;ICAA 2021;2021 International Conference on Intelligent Computing, Automation and Applications;Jun 25, 2021 - Jun 27, 2021;Nanjing;Jun 21, 2021;21/06/2021;217;2021-06-21
100;1005;ICT-DM 2021;The 7th International Conference on Information and Communication Technologies for Disaster Management;Dec 3, 2021 - Dec 5, 2021;Hangzhou, China;Jun 20, 2021 (Jun 15, 2021);20/06/2021;218;2021-06-20
100;1005;WSM-Scopus 2021;The 3rd International Conference on Water Security and Management ( WSM 2021);Dec 9, 2021 - Dec 11, 2021;Tokyo, Japan;Jun 10, 2021;10/06/2021;219;2021-06-10
100;1005;CSW 2021;2021 International Workshop on Cyber Security (CSW 2021);Aug 13, 2021 - Aug 15, 2021;Stockholm, Sweden;Jun 30, 2021;30/06/2021;220;2021-06-30
100;1005;ICENT--EI Compendex, Scopus 2021;2021 3rd International Conference on Emerging Networks Technologies (ICENT 2021)--Ei Compendex, Scopus;Sep 22, 2021 - Sep 24, 2021;Okinawa, Japan;May 10, 2021;10/05/2021;221;2021-05-10
100;1005;WoSCA 2021;WoSCA 2021 : 2nd International Workshop on Smart Contract Analysis;Jul 12, 2021 - Jul 16, 2021;Aarhus, Denmark;May 14, 2021;14/05/2021;222;2021-05-14
100;1006;ICDM 2021;21st IEEE International Conference on Data Mining;Dec 7, 2021 - Dec 10, 2021;Auckland, New Zealand;Jun 11, 2021;11/06/2021;223;2021-06-11
100;1006;CEVVE 2021;2021 International Conference on Electric Vehicle and Vehicle Engineering (CEVVE 2021);Sep 17, 2021 - Sep 19, 2021;Frankfurt, Germany;Jul 31, 2021;31/07/2021;224;2021-07-31
100;1006;MDPI-SI-BDHA 2021;Call for Papers: Special Issue “Big Data for eHealth Applications” (MDPI Applied Sciences, IF 2.474 – Indexed on Scopus, Web of Science);N/A;N/A;Sep 15, 2021;15/09/2021;225;2021-09-15
100;1006;DATA ANALYTICS 2021;The Tenth International Conference on Data Analytics;Oct 3, 2021 - Oct 7, 2021;Barcelona, Spain;Jul 5, 2021;5/07/2021;226;2021-07-05
100;1006;ML_BDA 2021;Special Issue on Machine Learning Technologies for Big Data Analytics;N/A;N/A;Aug 15, 2021;15/08/2021;227;2021-08-15
100;1006;IEEE DSAA 2021;8th IEEE International Conference on Data Science and Advanced Analytics;Oct 6, 2021 - Oct 9, 2021;Porto, Portugal;May 23, 2021;23/05/2021;228;2021-05-23
100;1006;BDIoT 2021;5th International Conference on Big Data and Internet of Things - BDIoT’21;Mar 17, 2021 - Mar 18, 2021;Rabat - Morocco;Dec 1, 2021;1/12/2021;229;2021-12-01
100;1006;iDSC 2021;4th International Data Science Conference;Oct 20, 2021 - Oct 22, 2021;Vienna;Jun 20, 2021;20/06/2021;230;2021-06-20
100;1006;SOUPS 2021;The Seventeenth Symposium on Usable Privacy and Security;Aug 8, 2021 - Aug 10, 2021;Vancouver, B.C., Canada;Feb 25, 2021 (Feb 18, 2021);25/02/2021;231;2021-02-25
100;1006;ISC HPC 2021;ISC HIGH PERFORMANCE 2021 DIGITAL;Jun 24, 2021 - Jul 2, 2021;Digital;Dec 21, 2021 (Dec 14, 2020);21/12/2021;232;2021-12-21
100;1006;IEEE SSCI 2021;2021 IEEE Symposium Series on Computational Intelligence;Dec 5, 2021 - Dec 8, 2021;Orlando, Florida, USA;Aug 6, 2021;6/08/2021;233;2021-08-06
100;1006;ICSRS--Scopus & EI Compendex 2021;2021 5th International Conference on System Reliability and Safety (ICSRS 2021)--Scopus & EI Compendex;Nov 24, 2021 - Nov 26, 2021;Palermo, Italy;Jul 5, 2021;5/07/2021;234;2021-07-05
100;1006;blockchain_ml_iot 2021;Network and Electronics (MDPI) Joint Special Issue - Blockchain and Machine Learning for IoT: Security and Privacy Challenges;N/A;N/A;Dec 31, 2021;31/12/2021;235;2021-12-31
100;1006;EAI SecureComm 2021;17th EAI International Conference on Security and Privacy in Communication Networks (Springer, Scopus, ISI, Ei, more);Sep 6, 2021 - Sep 9, 2021;Canterbury, Great Britain;Mar 15, 2021;15/03/2021;236;2021-03-15
100;1006;CSPPSG 2021;MDPI Sensors - Special Issue on 'Cybersecurity and Privacy-Preserving in Modern Smart Grid';N/A;N/A;Feb 28, 2021;28/02/2021;237;2021-02-28
100;1006;ai4i 2021;Artificial Intelligence for Industries (ai4i 2021);Sep 20, 2021 - Sep 22, 2021;Laguna Hills, California, USA;Jul 1, 2021;1/07/2021;238;2021-07-01
100;1006;SOFSEM 2021;47th International Conference on Current Trends in Theory and Practice of Computer Science;Jan 25, 2021 - Jan 28, 2021;Bozen-Bolzano, Italy;Aug 3, 2021 (Jul 27, 2021);3/08/2021;239;2021-08-03
100;1006;Scopus-ICDPR 2022;The 6th International Conference on Data Processing and Robotics (ICDPR 2022);Jan 6, 2022 - Jan 8, 2022;Hokkaido, Japan;Jul 5, 2021;5/07/2021;240;2021-07-05
100;1006;Mapping_Monitoring_Wetlands 2021;[Water] (IF: 2.544, ISSN 2073-4441) Special Issue: Mapping and Monitoring of Wetlands;N/A;N/A;Nov 30, 2021;30/11/2021;241;2021-11-30
100;1006;ICBDB 2021;2021 3rd International Conference on Big Data and Blockchain(ICBDB 2021);Dec 3, 2021 - Dec 5, 2021;Beijing, China;Oct 30, 2021;30/10/2021;242;2021-10-30
100;1006;EI-WBDC 2021;2021 3rd International Workshop on Big Data and Computing(WBDC 2021);Dec 3, 2021 - Dec 5, 2021;Beijing, China;Oct 31, 2021;31/10/2021;243;2021-10-31
100;1006;AICCC--EI, Scopus 2021;2021 4th Artificial Intelligence and Cloud Computing Conference (AICCC 2021)--EI Compendex, Scopus;Dec 17, 2021 - Dec 19, 2021;Kyoto, Japan;Aug 5, 2021;5/08/2021;244;2021-08-05
100;1006;BigMM 2021;IEEE International Conference on Multimedia Big Data 2021;Nov 15, 2021 - Nov 17, 2021;Taichung, Taiwan;Aug 9, 2021;9/08/2021;245;2021-08-09
100;1006;SPTM 2021;9th International Conference of Security, Privacy and Trust Management;Apr 24, 2021 - Apr 25, 2021;Copenhagen, Denmark;Feb 20, 2021;20/02/2021;246;2021-02-20
100;1006;ICBICC 2021;2021 3rd International Conference on Big Data, IoT, and Cloud Computing (ICBICC 2021);Nov 12, 2021 - Nov 14, 2021;Rome, Italy;Sep 30, 2021;30/09/2021;247;2021-09-30
100;1006;ICPM 2021;3rd International Conference on Process Mining;Oct 31, 2021 - Nov 4, 2021;Eindhoven;Jul 1, 2021 (Jun 15, 2021);1/07/2021;248;2021-07-01
100;1006;BDSIC--EI Compendex, Scopus 2021;2021 3rd International Conference on Big-data Service and Intelligent Computation (BDSIC 2021)--Ei Compendex, Scopus;Nov 19, 2021 - Nov 21, 2021;HuaQiao University, Xiamen?China;Jul 5, 2021;5/07/2021;249;2021-07-05
100;1006;BDSIC--EI, Scopus 2021;2021 3rd International Conference on Big-data Service and Intelligent Computation (BDSIC 2021)--Ei Compendex, Scopus;Nov 19, 2021 - Nov 21, 2021;HuaQiao University, Xiamen?China;Jul 5, 2021;5/07/2021;250;2021-07-05
100;1006;CCEAI-Scopus 2022;The 6th International Conference on Control Engineering and Artificial Intelligence (CCEAI 2022);Jan 6, 2022 - Jan 8, 2022;Hokkaido, Japan;Jul 5, 2021;5/07/2021;251;2021-07-05
100;1006;EICC 2021;European Interdisciplinary Cybersecurity Conference (EICC 2021);Nov 10, 2021 - Nov 11, 2021;Targu Mures, Romania;Jun 14, 2021;14/06/2021;252;2021-06-14
100;1006;NCAA 2022;Topical Collection on Deep Learning for Time Series Data for Neural Computing and Applications;N/A;N/A;Jun 30, 2021;30/06/2021;253;2021-06-30
100;1006;IDEAS 2021;25th International Database Engineering & Applications Symposium;Jul 14, 2021 - Jul 16, 2021;Montreal;Apr 1, 2021;1/04/2021;254;2021-04-01
100;1006;CANS 2021;Cryptology and Network Security;Dec 13, 2021 - Dec 15, 2021;Vienna, Austria;Jun 1, 2021;1/06/2021;255;2021-06-01
100;1006;SI on SPIHG 2022;IEEE S&P CfP: Special Issue on Security and Privacy Issues of Home Globalization;N/A;N/A;May 15, 2021;15/05/2021;256;2021-05-15
100;1006;SPBP 2021;The Fourth Workshop on Security and Privacy-enhanced Business Process Management;Sep 6, 2021 - Sep 6, 2021;Rome, Italy;May 24, 2021;24/05/2021;257;2021-05-24
100;1006;PPML at INTERSPEECH 2021;Privacy-preserving Machine Learning for Audio & Speech Processing -- INTERSPEECH 2021 Special Session;Aug 30, 2021 - Sep 3, 2021;Brno, Czechia;Mar 26, 2021;26/03/2021;258;2021-03-26
100;1006;CENTRIC 2021;The Fourteenth International Conference on Advances in Human-oriented and Personalized Mechanisms, Technologies, and Services;Oct 3, 2021 - Oct 7, 2021;Barcelona, Spain;Jul 5, 2021;5/07/2021;259;2021-07-05
100;1006;ICAA 2021;2021 International Conference on Intelligent Computing, Automation and Applications;Jun 25, 2021 - Jun 27, 2021;Nanjing;Jun 21, 2021;21/06/2021;260;2021-06-21
100;1006;ICT-DM 2021;The 7th International Conference on Information and Communication Technologies for Disaster Management;Dec 3, 2021 - Dec 5, 2021;Hangzhou, China;Jun 20, 2021 (Jun 15, 2021);20/06/2021;261;2021-06-20
100;1006;Call for Book Chapter 2021;Blockchain and Deep Learning - Future Trends and Enabling Technologies;Feb 1, 2021 - Apr 30, 2022;Book Chapter;Jun 4, 2021 (Mar 15, 2021);4/06/2021;262;2021-06-04
100;1006;ICoIV 2021 - Ei Compendex & Scopus 2021;2021 International Conference on Intelligent Vehicles (ICoIV 2021);Jun 21, 2021 - Jun 23, 2021;Chengdu, China;May 20, 2021;20/05/2021;263;2021-05-20
100;1006;MEDES 2021;The 13th International ACM Conference on Management of Digital EcoSystems;Nov 1, 2021 - Nov 3, 2021;Hammamet - Tunisia;May 24, 2021;24/05/2021;264;2021-05-24
100;1006;STPSA 2021;The 15th IEEE International Workshop on Security, Trust, and Privacy for Software Applications;Jul 12, 2021 - Jul 16, 2021;Virtual;Apr 21, 2021;21/04/2021;265;2021-04-21
100;1006;CLOUD S&P 2021;3rd Workshop on Cloud Security and Privacy;Jun 21, 2021 - Jun 24, 2021;Kamakura, Japan;Mar 20, 2021;20/03/2021;266;2021-03-20
100;1006;ACM WiSec 2021;ACM Conference on Security and Privacy in Wireless and Mobile Networks;Jun 28, 2021 - Jul 1, 2021;Virtual;Mar 18, 2021;18/03/2021;267;2021-03-18
100;1006;MEDES 2021;The 13th International Conference on Management of Digital EcoSystems;Nov 1, 2021 - Nov 3, 2021;Hammamet - Tunisia;May 24, 2021;24/05/2021;268;2021-05-24
100;1006;EAI CyDiP (virtual) 2021;EAI International Conference on Emerging Technologies of Cybersecurity and Digital Privacy (online conference);Oct 18, 2021 - Oct 19, 2021;Cyberspace;Apr 19, 2021;19/04/2021;269;2021-04-19
100;1006;OID 2021;Open Identity Summit 2021;Jun 1, 2021 - Jun 2, 2021;Copenhagen, Denmark;Mar 1, 2021;1/03/2021;270;2021-03-01
100;1006;ICISPP--Ei Compendex, Scopus 2021;2021 2nd International Conference on Information Security and Privacy Protection (ICISPP 2021)--Ei Compendex, Scopus;Jul 9, 2021 - Jul 11, 2021;Nanjing, China;Feb 20, 2021;20/02/2021;271;2021-02-20
100;1006;FI-CyberSec 2021;Feature Papers for Future Internet - Cybersecurity Section;N/A;N/A;Feb 28, 2021;28/02/2021;272;2021-02-28
100;1006;Sensors (MDPI) SI 2021;Sensors SI on Security, Trust and Privacy in New Computing Environments;N/A;N/A;Mar 31, 2021;31/03/2021;273;2021-03-31
100;1007;NISecurity 2021;2021 International Conference on Network and Information Security (NISecurity 2021);Aug 13, 2021 - Aug 15, 2021;Stockholm, Sweden;Jun 30, 2021;30/06/2021;274;2021-06-30
100;1007;CRITIS 2021;The 16th International Conference on Critical Information Infrastructures Security;Sep 27, 2021 - Sep 29, 2021;EPFL SwissTech, Lausanne, Switzerland;May 14, 2021;14/05/2021;275;2021-05-14
100;1007;ICSRS--Scopus & EI 2021;2021 5th International Conference on System Reliability and Safety (ICSRS 2021)--Scopus & EI Compendex;Nov 24, 2021 - Nov 26, 2021;Palermo, Italy;Jul 5, 2021;5/07/2021;276;2021-07-05
100;1007;Elec-SI-IIDS 2021;Special Issue on Design of Intelligent Intrusion Detection Systems;N/A;N/A;May 31, 2021;31/05/2021;277;2021-05-31
100;1007;ICTS 2021;The 13th International Conference on Information & Communication Technology and System;Oct 20, 2021 - Oct 21, 2021;Virtual conference;Jul 8, 2021;8/07/2021;278;2021-07-08
100;1007;IWoSR 2021;2021 International Workshop on Service Robotics (IWoSR 2021);Jun 21, 2021 - Jun 23, 2021;Chengdu, China;May 20, 2021;20/05/2021;279;2021-05-20
100;1007;ECNLPIR 2021;2021 European Conference on Natural Language Processing and Information Retrieval (ECNLPIR 2021);Aug 13, 2021 - Aug 15, 2021;Stockholm, Sweden;Jun 30, 2021;30/06/2021;280;2021-06-30
100;1007;ICONIP 2021;The 28th International Conference on Neural Information Processing (ICONIP2021);Dec 8, 2021 - Dec 12, 2021;Bali, Indonesia;Jun 30, 2021;30/06/2021;281;2021-06-30
100;1007;FAST 2021;19th USENIX Conference on File and Storage Technologies;Sep 24, 2020 - Jan 25, 2021;SANTA CLARA, CA, USA;Sep 24, 2020;24/09/2020;282;2020-09-24
100;1007;ECCSIT 2021;2021 European Conference on Computer Science and Information Technology (ECCSIT 2021);Dec 14, 2021 - Dec 16, 2021;Budapest, Hungary;Oct 31, 2021;31/10/2021;283;2021-10-31
100;1007;CEVVE 2021;2021 International Conference on Electric Vehicle and Vehicle Engineering (CEVVE 2021);Sep 17, 2021 - Sep 19, 2021;Frankfurt, Germany;Jul 31, 2021;31/07/2021;284;2021-07-31
100;1007;EI-CFAIS 2021;2021 International Conference on Frontiers of Artificial Intelligence and Statistics (CFAIS 2021);Dec 1, 2021 - Dec 3, 2021;Beijing, China;Oct 30, 2021;30/10/2021;285;2021-10-30
100;1007;ISC HPC 2021;ISC HIGH PERFORMANCE 2021 DIGITAL;Jun 24, 2021 - Jul 2, 2021;Digital;Dec 21, 2021 (Dec 14, 2020);21/12/2021;286;2021-12-21
100;1007;CCNC 2021;IEEE Consumer Communications & Networking Conference;Jan 9, 2021 - Jan 12, 2021;Las Vegas, USA;Jul 10, 2021;10/07/2021;287;2021-07-10
100;1007;blockchain_ml_iot 2021;Network and Electronics (MDPI) Joint Special Issue - Blockchain and Machine Learning for IoT: Security and Privacy Challenges;N/A;N/A;Dec 31, 2021;31/12/2021;288;2021-12-31
100;1007;KMIS 2021;13th International Conference on Knowledge Management and Information Systems;Oct 25, 2021 - Oct 27, 2021;Valletta, Malta;May 18, 2021;18/05/2021;289;2021-05-18
100;1007;CHEOPS 2021;Workshop on Challenges and Opportunities of Efficient and Performant Storage Systems;Apr 26, 2021 - Apr 26, 2021;Held remotely;Feb 17, 2021 (Feb 10, 2021);17/02/2021;290;2021-02-17
100;1007;AS-RLPMTM 2021;Applied Sciences special issue Rich Linguistic Processing for Multilingual Text Mining;N/A;N/A;Jun 30, 2021;30/06/2021;291;2021-06-30
100;1007;ISAIC 2021;The 2nd International Symposium on Automation, Information and Computing (ISAIC 2021);Dec 3, 2021 - Dec 6, 2021;Beijing Jiaotong University, China;Oct 15, 2021;15/10/2021;292;2021-10-15
100;1007;FCSIT 2021;2021 3rd Euro-Asia Conference on Frontiers of Computer Science and Information Technology (FCSIT 2021);Dec 3, 2021 - Dec 5, 2021;Beijing, China;Oct 31, 2021;31/10/2021;293;2021-10-31
100;1007;SI: Advanced Technology for IE 2022;Special Issue: Secure and Advanced Technology for Intelligent Environments;Jan 1, 2021 - Jun 1, 2022;JAISE (IOS) journal;Sep 5, 2021;5/09/2021;294;2021-09-05
100;1007;HotStorage 2021;13th Workshop on Hot Topics in Storage and File Systems;Jul 27, 2021 - Jul 28, 2021;Virtual;Apr 30, 2021;30/04/2021;295;2021-04-30
100;1007;CANS 2021;Cryptology and Network Security;Dec 13, 2021 - Dec 15, 2021;Vienna, Austria;Jun 1, 2021;1/06/2021;296;2021-06-01
100;1007;CLUSTER 2021;23rd IEEE Cluster Conference;Sep 7, 2021 - Sep 10, 2021;Portland, Oregon, USA;May 17, 2021 (May 10, 2021);17/05/2021;297;2021-05-17
100;1007;SNSA-SI-MDPI 2021;Sensor Networks Security and Applications;N/A;N/A;Jul 31, 2021;31/07/2021;298;2021-07-31
100;1007;ICRE--EI, Scopus 2021;2021 5th International Conference on Reliability Engineering (ICRE 2021)--EI Compendex, Scopus;Nov 24, 2021 - Nov 26, 2021;Palermo, Italy;Jul 5, 2021;5/07/2021;299;2021-07-05
100;1007;SYSTOR 2021;The 14th ACM International Systems and Storage Conference;Jun 14, 2021 - Jun 16, 2021;Haifa, Israel;Mar 2, 2021;2/03/2021;300;2021-03-02
100;1007;FUSION 2021;24th International Conference on Information Fusion;Nov 1, 2021 - Nov 4, 2021;Sun City, South Africa;May 15, 2021;15/05/2021;301;2021-05-15
100;1007;KDIR 2021;13th International Conference on Knowledge Discovery and Information Retrieval;Oct 25, 2021 - Oct 27, 2021;Valletta, Malta;May 18, 2021;18/05/2021;302;2021-05-18
100;1007;Spec.Issue on Social Informatics: Scopus 2021;Journal of Social and Business Informatics - Acta Informatica Pragensia;N/A;N/A;Jul 31, 2021;31/07/2021;303;2021-07-31
100;1007;EMERGING 2021;The Thirteenth International Conference on Emerging Networks and Systems Intelligence;Oct 3, 2021 - Oct 7, 2021;Barcelona, Spain;Jul 5, 2021;5/07/2021;304;2021-07-05
100;1007;ICT-DM 2021;The 7th International Conference on Information and Communication Technologies for Disaster Management;Dec 3, 2021 - Dec 5, 2021;Hangzhou, China;Jun 20, 2021 (Jun 15, 2021);20/06/2021;305;2021-06-20
100;1007;EICC 2021;European Interdisciplinary Cybersecurity Conference (EICC 2021);Nov 10, 2021 - Nov 11, 2021;Targu Mures, Romania;Jun 14, 2021;14/06/2021;306;2021-06-14
100;1007;ADIP--EI Compendex, Scopus 2021;2021 3rd Asia Digital Image Processing Conference (ADIP 2021)--EI Compendex, Scopus;Dec 17, 2021 - Dec 19, 2021;Kyoto, Japan;Aug 5, 2021;5/08/2021;307;2021-08-05
100;1007;ADIP--EI, Scopus 2021;2021 3rd Asia Digital Image Processing Conference (ADIP 2021)--EI Compendex, Scopus;Dec 17, 2021 - Dec 19, 2021;Kyoto, Japan;Aug 5, 2021;5/08/2021;308;2021-08-05
100;1007;MDPI Mathematics InSysModGraph 2021;Special Issue Information Systems Modeling Based on Graph Theory;N/A;N/A;Jul 31, 2021;31/07/2021;309;2021-07-31
100;1007;CCCI 2021;International Conference on Communications, Computing, Cybersecurity, and Informatics;Oct 15, 2021 - Oct 17, 2021;Beijing, China;Jul 24, 2021;24/07/2021;310;2021-07-24
100;1007;ICNISC 2021;7th Annual International Conference on Network and Information Systems for Computers;Jul 23, 2021 - Jul 25, 2021;Guiyang;Jul 19, 2021;19/07/2021;311;2021-07-19
100;1007;BDSIC--EI Compendex, Scopus 2021;2021 3rd International Conference on Big-data Service and Intelligent Computation (BDSIC 2021)--Ei Compendex, Scopus;Nov 19, 2021 - Nov 21, 2021;HuaQiao University, Xiamen?China;Jul 5, 2021;5/07/2021;312;2021-07-05
100;1007;BDSIC--EI, Scopus 2021;2021 3rd International Conference on Big-data Service and Intelligent Computation (BDSIC 2021)--Ei Compendex, Scopus;Nov 19, 2021 - Nov 21, 2021;HuaQiao University, Xiamen?China;Jul 5, 2021;5/07/2021;313;2021-07-05
100;1007;Solar & Storage Integration Workshop 2021;11th International Workshop on Integration of Solar Power & Storage into Power Systems;Sep 28, 2021 - Sep 29, 2021;Virtual/Germany;May 1, 2021;1/05/2021;314;2021-05-01
100;1007;Scopus-WSM 2021;The 3rd International Conference on Water Security and Management ( WSM 2021);Dec 9, 2021 - Dec 11, 2021;Tokyo, Japan;Jun 10, 2021;10/06/2021;315;2021-06-10
100;1007;SI on SPIHG 2022;IEEE S&P CfP: Special Issue on Security and Privacy Issues of Home Globalization;N/A;N/A;May 15, 2021;15/05/2021;316;2021-05-15
100;1007;SPBP 2021;The Fourth Workshop on Security and Privacy-enhanced Business Process Management;Sep 6, 2021 - Sep 6, 2021;Rome, Italy;May 24, 2021;24/05/2021;317;2021-05-24
100;1007;HOST 2021;IEEE International Symposium on Hardware Oriented Security and Trust (HOST);Dec 5, 2021 - Dec 8, 2021;Washington Dc, USA;May 4, 2021 (Apr 27, 2021);4/05/2021;318;2021-05-04
100;1007;CYBER 2021;The Sixth International Conference on Cyber-Technologies and Cyber-Systems;Oct 3, 2021 - Oct 7, 2021;Barcelona, Spain;Jul 5, 2021;5/07/2021;319;2021-07-05
100;1007;MDPI - Risk Management - Scopus 2021;Special Issue of Journal Applied System Innovation: Risk Management;N/A;N/A;Jul 31, 2021;31/07/2021;320;2021-07-31
100;1007;ICCPR--ACM, Ei, Scopus 2021;ACM--2021 10th International Conference on Computing and Pattern Recognition (ICCPR 2021)--Ei Compendex, Scopus;Oct 15, 2021 - Oct 17, 2021;Shanghai, China;Jun 1, 2021;1/06/2021;321;2021-06-01
100;1007;WSM-Scopus 2021;The 3rd International Conference on Water Security and Management ( WSM 2021);Dec 9, 2021 - Dec 11, 2021;Tokyo, Japan;Jun 10, 2021;10/06/2021;322;2021-06-10
100;1007;CSW 2021;2021 International Workshop on Cyber Security (CSW 2021);Aug 13, 2021 - Aug 15, 2021;Stockholm, Sweden;Jun 30, 2021;30/06/2021;323;2021-06-30
100;1007;IC3K 2021;13th International Joint Conference on Knowledge Discovery, Knowledge Engineering and Knowledge Management;Oct 25, 2021 - Oct 27, 2021;Valletta, Malta;May 18, 2021;18/05/2021;324;2021-05-18
101;1008;ECML PKDD 2021;European Conference on Machine Learning and Principles and Practice of Knowledge Discovery in Databases;Sep 13, 2021 - Sep 17, 2021;Bilbao, Spain;May 2, 2021;2/05/2021;325;2021-05-02
101;1008;PODC 2021;Principles of Distributed Computing;Jul 26, 2021 - Jul 30, 2021;Salerno, Italy;Feb 15, 2021 (Feb 11, 2021);15/02/2021;326;2021-02-15
101;1008;ECML PKDD 2021;European Conference on Machine Learning and Principles and Practice of Knowledge Discovery in Databases;Sep 13, 2021 - Sep 17, 2021;Bilbao, Spain;Apr 2, 2021 (Mar 26, 2021);2/04/2021;327;2021-04-02
101;1008;KR 2021;18th International Conference on Principles of Knowledge Representation and Reasoning;Nov 6, 2021 - Nov 12, 2021;Hanoi, Vietnam;Mar 31, 2021 (Mar 24, 2021);31/03/2021;328;2021-03-31
101;1008;PODS 2021;Symposium on Principles of Database Systems;Jun 20, 2021 - Jun 25, 2021;Xi'an, China;Dec 20, 2020 (Dec 13, 2020);20/12/2020;329;2020-12-20
101;1008;PADS 2021;ACM SIGSIM Conference on Principles of Advanced Discrete Simulation;May 31, 2020 - Jun 2, 2020;Suffolk, VA, USA;Jan 31, 2021 (Jan 17, 2021);31/01/2021;330;2021-01-31
101;1008;CP 2021;International Conference on Principles and Practice of Constraint Programming;Oct 25, 2021 - Oct 29, 2021;Montpellier;May 14, 2021;14/05/2021;331;2021-05-14
101;1008;CP 2021;Twenty-Seventh Conference on Principles and Practice of Constraint Programming;Oct 25, 2021 - Oct 29, 2021;Montpellier (France);Jun 21, 2021 (May 14, 2021);21/06/2021;332;2021-06-21
101;1008;Sale Analytics 2021;Call for Book Chapters Shale Analytics: Principles and Practices;Jan 30, 2021 - Feb 15, 2021;Online;Jan 30, 2021;30/01/2021;333;2021-01-30
101;1008;PPoPP 2021;26th ACM SIGPLAN Annual Symposium on Principles and Practice of Parallel Programming;Feb 27, 2021 - Mar 3, 2021;Seoul, South Korea;Aug 13, 2020 (Aug 6, 2020);13/08/2020;334;2020-08-13
101;1008;POPL 2021;Principles of Programming Languages 2021;Feb 17, 2021 - Feb 22, 2021;Copenhagen, Denmark;Jul 9, 2020;9/07/2020;335;2020-07-09
101;1008;ECML PKDD (journal track) 2021;European Conference on Machine Learning and Principles and Practice of Knowledge Discovery in Databases;Sep 13, 2021 - Sep 17, 2021;Bilbao, Spain;TBD;NULL;336;NULL
101;1009;NSDI 2022;19th USENIX Symposium on Networked Systems Design and Implementation;Apr 4, 2022 - Apr 6, 2022;RENTON, WA;Mar 10, 2021 (Mar 4, 2021);10/03/2021;337;2021-03-10
101;1009;ENVIRONMENTS BY DESIGN 2021;ENVIRONMENTS BY DESIGN: HEALTH, WELLBEING AND PLACE;Dec 1, 2021 - Dec 3, 2021;virtual;Jun 25, 2021;25/06/2021;338;2021-06-25
101;1009;CLNLP 2021;2021 2nd International Conference on Computational Linguistics and Natural Language Processing (CLNLP 2021);Dec 3, 2021 - Dec 5, 2021;Beijing, China;Oct 30, 2021;30/10/2021;339;2021-10-30
101;1009;ICDEPI-SCOPUS 2021;5th International Conference on Design Engineering and Product Innovation (ICDEPI 2021);Aug 25, 2021 - Aug 27, 2021;Amsterdam, Netherlands;Apr 25, 2021;25/04/2021;340;2021-04-25
101;1009;PARMA-DITAM 2021;PARMA-DITAM: 12th Workshop on Parallel Programming and Run-Time Management Techniques for Many-core Architectures & 10th Workshop on Design Tools and Architectures for Multi-Core;Jan 19, 2021 - Jan 19, 2021;Virtual;Nov 13, 2021;13/11/2021;341;2021-11-13
101;1009;DSD 2021;Euromicro Conference on Digital System Design (DSD) 2021;Sep 6, 2021 - Sep 8, 2021;Palermo, Sicily, Italy;Apr 1, 2021;1/04/2021;342;2021-04-01
101;1009;ICCSE 2021;The 16th International Conference on Computer Science and Education;Aug 17, 2021 - Aug 21, 2021;Lancaster;Apr 15, 2021;15/04/2021;343;2021-04-15
101;1009;VALID 2021;The Thirteenth International Conference on Advances in System Testing and Validation Lifecycle;Oct 3, 2021 - Oct 7, 2021;Barcelona, Spain;Jul 5, 2021;5/07/2021;344;2021-07-05
101;1009;Elec-SI-IIDS 2021;Special Issue on Design of Intelligent Intrusion Detection Systems;N/A;N/A;May 31, 2021;31/05/2021;345;2021-05-31
101;1009;SLATE 2021;10th Symposium on Languages, Technologies and Applications;Jul 1, 2021 - Jul 2, 2021;ESMAD, Vila do Conde, Portugal;Apr 1, 2021;1/04/2021;346;2021-04-01
101;1009;Scopus-WADCE 2021;7th International Workshop on Aircraft Design and Control Engineering (WADCE 2021);Dec 9, 2021 - Dec 12, 2021;Melbourne, Australia;Jun 10, 2021;10/06/2021;347;2021-06-10
101;1009;FDL 2021;24th IEEE Forum on specification & Design Languages;Sep 8, 2021 - Sep 10, 2021;Antibes (France);May 24, 2021 (May 17, 2021);24/05/2021;348;2021-05-24
101;1009;CODES + ISSS 2021;International Conference on Hardware/Software Codesign and System Synthesis;Oct 10, 2021 - Oct 15, 2021;virtual?;Apr 9, 2021 (Apr 2, 2021);9/04/2021;349;2021-04-09
101;1009;AIEDAM Data-Enabled Design 2021;AIEDAM Thematic Collection: Perspectives on Data-Enabled Design - Design meets Data Science;N/A;N/A;Apr 30, 2021;30/04/2021;350;2021-04-30
101;1009;SCOPUS-ATDMAE 2021;5th International Conference on Advanced Technologies in Design, Mechanical and Aeronautical Engineering (ATDMAE 2021);Aug 25, 2021 - Aug 27, 2021;Amsterdam, Netherlands;Apr 25, 2021;25/04/2021;351;2021-04-25
101;1009;desAIgn 2021;International Conference on the Impact of Artificial Intelligence on Contemporary Design;May 25, 2021 - May 25, 2021;online;Mar 25, 2021;25/03/2021;352;2021-03-25
101;1009;HEART 2021;11th International Symposium on Highly Efficient Accelerators and Reconfigurable Technologies;Jun 21, 2021 - Jun 23, 2021;Online;Mar 15, 2021;15/03/2021;353;2021-03-15
101;1009;ICCPM 2021;2021 12th International Conference on Construction and Project Management (ICCPM 2021);Sep 27, 2021 - Sep 29, 2021;Macau, China;May 10, 2021;10/05/2021;354;2021-05-10
101;1009;SDM 2021;8th International Conference on Sustainable Design and Manufacturing;Sep 15, 2021 - Sep 17, 2021;Split, Croatia & Virtual;Apr 2, 2021;2/04/2021;355;2021-04-02
101;1009;SBCCI 2021;34rd Symposium on Integrated Circuits and Systems Design;Aug 23, 2021 - Aug 27, 2021;Campinas, Brazil;Apr 5, 2021;5/04/2021;356;2021-04-05
101;1009;ATDMAE 2021;5th International Conference on Advanced Technologies in Design, Mechanical and Aeronautical Engineering (ATDMAE 2021);Aug 25, 2021 - Aug 27, 2021;Amsterdam, Netherlands;Apr 25, 2021;25/04/2021;357;2021-04-25
101;1009;Industry Practices in Edu 2021;Book Chapter for Industry Practices, Processes and Techniques Adopted in Education - Supporting innovative teaching and learning practice;N/A;N/A;Mar 1, 2021 (Jan 20, 2021);1/03/2021;358;2021-03-01
101;1009;SMACD 2021;International Conference on Synthesis, Modeling, Analysis and Simulation Methods and Applications to Circuit Design;Jul 19, 2021 - Jul 22, 2021;Virtual event;Mar 7, 2021;7/03/2021;359;2021-03-07
101;1009;AIFIT 2021;AI for Future Intelligent Transportation: Smarter and Greener Design;Feb 15, 2021 - May 31, 2021;India;Apr 30, 2021 (Feb 15, 2021);30/04/2021;360;2021-04-30
101;1009;BMSD 2021;11th Int. Symposium on Business Modeling and Software Design;Jul 5, 2021 - Jul 7, 2021;Sofia, Bulgaria;Mar 15, 2021;15/03/2021;361;2021-03-15
101;1009;CST 2021;8th International Conference on Foundations of Computer Science & Technology;Dec 23, 2021 - Dec 24, 2021;Sydney, Australia;Mar 13, 2021;13/03/2021;362;2021-03-13
101;1009;IHCI 2021;15th International Conference on Interfaces and Human Computer Interaction 2021;Jul 21, 2021 - Jul 23, 2021;online;Mar 1, 2021;1/03/2021;363;2021-03-01
101;1009;Sensors (MDPI) SI on TIE 2021;Sensors Special Issue on Trusted IoT Ecosystem;N/A;N/A;Mar 31, 2021;31/03/2021;364;2021-03-31
101;1009;IMECE 2021;International Mechanical Engineering Congress and Exposition;Nov 1, 2021 - Nov 4, 2021;Virtual;Mar 9, 2021;9/03/2021;365;2021-03-09
101;1009;WCN 2022;Wireless Communications and Networking: Theory and Practice;N/A;N/A;Feb 28, 2021;28/02/2021;366;2021-02-28
101;1010;NSDI 2021;18th USENIX Symposium on Networked Systems Design and Implementation;Apr 12, 2021 - Apr 14, 2021;BOSTON, MA, USA;Apr 17, 2020 (Apr 10, 2020);17/04/2020;367;2020-04-17
101;1010;NSDI 2022;19th USENIX Symposium on Networked Systems Design and Implementation;Apr 4, 2022 - Apr 6, 2022;RENTON, WA;Mar 10, 2021 (Mar 4, 2021);10/03/2021;368;2021-03-10
101;1010;PLDI 2021;Programming Language Design and Implementation;Jun 20, 2021 - Jun 25, 2021;Virtual Conference;Nov 20, 2020;20/11/2020;369;2020-11-20
101;1010;CPHS21;CFP: The First International Workshop on Cyber-Physical-Human System Design and Implementation;May 18, 2021 - May 18, 2021;Virtual;Feb 21, 2021;21/02/2021;370;2021-02-21
101;1010;IoTDI 2021;6th ACM/IEEE Conference on Internet of Things Design and Implementation;May 18, 2021 - May 21, 2021;Nashville, Tenessee, USA;Oct 26, 2020 (Oct 19, 2020);26/10/2020;371;2020-10-26
101;1010;IoTDI 2021;6th ACM/IEEE Conference on Internet of Things Design and Implementation;May 18, 2021 - May 21, 2021;Nashville, Tennessee, USA;Oct 26, 2020 (Oct 19, 2020);26/10/2020;372;2020-10-26
101;1010;IoTDI 2021;International Conference on Internet of Things Design and Implementation (IoTDI);May 18, 2021 - May 21, 2021;Nashville, Tennessee, USA;Oct 26, 2020 (Oct 19, 2020);26/10/2020;373;2020-10-26
101;1010;IoTDI 2021;6th ACM/IEEE Conference on Internet of Things Design and Implementation;May 18, 2021 - May 21, 2021;Nashville, Tennessee, USA;Oct 26, 2020 (Oct 19, 2020);26/10/2020;374;2020-10-26
101;1010;IoTDI 2021;6th ACM/IEEE Conference on Internet of Things Design and Implementation;May 18, 2021 - May 21, 2021;Nashville, Tennessee, USA;Oct 26, 2020;26/10/2020;375;2020-10-26
101;1010;IoTDI 2021;6th ACM/IEEE Conference on Internet of Things Design and Implementation;May 18, 2021 - May 21, 2021;Nashville, Tennessee, USA;Oct 26, 2020 (Oct 19, 2020);26/10/2020;376;2020-10-26
101;1010;EAI TRIDENTCOM 2021;16th EAI International Conference on Tools for Design, Implementation and Verification of Emerging Information Technologies (Springer, Scopus, ISI, Ei, more);Nov 24, 2021 - Nov 26, 2021;Melbourne, Australia;May 3, 2020;3/05/2020;377;2020-05-03
101;1011;VSC @IEEE WETICE 2021;Track on Validating Software for Critical Systems (VSC) @IEEE WETICE 2021;Jun 23, 2021 - Jun 25, 2021;Basque Coast - Bayonne, France;Feb 28, 2021;28/02/2021;378;2021-02-28
101;1011;IJCSA 2021;International Journal on Computational Science & Applications;N/A;N/A;Feb 20, 2021;20/02/2021;379;2021-02-20
101;1011;MDPI-SI-BDHA 2021;Call for Papers: Special Issue “Big Data for eHealth Applications” (MDPI Applied Sciences, IF 2.474 – Indexed on Scopus, Web of Science);N/A;N/A;Sep 15, 2021;15/09/2021;380;2021-09-15
101;1011;ATVA 2021;The 19th International Symposium on Automated Technology for Verification and Analysis;Oct 18, 2021 - Oct 22, 2021;Gold Coast, Australia;Apr 9, 2021;9/04/2021;381;2021-04-09
101;1011;SANER 2021;The 28th edition of the IEEE International Conference on Software Analysis, Evolution and Reengineering;Mar 9, 2021 - Mar 12, 2021;Virtually;Oct 15, 2021;15/10/2021;382;2021-10-15
101;1011;ICIAP 2021;ICIAP2021 -21th International Conference on Image Analysis and Processing;Sep 13, 2021 - Sep 17, 2021;Lecce;May 5, 2021;5/05/2021;383;2021-05-05
101;1011;DATA ANALYTICS 2021;The Tenth International Conference on Data Analytics;Oct 3, 2021 - Oct 7, 2021;Barcelona, Spain;Jul 5, 2021;5/07/2021;384;2021-07-05
101;1011;XSA 2021;Explainable Deep Learning for Sentiment Analysis;N/A;N/A;Jun 30, 2021;30/06/2021;385;2021-06-30
101;1011;VALID 2021;The Thirteenth International Conference on Advances in System Testing and Validation Lifecycle;Oct 3, 2021 - Oct 7, 2021;Barcelona, Spain;Jul 5, 2021;5/07/2021;386;2021-07-05
101;1011;MIAIAD 2021;Medical Image Analysis special issue on Image Analysis in Dermatology;N/A;N/A;Mar 1, 2021;1/03/2021;387;2021-03-01
101;1011;MIUA 2021;MEDICAL IMAGE UNDERSTANDING AND ANALYSIS;Jul 12, 2021 - Jul 14, 2021;Oxford, UK;Mar 19, 2021;19/03/2021;388;2021-03-19
101;1011;ICSEA 2021;The Sixteenth International Conference on Software Engineering Advances;Oct 3, 2021 - Oct 7, 2021;Barcelona, Spain;Jul 5, 2021;5/07/2021;389;2021-07-05
101;1011;EuroSTAR Conference 2021;29th EuroSTAR Software Testing & Quality Conference;Sep 28, 2021 - Sep 30, 2021;In-Person & Online;Feb 7, 2021;7/02/2021;390;2021-02-07
101;1011;TRECVID 2021;TREC Video Retrieval Evaluation;Dec 7, 2021 - Dec 10, 2021;In-person Or Virtual;May 3, 2021;3/05/2021;391;2021-05-03
101;1011;WoSCA 2021;WoSCA 2021 : 2nd International Workshop on Smart Contract Analysis;Jul 12, 2021 - Jul 16, 2021;Aarhus, Denmark;May 14, 2021;14/05/2021;392;2021-05-14
101;1011;CSIA 2021;12th International Conference on Communications Security & Information Assurance;Nov 20, 2021 - Nov 21, 2021;Zurich, Switzerland;Mar 6, 2021;6/03/2021;393;2021-03-06
101;1011;SOEN 2021;6th International Conference on Software Engineering;May 29, 2021 - May 30, 2021;Vancouver, Canada;Feb 20, 2021;20/02/2021;394;2021-02-20
101;1011;CP 2021;Twenty-Seventh Conference on Principles and Practice of Constraint Programming;Oct 25, 2021 - Oct 29, 2021;Montpellier (France);Jun 21, 2021 (May 14, 2021);21/06/2021;395;2021-06-21
101;1011;CP 2021;International Conference on Principles and Practice of Constraint Programming;Oct 25, 2021 - Oct 29, 2021;Montpellier;May 14, 2021;14/05/2021;396;2021-05-14
101;1011;TASE 2021;The 15th International Symposium on Theoretical Aspects of Software Engineering;Aug 25, 2021 - Aug 27, 2021;Shanghai;Mar 7, 2021 (Feb 28, 2021);7/03/2021;397;2021-03-07
101;1011;ISIC-SIAW-CVPR 2021;Sixth ISIC Skin Image Analysis Workshop@CVPR 2021;Jun 19, 2021 - Jun 25, 2021;WWW (Virtual);Mar 17, 2021;17/03/2021;398;2021-03-17
101;1011;NER & Geo-Tagging for Literary Analysis 2021;Distant Reading Training School: Named Entity Recognition & Geo-Tagging for Literary Analysis;Mar 22, 2021 - Mar 25, 2021;Rijeka-Zoom;Mar 7, 2021;7/03/2021;399;2021-03-07
101;1011;JSS SI on Test Automation 2021;Special Issue on “Test Automation: Trends, Benefits, and Costs” - Journal of Systems and Software (Elsevier);N/A;N/A;Mar 31, 2021;31/03/2021;400;2021-03-31
101;1011;SAMRA 2021;Sentiment Analysis as a Multidisciplinary Research Area;N/A;N/A;Mar 31, 2021;31/03/2021;401;2021-03-31
101;1011;X-SENTIMENT 2021;X-SENTIMENT@ESWC 6th International Workshop on eXplainable SENTIment Mining and EmotioN deTection;Jun 7, 2021 - Jun 7, 2021;Hersonissos, Greece;Mar 1, 2021;1/03/2021;402;2021-03-01
101;1011;SOFE 2021;7th International Conference on Software Engineering;Mar 20, 2021 - Mar 21, 2021;Vienna, Austria;Feb 20, 2021;20/02/2021;403;2021-02-20
101;1011;SIGPRO 2021;International Conference on Data Science and Cloud Computing;Sep 18, 2021 - Sep 19, 2021;Copenhagen, Denmark;Feb 20, 2021;20/02/2021;404;2021-02-20
101;1011;ISPA 2021;12th International Symposium on Image and Signal Processing and Analysis;Sep 13, 2021 - Sep 15, 2021;Zagreb;May 25, 2021;25/05/2021;405;2021-05-25
101;1011;Big Data Analytics in Sustainable City 2021;IS04: Big Data Analytics in Sustainable and Smart City;Sep 15, 2021 - Sep 17, 2021;Split, Croatia;Apr 2, 2021;2/04/2021;406;2021-04-02
101;1011;WCPAS & IACSS 2021;World Congress of Performance Analysis of Sport 2021 & International Symposium on Computer Science in Sport 2021;Aug 29, 2021 - Sep 1, 2021;Vienna;Apr 1, 2021;1/04/2021;407;2021-04-01
101;1011;MLDS 2021;2nd International Conference on Machine Learning Techniques and Data Science;Nov 20, 2021 - Nov 21, 2021;Zurich, Switzerland;Mar 6, 2021;6/03/2021;408;2021-03-06
101;1011;SMACD 2021;International Conference on Synthesis, Modeling, Analysis and Simulation Methods and Applications to Circuit Design;Jul 19, 2021 - Jul 22, 2021;Virtual event;Mar 7, 2021;7/03/2021;409;2021-03-07
101;1011;SE 2021;9th International Conference on Software Engineering & Trends;Jul 10, 2021 - Jul 11, 2021;Toronto, Canada;Feb 20, 2021;20/02/2021;410;2021-02-20
101;1011;SEC 2021;7th International Conference on Software Engineering;Mar 27, 2021 - Mar 28, 2021;Sydney, Australia;Feb 20, 2021;20/02/2021;411;2021-02-20
101;1011;CAIML 2021;2nd International Conference on Artificial Intelligence and Machine Learning;Jun 26, 2021 - Jun 27, 2021;Sydney, Australia;Feb 27, 2021;27/02/2021;412;2021-02-27
101;1011;SIPIJ 2021;Signal & Image Processing : An International Journal;N/A;N/A;Feb 20, 2021;20/02/2021;413;2021-02-20
101;1011;DaMi 2021;7th International Conference on Data Mining;Apr 24, 2021 - Apr 25, 2021;Copenhagen, Denmark;Feb 20, 2021;20/02/2021;414;2021-02-20
101;1011;NumANN 2021;Mathematics Journal Special Issue on Numerical Analysis of Artificial Neural Networks;N/A;N/A;Mar 31, 2021;31/03/2021;415;2021-03-31
101;1011;ICBA Spring 2021;2021 International Conference on Business Administration - Spring Session;May 7, 2021 - May 7, 2021;National Taipei University;Mar 22, 2021;22/03/2021;416;2021-03-22
101;1011;IEEE ADAITC 2021;2021 IEEE Autonomous Driving AI Test Challenge;Aug 23, 2021 - Aug 26, 2021;Online;Mar 15, 2021;15/03/2021;417;2021-03-15
101;1011;ASOFT 2021;2nd International Conference on Advances in Software Engineering;Sep 18, 2021 - Sep 19, 2021;Copenhagen, Denmark;Feb 20, 2021;20/02/2021;418;2021-02-20
101;1011;IJSEA 2021;International Journal of Software Engineering & Applications -ERA Indexed;N/A;N/A;Feb 20, 2021;20/02/2021;419;2021-02-20
101;1011;ICGDA--Ei and Scopus 2021;ACM--2021 4th International Conference on Geoinformatics and Data Analysis (ICGDA 2021)--Ei Compendex, Scopus;Apr 14, 2021 - Apr 16, 2021;Marseille, France;Feb 25, 2021;25/02/2021;420;2021-02-25
101;1011;WEARS 2021;The First International Workshop on Evaluation and Analysis of Recommender Systems in Software Engineering;Jun 23, 2021 - Jun 23, 2021;Trondheim Norway, Virtual;Mar 26, 2021;26/03/2021;421;2021-03-26
101;1011;ICRAMI 2021;International Conference on Recent Advances in Mathematics and Informatics;Sep 21, 2021 - Sep 22, 2021;Tebessa, Algeria;Mar 4, 2021;4/03/2021;422;2021-03-04
101;1011;CVMI@CVPR 2021;6th IEEE Workshop on Computer Vision for Microscopy Image Analysis (CVMI) 2021;Jun 25, 2021 - Jun 25, 2021;Virtual;Mar 23, 2021;23/03/2021;423;2021-03-23
101;1011;SEMIT 2021;2nd International Conference on Software Engineering and Managing Information Technology;Nov 20, 2021 - Nov 21, 2021;Zurich, Switzerland;Mar 6, 2021;6/03/2021;424;2021-03-06
101;1011;DMDBS 2021;7th International Conference on Data Mining and Database Management Systems;Nov 27, 2021 - Nov 28, 2021;London, United Kingdom;Feb 27, 2021;27/02/2021;425;2021-02-27
101;1011;SOENG 2021;7th International Conference on Software Engineering;Apr 24, 2021 - Apr 25, 2021;Copenhagen, Denmark;Feb 20, 2021;20/02/2021;426;2021-02-20
101;1011;SOFEA 2021;7th International Conference on Software Engineering and Applications;Oct 23, 2021 - Oct 24, 2021;Sydney, Australia;Feb 20, 2021;20/02/2021;427;2021-02-20
101;1011;Visual Intersections 5 2021;The 5th Annual Visual Culture Summer School;Jun 21, 2021 - Jun 25, 2021;Online (hosted by Durham University);Feb 22, 2021;22/02/2021;428;2021-02-22
101;1012;WCN 2022;Wireless Communications and Networking: Theory and Practice;N/A;N/A;Feb 28, 2021;28/02/2021;429;2021-02-28
101;1012;JSEP SI on Distributed Complex Systems 2021;Special Issue on “Distributed Complex Systems: Governance, Engineering, and Maintenance” - Journal of Software: Evolution and Process (Wiley);N/A;N/A;Feb 28, 2021;28/02/2021;430;2021-02-28
101;1012;ICCQ 2021;IEEE International Conference on Code Quality;Mar 27, 2021 - Mar 27, 2021;Moscow, Russia;Dec 4, 2020;4/12/2020;431;2020-12-04
101;1012;RAIL 2021;Fifth International Conference on Railway Technology: Research, Development and Maintenance;Aug 3, 2021 - Sep 2, 2021;Palma, Mallorca, Spain;Feb 19, 2021;19/02/2021;432;2021-02-19
101;1012;MFSens 2021;International Workshop on Maintenance-Free Context Sensing;Jan 8, 2021 - Jan 8, 2021;Online;Sep 22, 2020;22/09/2020;433;2020-09-22
101;1013;WoSCA 2021;WoSCA 2021 : 2nd International Workshop on Smart Contract Analysis;Jul 12, 2021 - Jul 16, 2021;Aarhus, Denmark;May 14, 2021;14/05/2021;434;2021-05-14
101;1013;ASE 2021;The 36th IEEE/ACM International Conference on Automated Software Engineering;Nov 15, 2021 - Nov 19, 2021;Melbourne, Australia;Apr 23, 2021 (Apr 16, 2021);23/04/2021;435;2021-04-23
101;1013;CEVVE 2021;2021 International Conference on Electric Vehicle and Vehicle Engineering (CEVVE 2021);Sep 17, 2021 - Sep 19, 2021;Frankfurt, Germany;Jul 31, 2021;31/07/2021;436;2021-07-31
101;1013;SA-TTA 2021;The 9th track on Software Architecture: Theory, Technology, and Applications (SA-TTA) at the 36th ACM/SIGAPP Symposium On Applied Computing (SAC 2021);Mar 22, 2021 - Mar 26, 2021;Gwangju, Korea;Oct 28, 2021;28/10/2021;437;2021-10-28
101;1013;CCNC 2021;IEEE Consumer Communications & Networking Conference;Jan 9, 2021 - Jan 12, 2021;Las Vegas, USA;Jul 10, 2021;10/07/2021;438;2021-07-10
101;1013;CRITIS 2021;The 16th International Conference on Critical Information Infrastructures Security;Sep 27, 2021 - Sep 29, 2021;EPFL SwissTech, Lausanne, Switzerland;May 14, 2021;14/05/2021;439;2021-05-14
101;1013;blockchain_ml_iot 2021;Network and Electronics (MDPI) Joint Special Issue - Blockchain and Machine Learning for IoT: Security and Privacy Challenges;N/A;N/A;Dec 31, 2021;31/12/2021;440;2021-12-31
101;1013;SANER 2021;The 28th edition of the IEEE International Conference on Software Analysis, Evolution and Reengineering;Mar 9, 2021 - Mar 12, 2021;Virtually;Oct 15, 2021;15/10/2021;441;2021-10-15
101;1013;ICSESS 2021;2021 12th International Conference on Software Engineering and Service Science;Aug 20, 2021 - Aug 22, 2021;China;May 15, 2021;15/05/2021;442;2021-05-15
101;1013;SOFSEM 2021;47th International Conference on Current Trends in Theory and Practice of Computer Science;Jan 25, 2021 - Jan 28, 2021;Bozen-Bolzano, Italy;Aug 3, 2021 (Jul 27, 2021);3/08/2021;443;2021-08-03
101;1013;NISecurity 2021;2021 International Conference on Network and Information Security (NISecurity 2021);Aug 13, 2021 - Aug 15, 2021;Stockholm, Sweden;Jun 30, 2021;30/06/2021;444;2021-06-30
101;1013;ICSED--EI Compendex, Scopus 2021;2021 3rd International Conference on Software Engineering and Development (ICSED 2021)--EI Compendex, Scopus;Nov 19, 2021 - Nov 21, 2021;HuaQiao University, Xiamen?China;Jul 5, 2021;5/07/2021;445;2021-07-05
101;1013;SI: Advanced Technology for IE 2022;Special Issue: Secure and Advanced Technology for Intelligent Environments;Jan 1, 2021 - Jun 1, 2022;JAISE (IOS) journal;Sep 5, 2021;5/09/2021;446;2021-09-05
101;1013;CANS 2021;Cryptology and Network Security;Dec 13, 2021 - Dec 15, 2021;Vienna, Austria;Jun 1, 2021;1/06/2021;447;2021-06-01
101;1013;MODELS 2021;ACM/IEEE 24th International Conference on Model Driven Engineering Languages and Systems;Oct 10, 2021 - Oct 15, 2021;Fukuoka, Japan;May 7, 2021 (Apr 30, 2021);7/05/2021;448;2021-05-07
101;1013;CLUSTER 2021;23rd IEEE Cluster Conference;Sep 7, 2021 - Sep 10, 2021;Portland, Oregon, USA;May 17, 2021 (May 10, 2021);17/05/2021;449;2021-05-17
101;1013;SE4ICPS 2021;The 1st IEEE International Workshop on Software Engineering for Industrial Cyber-Physical Systems;Jul 12, 2021 - Jul 16, 2021;Virtual;Apr 21, 2021;21/04/2021;450;2021-04-21
101;1013;SPLC 2021;25th ACM International Systems and Software Product Line Conference;Sep 6, 2021 - Sep 11, 2021;Leicester / Online;Apr 23, 2021 (Apr 16, 2021);23/04/2021;451;2021-04-23
101;1013;SNSA-SI-MDPI 2021;Sensor Networks Security and Applications;N/A;N/A;Jul 31, 2021;31/07/2021;452;2021-07-31
101;1013;ICSRS--Scopus & EI 2021;2021 5th International Conference on System Reliability and Safety (ICSRS 2021)--Scopus & EI Compendex;Nov 24, 2021 - Nov 26, 2021;Palermo, Italy;Jul 5, 2021;5/07/2021;453;2021-07-05
101;1013;ICSEA 2021;The Sixteenth International Conference on Software Engineering Advances;Oct 3, 2021 - Oct 7, 2021;Barcelona, Spain;Jul 5, 2021;5/07/2021;454;2021-07-05
101;1013;ACM MIDDLEWARE 2021;22nd ACM/IFIP International Conference;Dec 6, 2021 - Dec 10, 2021;Québec City, Canada;May 22, 2021 (May 15, 2021);22/05/2021;455;2021-05-22
101;1013;EMERGING 2021;The Thirteenth International Conference on Emerging Networks and Systems Intelligence;Oct 3, 2021 - Oct 7, 2021;Barcelona, Spain;Jul 5, 2021;5/07/2021;456;2021-07-05
101;1013;VISSOFT 2021;9th IEEE Working Conference on Software Visualization;Sep 27, 2021 - Sep 28, 2021;virtual;Jun 18, 2021 (Jun 11, 2021);18/06/2021;457;2021-06-18
101;1013;EICC 2021;European Interdisciplinary Cybersecurity Conference (EICC 2021);Nov 10, 2021 - Nov 11, 2021;Targu Mures, Romania;Jun 14, 2021;14/06/2021;458;2021-06-14
101;1013;IEEE ICVR--Ei, Scopus 2021;2021 IEEE 7th International Conference on Virtual Reality (ICVR 2021)--EI Compendex, Scopus;May 20, 2021 - May 22, 2021;Foshan, China;Apr 15, 2021;15/04/2021;459;2021-04-15
101;1013;IntelligentIoT 2021;Special Issue Embedded Intelligence in IoT Systems;N/A;N/A;Aug 31, 2021;31/08/2021;460;2021-08-31
101;1013;ICSED--EI, Scopus 2021;2021 3rd International Conference on Software Engineering and Development (ICSED 2021)--EI Compendex, Scopus;Nov 19, 2021 - Nov 21, 2021;HuaQiao University, Xiamen?China;Jul 5, 2021;5/07/2021;461;2021-07-05
101;1013;CCCI 2021;International Conference on Communications, Computing, Cybersecurity, and Informatics;Oct 15, 2021 - Oct 17, 2021;Beijing, China;Jul 24, 2021;24/07/2021;462;2021-07-24
101;1013;Scopus-WSM 2021;The 3rd International Conference on Water Security and Management ( WSM 2021);Dec 9, 2021 - Dec 11, 2021;Tokyo, Japan;Jun 10, 2021;10/06/2021;463;2021-06-10
101;1013;JIISIC 2021;XVI - Jornadas Iberoamericanas de Ingeniería de Software e Ingeniería del Conocimiento;Sep 22, 2021 - Sep 24, 2021;Santiago de Chile, Chile;May 15, 2021;15/05/2021;464;2021-05-15
101;1013;SI on SPIHG 2022;IEEE S&P CfP: Special Issue on Security and Privacy Issues of Home Globalization;N/A;N/A;May 15, 2021;15/05/2021;465;2021-05-15
101;1013;Elec-SI-IIDS 2021;Special Issue on Design of Intelligent Intrusion Detection Systems;N/A;N/A;May 31, 2021;31/05/2021;466;2021-05-31
101;1013;SPBP 2021;The Fourth Workshop on Security and Privacy-enhanced Business Process Management;Sep 6, 2021 - Sep 6, 2021;Rome, Italy;May 24, 2021;24/05/2021;467;2021-05-24
101;1013;HOST 2021;IEEE International Symposium on Hardware Oriented Security and Trust (HOST);Dec 5, 2021 - Dec 8, 2021;Washington Dc, USA;May 4, 2021 (Apr 27, 2021);4/05/2021;468;2021-05-04
101;1013;CONISOFT 2021;9th International Conference on Software Engineering Research and Innovation;Oct 25, 2021 - Oct 29, 2021;San Diego Global Knowledge University (S;May 15, 2021;15/05/2021;469;2021-05-15
101;1013;SPML--ACM, EI, Scopus 2021;ACM--2021 4th International Conference on Signal Processing and Machine Learning (SPML 2021)--EI Compendex, Scopus;Aug 18, 2021 - Aug 20, 2021;Beijing, China;Apr 20, 2021;20/04/2021;470;2021-04-20
101;1013;CYBER 2021;The Sixth International Conference on Cyber-Technologies and Cyber-Systems;Oct 3, 2021 - Oct 7, 2021;Barcelona, Spain;Jul 5, 2021;5/07/2021;471;2021-07-05
101;1013;MDPI - Risk Management - Scopus 2021;Special Issue of Journal Applied System Innovation: Risk Management;N/A;N/A;Jul 31, 2021;31/07/2021;472;2021-07-31
101;1013;ICTS 2021;The 13th International Conference on Information & Communication Technology and System;Oct 20, 2021 - Oct 21, 2021;Virtual conference;Jul 8, 2021;8/07/2021;473;2021-07-08
101;1013;WSM-Scopus 2021;The 3rd International Conference on Water Security and Management ( WSM 2021);Dec 9, 2021 - Dec 11, 2021;Tokyo, Japan;Jun 10, 2021;10/06/2021;474;2021-06-10
101;1013;CSW 2021;2021 International Workshop on Cyber Security (CSW 2021);Aug 13, 2021 - Aug 15, 2021;Stockholm, Sweden;Jun 30, 2021;30/06/2021;475;2021-06-30
101;1013;ICENT--EI Compendex, Scopus 2021;2021 3rd International Conference on Emerging Networks Technologies (ICENT 2021)--Ei Compendex, Scopus;Sep 22, 2021 - Sep 24, 2021;Okinawa, Japan;May 10, 2021;10/05/2021;476;2021-05-10
101;1013;QUATIC 2021;International Conference on the Quality of Information and Communications Technology;Sep 8, 2021 - Sep 11, 2021;Portugal;Apr 10, 2021;10/04/2021;477;2021-04-10
101;1013;QUORS 2021;The 15th IEEE International Workshop on Quality Oriented Reuse of Software;Jul 13, 2021 - Jul 16, 2021;Virtual due to COVID, Madrid, Spain;Apr 21, 2021;21/04/2021;478;2021-04-21
101;1013;Scopus-WADCE 2021;7th International Workshop on Aircraft Design and Control Engineering (WADCE 2021);Dec 9, 2021 - Dec 12, 2021;Melbourne, Australia;Jun 10, 2021;10/06/2021;479;2021-06-10
101;1013;SKM 2021;International Conference on Secure Knowledge Management;Oct 8, 2021 - Oct 9, 2021;San Antonio;Jun 21, 2021;21/06/2021;480;2021-06-21
101;1013;EAI Qshine 2021;17th EAI International Conference on Heterogeneous Networking for Quality, Reliability, Security and Robustness (Springer, Scopus, ISI, Ei, more);Nov 29, 2021 - Nov 30, 2021;Melbourne, Australia;May 20, 2021;20/05/2021;481;2021-05-20
101;1013;SciSec 2021;3rd International Conference on Science of Cyber Security;Aug 13, 2021 - Aug 15, 2021;Shanghai, China;May 1, 2021;1/05/2021;482;2021-05-01
101;1013;Electronics (SI Open Souce Learning) 2021;Electronics Special issue: Open Source Software in Learning Environments (IF 2.412, ISSN 2079-9292);N/A;N/A;May 21, 2021;21/05/2021;483;2021-05-21
101;1013;ICRV--ACM, EI, Scopus 2021;ACM--2021 The 6th International Conference on Robotics and Vision (ICRV 2021)--Ei Compendex, SCOPUS;Sep 18, 2021 - Sep 20, 2021;Lanzhou, China;May 5, 2021;5/05/2021;484;2021-05-05
101;1014;FATES 2021;3rd Workshop on Fairness, Accountability, Transparency, Ethics and Society on the Web;Apr 19, 2021 - Apr 23, 2021;Ljubljana, Slovenia;Jan 25, 2021;25/01/2021;485;2021-01-25
101;1014;Engineering Ethics 2021;Special Issue on: Engineering Ethics: Bridging the Theory-Practice Gap;N/A;N/A;Dec 1, 2020;1/12/2020;486;2020-12-01
101;1014;ACERP 2021;The 11th Asian Conference on Ethics, Religion & Philosophy;Mar 28, 2021 - Mar 31, 2021;Tokyo, Japan;Jan 15, 2021;15/01/2021;487;2021-01-15
101;1014;LesserEthics 2021;Lesser Ethics: Retrieving the Good Life in the Franciscan Tradition;Jun 24, 2021 - Jun 25, 2021;Zoom;Mar 1, 2021;1/03/2021;488;2021-03-01
101;1014;Romantic Ethics 2022;Romantic Ethics and the ‘Woke’ Romantics (Edited Volume, Anglistik und Englischunterricht);N/A;N/A;Nov 20, 2020;20/11/2020;489;2020-11-20
101;1014;IJEL 2021;Inamori International Thesis Prize in Military Ethics;N/A;Case Western Reserve University;Feb 15, 2021;15/02/2021;490;2021-02-15
101;1014;IEEESSIT21CW 2021;IEEE SSIT 3rd Conference on Norbert Wiener in the 21st Century;Jul 22, 2021 - Jul 25, 2021;Chennai, India;Mar 1, 2021;1/03/2021;491;2021-03-01
101;1014;IJEL 2021;Ethical Leadership + Justice;Dec 4, 2020 - Mar 15, 2021;Case Western Reserve University;Mar 15, 2021;15/03/2021;492;2021-03-15
101;1014;SEthics 2021;Ethics in Software Engineering Research and Practice;Jun 4, 2021 - Jun 4, 2021;Virtual;Jan 19, 2021;19/01/2021;493;2021-01-19
101;1014;EPTvS 2021;CFP: Ethics and Politics of TV Series;N/A;N/A;Jan 31, 2021;31/01/2021;494;2021-01-31
101;1014;CARE 2021;Care: 1st Global Interdisciplinary Conference;Mar 12, 2021 - Mar 13, 2021;Lisbon, Portugal;Sep 4, 2020;4/09/2020;495;2020-09-04
101;1014;13-ICGS3 2021;VIRTUAL 13th International Conference on Global Security, Safety & Sustainability, ICGS3-21;Jan 14, 2021 - Jan 15, 2021;London;Sep 3, 2020 (Jul 21, 2020);3/09/2020;496;2020-09-03
101;1014;MEAM 2021;CFP: Handbook of Research on Machine Ethics and Morality;N/A;N/A;Nov 2, 2019;2/11/2019;497;2019-11-02
102;1015;NSDI 2022;19th USENIX Symposium on Networked Systems Design and Implementation;Apr 4, 2022 - Apr 6, 2022;RENTON, WA;Mar 10, 2021 (Mar 4, 2021);10/03/2021;498;2021-03-10
102;1015;MobiSPC 2021;The 18th International Conference on Mobile Systems and Pervasive Computing;Aug 9, 2021 - Aug 12, 2021;Leuven, Belgium;Mar 19, 2021;19/03/2021;499;2021-03-19
102;1015;ENVIRONMENTS BY DESIGN 2021;ENVIRONMENTS BY DESIGN: HEALTH, WELLBEING AND PLACE;Dec 1, 2021 - Dec 3, 2021;virtual;Jun 25, 2021;25/06/2021;500;2021-06-25
102;1015;CLNLP 2021;2021 2nd International Conference on Computational Linguistics and Natural Language Processing (CLNLP 2021);Dec 3, 2021 - Dec 5, 2021;Beijing, China;Oct 30, 2021;30/10/2021;501;2021-10-30
102;1015;ICDEPI-SCOPUS 2021;5th International Conference on Design Engineering and Product Innovation (ICDEPI 2021);Aug 25, 2021 - Aug 27, 2021;Amsterdam, Netherlands;Apr 25, 2021;25/04/2021;502;2021-04-25
102;1015;PARMA-DITAM 2021;PARMA-DITAM: 12th Workshop on Parallel Programming and Run-Time Management Techniques for Many-core Architectures & 10th Workshop on Design Tools and Architectures for Multi-Core;Jan 19, 2021 - Jan 19, 2021;Virtual;Nov 13, 2021;13/11/2021;503;2021-11-13
102;1015;DSD 2021;Euromicro Conference on Digital System Design (DSD) 2021;Sep 6, 2021 - Sep 8, 2021;Palermo, Sicily, Italy;Apr 1, 2021;1/04/2021;504;2021-04-01
102;1015;ICCSE 2021;The 16th International Conference on Computer Science and Education;Aug 17, 2021 - Aug 21, 2021;Lancaster;Apr 15, 2021;15/04/2021;505;2021-04-15
102;1015;VALID 2021;The Thirteenth International Conference on Advances in System Testing and Validation Lifecycle;Oct 3, 2021 - Oct 7, 2021;Barcelona, Spain;Jul 5, 2021;5/07/2021;506;2021-07-05
102;1015;Elec-SI-IIDS 2021;Special Issue on Design of Intelligent Intrusion Detection Systems;N/A;N/A;May 31, 2021;31/05/2021;507;2021-05-31
102;1015;SLATE 2021;10th Symposium on Languages, Technologies and Applications;Jul 1, 2021 - Jul 2, 2021;ESMAD, Vila do Conde, Portugal;Apr 1, 2021;1/04/2021;508;2021-04-01
102;1015;Scopus-WADCE 2021;7th International Workshop on Aircraft Design and Control Engineering (WADCE 2021);Dec 9, 2021 - Dec 12, 2021;Melbourne, Australia;Jun 10, 2021;10/06/2021;509;2021-06-10
102;1015;FDL 2021;24th IEEE Forum on specification & Design Languages;Sep 8, 2021 - Sep 10, 2021;Antibes (France);May 24, 2021 (May 17, 2021);24/05/2021;510;2021-05-24
102;1015;CODES + ISSS 2021;International Conference on Hardware/Software Codesign and System Synthesis;Oct 10, 2021 - Oct 15, 2021;virtual?;Apr 9, 2021 (Apr 2, 2021);9/04/2021;511;2021-04-09
102;1015;AIEDAM Data-Enabled Design 2021;AIEDAM Thematic Collection: Perspectives on Data-Enabled Design - Design meets Data Science;N/A;N/A;Apr 30, 2021;30/04/2021;512;2021-04-30
102;1015;SCOPUS-ATDMAE 2021;5th International Conference on Advanced Technologies in Design, Mechanical and Aeronautical Engineering (ATDMAE 2021);Aug 25, 2021 - Aug 27, 2021;Amsterdam, Netherlands;Apr 25, 2021;25/04/2021;513;2021-04-25
102;1015;desAIgn 2021;International Conference on the Impact of Artificial Intelligence on Contemporary Design;May 25, 2021 - May 25, 2021;online;Mar 25, 2021;25/03/2021;514;2021-03-25
102;1015;HEART 2021;11th International Symposium on Highly Efficient Accelerators and Reconfigurable Technologies;Jun 21, 2021 - Jun 23, 2021;Online;Mar 15, 2021;15/03/2021;515;2021-03-15
102;1015;ICCPM 2021;2021 12th International Conference on Construction and Project Management (ICCPM 2021);Sep 27, 2021 - Sep 29, 2021;Macau, China;May 10, 2021;10/05/2021;516;2021-05-10
102;1015;SDM 2021;8th International Conference on Sustainable Design and Manufacturing;Sep 15, 2021 - Sep 17, 2021;Split, Croatia & Virtual;Apr 2, 2021;2/04/2021;517;2021-04-02
102;1015;SBCCI 2021;34rd Symposium on Integrated Circuits and Systems Design;Aug 23, 2021 - Aug 27, 2021;Campinas, Brazil;Apr 5, 2021;5/04/2021;518;2021-04-05
102;1015;ATDMAE 2021;5th International Conference on Advanced Technologies in Design, Mechanical and Aeronautical Engineering (ATDMAE 2021);Aug 25, 2021 - Aug 27, 2021;Amsterdam, Netherlands;Apr 25, 2021;25/04/2021;519;2021-04-25
102;1015;Industry Practices in Edu 2021;Book Chapter for Industry Practices, Processes and Techniques Adopted in Education - Supporting innovative teaching and learning practice;N/A;n/a;Mar 1, 2021 (Jan 20, 2021);1/03/2021;520;2021-03-01
102;1015;SMACD 2021;International Conference on Synthesis, Modeling, Analysis and Simulation Methods and Applications to Circuit Design;Jul 19, 2021 - Jul 22, 2021;Virtual event;Mar 7, 2021;7/03/2021;521;2021-03-07
102;1015;AIFIT 2021;AI for Future Intelligent Transportation: Smarter and Greener Design;Feb 15, 2021 - May 31, 2021;India;Apr 30, 2021 (Feb 15, 2021);30/04/2021;522;2021-04-30
102;1015;BMSD 2021;11th Int. Symposium on Business Modeling and Software Design;Jul 5, 2021 - Jul 7, 2021;Sofia, Bulgaria;Mar 15, 2021;15/03/2021;523;2021-03-15
102;1015;CST 2021;8th International Conference on Foundations of Computer Science & Technology;Dec 23, 2021 - Dec 24, 2021;Sydney, Australia;Mar 13, 2021;13/03/2021;524;2021-03-13
102;1015;IHCI 2021;15th International Conference on Interfaces and Human Computer Interaction 2021;Jul 21, 2021 - Jul 23, 2021;online;Mar 1, 2021;1/03/2021;525;2021-03-01
102;1015;Sensors (MDPI) SI on TIE 2021;Sensors Special Issue on Trusted IoT Ecosystem;N/A;N/A;Mar 31, 2021;31/03/2021;526;2021-03-31
102;1015;IMECE 2021;International Mechanical Engineering Congress and Exposition;Nov 1, 2021 - Nov 4, 2021;Virtual;Mar 9, 2021;9/03/2021;527;2021-03-09
102;1015;WCN 2022;Wireless Communications and Networking: Theory and Practice;N/A;N/A;Feb 28, 2021;28/02/2021;528;2021-02-28
102;1016;MobiSPC 2021;The 18th International Conference on Mobile Systems and Pervasive Computing;Aug 9, 2021 - Aug 12, 2021;Leuven, Belgium;Mar 19, 2021;19/03/2021;529;2021-03-19
102;1016;IIOM Conference 2021;IIOM International Conference 2021- Obsolescence Management- The Key to Sustainability;May 25, 2021 - May 27, 2021;Munich;Sep 30, 2020;30/09/2020;530;2020-09-30
102;1017;MobiSPC 2021;The 18th International Conference on Mobile Systems and Pervasive Computing;Aug 9, 2021 - Aug 12, 2021;Leuven, Belgium;Mar 19, 2021;19/03/2021;531;2021-03-19
102;1017;VALID 2021;The Thirteenth International Conference on Advances in System Testing and Validation Lifecycle;Oct 3, 2021 - Oct 7, 2021;Barcelona, Spain;Jul 5, 2021;5/07/2021;532;2021-07-05
102;1017;ICSEA 2021;The Sixteenth International Conference on Software Engineering Advances;Oct 3, 2021 - Oct 7, 2021;Barcelona, Spain;Jul 5, 2021;5/07/2021;533;2021-07-05
102;1017;EuroSTAR Conference 2021;29th EuroSTAR Software Testing & Quality Conference;Sep 28, 2021 - Sep 30, 2021;In-Person & Online;Feb 7, 2021;7/02/2021;534;2021-02-07
102;1017;CSIA 2021;12th International Conference on Communications Security & Information Assurance;Nov 20, 2021 - Nov 21, 2021;Zurich, Switzerland;Mar 6, 2021;6/03/2021;535;2021-03-06
102;1017;SOEN 2021;6th International Conference on Software Engineering;May 29, 2021 - May 30, 2021;Vancouver, Canada;Feb 20, 2021;20/02/2021;536;2021-02-20
102;1017;CP 2021;Twenty-Seventh Conference on Principles and Practice of Constraint Programming;Oct 25, 2021 - Oct 29, 2021;Montpellier (France);Jun 21, 2021 (May 14, 2021);21/06/2021;537;2021-06-21
102;1017;CP 2021;International Conference on Principles and Practice of Constraint Programming;Oct 25, 2021 - Oct 29, 2021;Montpellier;May 14, 2021;14/05/2021;538;2021-05-14
102;1017;TASE 2021;The 15th International Symposium on Theoretical Aspects of Software Engineering;Aug 25, 2021 - Aug 27, 2021;Shanghai;Mar 7, 2021 (Feb 28, 2021);7/03/2021;539;2021-03-07
102;1017;JSS SI on Test Automation 2021;Special Issue on “Test Automation: Trends, Benefits, and Costs” - Journal of Systems and Software (Elsevier);N/A;N/A;Mar 31, 2021;31/03/2021;540;2021-03-31
102;1017;SOFE 2021;7th International Conference on Software Engineering;Mar 20, 2021 - Mar 21, 2021;Vienna, Austria;Feb 20, 2021;20/02/2021;541;2021-02-20
102;1017;SIGPRO 2021;International Conference on Data Science and Cloud Computing;Sep 18, 2021 - Sep 19, 2021;Copenhagen, Denmark;Feb 20, 2021;20/02/2021;542;2021-02-20
102;1017;MLDS 2021;2nd International Conference on Machine Learning Techniques and Data Science;Nov 20, 2021 - Nov 21, 2021;Zurich, Switzerland;Mar 6, 2021;6/03/2021;543;2021-03-06
102;1017;SEC 2021;7th International Conference on Software Engineering;Mar 27, 2021 - Mar 28, 2021;Sydney, Australia;Feb 20, 2021;20/02/2021;544;2021-02-20
102;1017;DaMi 2021;7th International Conference on Data Mining;Apr 24, 2021 - Apr 25, 2021;Copenhagen, Denmark;Feb 20, 2021;20/02/2021;545;2021-02-20
102;1017;CAIML 2021;2nd International Conference on Artificial Intelligence and Machine Learning;Jun 26, 2021 - Jun 27, 2021;Sydney, Australia;Feb 27, 2021;27/02/2021;546;2021-02-27
102;1017;SE 2021;9th International Conference on Software Engineering & Trends;Jul 10, 2021 - Jul 11, 2021;Toronto, Canada;Feb 20, 2021;20/02/2021;547;2021-02-20
102;1017;IEEE ADAITC 2021;2021 IEEE Autonomous Driving AI Test Challenge;Aug 23, 2021 - Aug 26, 2021;Online;Mar 15, 2021;15/03/2021;548;2021-03-15
102;1017;ASOFT 2021;2nd International Conference on Advances in Software Engineering;Sep 18, 2021 - Sep 19, 2021;Copenhagen, Denmark;Feb 20, 2021;20/02/2021;549;2021-02-20
102;1017;IJSEA 2021;International Journal of Software Engineering & Applications -ERA Indexed;N/A;N/A;Feb 20, 2021;20/02/2021;550;2021-02-20
102;1017;VSC @IEEE WETICE 2021;Track on Validating Software for Critical Systems (VSC) @IEEE WETICE 2021;Jun 23, 2021 - Jun 25, 2021;Basque Coast - Bayonne, France;Feb 28, 2021;28/02/2021;551;2021-02-28
102;1017;SEMIT 2021;2nd International Conference on Software Engineering and Managing Information Technology;Nov 20, 2021 - Nov 21, 2021;Zurich, Switzerland;Mar 6, 2021;6/03/2021;552;2021-03-06
102;1017;SOFEA 2021;7th International Conference on Software Engineering and Applications;Oct 23, 2021 - Oct 24, 2021;Sydney, Australia;Feb 20, 2021;20/02/2021;553;2021-02-20
102;1017;SEA 2021;10th International Conference on Software Engineering and Applications;Jun 19, 2021 - Jun 20, 2021;Copenhagen, Denmark;Feb 27, 2021;27/02/2021;554;2021-02-27
102;1017;IJCSA 2021;International Journal on Computational Science & Applications;N/A;N/A;Feb 20, 2021;20/02/2021;555;2021-02-20
102;1017;SOENG 2021;7th International Conference on Software Engineering;Apr 24, 2021 - Apr 25, 2021;Copenhagen, Denmark;Feb 20, 2021;20/02/2021;556;2021-02-20
102;1017;DMDBS 2021;7th International Conference on Data Mining and Database Management Systems;Nov 27, 2021 - Nov 28, 2021;London, United Kingdom;Feb 27, 2021;27/02/2021;557;2021-02-27
102;1017;Crowd@QoMEX 2021;Crowd-sourced and Remote User Studies for Quality of Experience and Usability Research;Jun 14, 2021 - Jun 17, 2021;virtual;Feb 16, 2021;16/02/2021;558;2021-02-16
102;1017;ADCOM 2021;7th International conference on Advanced Computing;Mar 20, 2021 - Mar 21, 2021;Vienna, Austria;Feb 20, 2021;20/02/2021;559;2021-02-20
102;1017;CMC 2021;7th International Conference on Control, Modeling and Computing;Jul 24, 2021 - Jul 25, 2021;London, United Kingdom;Feb 20, 2021;20/02/2021;560;2021-02-20
102;1017;IJMPICT 2021;International Journal of Managing Public Sector Information and Communication Technologies;N/A;N/A;Feb 20, 2021;20/02/2021;561;2021-02-20
102;1018;EI-CFAIS 2021;2021 International Conference on Frontiers of Artificial Intelligence and Statistics (CFAIS 2021);Dec 1, 2021 - Dec 3, 2021;Beijing, China;Oct 30, 2021;30/10/2021;562;2021-10-30
102;1018;AIKE 2021;IEEE Artificial Intelligence & Knowledge Engineering 2021;Dec 1, 2021 - Dec 3, 2021;Laguna Hills, CA;Sep 15, 2021;15/09/2021;563;2021-09-15
102;1018;ICRE--EI Compendex, Scopus 2021;2021 5th International Conference on Reliability Engineering (ICRE 2021)--EI Compendex, Scopus;Nov 24, 2021 - Nov 26, 2021;Palermo, Italy;Jul 5, 2021;5/07/2021;564;2021-07-05
102;1018;ICSRS--Scopus & EI Compendex 2021;2021 5th International Conference on System Reliability and Safety (ICSRS 2021)--Scopus & EI Compendex;Nov 24, 2021 - Nov 26, 2021;Palermo, Italy;Jul 5, 2021;5/07/2021;565;2021-07-05
102;1018;ICPE 2021;International Conference on Performance Engineering;Apr 19, 2021 - Apr 23, 2021;Rennes, France;Oct 23, 2021 (Oct 16, 2021);23/10/2021;566;2021-10-23
102;1018;MobiSPC 2021;The 18th International Conference on Mobile Systems and Pervasive Computing;Aug 9, 2021 - Aug 12, 2021;Leuven, Belgium;Mar 19, 2021;19/03/2021;567;2021-03-19
102;1018;SA-TTA 2021;The 9th track on Software Architecture: Theory, Technology, and Applications (SA-TTA) at the 36th ACM/SIGAPP Symposium On Applied Computing (SAC 2021);Mar 22, 2021 - Mar 26, 2021;Gwangju, Korea;Oct 28, 2021;28/10/2021;568;2021-10-28
102;1018;ICCAEE 2021;2021 4th International Conference on Civil, Architectural and Environmental Engineering(ICCAEE 2021);Dec 10, 2021 - Dec 12, 2021;Shanghai, China;Oct 31, 2021;31/10/2021;569;2021-10-31
102;1018;EI-WBDC 2021;2021 3rd International Workshop on Big Data and Computing(WBDC 2021);Dec 3, 2021 - Dec 5, 2021;Beijing, China;Oct 31, 2021;31/10/2021;570;2021-10-31
102;1018;SOFSEM 2021;47th International Conference on Current Trends in Theory and Practice of Computer Science;Jan 25, 2021 - Jan 28, 2021;Bozen-Bolzano, Italy;Aug 3, 2021 (Jul 27, 2021);3/08/2021;571;2021-08-03
102;1018;ISOPE 2021;31st International Ocean and Polar Engineering Conference;Jun 20, 2021 - Jun 25, 2021;Rhodes, Greece;Nov 20, 2021;20/11/2021;572;2021-11-20
102;1018;FCSIT 2021;2021 3rd Euro-Asia Conference on Frontiers of Computer Science and Information Technology (FCSIT 2021);Dec 3, 2021 - Dec 5, 2021;Beijing, China;Oct 31, 2021;31/10/2021;573;2021-10-31
102;1018;4th ICSTR Rome 2021;4th ICSTR Rome – International Conference on Science & Technology Research, 09-10 September 2021;Sep 9, 2021 - Sep 10, 2021;University of Washington – Rome Center (;Sep 8, 2021;8/09/2021;574;2021-09-08
102;1018;AICCC--EI, Scopus 2021;2021 4th Artificial Intelligence and Cloud Computing Conference (AICCC 2021)--EI Compendex, Scopus;Dec 17, 2021 - Dec 19, 2021;Kyoto, Japan;Aug 5, 2021;5/08/2021;575;2021-08-05
102;1018;NAOME 2021;2021 5th International Conference on Naval Architecture and Ocean&Marine Engineering(NAOME 2021);Dec 10, 2021 - Dec 12, 2021;Shanghai, China;Oct 31, 2021;31/10/2021;576;2021-10-31
102;1018;CEVVE 2021;2021 International Conference on Electric Vehicle and Vehicle Engineering (CEVVE 2021);Sep 17, 2021 - Sep 19, 2021;Frankfurt, Germany;Jul 31, 2021;31/07/2021;577;2021-07-31
102;1018;IOP--PEIE--EI Compendex, Scopus 2021;IOP--2021 Internatonal Conference on Power, Energy and Industrial Engineering (PEIE 2021)--EI Compendex, Scopus;Nov 26, 2021 - Nov 28, 2021;Shenzhen, China;Jul 20, 2021;20/07/2021;578;2021-07-20
102;1018;PEIE--IOP, EI, Scopus 2021;IOP--2021 Internatonal Conference on Power, Energy and Industrial Engineering (PEIE 2021)--EI Compendex, Scopus;Nov 26, 2021 - Nov 28, 2021;Shenzhen, China;Jul 20, 2021;20/07/2021;579;2021-07-20
102;1018;ICSTTE 2021;2021 5th International Conference on SmartRail, Traffic and Transportation Engineering (ICSTTE 2021);Sep 17, 2021 - Sep 19, 2021;Frankfurt, Germany;Jul 31, 2021;31/07/2021;580;2021-07-31
102;1018;MEAMT 2021;2021 5th International Conference on Material Engineering and Advanced Manufacturing Technology (MEAMT 2021);Oct 15, 2021 - Oct 17, 2021;Singapore;Aug 30, 2021;30/08/2021;581;2021-08-30
102;1018;ICMEIM 2021;2021 International Conference on Mechanical Engineering and Intelligent Manufacturing (ICMEIM 2021);Oct 27, 2021 - Oct 29, 2021;Sapporo, Japan;Aug 5, 2021 (Aug 30, 2021);5/08/2021;582;2021-08-05
102;1018;EI-MEAMT 2021;2021 5th International Conference on Material Engineering and Advanced Manufacturing Technology (MEAMT 2021);Oct 15, 2021 - Oct 17, 2021;Singapore;Aug 30, 2021;30/08/2021;583;2021-08-30
102;1018;ICPEE--Ei and Scopus 2021;2021 5th International Conference on Power and Energy Engineering (ICPEE 2021)--Ei Compendex, Scopus;Dec 2, 2021 - Dec 4, 2021;Xiamen, China;Aug 15, 2021;15/08/2021;584;2021-08-15
102;1018;CCISP-Scopus 2021;The 6th International Conference on Communication, Image and Signal Processing;Nov 19, 2021 - Nov 21, 2021;Chengdu, China;Jul 20, 2021;20/07/2021;585;2021-07-20
102;1018;ICRER--EI, Scopus 2021;2021 3rd International Conference on Resources and Environmental Research (ICRER 2021)--Ei Compendex, Scopus;Dec 2, 2021 - Dec 4, 2021;Xiamen, China;Aug 15, 2021;15/08/2021;586;2021-08-15
102;1018;IOP--ICREC--EI Compendex, Scopus 2021;IOP--2021 the 6th International Conference on Renewable Energy and Conservation (ICREC 2021)--EI Compendex, Scopus;Nov 26, 2021 - Nov 28, 2021;Shenzhen, China;Jul 20, 2021;20/07/2021;587;2021-07-20
102;1018;EI-CoEEPE 2021;2021 International Joint Conference on Energy, Electrical and Power Engineering (CoEEPE 2021);Sep 17, 2021 - Sep 19, 2021;Frankfurt, Germany;Jul 31, 2021;31/07/2021;588;2021-07-31
102;1018;GESB 2021;Genome Engineering and Synthetic Biology (4th edition);Sep 23, 2021 - Sep 24, 2021;De Bijloke, Bijlokekaai 7, 9000 Gent;Jul 8, 2021;8/07/2021;589;2021-07-08
102;1018;SPIE OP 2021;SPIE Optics + Photonics 2021;Aug 1, 2021 - Aug 5, 2021;San Diego, CA;Jul 7, 2021 (Jan 20, 2021);7/07/2021;590;2021-07-07
102;1018;ICREC--IOP, EI, Scopus 2021;IOP--2021 the 6th International Conference on Renewable Energy and Conservation (ICREC 2021)--EI Compendex, Scopus;Nov 26, 2021 - Nov 28, 2021;Shenzhen, China;Jul 20, 2021;20/07/2021;591;2021-07-20
102;1018;MDPI - Risk Management - Scopus 2021;Special Issue of Journal Applied System Innovation: Risk Management;N/A;N/A;Jul 31, 2021;31/07/2021;592;2021-07-31
103;1019;ICDM 2021;21st IEEE International Conference on Data Mining;Dec 7, 2021 - Dec 10, 2021;Auckland, New Zealand;Jun 11, 2021;11/06/2021;593;2021-06-11
103;1019;PODC 2021;Principles of Distributed Computing;Jul 26, 2021 - Jul 30, 2021;Salerno, Italy;Feb 15, 2021 (Feb 11, 2021);15/02/2021;594;2021-02-15
103;1019;Euro-Par 2021;European Conference on Parallel and Distributed Computing;Sep 1, 2021 - Sep 3, 2021;Lisbon, Portugal;Feb 12, 2021 (Feb 5, 2021);12/02/2021;595;2021-02-12
103;1019;SA-TTA 2021;The 9th track on Software Architecture: Theory, Technology, and Applications (SA-TTA) at the 36th ACM/SIGAPP Symposium On Applied Computing (SAC 2021);Mar 22, 2021 - Mar 26, 2021;Gwangju, Korea;Oct 28, 2021;28/10/2021;596;2021-10-28
103;1019;ICSRS--Scopus & EI Compendex 2021;2021 5th International Conference on System Reliability and Safety (ICSRS 2021)--Scopus & EI Compendex;Nov 24, 2021 - Nov 26, 2021;Palermo, Italy;Jul 5, 2021;5/07/2021;597;2021-07-05
103;1019;UVS-Oman 2022;The 2nd International Conference on Unmanned Vehicle Systems (UVS-Oman 2022) - IEEE;Feb 7, 2022 - Feb 9, 2022;Muscat, Oman;Oct 15, 2021;15/10/2021;598;2021-10-15
103;1019;Micro - Compiling for Accelerators 2022;IEEE Micro Special Issue on Compiling for Accelerators;N/A;N/A;Dec 15, 2021;15/12/2021;599;2021-12-15
103;1019;STRA - Eurasia Research 2021;8th ICSTR Dubai – International Conference on Science & Technology Research, 25-26 October 2021;Oct 25, 2021 - Oct 26, 2021;Flora Creek, Deira, Dubai, UAE;Oct 24, 2021;24/10/2021;600;2021-10-24
103;1019;6th ICSTR London September 2021;6th ICSTR London – International Conference on Science & Technology Research, 09-10 September 2021;Sep 9, 2021 - Sep 10, 2021;The Tomlinson Centre, Queensbridge Road,;Sep 8, 2021;8/09/2021;601;2021-09-08
103;1019;UBICOMM 2021;The Fifteenth International Conference on Mobile Ubiquitous Computing, Systems, Services and Technologies;Oct 3, 2021 - Oct 7, 2021;Barcelona, Spain;Jul 5, 2021;5/07/2021;602;2021-07-05
103;1019;STRA - Eurasia Research 2021;3rd ICSTR Paris – International Conference on Science & Technology Research, 28-29 November 2021;Nov 28, 2021 - Nov 29, 2021;FormaSquare-Docks de Paris, Paris, Franc;Nov 26, 2021;26/11/2021;603;2021-11-26
103;1019;SNPD 2021;22nd IEEE/ACIS International Summer Conference on Software Engineering, Artificial Intelligence, Networking and Parallel/Distributed Computing;Jul 7, 2021 - Jul 9, 2021;Taichung, Taiwan;Apr 4, 2021;4/04/2021;604;2021-04-04
103;1019;3rd ICSTR Athens September 2021;3rd ICSTR Athens – International Conference on Science & Technology Research, 17-18 September 2021;Sep 17, 2021 - Sep 18, 2021;Novotel Athenes, Michail Voda 4, Athens;Sep 16, 2021;16/09/2021;605;2021-09-16
103;1019;EMERGING 2021;The Thirteenth International Conference on Emerging Networks and Systems Intelligence;Oct 3, 2021 - Oct 7, 2021;Barcelona, Spain;Jul 5, 2021;5/07/2021;606;2021-07-05
103;1019;ISCSIC 2021;2021 5th International Symposium on Computer Science and Intelligent Control;Nov 12, 2021 - Nov 14, 2021;Rome, Italy;Oct 15, 2021;15/10/2021;607;2021-10-15
103;1019;NAOME 2021;2021 5th International Conference on Naval Architecture and Ocean&Marine Engineering(NAOME 2021);Dec 10, 2021 - Dec 12, 2021;Shanghai, China;Oct 31, 2021;31/10/2021;608;2021-10-31
103;1019;SI: Advanced Technology for IE 2022;Special Issue: Secure and Advanced Technology for Intelligent Environments;Jan 1, 2021 - Jun 1, 2022;JAISE (IOS) journal;Sep 5, 2021;5/09/2021;609;2021-09-05
103;1019;AICCC--EI, Scopus 2021;2021 4th Artificial Intelligence and Cloud Computing Conference (AICCC 2021)--EI Compendex, Scopus;Dec 17, 2021 - Dec 19, 2021;Kyoto, Japan;Aug 5, 2021;5/08/2021;610;2021-08-05
103;1019;CFMAI 2021;2021 3rd International Conference on Frontiers of Mathematics and Artificial Intelligence (CFMAI 2021);Dec 1, 2021 - Dec 3, 2021;Beijing, China;Oct 31, 2021;31/10/2021;611;2021-10-31
103;1019;IJDPS 2021;International Journal of Distributed and Parallel systems;N/A;N/A;Feb 20, 2021;20/02/2021;612;2021-02-20
103;1019;SPAA 2021;33th ACM Symposium on Parallelism in Algorithms and Architectures;Jul 6, 2021 - Jul 8, 2021;Philadelphia, PA, USA;Feb 11, 2021 (Feb 8, 2021);11/02/2021;613;2021-02-11
103;1019;CPSIOT 2021;2021International Conference on Cyber Physical Systems and IoT(CPSIOT 2021);Nov 19, 2021 - Nov 21, 2021;Hangzhou, China;Sep 30, 2021;30/09/2021;614;2021-09-30
103;1019;SI: IE for Health and Well-being 2022;Special issue: Intelligent Environments for Health and Well-being;Jan 1, 2021 - Jun 1, 2020;Applied human informatics (AHI) journal;Sep 5, 2021;5/09/2021;615;2021-09-05
103;1019;ICRE--EI, Scopus 2021;2021 5th International Conference on Reliability Engineering (ICRE 2021)--EI Compendex, Scopus;Nov 24, 2021 - Nov 26, 2021;Palermo, Italy;Jul 5, 2021;5/07/2021;616;2021-07-05
103;1019;DEBS 2021;The 15th ACM International Conference on Distributed and Event-based Systems;Jun 28, 2021 - Jul 3, 2021;Milan, Italy;Mar 5, 2021 (Feb 26, 2021);5/03/2021;617;2021-03-05
103;1019;APEEN 2021;APEEN2021 Conference: Energy Transition and Sustainability;Jan 20, 2021 - Jan 21, 2021;Online;Sep 10, 2021;10/09/2021;618;2021-09-10
103;1019;CCEAI-Scopus 2022;The 6th International Conference on Control Engineering and Artificial Intelligence (CCEAI 2022);Jan 6, 2022 - Jan 8, 2022;Hokkaido, Japan;Jul 5, 2021;5/07/2021;619;2021-07-05
103;1019;GLOBAL HEALTH 2021;The Tenth International Conference on Global Health Challenges;Oct 3, 2021 - Oct 7, 2021;Barcelona, Spain;Jul 5, 2021;5/07/2021;620;2021-07-05
103;1019;Smart Health 2021;Special Issue - Systems, Applications and Services for Smart Health;N/A;N/A;Jun 25, 2021;25/06/2021;621;2021-06-25
103;1019;ACM SenSys 2021;ACM Conference on Embedded Networked Sensor Systems;Nov 15, 2021 - Nov 17, 2021;Coimbra, Portugal;Jun 4, 2021 (May 28, 2021);4/06/2021;622;2021-06-04
103;1019;JCC 2021;The Second IEEE International Conference on JointCloud Computing;Aug 23, 2021 - Aug 26, 2021;onlin;May 1, 2021 (Apr 24, 2021);1/05/2021;623;2021-05-01
103;1019;IntelligentIoT 2021;Special Issue Embedded Intelligence in IoT Systems;N/A;N/A;Aug 31, 2021;31/08/2021;624;2021-08-31
103;1019;BDSIC--EI Compendex, Scopus 2021;2021 3rd International Conference on Big-data Service and Intelligent Computation (BDSIC 2021)--Ei Compendex, Scopus;Nov 19, 2021 - Nov 21, 2021;HuaQiao University, Xiamen?China;Jul 5, 2021;5/07/2021;625;2021-07-05
103;1019;MDPI Mathematics InSysModGraph 2021;Special Issue Information Systems Modeling Based on Graph Theory;N/A;N/A;Jul 31, 2021;31/07/2021;626;2021-07-31
103;1019;CYBER 2021;The Sixth International Conference on Cyber-Technologies and Cyber-Systems;Oct 3, 2021 - Oct 7, 2021;Barcelona, Spain;Jul 5, 2021;5/07/2021;627;2021-07-05
103;1019;ICSNC 2021;The Sixteenth International Conference on Systems and Networks Communications;Oct 3, 2021 - Oct 7, 2021;Barcelona, Spain;Jul 5, 2021;5/07/2021;628;2021-07-05
103;1019;VALID 2021;The Thirteenth International Conference on Advances in System Testing and Validation Lifecycle;Oct 3, 2021 - Oct 7, 2021;Barcelona, Spain;Jul 5, 2021;5/07/2021;629;2021-07-05
103;1019;ENVIRONMENTS BY DESIGN 2021;ENVIRONMENTS BY DESIGN: HEALTH, WELLBEING AND PLACE;Dec 1, 2021 - Dec 3, 2021;virtual;Jun 25, 2021;25/06/2021;630;2021-06-25
103;1019;Elec-SI-IIDS 2021;Special Issue on Design of Intelligent Intrusion Detection Systems;N/A;N/A;May 31, 2021;31/05/2021;631;2021-05-31
103;1019;ARCS 2021;34th GI/ITG International Conference on Architecture of Computing Systems;Jun 7, 2021 - Jun 10, 2021;Virtual Conference;Mar 22, 2021 (Mar 15, 2021);22/03/2021;632;2021-03-22
103;1019;ICREC--IOP, EI, Scopus 2021;IOP--2021 the 6th International Conference on Renewable Energy and Conservation (ICREC 2021)--EI Compendex, Scopus;Nov 26, 2021 - Nov 28, 2021;Shenzhen, China;Jul 20, 2021;20/07/2021;633;2021-07-20
103;1019;ICNISC 2021;7th Annual International Conference on Network and Information Systems for Computers;Jul 23, 2021 - Jul 25, 2021;Guiyang;Jul 19, 2021;19/07/2021;634;2021-07-19
103;1019;ICT-DM 2021;The 7th International Conference on Information and Communication Technologies for Disaster Management;Dec 3, 2021 - Dec 5, 2021;Hangzhou, China;Jun 20, 2021 (Jun 15, 2021);20/06/2021;635;2021-06-20
103;1019;ICCPR--ACM, Ei, Scopus 2021;ACM--2021 10th International Conference on Computing and Pattern Recognition (ICCPR 2021)--Ei Compendex, Scopus;Oct 15, 2021 - Oct 17, 2021;Shanghai, China;Jun 1, 2021;1/06/2021;636;2021-06-01
103;1019;IEEE 14th MCSoC 2021;14th IEEE International Symposium on Embedded Multicore/Manycore (MCSoC 2021);Dec 20, 2021 - Dec 23, 2021;Singapore;May 31, 2021 (May 25, 2021);31/05/2021;637;2021-05-31
103;1019;DCOSS 2021;The 17th Annual International Conference on Distributed Computing in Sensor Systems;Jul 14, 2021 - Jul 16, 2021;Virtual Event;Mar 31, 2021;31/03/2021;638;2021-03-31
103;1019;Scopus-WAT 2021;The 3rd International Workshop on Automation Technologies (WAT 2021);Dec 16, 2021 - Dec 18, 2021;Macau SAR, China;Jun 15, 2021;15/06/2021;639;2021-06-15
103;1019;AES 2021;AES 2021, the 8th International Conference on Antennas and Electromagnetic Systems;Nov 16, 2021 - Nov 19, 2021;Marrakesh - Morocco;Jun 4, 2021;4/06/2021;640;2021-06-04
103;1019;SI-DIEFIoT-JPDC 2021;Special Issue on Distributed Intelligence at the Edge for the Future Internet of Things - Journal of Parallel and Distributed Computing;N/A;N/A;May 31, 2021;31/05/2021;641;2021-05-31
103;1019;ESWEEK 2021;Embedded Systems Week;Oct 10, 2021 - Oct 15, 2021;Virtual Conference;Apr 9, 2021 (Apr 2, 2021);9/04/2021;642;2021-04-09
103;1019;ICSOFT 2021;16th International Conference on Software Technologies;Jul 6, 2021 - Jul 8, 2021;Online Streaming;Apr 1, 2021;1/04/2021;643;2021-04-01
103;1020;ICNP 2021;International Conference on Network Protocols;Nov 2, 2021 - Nov 5, 2021;Dallas, TX;May 24, 2021 (May 17, 2021);24/05/2021;644;2021-05-24
103;1020;SA-TTA 2021;The 9th track on Software Architecture: Theory, Technology, and Applications (SA-TTA) at the 36th ACM/SIGAPP Symposium On Applied Computing (SAC 2021);Mar 22, 2021 - Mar 26, 2021;Gwangju, Korea;Oct 28, 2021;28/10/2021;645;2021-10-28
103;1020;BDIoT 2021;5th International Conference on Big Data and Internet of Things - BDIoT’21;Mar 17, 2021 - Mar 18, 2021;Rabat - Morocco;Dec 1, 2021;1/12/2021;646;2021-12-01
103;1020;Micro - Compiling for Accelerators 2022;IEEE Micro Special Issue on Compiling for Accelerators;N/A;N/A;Dec 15, 2021;15/12/2021;647;2021-12-15
103;1020;STRA - Eurasia Research 2021;8th ICSTR Dubai – International Conference on Science & Technology Research, 25-26 October 2021;Oct 25, 2021 - Oct 26, 2021;Flora Creek, Deira, Dubai, UAE;Oct 24, 2021;24/10/2021;648;2021-10-24
103;1020;6th ICSTR London September 2021;6th ICSTR London – International Conference on Science & Technology Research, 09-10 September 2021;Sep 9, 2021 - Sep 10, 2021;The Tomlinson Centre, Queensbridge Road,;Sep 8, 2021;8/09/2021;649;2021-09-08
103;1020;STRA - Eurasia Research 2021;3rd ICSTR Paris – International Conference on Science & Technology Research, 28-29 November 2021;Nov 28, 2021 - Nov 29, 2021;FormaSquare-Docks de Paris, Paris, Franc;Nov 26, 2021;26/11/2021;650;2021-11-26
103;1020;NISecurity 2021;2021 International Conference on Network and Information Security (NISecurity 2021);Aug 13, 2021 - Aug 15, 2021;Stockholm, Sweden;Jun 30, 2021;30/06/2021;651;2021-06-30
103;1020;blockchain_ml_iot 2021;Network and Electronics (MDPI) Joint Special Issue - Blockchain and Machine Learning for IoT: Security and Privacy Challenges;N/A;N/A;Dec 31, 2021;31/12/2021;652;2021-12-31
103;1020;3rd ICSTR Athens September 2021;3rd ICSTR Athens – International Conference on Science & Technology Research, 17-18 September 2021;Sep 17, 2021 - Sep 18, 2021;Novotel Athenes, Michail Voda 4, Athens;Sep 16, 2021;16/09/2021;653;2021-09-16
103;1020;NAOME 2021;2021 5th International Conference on Naval Architecture and Ocean&Marine Engineering(NAOME 2021);Dec 10, 2021 - Dec 12, 2021;Shanghai, China;Oct 31, 2021;31/10/2021;654;2021-10-31
103;1020;MDPI mathematics 2021;MDPI mathematics - Special Issue on Computational Optimizations for Machine Learning;N/A;N/A;Sep 30, 2021;30/09/2021;655;2021-09-30
103;1020;CANS 2021;Cryptology and Network Security;Dec 13, 2021 - Dec 15, 2021;Vienna, Austria;Jun 1, 2021;1/06/2021;656;2021-06-01
103;1020;NetIIoT 2021;State-of-Art of Network Architectures and Protocols for Industrial IoT;N/A;N/A;Sep 20, 2021;20/09/2021;657;2021-09-20
103;1020;ICSRS--Scopus & EI 2021;2021 5th International Conference on System Reliability and Safety (ICSRS 2021)--Scopus & EI Compendex;Nov 24, 2021 - Nov 26, 2021;Palermo, Italy;Jul 5, 2021;5/07/2021;658;2021-07-05
103;1020;SNSA-SI-MDPI 2021;Sensor Networks Security and Applications;N/A;N/A;Jul 31, 2021;31/07/2021;659;2021-07-31
103;1020;ICNISC 2021;7th Annual International Conference on Network and Information Systems for Computers;Jul 23, 2021 - Jul 25, 2021;Guiyang;Jul 19, 2021;19/07/2021;660;2021-07-19
103;1020;ENVIRONMENTS BY DESIGN 2021;ENVIRONMENTS BY DESIGN: HEALTH, WELLBEING AND PLACE;Dec 1, 2021 - Dec 3, 2021;virtual;Jun 25, 2021;25/06/2021;661;2021-06-25
103;1020;Elec-SI-IIDS 2021;Special Issue on Design of Intelligent Intrusion Detection Systems;N/A;N/A;May 31, 2021;31/05/2021;662;2021-05-31
103;1020;ARCS 2021;34th GI/ITG International Conference on Architecture of Computing Systems;Jun 7, 2021 - Jun 10, 2021;Virtual Conference;Mar 22, 2021 (Mar 15, 2021);22/03/2021;663;2021-03-22
103;1020;MDAI 2021;18th International Conference on Modeling Decisions for Artificial Intelligence;Sep 27, 2021 - Sep 30, 2021;Umea, Sweden;Mar 22, 2021;22/03/2021;664;2021-03-22
103;1020;Scopus-CCISP 2021;The 6th International Conference on Communication, Image and Signal Processing;Nov 19, 2021 - Nov 21, 2021;Chengdu, China;Jul 20, 2021;20/07/2021;665;2021-07-20
103;1020;ICREC--IOP, EI, Scopus 2021;IOP--2021 the 6th International Conference on Renewable Energy and Conservation (ICREC 2021)--EI Compendex, Scopus;Nov 26, 2021 - Nov 28, 2021;Shenzhen, China;Jul 20, 2021;20/07/2021;666;2021-07-20
103;1020;ICENT--EI Compendex, Scopus 2021;2021 3rd International Conference on Emerging Networks Technologies (ICENT 2021)--Ei Compendex, Scopus;Sep 22, 2021 - Sep 24, 2021;Okinawa, Japan;May 10, 2021;10/05/2021;667;2021-05-10
103;1020;SCOPUS-DMCIT 2021;5th International Conference on Data Mining, Communications and Information Technology (DMCIT 2021);Apr 16, 2021 - Apr 18, 2021;Hangzhou, China;Mar 15, 2021;15/03/2021;668;2021-03-15
103;1020;ICSOFT 2021;16th International Conference on Software Technologies;Jul 6, 2021 - Jul 8, 2021;Online Streaming;Apr 1, 2021;1/04/2021;669;2021-04-01
103;1020;ESWEEK 2021;Embedded Systems Week;Oct 10, 2021 - Oct 15, 2021;Virtual Conference;Apr 9, 2021 (Apr 2, 2021);9/04/2021;670;2021-04-09
103;1020;HEART 2021;11th International Symposium on Highly Efficient Accelerators and Reconfigurable Technologies;Jun 21, 2021 - Jun 23, 2021;Online;Mar 15, 2021;15/03/2021;671;2021-03-15
103;1020;ICBMM--EI Compendex and Scopus 2021;2021 The 5th International Conference on Building Materials and Materials Engineering (ICBMM 2021)--Ei Compendex, Scopus;Sep 24, 2021 - Sep 26, 2021;Barcelona, Spain;May 10, 2021;10/05/2021;672;2021-05-10
103;1020;ICSCE--Ei Compendex, Scopus 2021;2021 5th International Conference on Structural and Civil Engineering (ICSCE 2021)--Ei Compendex, Scopus;Sep 24, 2021 - Sep 26, 2021;Barcelona, Spain;May 10, 2021;10/05/2021;673;2021-05-10
103;1020;ICCPM 2021;2021 12th International Conference on Construction and Project Management (ICCPM 2021);Sep 27, 2021 - Sep 29, 2021;Macau, China;May 10, 2021;10/05/2021;674;2021-05-10
103;1020;ICCNT--JA, SCOPUS 2021;2021 5th International Conference on Communication and Network Technology (ICCNT 2021)--JA, Scopus;Sep 25, 2021 - Sep 27, 2021;Paris, France;May 5, 2021;5/05/2021;675;2021-05-05
103;1020;NOCS 2021;International Symposium on Networks-on-Chip (NOCS) 2021 Call for Papers;Oct 10, 2021 - Oct 15, 2021;Virtual Conference;May 21, 2021 (May 14, 2021);21/05/2021;676;2021-05-21
103;1020;ICCUE 2021;2021 8th International Conference on Civil and Urban Engineering (ICCUE 2021);Sep 10, 2021 - Sep 13, 2021;Vienna, Austria;May 20, 2021;20/05/2021;677;2021-05-20
103;1020;CASES 2021;International Conference on Compilers, Architectures, and Synthesis for Embedded Systems;Oct 10, 2021 - Oct 15, 2021;Virtual Conference;Apr 9, 2021 (Apr 2, 2021);9/04/2021;678;2021-04-09
103;1020;Big Data Analytics in Sustainable City 2021;IS04: Big Data Analytics in Sustainable and Smart City;Sep 15, 2021 - Sep 17, 2021;Split, Croatia;Apr 2, 2021;2/04/2021;679;2021-04-02
103;1020;CLOUD 2021;10th International Conference on Cloud Computing: Services and Architecture;Jun 19, 2021 - Jun 20, 2021;Copenhagen, Denmark;Feb 27, 2021;27/02/2021;680;2021-02-27
103;1020;NCS 2021;13th International Conference on Network and Communications Security;Sep 25, 2021 - Sep 26, 2021;Toronto, Canada;Feb 27, 2021;27/02/2021;681;2021-02-27
103;1020;CODES+ISSS 2021;International Conference on Hardware/Software Codesign and System Synthesis;Oct 10, 2021 - Oct 15, 2021;Virtual Conference;Apr 9, 2021 (Apr 2, 2021);9/04/2021;682;2021-04-09
103;1020;MSF--ICACM--EI, Scopus 2021;MSF--2021 4th International Conference on Advanced Composite Materials (ICACM 2021)--Ei Compendex, Scopus;Aug 25, 2021 - Aug 27, 2021;Tokyo, Japan;Apr 10, 2021;10/04/2021;683;2021-04-10
103;1020;MSF--ICAFM--Ei, Scopus 2021;MSF--2021 The 6th International Conference on Advanced Functional Materials (ICAFM 2021)--Ei Compendex, Scopus;Aug 25, 2021 - Aug 27, 2021;Tokyo, Japan;Apr 10, 2021;10/04/2021;684;2021-04-10
103;1020;CCGE 2021;1st IEEE International Conference on Computing, Communication and Green Engineering-2021;Jul 8, 2021 - Jul 10, 2021;Pune;Apr 10, 2021;10/04/2021;685;2021-04-10
103;1020;Scopus-ICMEAS 2021;7th International Conference on Mechanical Engineering and Automation Science (ICMEAS 2021);Oct 28, 2021 - Oct 30, 2021;Seoul, South Korea;Apr 30, 2021;30/04/2021;686;2021-04-30
103;1020;MISSI 2021;International Conference on Multimedia & Network Information Systems;Sep 1, 2021 - Sep 3, 2021;Paris, France;Mar 20, 2021;20/03/2021;687;2021-03-20
103;1020;ANNSIM 2021;2021 Annual Modeling and Simulation Conference;Jul 19, 2021 - Jul 22, 2021;Fairfax, Virginia;Mar 1, 2021;1/03/2021;688;2021-03-01
103;1020;ICNST--EI Compendex and Scopus 2021;IEEE--2021 The 4th International Conference on Nanoscience and Technology (ICNST 2021)--EI Compendex, Scopus;Jun 26, 2021 - Jun 28, 2021;Chengdu, China;Mar 30, 2021;30/03/2021;689;2021-03-30
103;1020;JNSM SI on B5G 2021;Journal of Network and Systems Management: Special Issue on Network management for beyond 5G systems;N/A;N/A;Mar 30, 2021;30/03/2021;690;2021-03-30
103;1020;HURBE 2021;Making healthy cities for people. Education, research, practice in planning, architecture and engineering;Oct 4, 2021 - Oct 5, 2021;Sarajevo, Bosnia Herzegovina;Mar 15, 2021;15/03/2021;691;2021-03-15
103;1020;GridCom 2021;13th International Conference on GridComputing;Nov 20, 2021 - Nov 21, 2021;Zurich, Switzerland;Mar 6, 2021;6/03/2021;692;2021-03-06
103;1020;WiMoA 2021;3th International Conference on Wireless, Mobile Network and Applications;Nov 20, 2021 - Nov 21, 2021;Zurich, Switzerland;Mar 6, 2021;6/03/2021;693;2021-03-06
103;1020;ICINT--EI Compendex, Scopus 2021;2021 6th International Conference on Information and Network Technologies (ICINT 2021)--EI Compendex, Scopus;May 22, 2021 - May 24, 2021;Okinawa, Japan;Mar 5, 2021;5/03/2021;694;2021-03-05
103;1021;ICNP 2021;International Conference on Network Protocols;Nov 2, 2021 - Nov 5, 2021;Dallas, TX;May 24, 2021 (May 17, 2021);24/05/2021;695;2021-05-24
103;1021;BDIoT 2021;5th International Conference on Big Data and Internet of Things - BDIoT’21;Mar 17, 2021 - Mar 18, 2021;Rabat - Morocco;Dec 1, 2021;1/12/2021;696;2021-12-01
103;1021;NISecurity 2021;2021 International Conference on Network and Information Security (NISecurity 2021);Aug 13, 2021 - Aug 15, 2021;Stockholm, Sweden;Jun 30, 2021;30/06/2021;697;2021-06-30
103;1021;blockchain_ml_iot 2021;Network and Electronics (MDPI) Joint Special Issue - Blockchain and Machine Learning for IoT: Security and Privacy Challenges;N/A;N/A;Dec 31, 2021;31/12/2021;698;2021-12-31
103;1021;MDPI mathematics 2021;MDPI mathematics - Special Issue on Computational Optimizations for Machine Learning;N/A;N/A;Sep 30, 2021;30/09/2021;699;2021-09-30
103;1021;CANS 2021;Cryptology and Network Security;Dec 13, 2021 - Dec 15, 2021;Vienna, Austria;Jun 1, 2021;1/06/2021;700;2021-06-01
103;1021;NetIIoT 2021;State-of-Art of Network Architectures and Protocols for Industrial IoT;N/A;N/A;Sep 20, 2021;20/09/2021;701;2021-09-20
103;1021;ICSRS--Scopus & EI 2021;2021 5th International Conference on System Reliability and Safety (ICSRS 2021)--Scopus & EI Compendex;Nov 24, 2021 - Nov 26, 2021;Palermo, Italy;Jul 5, 2021;5/07/2021;702;2021-07-05
103;1021;ICNISC 2021;7th Annual International Conference on Network and Information Systems for Computers;Jul 23, 2021 - Jul 25, 2021;Guiyang;Jul 19, 2021;19/07/2021;703;2021-07-19
103;1021;SNSA-SI-MDPI 2021;Sensor Networks Security and Applications;N/A;N/A;Jul 31, 2021;31/07/2021;704;2021-07-31
103;1021;Elec-SI-IIDS 2021;Special Issue on Design of Intelligent Intrusion Detection Systems;N/A;N/A;May 31, 2021;31/05/2021;705;2021-05-31
103;1021;MDAI 2021;18th International Conference on Modeling Decisions for Artificial Intelligence;Sep 27, 2021 - Sep 30, 2021;Umea, Sweden;Mar 22, 2021;22/03/2021;706;2021-03-22
103;1021;Scopus-CCISP 2021;The 6th International Conference on Communication, Image and Signal Processing;Nov 19, 2021 - Nov 21, 2021;Chengdu, China;Jul 20, 2021;20/07/2021;707;2021-07-20
103;1021;ICENT--EI Compendex, Scopus 2021;2021 3rd International Conference on Emerging Networks Technologies (ICENT 2021)--Ei Compendex, Scopus;Sep 22, 2021 - Sep 24, 2021;Okinawa, Japan;May 10, 2021;10/05/2021;708;2021-05-10
103;1021;SCOPUS-DMCIT 2021;5th International Conference on Data Mining, Communications and Information Technology (DMCIT 2021);Apr 16, 2021 - Apr 18, 2021;Hangzhou, China;Mar 15, 2021;15/03/2021;709;2021-03-15
103;1021;ICCNT--JA, SCOPUS 2021;2021 5th International Conference on Communication and Network Technology (ICCNT 2021)--JA, Scopus;Sep 25, 2021 - Sep 27, 2021;Paris, France;May 5, 2021;5/05/2021;710;2021-05-05
103;1021;Big Data Analytics in Sustainable City 2021;IS04: Big Data Analytics in Sustainable and Smart City;Sep 15, 2021 - Sep 17, 2021;Split, Croatia;Apr 2, 2021;2/04/2021;711;2021-04-02
103;1021;NCS 2021;13th International Conference on Network and Communications Security;Sep 25, 2021 - Sep 26, 2021;Toronto, Canada;Feb 27, 2021;27/02/2021;712;2021-02-27
103;1021;CCGE 2021;1st IEEE International Conference on Computing, Communication and Green Engineering-2021;Jul 8, 2021 - Jul 10, 2021;Pune;Apr 10, 2021;10/04/2021;713;2021-04-10
103;1021;Scopus-ICMEAS 2021;7th International Conference on Mechanical Engineering and Automation Science (ICMEAS 2021);Oct 28, 2021 - Oct 30, 2021;Seoul, South Korea;Apr 30, 2021;30/04/2021;714;2021-04-30
103;1021;JNSM SI on B5G 2021;Journal of Network and Systems Management: Special Issue on Network management for beyond 5G systems;N/A;N/A;Mar 30, 2021;30/03/2021;715;2021-03-30
103;1021;MISSI 2021;International Conference on Multimedia & Network Information Systems;Sep 1, 2021 - Sep 3, 2021;Paris, France;Mar 20, 2021;20/03/2021;716;2021-03-20
103;1021;GridCom 2021;13th International Conference on GridComputing;Nov 20, 2021 - Nov 21, 2021;Zurich, Switzerland;Mar 6, 2021;6/03/2021;717;2021-03-06
103;1021;ANNSIM 2021;2021 Annual Modeling and Simulation Conference;Jul 19, 2021 - Jul 22, 2021;Fairfax, Virginia;Mar 1, 2021;1/03/2021;718;2021-03-01
103;1021;ICINT--EI Compendex, Scopus 2021;2021 6th International Conference on Information and Network Technologies (ICINT 2021)--EI Compendex, Scopus;May 22, 2021 - May 24, 2021;Okinawa, Japan;Mar 5, 2021;5/03/2021;719;2021-03-05
103;1021;ICINT--EI, Scopus 2021;2021 6th International Conference on Information and Network Technologies (ICINT 2021)--EI Compendex, Scopus;May 22, 2021 - May 24, 2021;Okinawa, Japan;Mar 5, 2021;5/03/2021;720;2021-03-05
103;1021;ATCES--SCOPUS 2021;5th International Conference on Aerospace Technology, Communications and Energy Systems (ATCES 2021);Sep 23, 2021 - Sep 25, 2021;Shanghai, China;Mar 25, 2021;25/03/2021;721;2021-03-25
103;1021;WiMoA 2021;3th International Conference on Wireless, Mobile Network and Applications;Nov 20, 2021 - Nov 21, 2021;Zurich, Switzerland;Mar 6, 2021;6/03/2021;722;2021-03-06
103;1021;WCN 2022;Wireless Communications and Networking: Theory and Practice;N/A;N/A;Feb 28, 2021;28/02/2021;723;2021-02-28
103;1021;WiMo 2021;13th International Conference on Wireless & Mobile Network;Jun 26, 2021 - Jun 27, 2021;Sydney, Australia;Feb 27, 2021;27/02/2021;724;2021-02-27
103;1022;ICNP 2021;International Conference on Network Protocols;Nov 2, 2021 - Nov 5, 2021;Dallas, TX;May 24, 2021 (May 17, 2021);24/05/2021;725;2021-05-24
103;1022;BDIoT 2021;5th International Conference on Big Data and Internet of Things - BDIoT’21;Mar 17, 2021 - Mar 18, 2021;Rabat - Morocco;Dec 1, 2021;1/12/2021;726;2021-12-01
103;1022;UBICOMM 2021;The Fifteenth International Conference on Mobile Ubiquitous Computing, Systems, Services and Technologies;Oct 3, 2021 - Oct 7, 2021;Barcelona, Spain;Jul 5, 2021;5/07/2021;727;2021-07-05
103;1022;NISecurity 2021;2021 International Conference on Network and Information Security (NISecurity 2021);Aug 13, 2021 - Aug 15, 2021;Stockholm, Sweden;Jun 30, 2021;30/06/2021;728;2021-06-30
103;1022;blockchain_ml_iot 2021;Network and Electronics (MDPI) Joint Special Issue - Blockchain and Machine Learning for IoT: Security and Privacy Challenges;N/A;N/A;Dec 31, 2021;31/12/2021;729;2021-12-31
103;1022;CBW 2021;2nd International Conference on Cloud, Big Data and Web Services;Jul 24, 2021 - Jul 25, 2021;London, United Kingdom;Feb 20, 2021;20/02/2021;730;2021-02-20
103;1022;MDPI mathematics 2021;MDPI mathematics - Special Issue on Computational Optimizations for Machine Learning;N/A;N/A;Sep 30, 2021;30/09/2021;731;2021-09-30
103;1022;CANS 2021;Cryptology and Network Security;Dec 13, 2021 - Dec 15, 2021;Vienna, Austria;Jun 1, 2021;1/06/2021;732;2021-06-01
103;1022;NetIIoT 2021;State-of-Art of Network Architectures and Protocols for Industrial IoT;N/A;N/A;Sep 20, 2021;20/09/2021;733;2021-09-20
103;1022;ICSRS--Scopus & EI 2021;2021 5th International Conference on System Reliability and Safety (ICSRS 2021)--Scopus & EI Compendex;Nov 24, 2021 - Nov 26, 2021;Palermo, Italy;Jul 5, 2021;5/07/2021;734;2021-07-05
103;1022;Smart Health 2021;Special Issue - Systems, Applications and Services for Smart Health;N/A;N/A;Jun 25, 2021;25/06/2021;735;2021-06-25
103;1022;SNSA-SI-MDPI 2021;Sensor Networks Security and Applications;N/A;N/A;Jul 31, 2021;31/07/2021;736;2021-07-31
103;1022;ICNISC 2021;7th Annual International Conference on Network and Information Systems for Computers;Jul 23, 2021 - Jul 25, 2021;Guiyang;Jul 19, 2021;19/07/2021;737;2021-07-19
103;1022;CENTRIC 2021;The Fourteenth International Conference on Advances in Human-oriented and Personalized Mechanisms, Technologies, and Services;Oct 3, 2021 - Oct 7, 2021;Barcelona, Spain;Jul 5, 2021;5/07/2021;738;2021-07-05
103;1022;Elec-SI-IIDS 2021;Special Issue on Design of Intelligent Intrusion Detection Systems;N/A;N/A;May 31, 2021;31/05/2021;739;2021-05-31
103;1022;MDAI 2021;18th International Conference on Modeling Decisions for Artificial Intelligence;Sep 27, 2021 - Sep 30, 2021;Umea, Sweden;Mar 22, 2021;22/03/2021;740;2021-03-22
103;1022;AMBIENT 2021;The Eleventh International Conference on Ambient Computing, Applications, Services and Technologies;Oct 3, 2021 - Oct 7, 2021;Barcelona, Spain;Jul 5, 2021;5/07/2021;741;2021-07-05
103;1022;Scopus-CCISP 2021;The 6th International Conference on Communication, Image and Signal Processing;Nov 19, 2021 - Nov 21, 2021;Chengdu, China;Jul 20, 2021;20/07/2021;742;2021-07-20
103;1022;WEBIST 2021;17th International Conference on Web Information Systems and Technologies;Oct 26, 2021 - Oct 28, 2021;Valletta, Malta;May 18, 2021;18/05/2021;743;2021-05-18
103;1022;ICENT--EI Compendex, Scopus 2021;2021 3rd International Conference on Emerging Networks Technologies (ICENT 2021)--Ei Compendex, Scopus;Sep 22, 2021 - Sep 24, 2021;Okinawa, Japan;May 10, 2021;10/05/2021;744;2021-05-10
103;1022;GEOProcessing 2021;The Thirteenth International Conference on Advanced Geographic Information Systems, Applications, and Services;Jul 18, 2021 - Jul 22, 2021;Nice, France;Apr 19, 2021;19/04/2021;745;2021-04-19
103;1022;SCOPUS-DMCIT 2021;5th International Conference on Data Mining, Communications and Information Technology (DMCIT 2021);Apr 16, 2021 - Apr 18, 2021;Hangzhou, China;Mar 15, 2021;15/03/2021;746;2021-03-15
103;1022;ICSSE--Ei and Scopus 2021;2021 4th International Conference on Software and Services Engineering (ICSSE 2021)--Ei Compendex, Scopus;Apr 14, 2021 - Apr 16, 2021;Marseille, France;Feb 25, 2021;25/02/2021;747;2021-02-25
103;1022;EAI MobiCASE 2021;12th EAI International Conference on Mobile Computing, Applications and Services (Springer, Scopus, ISI, Ei, more);Sep 18, 2021 - Sep 19, 2021;Hangzhou, People's Republic of China;Apr 25, 2021;25/04/2021;748;2021-04-25
103;1022;ICIW 2021;The Sixteenth International Conference on Internet and Web Applications and Services;May 30, 2021 - Jun 3, 2021;Valencia, Spain;Mar 2, 2021;2/03/2021;749;2021-03-02
103;1022;MOBILITY 2021;The Eleventh International Conference on Mobile Services, Resources, and Users;May 30, 2021 - Jun 3, 2021;Valencia, Spain;Mar 2, 2021;2/03/2021;750;2021-03-02
103;1022;ICCNT--JA, SCOPUS 2021;2021 5th International Conference on Communication and Network Technology (ICCNT 2021)--JA, Scopus;Sep 25, 2021 - Sep 27, 2021;Paris, France;May 5, 2021;5/05/2021;751;2021-05-05
103;1022;Wind Integration Workshop 2021;20th International Workshop on Large-scale Integration of Wind Power into Power Systems as well as on Transmission Networks for Offshore Wind Power Plants;Sep 29, 2021 - Oct 1, 2021;Virtual/Germany;May 1, 2021;1/05/2021;752;2021-05-01
103;1022;Big Data Analytics in Sustainable City 2021;IS04: Big Data Analytics in Sustainable and Smart City;Sep 15, 2021 - Sep 17, 2021;Split, Croatia;Apr 2, 2021;2/04/2021;753;2021-04-02
103;1022;EAI COMPSE 2021;5th EAI International Conference on Computer Science and Engineering in Health Services;Jul 30, 2021 - Jul 31, 2021;Mexico City, Mexico;Apr 7, 2021;7/04/2021;754;2021-04-07
103;1022;FinteQC 2021;The 3rd Canadian Conference on Fintech and Insurtech (online event);May 19, 2021 - May 20, 2021;Quebec Canada;Mar 8, 2021;8/03/2021;755;2021-03-08
103;1022;CLOUD 2021;10th International Conference on Cloud Computing: Services and Architecture;Jun 19, 2021 - Jun 20, 2021;Copenhagen, Denmark;Feb 27, 2021;27/02/2021;756;2021-02-27
103;1022;NCS 2021;13th International Conference on Network and Communications Security;Sep 25, 2021 - Sep 26, 2021;Toronto, Canada;Feb 27, 2021;27/02/2021;757;2021-02-27
103;1022;COLLA 2021;The Eleventh International Conference on Advanced Collaborative Networks, Systems and Applications;Jul 18, 2021 - Jul 22, 2021;Nice, France;Apr 19, 2021;19/04/2021;758;2021-04-19
103;1022;CCGE 2021;1st IEEE International Conference on Computing, Communication and Green Engineering-2021;Jul 8, 2021 - Jul 10, 2021;Pune;Apr 10, 2021;10/04/2021;759;2021-04-10
103;1022;ECSA 58;ECSA 58 - EMECS 13 Estuaries and coastal seas in the Anthropocene Structure, functions, services and management;Sep 6, 2021 - Sep 10, 2021;Hull, UK;Apr 9, 2021;9/04/2021;760;2021-04-09
103;1022;Scopus-ICMEAS 2021;7th International Conference on Mechanical Engineering and Automation Science (ICMEAS 2021);Oct 28, 2021 - Oct 30, 2021;Seoul, South Korea;Apr 30, 2021;30/04/2021;761;2021-04-30
103;1022;MISSI 2021;International Conference on Multimedia & Network Information Systems;Sep 1, 2021 - Sep 3, 2021;Paris, France;Mar 20, 2021;20/03/2021;762;2021-03-20
103;1022;ANNSIM 2021;2021 Annual Modeling and Simulation Conference;Jul 19, 2021 - Jul 22, 2021;Fairfax, Virginia;Mar 1, 2021;1/03/2021;763;2021-03-01
103;1022;IEEE SOSE 2021;The 15th IEEE International Conference On Service-Oriented System Engineering;Aug 23, 2021 - Aug 26, 2021;Online;Mar 1, 2021;1/03/2021;764;2021-03-01
103;1022;JNSM SI on B5G 2021;Journal of Network and Systems Management: Special Issue on Network management for beyond 5G systems;N/A;N/A;Mar 30, 2021;30/03/2021;765;2021-03-30
103;1022;GridCom 2021;13th International Conference on GridComputing;Nov 20, 2021 - Nov 21, 2021;Zurich, Switzerland;Mar 6, 2021;6/03/2021;766;2021-03-06
103;1022;ACCSE 2021;The Sixth International Conference on Advances in Computation, Communications and Services;May 30, 2021 - Jun 3, 2021;Valencia, Spain;Mar 2, 2021;2/03/2021;767;2021-03-02
103;1022;ICNS 2021;The Seventeenth International Conference on Networking and Services;May 30, 2021 - Jun 3, 2021;Valencia, Spain;Mar 2, 2021;2/03/2021;768;2021-03-02
103;1022;WEB 2021;The Ninth International Conference on Building and Exploring Web Based Environments;May 30, 2021 - Jun 3, 2021;Valencia, Spain;Mar 2, 2021;2/03/2021;769;2021-03-02
103;1022;ITCSS 2021;7th International Conference on Information Technology Convergence and Services;Mar 20, 2021 - Mar 21, 2021;Vienna, Austria;Feb 20, 2021;20/02/2021;770;2021-02-20
103;1022;ASOFT 2021;2nd International Conference on Advances in Software Engineering;Sep 18, 2021 - Sep 19, 2021;Copenhagen, Denmark;Feb 20, 2021;20/02/2021;771;2021-02-20
103;1022;WiMoA 2021;3th International Conference on Wireless, Mobile Network and Applications;Nov 20, 2021 - Nov 21, 2021;Zurich, Switzerland;Mar 6, 2021;6/03/2021;772;2021-03-06
103;1022;BRAINS 2021;3rd Conference on Blockchain Research & Applications for Innovative Networks and Services;Sep 27, 2021 - Sep 30, 2021;Paris, France;Mar 31, 2021;31/03/2021;773;2021-03-31
103;1022;ICINT--EI Compendex, Scopus 2021;2021 6th International Conference on Information and Network Technologies (ICINT 2021)--EI Compendex, Scopus;May 22, 2021 - May 24, 2021;Okinawa, Japan;Mar 5, 2021;5/03/2021;774;2021-03-05
103;1022;ICINT--EI, Scopus 2021;2021 6th International Conference on Information and Network Technologies (ICINT 2021)--EI Compendex, Scopus;May 22, 2021 - May 24, 2021;Okinawa, Japan;Mar 5, 2021;5/03/2021;775;2021-03-05
103;1023;ICNP 2021;International Conference on Network Protocols;Nov 2, 2021 - Nov 5, 2021;Dallas, TX;May 24, 2021 (May 17, 2021);24/05/2021;776;2021-05-24
103;1023;BDIoT 2021;5th International Conference on Big Data and Internet of Things - BDIoT’21;Mar 17, 2021 - Mar 18, 2021;Rabat - Morocco;Dec 1, 2021;1/12/2021;777;2021-12-01
103;1023;NISecurity 2021;2021 International Conference on Network and Information Security (NISecurity 2021);Aug 13, 2021 - Aug 15, 2021;Stockholm, Sweden;Jun 30, 2021;30/06/2021;778;2021-06-30
103;1023;blockchain_ml_iot 2021;Network and Electronics (MDPI) Joint Special Issue - Blockchain and Machine Learning for IoT: Security and Privacy Challenges;N/A;N/A;Dec 31, 2021;31/12/2021;779;2021-12-31
103;1023;MDPI mathematics 2021;MDPI mathematics - Special Issue on Computational Optimizations for Machine Learning;N/A;N/A;Sep 30, 2021;30/09/2021;780;2021-09-30
103;1023;CANS 2021;Cryptology and Network Security;Dec 13, 2021 - Dec 15, 2021;Vienna, Austria;Jun 1, 2021;1/06/2021;781;2021-06-01
103;1023;NetIIoT 2021;State-of-Art of Network Architectures and Protocols for Industrial IoT;N/A;N/A;Sep 20, 2021;20/09/2021;782;2021-09-20
103;1023;Micrads 2021;MICRADS´21 - The 2021 Multidisciplinary International Conference of Research Applied to Defense and Security;May 26, 2021 - May 28, 2021;Cartagena da Índias;Feb 10, 2021;10/02/2021;783;2021-02-10
103;1023;ICSRS--Scopus & EI 2021;2021 5th International Conference on System Reliability and Safety (ICSRS 2021)--Scopus & EI Compendex;Nov 24, 2021 - Nov 26, 2021;Palermo, Italy;Jul 5, 2021;5/07/2021;784;2021-07-05
103;1023;ICNISC 2021;7th Annual International Conference on Network and Information Systems for Computers;Jul 23, 2021 - Jul 25, 2021;Guiyang;Jul 19, 2021;19/07/2021;785;2021-07-19
103;1023;SNSA-SI-MDPI 2021;Sensor Networks Security and Applications;N/A;N/A;Jul 31, 2021;31/07/2021;786;2021-07-31
103;1023;Elec-SI-IIDS 2021;Special Issue on Design of Intelligent Intrusion Detection Systems;N/A;N/A;May 31, 2021;31/05/2021;787;2021-05-31
103;1023;MDAI 2021;18th International Conference on Modeling Decisions for Artificial Intelligence;Sep 27, 2021 - Sep 30, 2021;Umea, Sweden;Mar 22, 2021;22/03/2021;788;2021-03-22
103;1023;Scopus-CCISP 2021;The 6th International Conference on Communication, Image and Signal Processing;Nov 19, 2021 - Nov 21, 2021;Chengdu, China;Jul 20, 2021;20/07/2021;789;2021-07-20
103;1023;ICENT--EI Compendex, Scopus 2021;2021 3rd International Conference on Emerging Networks Technologies (ICENT 2021)--Ei Compendex, Scopus;Sep 22, 2021 - Sep 24, 2021;Okinawa, Japan;May 10, 2021;10/05/2021;790;2021-05-10
103;1023;SCOPUS-DMCIT 2021;5th International Conference on Data Mining, Communications and Information Technology (DMCIT 2021);Apr 16, 2021 - Apr 18, 2021;Hangzhou, China;Mar 15, 2021;15/03/2021;791;2021-03-15
103;1023;ICCNT--JA, SCOPUS 2021;2021 5th International Conference on Communication and Network Technology (ICCNT 2021)--JA, Scopus;Sep 25, 2021 - Sep 27, 2021;Paris, France;May 5, 2021;5/05/2021;792;2021-05-05
103;1023;Big Data Analytics in Sustainable City 2021;IS04: Big Data Analytics in Sustainable and Smart City;Sep 15, 2021 - Sep 17, 2021;Split, Croatia;Apr 2, 2021;2/04/2021;793;2021-04-02
103;1023;NCS 2021;13th International Conference on Network and Communications Security;Sep 25, 2021 - Sep 26, 2021;Toronto, Canada;Feb 27, 2021;27/02/2021;794;2021-02-27
103;1023;CCGE 2021;1st IEEE International Conference on Computing, Communication and Green Engineering-2021;Jul 8, 2021 - Jul 10, 2021;Pune;Apr 10, 2021;10/04/2021;795;2021-04-10
103;1023;Scopus-ICMEAS 2021;7th International Conference on Mechanical Engineering and Automation Science (ICMEAS 2021);Oct 28, 2021 - Oct 30, 2021;Seoul, South Korea;Apr 30, 2021;30/04/2021;796;2021-04-30
103;1023;JNSM SI on B5G 2021;Journal of Network and Systems Management: Special Issue on Network management for beyond 5G systems;N/A;N/A;Mar 30, 2021;30/03/2021;797;2021-03-30
103;1023;MISSI 2021;International Conference on Multimedia & Network Information Systems;Sep 1, 2021 - Sep 3, 2021;Paris, France;Mar 20, 2021;20/03/2021;798;2021-03-20
103;1023;GridCom 2021;13th International Conference on GridComputing;Nov 20, 2021 - Nov 21, 2021;Zurich, Switzerland;Mar 6, 2021;6/03/2021;799;2021-03-06
103;1023;ANNSIM 2021;2021 Annual Modeling and Simulation Conference;Jul 19, 2021 - Jul 22, 2021;Fairfax, Virginia;Mar 1, 2021;1/03/2021;800;2021-03-01
103;1023;ICINT--EI Compendex, Scopus 2021;2021 6th International Conference on Information and Network Technologies (ICINT 2021)--EI Compendex, Scopus;May 22, 2021 - May 24, 2021;Okinawa, Japan;Mar 5, 2021;5/03/2021;801;2021-03-05
103;1023;ICINT--EI, Scopus 2021;2021 6th International Conference on Information and Network Technologies (ICINT 2021)--EI Compendex, Scopus;May 22, 2021 - May 24, 2021;Okinawa, Japan;Mar 5, 2021;5/03/2021;802;2021-03-05
103;1023;ATCES--SCOPUS 2021;5th International Conference on Aerospace Technology, Communications and Energy Systems (ATCES 2021);Sep 23, 2021 - Sep 25, 2021;Shanghai, China;Mar 25, 2021;25/03/2021;803;2021-03-25
103;1023;WiMoA 2021;3th International Conference on Wireless, Mobile Network and Applications;Nov 20, 2021 - Nov 21, 2021;Zurich, Switzerland;Mar 6, 2021;6/03/2021;804;2021-03-06
103;1023;WCN 2022;Wireless Communications and Networking: Theory and Practice;N/A;N/A;Feb 28, 2021;28/02/2021;805;2021-02-28
103;1023;WiMo 2021;13th International Conference on Wireless & Mobile Network;Jun 26, 2021 - Jun 27, 2021;Sydney, Australia;Feb 27, 2021;27/02/2021;806;2021-02-27
103;1023;IEEE OJ-CS Special Section 2021;Special Section on Cybersecurity: Privacy, Attack, and Defense;N/A;N/A;Jul 31, 2020;31/07/2020;807;2020-07-31
103;1023;RomHack 2021;#RomHack2021;Sep 25, 2020 - Sep 25, 2020;Rome;May 28, 2020;28/05/2020;808;2020-05-28
104;1024;Industry Practices in Edu 2021;Book Chapter for Industry Practices, Processes and Techniques Adopted in Education - Supporting innovative teaching and learning practice;N/A;N/A;Mar 1, 2021 (Jan 20, 2021);1/03/2021;809;2021-03-01
104;1024;ICSRS--Scopus & EI Compendex 2021;2021 5th International Conference on System Reliability and Safety (ICSRS 2021)--Scopus & EI Compendex;Nov 24, 2021 - Nov 26, 2021;Palermo, Italy;Jul 5, 2021;5/07/2021;810;2021-07-05
104;1024;DSD 2021;Euromicro Conference on Digital System Design (DSD) 2021;Sep 6, 2021 - Sep 8, 2021;Palermo, Sicily, Italy;Apr 1, 2021;1/04/2021;811;2021-04-01
104;1024;MODELS 2021;ACM/IEEE 24th International Conference on Model Driven Engineering Languages and Systems;Oct 10, 2021 - Oct 15, 2021;Fukuoka, Japan;May 7, 2021 (Apr 30, 2021);7/05/2021;812;2021-05-07
104;1024;CODES + ISSS 2021;International Conference on Hardware/Software Codesign and System Synthesis;Oct 10, 2021 - Oct 15, 2021;virtual?;Apr 9, 2021 (Apr 2, 2021);9/04/2021;813;2021-04-09
104;1024;ICSRS--Scopus & EI 2021;2021 5th International Conference on System Reliability and Safety (ICSRS 2021)--Scopus & EI Compendex;Nov 24, 2021 - Nov 26, 2021;Palermo, Italy;Jul 5, 2021;5/07/2021;814;2021-07-05
104;1024;Spec.Issue on Social Informatics: Scopus 2021;Journal of Social and Business Informatics - Acta Informatica Pragensia;N/A;N/A;Jul 31, 2021;31/07/2021;815;2021-07-31
104;1024;PhSR 2021;CFP: Philosophy and Sonic Research: Thinking with Sounds and Rhythms;N/A;N/A;Apr 15, 2021;15/04/2021;816;2021-04-15
104;1024;VALID 2021;The Thirteenth International Conference on Advances in System Testing and Validation Lifecycle;Oct 3, 2021 - Oct 7, 2021;Barcelona, Spain;Jul 5, 2021;5/07/2021;817;2021-07-05
104;1024;ICNISC 2021;7th Annual International Conference on Network and Information Systems for Computers;Jul 23, 2021 - Jul 25, 2021;Guiyang;Jul 19, 2021;19/07/2021;818;2021-07-19
104;1024;MDPI - Risk Management - Scopus 2021;Special Issue of Journal Applied System Innovation: Risk Management;N/A;N/A;Jul 31, 2021;31/07/2021;819;2021-07-31
104;1024;ICTS 2021;The 13th International Conference on Information & Communication Technology and System;Oct 20, 2021 - Oct 21, 2021;Virtual conference;Jul 8, 2021;8/07/2021;820;2021-07-08
104;1024;SIMUL 2021;The Thirteenth International Conference on Advances in System Simulation;Oct 3, 2021 - Oct 7, 2021;Barcelona, Spain;Jul 5, 2021;5/07/2021;821;2021-07-05
104;1024;CIMSS 2021;International Workshop on Critical Infrastructure and Manufacturing System Security;Jun 21, 2021 - Jun 24, 2021;Kamakura, Japan;Mar 20, 2021;20/03/2021;822;2021-03-20
104;1024;MODELS 2021;ACM/IEEE 24th International Conference on Model Driven Engineering Languages and Systems;Oct 10, 2021 - Oct 15, 2021;Fukuoka, Japan;May 7, 2021 (Apr 30, 2021);7/05/2021;823;2021-05-07
104;1024;FDL 2021;24th IEEE Forum on specification & Design Languages;Sep 8, 2021 - Sep 10, 2021;Antibes (France);May 24, 2021 (May 17, 2021);24/05/2021;824;2021-05-24
104;1024;PSGEC-IEEE 2021;2021 Power System And Green Energy Conference ( PSGEC 2021);Aug 20, 2021 - Aug 22, 2021;Shanghai, China;Mar 20, 2021;20/03/2021;825;2021-03-20
104;1024;E-Mobility Integration Symposium 2021;5th E-Mobility Power System Integration Symposium;Sep 27, 2021 - Sep 27, 2021;Virtual/Germany;May 1, 2021;1/05/2021;826;2021-05-01
104;1024;Wind Integration Workshop 2021;20th International Workshop on Large-scale Integration of Wind Power into Power Systems as well as on Transmission Networks for Offshore Wind Power Plants;Sep 29, 2021 - Oct 1, 2021;Virtual/Germany;May 1, 2021;1/05/2021;827;2021-05-01
104;1024;WoRMS 2021;3rd International Workshop on Reading Music Systems;Jul 23, 2021 - Jul 23, 2021;Alicante, Spain;Apr 23, 2021;23/04/2021;828;2021-04-23
104;1024;IEEE-PSGEC 2021;2021 Power System And Green Energy Conference ( PSGEC 2021);Aug 20, 2021 - Aug 22, 2021;Shanghai, China;Mar 20, 2021;20/03/2021;829;2021-03-20
104;1024;AIP Journal - Indexed in Scopus 2021;Journal of Social and Business Informatics - Acta Informatica Pragensia;N/A;N/A;Mar 31, 2021;31/03/2021;830;2021-03-31
104;1024;ICMSC--Springer, Scopus 2021;Springer--2021 The 5th International Conference on Mechanical, System and Control Engineering (ICMSC 2021)--IOP, Scopus;May 28, 2021 - May 30, 2021;Kazan, Russian Federation;Mar 20, 2021;20/03/2021;831;2021-03-20
104;1024;VRIS--SCOPUS, Ei 2021;2021 3rd International Conference on Virtual Reality and Intelligent System (VRIS 2021)--Ei Compendex, Scopus;Aug 18, 2021 - Aug 20, 2021;Kunming, China;Mar 25, 2021;25/03/2021;832;2021-03-25
104;1024;ICSTCC 2021;25th International Conference on System Theory, Control and Computing;Oct 20, 2021 - Oct 23, 2021;Iasi, Romania;Apr 30, 2021;30/04/2021;833;2021-04-30
104;1024;VRIS--SCOPUS, Ei Compendex 2021;2021 3rd International Conference on Virtual Reality and Intelligent System (VRIS 2021)--Ei Compendex, Scopus;Aug 18, 2021 - Aug 20, 2021;Kunming, China;Mar 25, 2021;25/03/2021;834;2021-03-25
104;1024;SCOPUS-SAASE 2021;5th International Symposium on Aviation and Aerospace System Engineering (SAASE 2021);May 14, 2021 - May 16, 2021;Beijing, China;Mar 10, 2021;10/03/2021;835;2021-03-10
104;1024;IEEE--ICCSS--Ei Compendex, Scopus 2021;IEEE--2021 4th International Conference on Circuits, Systems and Simulation (ICCSS 2021)--Ei Compendex, Scopus;May 26, 2021 - May 28, 2021;Kuala Lumpur, Malaysia;Mar 20, 2021;20/03/2021;836;2021-03-20
104;1024;ICMSR--Ei Compendex, Scopus 2021;2021 the 7th International Conference on Mechatronics System and Robots (ICMSR 2021)--Ei Compendex, Scopus;Apr 21, 2021 - Apr 23, 2021;Hong Kong;Mar 10, 2021;10/03/2021;837;2021-03-10
104;1024;ICMSR--Ei, Scopus 2021;2021 the 7th International Conference on Mechatronics System and Robots (ICMSR 2021)--Ei Compendex, Scopus;Apr 21, 2021 - Apr 23, 2021;Hong Kong;Mar 10, 2021;10/03/2021;838;2021-03-10
104;1024;ICCSA 2021;The 2nd International Conference on Computer Science's Complex Systems and their Applications;May 25, 2021 - May 26, 2021;Oum El Bouahi - Algeria;Mar 15, 2021;15/03/2021;839;2021-03-15
104;1024;ICCSS--IEEE, Ei and Scopus 2021;IEEE--2021 4th International Conference on Circuits, Systems and Simulation (ICCSS 2021)--Ei Compendex, Scopus;May 26, 2021 - May 28, 2021;Kuala Lumpur, Malaysia;Mar 20, 2021;20/03/2021;840;2021-03-20
104;1025;MDPI - Risk Management - Scopus 2021;Special Issue of Journal Applied System Innovation: Risk Management;N/A;N/A;Jul 31, 2021;31/07/2021;841;2021-07-31
104;1025;17th ICTEL Rome 2021;17th ICTEL 2021 – International Conference on Teaching, Education & Learning, 06-07 September, Rome;Sep 6, 2021 - Sep 7, 2021;University of Washington – Rome Center (;Sep 6, 2021 (Sep 5, 2021);6/09/2021;842;2021-09-06
104;1025;TERA - Eurasia Research 2021;19th ICTEL 2021 – International Conference on Teaching, Education & Learning, 11-12 October, Lisbon;Oct 11, 2021 - Oct 12, 2021;Universidade Autónoma de Lisboa (UAL), L;Oct 10, 2021;10/10/2021;843;2021-10-10
104;1025;20th ICTEL October, Dubai 2021;20th ICTEL 2021 – International Conference on Teaching, Education & Learning, 23-24 October, Dubai;Oct 23, 2021 - Oct 24, 2021;Flora Creek, Deira, Dubai, UAE;Oct 22, 2021;22/10/2021;844;2021-10-22
104;1025;ICSRS--Scopus & EI Compendex 2021;2021 5th International Conference on System Reliability and Safety (ICSRS 2021)--Scopus & EI Compendex;Nov 24, 2021 - Nov 26, 2021;Palermo, Italy;Jul 5, 2021;5/07/2021;845;2021-07-05
104;1025;TERA - Eurasia Research 2021;15th ICTEL 2021 – International Conference on Teaching, Education & Learning, 06-07 September, London;Sep 6, 2021 - Sep 5, 2021;The Tomlinson Centre, Queensbridge Road,;Sep 4, 2021;4/09/2021;846;2021-09-04
104;1025;13th ICTEL August, Amsterdam 2021;13th ICTEL 2021 – International Conference on Teaching, Education & Learning, 02-03 August, Amsterdam;Aug 2, 2021 - Aug 3, 2021;NH Hotel Amsterdam-Zuid, Van Leijenbergh;Aug 1, 2021;1/08/2021;847;2021-08-01
104;1025;PARMA-DITAM 2021;PARMA-DITAM: 12th Workshop on Parallel Programming and Run-Time Management Techniques for Many-core Architectures & 10th Workshop on Design Tools and Architectures for Multi-Core;Jan 19, 2021 - Jan 19, 2021;Virtual;Nov 13, 2021;13/11/2021;848;2021-11-13
104;1025;16th ICTEL Sept, Athens 2021;16th ICTEL 2021 – International Conference on Teaching, Education & Learning, 14-15 September, Athens;Sep 14, 2021 - Sep 15, 2021;Novotel Athenes, Michail Voda 4, Athens,;Sep 13, 2021;13/09/2021;849;2021-09-13
104;1025;KMIS 2021;13th International Conference on Knowledge Management and Information Systems;Oct 25, 2021 - Oct 27, 2021;Valletta, Malta;May 18, 2021;18/05/2021;850;2021-05-18
104;1025;DSD 2021;Euromicro Conference on Digital System Design (DSD) 2021;Sep 6, 2021 - Sep 8, 2021;Palermo, Sicily, Italy;Apr 1, 2021;1/04/2021;851;2021-04-01
104;1025;MODELS 2021;ACM/IEEE 24th International Conference on Model Driven Engineering Languages and Systems;Oct 10, 2021 - Oct 15, 2021;Fukuoka, Japan;May 7, 2021 (Apr 30, 2021);7/05/2021;852;2021-05-07
104;1025;CODES + ISSS 2021;International Conference on Hardware/Software Codesign and System Synthesis;Oct 10, 2021 - Oct 15, 2021;virtual?;Apr 9, 2021 (Apr 2, 2021);9/04/2021;853;2021-04-09
104;1025;ICSRS--Scopus & EI 2021;2021 5th International Conference on System Reliability and Safety (ICSRS 2021)--Scopus & EI Compendex;Nov 24, 2021 - Nov 26, 2021;Palermo, Italy;Jul 5, 2021;5/07/2021;854;2021-07-05
104;1025;ICPM 2021;3rd International Conference on Process Mining;Oct 31, 2021 - Nov 4, 2021;Eindhoven;Jul 1, 2021 (Jun 15, 2021);1/07/2021;855;2021-07-01
104;1025;IC3K 2021;13th International Joint Conference on Knowledge Discovery, Knowledge Engineering and Knowledge Management;Oct 25, 2021 - Oct 27, 2021;Valletta, Malta;May 18, 2021;18/05/2021;856;2021-05-18
104;1025;Spec.Issue on Social Informatics: Scopus 2021;Journal of Social and Business Informatics - Acta Informatica Pragensia;N/A;N/A;Jul 31, 2021;31/07/2021;857;2021-07-31
104;1025;Scopus-ICDPR 2022;The 6th International Conference on Data Processing and Robotics (ICDPR 2022);Jan 6, 2022 - Jan 8, 2022;Hokkaido, Japan;Jul 5, 2021;5/07/2021;858;2021-07-05
104;1025;ICT-DM 2021;The 7th International Conference on Information and Communication Technologies for Disaster Management;Dec 3, 2021 - Dec 5, 2021;Hangzhou, China;Jun 20, 2021 (Jun 15, 2021);20/06/2021;859;2021-06-20
104;1025;VALID 2021;The Thirteenth International Conference on Advances in System Testing and Validation Lifecycle;Oct 3, 2021 - Oct 7, 2021;Barcelona, Spain;Jul 5, 2021;5/07/2021;860;2021-07-05
104;1025;BDSIC--EI, Scopus 2021;2021 3rd International Conference on Big-data Service and Intelligent Computation (BDSIC 2021)--Ei Compendex, Scopus;Nov 19, 2021 - Nov 21, 2021;HuaQiao University, Xiamen?China;Jul 5, 2021;5/07/2021;861;2021-07-05
104;1025;Scopus-WSM 2021;The 3rd International Conference on Water Security and Management ( WSM 2021);Dec 9, 2021 - Dec 11, 2021;Tokyo, Japan;Jun 10, 2021;10/06/2021;862;2021-06-10
104;1025;MEDES 2021;The 13th International ACM Conference on Management of Digital EcoSystems;Nov 1, 2021 - Nov 3, 2021;Hammamet - Tunisia;May 24, 2021;24/05/2021;863;2021-05-24
104;1025;ICNISC 2021;7th Annual International Conference on Network and Information Systems for Computers;Jul 23, 2021 - Jul 25, 2021;Guiyang;Jul 19, 2021;19/07/2021;864;2021-07-19
104;1025;SIMUL 2021;The Thirteenth International Conference on Advances in System Simulation;Oct 3, 2021 - Oct 7, 2021;Barcelona, Spain;Jul 5, 2021;5/07/2021;865;2021-07-05
104;1025;ICTS 2021;The 13th International Conference on Information & Communication Technology and System;Oct 20, 2021 - Oct 21, 2021;Virtual conference;Jul 8, 2021;8/07/2021;866;2021-07-08
104;1025;WSM-Scopus 2021;The 3rd International Conference on Water Security and Management ( WSM 2021);Dec 9, 2021 - Dec 11, 2021;Tokyo, Japan;Jun 10, 2021;10/06/2021;867;2021-06-10
104;1025;SKM 2021;International Conference on Secure Knowledge Management;Oct 8, 2021 - Oct 9, 2021;San Antonio;Jun 21, 2021;21/06/2021;868;2021-06-21
104;1025;CHIRA 2021;5th International Conference on Computer-Human Interaction Research and Applications;Oct 28, 2021 - Oct 29, 2021;Valletta, Malta;May 18, 2021;18/05/2021;869;2021-05-18
104;1025;ICENT--EI, Scopus 2021;2021 3rd International Conference on Emerging Networks Technologies (ICENT 2021)--Ei Compendex, Scopus;Sep 22, 2021 - Sep 24, 2021;Okinawa, Japan;May 10, 2021;10/05/2021;870;2021-05-10
104;1025;ICENT--EI Compendex, Scopus 2021;2021 3rd International Conference on Emerging Networks Technologies (ICENT 2021)--Ei Compendex, Scopus;Sep 22, 2021 - Sep 24, 2021;Okinawa, Japan;May 10, 2021;10/05/2021;871;2021-05-10
104;1025;EAI BODYNETS 2021;16th EAI International Conference on Body Area Networks: Smart IoT and big data for intelligent health management (Springer, Scopus, ISI, Ei, more);Oct 25, 2021 - Oct 26, 2021;Glasgow, Great Britain;May 13, 2021;13/05/2021;872;2021-05-13
104;1025;CIMSS 2021;International Workshop on Critical Infrastructure and Manufacturing System Security;Jun 21, 2021 - Jun 24, 2021;Kamakura, Japan;Mar 20, 2021;20/03/2021;873;2021-03-20
104;1025;BSHDS 2021;4th International Conference on Business Sustainability, Human Resource Development and Social Responsibility;Jun 19, 2021 - Jun 20, 2021;Hotel Mystays Ochanomizu Conf Center;Jun 9, 2021;9/06/2021;874;2021-06-09
104;1025;KEAS 2021;4th International Conference on Knowledge Economy, Artificial Intelligence & Social Sciences;May 22, 2021 - May 23, 2021;Hotel Mystays Ochanomizu Conf Center;May 12, 2021;12/05/2021;875;2021-05-12
104;1025;ICCPM 2021;2021 12th International Conference on Construction and Project Management (ICCPM 2021);Sep 27, 2021 - Sep 29, 2021;Macau, China;May 10, 2021;10/05/2021;876;2021-05-10
104;1025;IEEE ICICSP--EI, Scopus 2021;2021 4th IEEE International Conference on Information Communication and Signal Processing (ICICSP 2021)--Ei Compendex, Scopus;Sep 24, 2021 - Sep 26, 2021;Shanghai, China;May 10, 2021;10/05/2021;877;2021-05-10
104;1025;CCIOT--ACM, EI Compendex, Scopus 2021;ACM--2021 6th International Conference on Cloud Computing and Internet of Things (CCIOT 2021)--Ei Compendex, Scopus;Sep 22, 2021 - Sep 24, 2021;Okinawa, Japan;May 10, 2021;10/05/2021;878;2021-05-10
104;1025;MEDES 2021;The 13th International Conference on Management of Digital EcoSystems;Nov 1, 2021 - Nov 3, 2021;Hammamet - Tunisia;May 24, 2021;24/05/2021;879;2021-05-24
104;1025;MODELS 2021;ACM/IEEE 24th International Conference on Model Driven Engineering Languages and Systems;Oct 10, 2021 - Oct 15, 2021;Fukuoka, Japan;May 7, 2021 (Apr 30, 2021);7/05/2021;880;2021-05-07
104;1025;SPBP 2021;The Fourth Workshop on Security and Privacy-enhanced Business Process Management;Sep 6, 2021 - Sep 6, 2021;Rome, Italy;May 24, 2021;24/05/2021;881;2021-05-24
104;1025;FDL 2021;24th IEEE Forum on specification & Design Languages;Sep 8, 2021 - Sep 10, 2021;Antibes (France);May 24, 2021 (May 17, 2021);24/05/2021;882;2021-05-24
104;1025;PSGEC-IEEE 2021;2021 Power System And Green Energy Conference ( PSGEC 2021);Aug 20, 2021 - Aug 22, 2021;Shanghai, China;Mar 20, 2021;20/03/2021;883;2021-03-20
104;1025;BPMS2 2021;14th Workshop on Social and Human Aspects of Business Process Management;Sep 6, 2021 - Sep 6, 2021;Rome, Italy;May 24, 2021;24/05/2021;884;2021-05-24
104;1025;E-Mobility Integration Symposium 2021;5th E-Mobility Power System Integration Symposium;Sep 27, 2021 - Sep 27, 2021;Virtual/Germany;May 1, 2021;1/05/2021;885;2021-05-01
104;1025;Wind Integration Workshop 2021;20th International Workshop on Large-scale Integration of Wind Power into Power Systems as well as on Transmission Networks for Offshore Wind Power Plants;Sep 29, 2021 - Oct 1, 2021;Virtual/Germany;May 1, 2021;1/05/2021;886;2021-05-01
104;1025;WoRMS 2021;3rd International Workshop on Reading Music Systems;Jul 23, 2021 - Jul 23, 2021;Alicante, Spain;Apr 23, 2021;23/04/2021;887;2021-04-23
104;1025;ICMSC--Springer, Scopus 2021;Springer--2021 The 5th International Conference on Mechanical, System and Control Engineering (ICMSC 2021)--IOP, Scopus;May 28, 2021 - May 30, 2021;Kazan, Russian Federation;Mar 20, 2021;20/03/2021;888;2021-03-20
104;1025;VRIS--SCOPUS, Ei 2021;2021 3rd International Conference on Virtual Reality and Intelligent System (VRIS 2021)--Ei Compendex, Scopus;Aug 18, 2021 - Aug 20, 2021;Kunming, China;Mar 25, 2021;25/03/2021;889;2021-03-25
104;1025;IEEE-PSGEC 2021;2021 Power System And Green Energy Conference ( PSGEC 2021);Aug 20, 2021 - Aug 22, 2021;Shanghai, China;Mar 20, 2021;20/03/2021;890;2021-03-20
104;1025;AIP Journal - Indexed in Scopus 2021;Journal of Social and Business Informatics - Acta Informatica Pragensia;N/A;N/A;Mar 31, 2021;31/03/2021;891;2021-03-31
104;1026;ICSTCC 2021;25th International Conference on System Theory, Control and Computing;Oct 20, 2021 - Oct 23, 2021;Iasi, Romania;Apr 30, 2021;30/04/2021;892;2021-04-30
104;1026;ICBDB 2021;2021 3rd International Conference on Big Data and Blockchain(ICBDB 2021);Dec 3, 2021 - Dec 5, 2021;Beijing, China;Oct 30, 2021;30/10/2021;893;2021-10-30
104;1026;IARCE 2021;2021 5th International Conference on Industrial Automation, Robotics and Control Engineering (IARCE 2021);Jun 18, 2021 - Jun 20, 2021;Chengdu, China;May 20, 2021;20/05/2021;894;2021-05-20
104;1026;EI-CFAIS 2021;2021 International Conference on Frontiers of Artificial Intelligence and Statistics (CFAIS 2021);Dec 1, 2021 - Dec 3, 2021;Beijing, China;Oct 30, 2021;30/10/2021;895;2021-10-30
104;1026;SECCE 2021;2021 International Symposium on Electronics, Communications and Control Engineering (SECCE 2021);May 14, 2021 - May 16, 2021;Prague, Czech Republic;Apr 15, 2021;15/04/2021;896;2021-04-15
104;1026;ICSRS--Scopus & EI Compendex 2021;2021 5th International Conference on System Reliability and Safety (ICSRS 2021)--Scopus & EI Compendex;Nov 24, 2021 - Nov 26, 2021;Palermo, Italy;Jul 5, 2021;5/07/2021;897;2021-07-05
104;1026;SACMAT 2021;1st CfP -- ACM Symposium on Access Control Models and Technologies -- SACMAT 2021;Jun 16, 2021 - Jun 18, 2021;Barcelona, Spain;Feb 15, 2021;15/02/2021;898;2021-02-15
104;1026;SI Electronics - EV Grids 2021;Special Issue - Electric Vehicles Integration and Control in Smart Grids;N/A;N/A;Nov 30, 2021;30/11/2021;899;2021-11-30
104;1026;ISCSIC 2021;2021 5th International Symposium on Computer Science and Intelligent Control;Nov 12, 2021 - Nov 14, 2021;Rome, Italy;Oct 15, 2021;15/10/2021;900;2021-10-15
104;1026;UVS-Oman 2022;The 2nd International Conference on Unmanned Vehicle Systems (UVS-Oman 2022) - IEEE;Feb 7, 2022 - Feb 9, 2022;Muscat, Oman;Oct 15, 2021;15/10/2021;901;2021-10-15
104;1026;IARCE 2021-Ei Compendex & Scopus 2021;2021 5th International Conference on Industrial Automation, Robotics and Control Engineering (IARCE 2021);Jun 18, 2021 - Jun 20, 2021;Chengdu, China;May 20, 2021;20/05/2021;902;2021-05-20
104;1026;DSD 2021;Euromicro Conference on Digital System Design (DSD) 2021;Sep 6, 2021 - Sep 8, 2021;Palermo, Sicily, Italy;Apr 1, 2021;1/04/2021;903;2021-04-01
104;1026;MODELS 2021;ACM/IEEE 24th International Conference on Model Driven Engineering Languages and Systems;Oct 10, 2021 - Oct 15, 2021;Fukuoka, Japan;May 7, 2021 (Apr 30, 2021);7/05/2021;904;2021-05-07
104;1026;CODES + ISSS 2021;International Conference on Hardware/Software Codesign and System Synthesis;Oct 10, 2021 - Oct 15, 2021;virtual?;Apr 9, 2021 (Apr 2, 2021);9/04/2021;905;2021-04-09
104;1026;ICSRS--Scopus & EI 2021;2021 5th International Conference on System Reliability and Safety (ICSRS 2021)--Scopus & EI Compendex;Nov 24, 2021 - Nov 26, 2021;Palermo, Italy;Jul 5, 2021;5/07/2021;906;2021-07-05
104;1026;Scopus-CCEAI 2022;The 6th International Conference on Control Engineering and Artificial Intelligence (CCEAI 2022);Jan 6, 2022 - Jan 8, 2022;Hokkaido, Japan;Jul 5, 2021;5/07/2021;907;2021-07-05
104;1026;IWoSR 2021;2021 International Workshop on Service Robotics (IWoSR 2021);Jun 21, 2021 - Jun 23, 2021;Chengdu, China;May 20, 2021;20/05/2021;908;2021-05-20
104;1026;ACM--ICSCC--EI Compendex and Scopus 2021;ACM--2021 6th International Conference on Systems, Control and Communications (ICSCC 2021)--Ei Compendex, Scopus;Oct 15, 2021 - Oct 17, 2021;Chongqing, China;May 10, 2021;10/05/2021;909;2021-05-10
104;1026;ICoCTA 2021;2021 2nd International Conference on Control Theory and Applications (ICoCTA 2021);Jun 18, 2021 - Jun 20, 2021;Chengdu, China;May 20, 2021;20/05/2021;910;2021-05-20
104;1026;EAI FABULOUS 2021;5th EAI International Conference on Future Access Enablers of Ubiquitous and Intelligent Infrastructures;May 6, 2021 - May 7, 2021;Zagreb, Croatia;Dec 15, 2020;15/12/2020;911;2020-12-15
104;1026;ACCESS 2021;2nd International Conference on ADVANCES IN COMPUTING, COMMUNICATION, EMBEDDED AND SECURE SYSTEMS;May 26, 2021 - May 28, 2021;Kalady, Ernakulam, INDIA;Mar 5, 2021;5/03/2021;912;2021-03-05
104;1026;Spec.Issue on Social Informatics: Scopus 2021;Journal of Social and Business Informatics - Acta Informatica Pragensia;N/A;N/A;Jul 31, 2021;31/07/2021;913;2021-07-31
104;1026;CCEAI-Scopus 2022;The 6th International Conference on Control Engineering and Artificial Intelligence (CCEAI 2022);Jan 6, 2022 - Jan 8, 2022;Hokkaido, Japan;Jul 5, 2021;5/07/2021;914;2021-07-05
104;1026;Scopus-CEECT 2021;The 3rd International Conference on Electrical Engineering and Control Technologies (CEECT 2021);Dec 16, 2021 - Dec 18, 2021;Macau SAR, China;Jun 15, 2021;15/06/2021;915;2021-06-15
104;1026;IEEE ICITE--EI Compendex, Scopus 2021;2021 IEEE 6th International Conference on Intelligent Transportation Engineering (IEEE ICITE 2021)--Ei Compendex, Scopus;Sep 17, 2021 - Sep 19, 2021;Beijing, China;Apr 20, 2021;20/04/2021;916;2021-04-20
104;1026;VALID 2021;The Thirteenth International Conference on Advances in System Testing and Validation Lifecycle;Oct 3, 2021 - Oct 7, 2021;Barcelona, Spain;Jul 5, 2021;5/07/2021;917;2021-07-05
104;1026;ICSCC--ACM, EI and Scopus 2021;ACM--2021 6th International Conference on Systems, Control and Communications (ICSCC 2021)--Ei Compendex, Scopus;Oct 15, 2021 - Oct 17, 2021;Chongqing, China;May 10, 2021;10/05/2021;918;2021-05-10
104;1026;SCI/EI Journal--Water Supply 2021;Water Supply Special Issue on Water Quality Control;Jul 30, 2021 - Jan 30, 2022;N/A;Jul 30, 2021;30/07/2021;919;2021-07-30
104;1026;ICNISC 2021;7th Annual International Conference on Network and Information Systems for Computers;Jul 23, 2021 - Jul 25, 2021;Guiyang;Jul 19, 2021;19/07/2021;920;2021-07-19
104;1026;SIMUL 2021;The Thirteenth International Conference on Advances in System Simulation;Oct 3, 2021 - Oct 7, 2021;Barcelona, Spain;Jul 5, 2021;5/07/2021;921;2021-07-05
104;1026;MDPI - Risk Management - Scopus 2021;Special Issue of Journal Applied System Innovation: Risk Management;N/A;N/A;Jul 31, 2021;31/07/2021;922;2021-07-31
104;1026;ICTS 2021;The 13th International Conference on Information & Communication Technology and System;Oct 20, 2021 - Oct 21, 2021;Virtual conference;Jul 8, 2021;8/07/2021;923;2021-07-08
104;1026;ICAA 2021;2021 International Conference on Intelligent Computing, Automation and Applications;Jun 25, 2021 - Jun 27, 2021;Nanjing;Jun 21, 2021;21/06/2021;924;2021-06-21
104;1026;Scopus-WADCE 2021;7th International Workshop on Aircraft Design and Control Engineering (WADCE 2021);Dec 9, 2021 - Dec 12, 2021;Melbourne, Australia;Jun 10, 2021;10/06/2021;925;2021-06-10
104;1026;IEEE--IRCE--EI Compendex, Scopus 2021;IEEE--2021 4th International Conference on Intelligent Robotics and Control Engineering (IRCE 2021)--Ei Compendex, SCOPUS;Sep 18, 2021 - Sep 20, 2021;Lanzhou, China;May 5, 2021;5/05/2021;926;2021-05-05
104;1026;CIMSS 2021;International Workshop on Critical Infrastructure and Manufacturing System Security;Jun 21, 2021 - Jun 24, 2021;Kamakura, Japan;Mar 20, 2021;20/03/2021;927;2021-03-20
104;1026;CEECT-Scopus 2021;The 3rd International Conference on Electrical Engineering and Control Technologies (CEECT 2021);Dec 16, 2021 - Dec 18, 2021;Macau SAR, China;Jun 15, 2021;15/06/2021;928;2021-06-15
104;1026;Scopus-WAT 2021;The 3rd International Workshop on Automation Technologies (WAT 2021);Dec 16, 2021 - Dec 18, 2021;Macau SAR, China;Jun 15, 2021;15/06/2021;929;2021-06-15
104;1026;Scopus-WPCE 2021;6th International Conference on Water Pollution Control Engineering (WPCE 2021);Dec 2, 2021 - Dec 5, 2021;Singapore;Jun 1, 2021;1/06/2021;930;2021-06-01
104;1026;CEESD-Scopus 2021;6th International Conference on Environmental Engineering and Sustainable Development (CEESD 2021);Dec 2, 2021 - Dec 5, 2021;Singapore;Jun 1, 2021;1/06/2021;931;2021-06-01
104;1026;ICACR--Ei Compendex and Scopus 2021;2021 5th International Conference on Automation, Control and Robots (ICACR 2021)--EI Compendex, Scopus;Sep 25, 2021 - Sep 27, 2021;Nanning, China;May 10, 2021;10/05/2021;932;2021-05-10
104;1026;IRCE--IEEE, EI, Scopus 2021;IEEE--2021 4th International Conference on Intelligent Robotics and Control Engineering (IRCE 2021)--Ei Compendex, SCOPUS;Sep 18, 2021 - Sep 20, 2021;Lanzhou, China;May 5, 2021;5/05/2021;933;2021-05-05
104;1026;MODELS 2021;ACM/IEEE 24th International Conference on Model Driven Engineering Languages and Systems;Oct 10, 2021 - Oct 15, 2021;Fukuoka, Japan;May 7, 2021 (Apr 30, 2021);7/05/2021;934;2021-05-07
104;1026;FDL 2021;24th IEEE Forum on specification & Design Languages;Sep 8, 2021 - Sep 10, 2021;Antibes (France);May 24, 2021 (May 17, 2021);24/05/2021;935;2021-05-24
104;1026;PSGEC-IEEE 2021;2021 Power System And Green Energy Conference ( PSGEC 2021);Aug 20, 2021 - Aug 22, 2021;Shanghai, China;Mar 20, 2021;20/03/2021;936;2021-03-20
104;1026;ICACR--Ei and Scopus 2021;2021 5th International Conference on Automation, Control and Robots (ICACR 2021)--EI Compendex, Scopus;Sep 25, 2021 - Sep 27, 2021;Nanning, China;May 10, 2021;10/05/2021;937;2021-05-10
104;1026;E-Mobility Integration Symposium 2021;5th E-Mobility Power System Integration Symposium;Sep 27, 2021 - Sep 27, 2021;Virtual/Germany;May 1, 2021;1/05/2021;938;2021-05-01
104;1026;Wind Integration Workshop 2021;20th International Workshop on Large-scale Integration of Wind Power into Power Systems as well as on Transmission Networks for Offshore Wind Power Plants;Sep 29, 2021 - Oct 1, 2021;Virtual/Germany;May 1, 2021;1/05/2021;939;2021-05-01
104;1026;WoRMS 2021;3rd International Workshop on Reading Music Systems;Jul 23, 2021 - Jul 23, 2021;Alicante, Spain;Apr 23, 2021;23/04/2021;940;2021-04-23
104;1026;ICMSC--Springer, Scopus 2021;Springer--2021 The 5th International Conference on Mechanical, System and Control Engineering (ICMSC 2021)--IOP, Scopus;May 28, 2021 - May 30, 2021;Kazan, Russian Federation;Mar 20, 2021;20/03/2021;941;2021-03-20
104;1026;VRIS--SCOPUS, Ei 2021;2021 3rd International Conference on Virtual Reality and Intelligent System (VRIS 2021)--Ei Compendex, Scopus;Aug 18, 2021 - Aug 20, 2021;Kunming, China;Mar 25, 2021;25/03/2021;942;2021-03-25
104;1027;VALID 2021;The Thirteenth International Conference on Advances in System Testing and Validation Lifecycle;Oct 3, 2021 - Oct 7, 2021;Barcelona, Spain;Jul 5, 2021;5/07/2021;943;2021-07-05
104;1027;ICSRS--Scopus & EI Compendex 2021;2021 5th International Conference on System Reliability and Safety (ICSRS 2021)--Scopus & EI Compendex;Nov 24, 2021 - Nov 26, 2021;Palermo, Italy;Jul 5, 2021;5/07/2021;944;2021-07-05
104;1027;DSD 2021;Euromicro Conference on Digital System Design (DSD) 2021;Sep 6, 2021 - Sep 8, 2021;Palermo, Sicily, Italy;Apr 1, 2021;1/04/2021;945;2021-04-01
104;1027;MODELS 2021;ACM/IEEE 24th International Conference on Model Driven Engineering Languages and Systems;Oct 10, 2021 - Oct 15, 2021;Fukuoka, Japan;May 7, 2021 (Apr 30, 2021);7/05/2021;946;2021-05-07
104;1027;CODES + ISSS 2021;International Conference on Hardware/Software Codesign and System Synthesis;Oct 10, 2021 - Oct 15, 2021;virtual?;Apr 9, 2021 (Apr 2, 2021);9/04/2021;947;2021-04-09
104;1027;ICSRS--Scopus & EI 2021;2021 5th International Conference on System Reliability and Safety (ICSRS 2021)--Scopus & EI Compendex;Nov 24, 2021 - Nov 26, 2021;Palermo, Italy;Jul 5, 2021;5/07/2021;948;2021-07-05
104;1027;Spec.Issue on Social Informatics: Scopus 2021;Journal of Social and Business Informatics - Acta Informatica Pragensia;N/A;N/A;Jul 31, 2021;31/07/2021;949;2021-07-31
104;1027;ICSEA 2021;The Sixteenth International Conference on Software Engineering Advances;Oct 3, 2021 - Oct 7, 2021;Barcelona, Spain;Jul 5, 2021;5/07/2021;950;2021-07-05
104;1027;EuroSTAR Conference 2021;29th EuroSTAR Software Testing & Quality Conference;Sep 28, 2021 - Sep 30, 2021;In-Person & Online;Feb 7, 2021;7/02/2021;951;2021-02-07
104;1027;ICNISC 2021;7th Annual International Conference on Network and Information Systems for Computers;Jul 23, 2021 - Jul 25, 2021;Guiyang;Jul 19, 2021;19/07/2021;952;2021-07-19
104;1027;SIMUL 2021;The Thirteenth International Conference on Advances in System Simulation;Oct 3, 2021 - Oct 7, 2021;Barcelona, Spain;Jul 5, 2021;5/07/2021;953;2021-07-05
104;1027;MDPI - Risk Management - Scopus 2021;Special Issue of Journal Applied System Innovation: Risk Management;N/A;N/A;Jul 31, 2021;31/07/2021;954;2021-07-31
104;1027;ICTS 2021;The 13th International Conference on Information & Communication Technology and System;Oct 20, 2021 - Oct 21, 2021;Virtual conference;Jul 8, 2021;8/07/2021;955;2021-07-08
104;1027;CIMSS 2021;International Workshop on Critical Infrastructure and Manufacturing System Security;Jun 21, 2021 - Jun 24, 2021;Kamakura, Japan;Mar 20, 2021;20/03/2021;956;2021-03-20
104;1027;CSIA 2021;12th International Conference on Communications Security & Information Assurance;Nov 20, 2021 - Nov 21, 2021;Zurich, Switzerland;Mar 6, 2021;6/03/2021;957;2021-03-06
104;1027;SOEN 2021;6th International Conference on Software Engineering;May 29, 2021 - May 30, 2021;Vancouver, Canada;Feb 20, 2021;20/02/2021;958;2021-02-20
104;1027;CP 2021;Twenty-Seventh Conference on Principles and Practice of Constraint Programming;Oct 25, 2021 - Oct 29, 2021;Montpellier (France);Jun 21, 2021 (May 14, 2021);21/06/2021;959;2021-06-21
104;1027;CP 2021;International Conference on Principles and Practice of Constraint Programming;Oct 25, 2021 - Oct 29, 2021;Montpellier;May 14, 2021;14/05/2021;960;2021-05-14
104;1027;MODELS 2021;ACM/IEEE 24th International Conference on Model Driven Engineering Languages and Systems;Oct 10, 2021 - Oct 15, 2021;Fukuoka, Japan;May 7, 2021 (Apr 30, 2021);7/05/2021;961;2021-05-07
104;1027;FDL 2021;24th IEEE Forum on specification & Design Languages;Sep 8, 2021 - Sep 10, 2021;Antibes (France);May 24, 2021 (May 17, 2021);24/05/2021;962;2021-05-24
104;1027;TASE 2021;The 15th International Symposium on Theoretical Aspects of Software Engineering;Aug 25, 2021 - Aug 27, 2021;Shanghai;Mar 7, 2021 (Feb 28, 2021);7/03/2021;963;2021-03-07
104;1027;JSS SI on Test Automation 2021;Special Issue on “Test Automation: Trends, Benefits, and Costs” - Journal of Systems and Software (Elsevier);N/A;N/A;Mar 31, 2021;31/03/2021;964;2021-03-31
104;1027;PSGEC-IEEE 2021;2021 Power System And Green Energy Conference ( PSGEC 2021);Aug 20, 2021 - Aug 22, 2021;Shanghai, China;Mar 20, 2021;20/03/2021;965;2021-03-20
104;1027;SOFE 2021;7th International Conference on Software Engineering;Mar 20, 2021 - Mar 21, 2021;Vienna, Austria;Feb 20, 2021;20/02/2021;966;2021-02-20
104;1027;SIGPRO 2021;International Conference on Data Science and Cloud Computing;Sep 18, 2021 - Sep 19, 2021;Copenhagen, Denmark;Feb 20, 2021;20/02/2021;967;2021-02-20
104;1027;E-Mobility Integration Symposium 2021;5th E-Mobility Power System Integration Symposium;Sep 27, 2021 - Sep 27, 2021;Virtual/Germany;May 1, 2021;1/05/2021;968;2021-05-01
104;1027;Wind Integration Workshop 2021;20th International Workshop on Large-scale Integration of Wind Power into Power Systems as well as on Transmission Networks for Offshore Wind Power Plants;Sep 29, 2021 - Oct 1, 2021;Virtual/Germany;May 1, 2021;1/05/2021;969;2021-05-01
104;1027;WoRMS 2021;3rd International Workshop on Reading Music Systems;Jul 23, 2021 - Jul 23, 2021;Alicante, Spain;Apr 23, 2021;23/04/2021;970;2021-04-23
104;1027;ICMSC--Springer, Scopus 2021;Springer--2021 The 5th International Conference on Mechanical, System and Control Engineering (ICMSC 2021)--IOP, Scopus;May 28, 2021 - May 30, 2021;Kazan, Russian Federation;Mar 20, 2021;20/03/2021;971;2021-03-20
104;1027;VRIS--SCOPUS, Ei 2021;2021 3rd International Conference on Virtual Reality and Intelligent System (VRIS 2021)--Ei Compendex, Scopus;Aug 18, 2021 - Aug 20, 2021;Kunming, China;Mar 25, 2021;25/03/2021;972;2021-03-25
104;1027;MLDS 2021;2nd International Conference on Machine Learning Techniques and Data Science;Nov 20, 2021 - Nov 21, 2021;Zurich, Switzerland;Mar 6, 2021;6/03/2021;973;2021-03-06
104;1027;IEEE-PSGEC 2021;2021 Power System And Green Energy Conference ( PSGEC 2021);Aug 20, 2021 - Aug 22, 2021;Shanghai, China;Mar 20, 2021;20/03/2021;974;2021-03-20
104;1027;AIP Journal - Indexed in Scopus 2021;Journal of Social and Business Informatics - Acta Informatica Pragensia;N/A;N/A;Mar 31, 2021;31/03/2021;975;2021-03-31
104;1027;SE 2021;9th International Conference on Software Engineering & Trends;Jul 10, 2021 - Jul 11, 2021;Toronto, Canada;Feb 20, 2021;20/02/2021;976;2021-02-20
104;1027;SEC 2021;7th International Conference on Software Engineering;Mar 27, 2021 - Mar 28, 2021;Sydney, Australia;Feb 20, 2021;20/02/2021;977;2021-02-20
104;1027;CAIML 2021;2nd International Conference on Artificial Intelligence and Machine Learning;Jun 26, 2021 - Jun 27, 2021;Sydney, Australia;Feb 27, 2021;27/02/2021;978;2021-02-27
104;1027;DaMi 2021;7th International Conference on Data Mining;Apr 24, 2021 - Apr 25, 2021;Copenhagen, Denmark;Feb 20, 2021;20/02/2021;979;2021-02-20
104;1027;ICSTCC 2021;25th International Conference on System Theory, Control and Computing;Oct 20, 2021 - Oct 23, 2021;Iasi, Romania;Apr 30, 2021;30/04/2021;980;2021-04-30
104;1027;IEEE--ICCSS--Ei Compendex, Scopus 2021;IEEE--2021 4th International Conference on Circuits, Systems and Simulation (ICCSS 2021)--Ei Compendex, Scopus;May 26, 2021 - May 28, 2021;Kuala Lumpur, Malaysia;Mar 20, 2021;20/03/2021;981;2021-03-20
104;1027;SCOPUS-SAASE 2021;5th International Symposium on Aviation and Aerospace System Engineering (SAASE 2021);May 14, 2021 - May 16, 2021;Beijing, China;Mar 10, 2021;10/03/2021;982;2021-03-10
104;1027;VRIS--SCOPUS, Ei Compendex 2021;2021 3rd International Conference on Virtual Reality and Intelligent System (VRIS 2021)--Ei Compendex, Scopus;Aug 18, 2021 - Aug 20, 2021;Kunming, China;Mar 25, 2021;25/03/2021;983;2021-03-25
104;1027;ICMSR--Ei Compendex, Scopus 2021;2021 the 7th International Conference on Mechatronics System and Robots (ICMSR 2021)--Ei Compendex, Scopus;Apr 21, 2021 - Apr 23, 2021;Hong Kong;Mar 10, 2021;10/03/2021;984;2021-03-10
104;1027;ICMSR--Ei, Scopus 2021;2021 the 7th International Conference on Mechatronics System and Robots (ICMSR 2021)--Ei Compendex, Scopus;Apr 21, 2021 - Apr 23, 2021;Hong Kong;Mar 10, 2021;10/03/2021;985;2021-03-10
104;1027;IEEE ADAITC 2021;2021 IEEE Autonomous Driving AI Test Challenge;Aug 23, 2021 - Aug 26, 2021;Online;Mar 15, 2021;15/03/2021;986;2021-03-15
104;1027;ASOFT 2021;2nd International Conference on Advances in Software Engineering;Sep 18, 2021 - Sep 19, 2021;Copenhagen, Denmark;Feb 20, 2021;20/02/2021;987;2021-02-20
104;1027;IJSEA 2021;International Journal of Software Engineering & Applications -ERA Indexed;N/A;N/A;Feb 20, 2021;20/02/2021;988;2021-02-20
104;1027;VSC @IEEE WETICE 2021;Track on Validating Software for Critical Systems (VSC) @IEEE WETICE 2021;Jun 23, 2021 - Jun 25, 2021;Basque Coast - Bayonne, France;Feb 28, 2021;28/02/2021;989;2021-02-28
104;1027;ICCSS--IEEE, Ei and Scopus 2021;IEEE--2021 4th International Conference on Circuits, Systems and Simulation (ICCSS 2021)--Ei Compendex, Scopus;May 26, 2021 - May 28, 2021;Kuala Lumpur, Malaysia;Mar 20, 2021;20/03/2021;990;2021-03-20
104;1027;ICCSA 2021;The 2nd International Conference on Computer Science's Complex Systems and their Applications;May 25, 2021 - May 26, 2021;Oum El Bouahi - Algeria;Mar 15, 2021;15/03/2021;991;2021-03-15
104;1027;SEMIT 2021;2nd International Conference on Software Engineering and Managing Information Technology;Nov 20, 2021 - Nov 21, 2021;Zurich, Switzerland;Mar 6, 2021;6/03/2021;992;2021-03-06
104;1027;DMDBS 2021;7th International Conference on Data Mining and Database Management Systems;Nov 27, 2021 - Nov 28, 2021;London, United Kingdom;Feb 27, 2021;27/02/2021;993;2021-02-27
104;1028;PACT 2021;The 30th International Conference on Parallel Architectures and Compilation Techniques;Sep 26, 2021 - Sep 29, 2021;Virtual Conference;Apr 19, 2021 (Apr 15, 2021);19/04/2021;994;2021-04-19
104;1028;ICSRS--Scopus & EI Compendex 2021;2021 5th International Conference on System Reliability and Safety (ICSRS 2021)--Scopus & EI Compendex;Nov 24, 2021 - Nov 26, 2021;Palermo, Italy;Jul 5, 2021;5/07/2021;995;2021-07-05
104;1028;ASAP 2021;IEEE International Conference on Application-specific Systems, Architectures and Processors;Jul 7, 2021 - Jul 9, 2021;Virtual;Apr 5, 2021 (Mar 29, 2021);5/04/2021;996;2021-04-05
104;1028;SPAA 2021;33th ACM Symposium on Parallelism in Algorithms and Architectures;Jul 6, 2021 - Jul 8, 2021;Philadelphia, PA, USA;Feb 11, 2021 (Feb 8, 2021);11/02/2021;997;2021-02-11
104;1028;CLUSTER 2021;23rd IEEE Cluster Conference;Sep 7, 2021 - Sep 10, 2021;Portland, Oregon, USA;May 17, 2021 (May 10, 2021);17/05/2021;998;2021-05-17
104;1028;PARMA-DITAM 2021;PARMA-DITAM: 12th Workshop on Parallel Programming and Run-Time Management Techniques for Many-core Architectures & 10th Workshop on Design Tools and Architectures for Multi-Core;Jan 19, 2021 - Jan 19, 2021;Virtual;Nov 13, 2021;13/11/2021;999;2021-11-13
104;1028;SI-RFIC-EWS 2021;Special Issue of Low Power RFIC Architectures for Emerging Wireless Standards, Electronics (MDPI);N/A;N/A;Dec 31, 2021;31/12/2021;1000;2021-12-31
104;1028;DSD 2021;Euromicro Conference on Digital System Design (DSD) 2021;Sep 6, 2021 - Sep 8, 2021;Palermo, Sicily, Italy;Apr 1, 2021;1/04/2021;1001;2021-04-01
104;1028;NetIIoT 2021;State-of-Art of Network Architectures and Protocols for Industrial IoT;N/A;N/A;Sep 20, 2021;20/09/2021;1002;2021-09-20
104;1028;MODELS 2021;ACM/IEEE 24th International Conference on Model Driven Engineering Languages and Systems;Oct 10, 2021 - Oct 15, 2021;Fukuoka, Japan;May 7, 2021 (Apr 30, 2021);7/05/2021;1003;2021-05-07
104;1028;CODES + ISSS 2021;International Conference on Hardware/Software Codesign and System Synthesis;Oct 10, 2021 - Oct 15, 2021;virtual?;Apr 9, 2021 (Apr 2, 2021);9/04/2021;1004;2021-04-09
104;1028;ICSRS--Scopus & EI 2021;2021 5th International Conference on System Reliability and Safety (ICSRS 2021)--Scopus & EI Compendex;Nov 24, 2021 - Nov 26, 2021;Palermo, Italy;Jul 5, 2021;5/07/2021;1005;2021-07-05
104;1028;Spec.Issue on Social Informatics: Scopus 2021;Journal of Social and Business Informatics - Acta Informatica Pragensia;N/A;N/A;Jul 31, 2021;31/07/2021;1006;2021-07-31
104;1028;VALID 2021;The Thirteenth International Conference on Advances in System Testing and Validation Lifecycle;Oct 3, 2021 - Oct 7, 2021;Barcelona, Spain;Jul 5, 2021;5/07/2021;1007;2021-07-05
104;1028;ICNISC 2021;7th Annual International Conference on Network and Information Systems for Computers;Jul 23, 2021 - Jul 25, 2021;Guiyang;Jul 19, 2021;19/07/2021;1008;2021-07-19
104;1028;SIMUL 2021;The Thirteenth International Conference on Advances in System Simulation;Oct 3, 2021 - Oct 7, 2021;Barcelona, Spain;Jul 5, 2021;5/07/2021;1009;2021-07-05
104;1028;MDPI - Risk Management - Scopus 2021;Special Issue of Journal Applied System Innovation: Risk Management;N/A;N/A;Jul 31, 2021;31/07/2021;1010;2021-07-31
104;1028;ICTS 2021;The 13th International Conference on Information & Communication Technology and System;Oct 20, 2021 - Oct 21, 2021;Virtual conference;Jul 8, 2021;8/07/2021;1011;2021-07-08
104;1028;BlockArch 2021;Second Workshop on Blockchain-Based Software Architectures (BlockArch 2021);Mar 22, 2021 - Mar 26, 2021;STUTTGART, GERMANY (Remote);Jan 20, 2021;20/01/2021;1012;2021-01-20
104;1028;CIMSS 2021;International Workshop on Critical Infrastructure and Manufacturing System Security;Jun 21, 2021 - Jun 24, 2021;Kamakura, Japan;Mar 20, 2021;20/03/2021;1013;2021-03-20
104;1028;MODELS 2021;ACM/IEEE 24th International Conference on Model Driven Engineering Languages and Systems;Oct 10, 2021 - Oct 15, 2021;Fukuoka, Japan;May 7, 2021 (Apr 30, 2021);7/05/2021;1014;2021-05-07
104;1028;FDL 2021;24th IEEE Forum on specification & Design Languages;Sep 8, 2021 - Sep 10, 2021;Antibes (France);May 24, 2021 (May 17, 2021);24/05/2021;1015;2021-05-24
104;1028;CASES 2021;International Conference on Compilers, Architectures, and Synthesis for Embedded Systems;Oct 10, 2021 - Oct 15, 2021;Virtual Conference;Apr 9, 2021 (Apr 2, 2021);9/04/2021;1016;2021-04-09
104;1028;PSGEC-IEEE 2021;2021 Power System And Green Energy Conference ( PSGEC 2021);Aug 20, 2021 - Aug 22, 2021;Shanghai, China;Mar 20, 2021;20/03/2021;1017;2021-03-20
104;1028;IJGCA 2021;International Journal of Grid Computing & Applications;N/A;N/A;Feb 20, 2021;20/02/2021;1018;2021-02-20
104;1028;E-Mobility Integration Symposium 2021;5th E-Mobility Power System Integration Symposium;Sep 27, 2021 - Sep 27, 2021;Virtual/Germany;May 1, 2021;1/05/2021;1019;2021-05-01
104;1028;Wind Integration Workshop 2021;20th International Workshop on Large-scale Integration of Wind Power into Power Systems as well as on Transmission Networks for Offshore Wind Power Plants;Sep 29, 2021 - Oct 1, 2021;Virtual/Germany;May 1, 2021;1/05/2021;1020;2021-05-01
104;1028;WoRMS 2021;3rd International Workshop on Reading Music Systems;Jul 23, 2021 - Jul 23, 2021;Alicante, Spain;Apr 23, 2021;23/04/2021;1021;2021-04-23
104;1028;ICMSC--Springer, Scopus 2021;Springer--2021 The 5th International Conference on Mechanical, System and Control Engineering (ICMSC 2021)--IOP, Scopus;May 28, 2021 - May 30, 2021;Kazan, Russian Federation;Mar 20, 2021;20/03/2021;1022;2021-03-20
104;1028;VRIS--SCOPUS, Ei 2021;2021 3rd International Conference on Virtual Reality and Intelligent System (VRIS 2021)--Ei Compendex, Scopus;Aug 18, 2021 - Aug 20, 2021;Kunming, China;Mar 25, 2021;25/03/2021;1023;2021-03-25
104;1028;IEEE-PSGEC 2021;2021 Power System And Green Energy Conference ( PSGEC 2021);Aug 20, 2021 - Aug 22, 2021;Shanghai, China;Mar 20, 2021;20/03/2021;1024;2021-03-20
104;1028;AIP Journal - Indexed in Scopus 2021;Journal of Social and Business Informatics - Acta Informatica Pragensia;N/A;N/A;Mar 31, 2021;31/03/2021;1025;2021-03-31
104;1028;CogArch 2021;Fifth Workshop on Cognitive Architectures;Feb 28, 2021 - Feb 28, 2021;Virtual;Jan 22, 2021;22/01/2021;1026;2021-01-22
104;1028;ICSTCC 2021;25th International Conference on System Theory, Control and Computing;Oct 20, 2021 - Oct 23, 2021;Iasi, Romania;Apr 30, 2021;30/04/2021;1027;2021-04-30
104;1028;IEEE--ICCSS--Ei Compendex, Scopus 2021;IEEE--2021 4th International Conference on Circuits, Systems and Simulation (ICCSS 2021)--Ei Compendex, Scopus;May 26, 2021 - May 28, 2021;Kuala Lumpur, Malaysia;Mar 20, 2021;20/03/2021;1028;2021-03-20
104;1028;SCOPUS-SAASE 2021;5th International Symposium on Aviation and Aerospace System Engineering (SAASE 2021);May 14, 2021 - May 16, 2021;Beijing, China;Mar 10, 2021;10/03/2021;1029;2021-03-10
104;1028;VRIS--SCOPUS, Ei Compendex 2021;2021 3rd International Conference on Virtual Reality and Intelligent System (VRIS 2021)--Ei Compendex, Scopus;Aug 18, 2021 - Aug 20, 2021;Kunming, China;Mar 25, 2021;25/03/2021;1030;2021-03-25
104;1028;ICMSR--Ei Compendex, Scopus 2021;2021 the 7th International Conference on Mechatronics System and Robots (ICMSR 2021)--Ei Compendex, Scopus;Apr 21, 2021 - Apr 23, 2021;Hong Kong;Mar 10, 2021;10/03/2021;1031;2021-03-10
104;1028;ICMSR--Ei, Scopus 2021;2021 the 7th International Conference on Mechatronics System and Robots (ICMSR 2021)--Ei Compendex, Scopus;Apr 21, 2021 - Apr 23, 2021;Hong Kong;Mar 10, 2021;10/03/2021;1032;2021-03-10
104;1028;SAMOS XXI 2021;21st International Conference on embedded computer Systems: Architectures, MOdeling and Simulation;Jul 4, 2021 - Jul 8, 2021;SAMOS, Greece;Mar 5, 2021;5/03/2021;1033;2021-03-05
104;1028;ICCSS--IEEE, Ei and Scopus 2021;IEEE--2021 4th International Conference on Circuits, Systems and Simulation (ICCSS 2021)--Ei Compendex, Scopus;May 26, 2021 - May 28, 2021;Kuala Lumpur, Malaysia;Mar 20, 2021;20/03/2021;1034;2021-03-20
104;1028;ICCSA 2021;The 2nd International Conference on Computer Science's Complex Systems and their Applications;May 25, 2021 - May 26, 2021;Oum El Bouahi - Algeria;Mar 15, 2021;15/03/2021;1035;2021-03-15
104;1028;IJGTT 2021;International Journal of Game Theory and Technology;N/A;N/A;Feb 20, 2021;20/02/2021;1036;2021-02-20
104;1028;AROSA@WETICE 2021;AROSA@WETICE 2021 : Adaptive and Reconfigurable Systems and Architectures;Jun 23, 2021 - Jun 25, 2021;Basque Coast - Bayonne, France;Feb 28, 2021;28/02/2021;1037;2021-02-28
104;1028;FlexNGIA 2021;1st IFIP/IEEE International workshop on Fully-Flexible Internet Architectures and Protocols for the Next-Generation Internet;May 17, 2021 - May 21, 2021;Bordeaux, France;Jan 29, 2021;29/01/2021;1038;2021-01-29
104;1028;GSAW CFP 2021;2021 Ground System Architectures Workshop Call for Participation;Mar 1, 2021 - Mar 5, 2021;Los Angeles, CA USA;Oct 22, 2020;22/10/2020;1039;2020-10-22
104;1028;HPC Asia 2021;International Conference on High Performance Computing in Asia-Pacific Region;Jan 20, 2021 - Jan 22, 2021;Jeju, S. Korea;Aug 28, 2020 (Aug 21, 2020);28/08/2020;1040;2020-08-28
104;1028;IEICE_ED_SI 2021;Special Section on the Architectures, Protocols, and Applications for the Future Internet;N/A;N/A;Aug 21, 2020;21/08/2020;1041;2020-08-21
104;1028;HiPEAC 2021;16th International Conference on High-Performance Embedded Architectures and Compilers;Jan 18, 2021 - Jan 20, 2021;Virtual;TBD;NULL;1042;NULL
105;1029;OID 2021;Open Identity Summit 2021;Jun 1, 2021 - Jun 2, 2021;Copenhagen, Denmark;Mar 1, 2021;1/03/2021;1043;2021-03-01
105;1029;17th ICTEL Rome 2021;17th ICTEL 2021 – International Conference on Teaching, Education & Learning, 06-07 September, Rome;Sep 6, 2021 - Sep 7, 2021;University of Washington – Rome Center (;Sep 6, 2021 (Sep 5, 2021);6/09/2021;1044;2021-09-06
105;1029;TERA - Eurasia Research 2021;19th ICTEL 2021 – International Conference on Teaching, Education & Learning, 11-12 October, Lisbon;Oct 11, 2021 - Oct 12, 2021;Universidade Autónoma de Lisboa (UAL), L;Oct 10, 2021;10/10/2021;1045;2021-10-10
105;1029;20th ICTEL October, Dubai 2021;20th ICTEL 2021 – International Conference on Teaching, Education & Learning, 23-24 October, Dubai;Oct 23, 2021 - Oct 24, 2021;Flora Creek, Deira, Dubai, UAE;Oct 22, 2021;22/10/2021;1046;2021-10-22
105;1029;TERA - Eurasia Research 2021;15th ICTEL 2021 – International Conference on Teaching, Education & Learning, 06-07 September, London;Sep 6, 2021 - Sep 5, 2021;The Tomlinson Centre, Queensbridge Road,;Sep 4, 2021;4/09/2021;1047;2021-09-04
105;1029;13th ICTEL August, Amsterdam 2021;13th ICTEL 2021 – International Conference on Teaching, Education & Learning, 02-03 August, Amsterdam;Aug 2, 2021 - Aug 3, 2021;NH Hotel Amsterdam-Zuid, Van Leijenbergh;Aug 1, 2021;1/08/2021;1048;2021-08-01
105;1029;PARMA-DITAM 2021;PARMA-DITAM: 12th Workshop on Parallel Programming and Run-Time Management Techniques for Many-core Architectures & 10th Workshop on Design Tools and Architectures for Multi-Core;Jan 19, 2021 - Jan 19, 2021;Virtual;Nov 13, 2021;13/11/2021;1049;2021-11-13
105;1029;16th ICTEL Sept, Athens 2021;16th ICTEL 2021 – International Conference on Teaching, Education & Learning, 14-15 September, Athens;Sep 14, 2021 - Sep 15, 2021;Novotel Athenes, Michail Voda 4, Athens,;Sep 13, 2021;13/09/2021;1050;2021-09-13
105;1029;KMIS 2021;13th International Conference on Knowledge Management and Information Systems;Oct 25, 2021 - Oct 27, 2021;Valletta, Malta;May 18, 2021;18/05/2021;1051;2021-05-18
105;1029;ICPM 2021;3rd International Conference on Process Mining;Oct 31, 2021 - Nov 4, 2021;Eindhoven;Jul 1, 2021 (Jun 15, 2021);1/07/2021;1052;2021-07-01
105;1029;IC3K 2021;13th International Joint Conference on Knowledge Discovery, Knowledge Engineering and Knowledge Management;Oct 25, 2021 - Oct 27, 2021;Valletta, Malta;May 18, 2021;18/05/2021;1053;2021-05-18
105;1029;Scopus-ICDPR 2022;The 6th International Conference on Data Processing and Robotics (ICDPR 2022);Jan 6, 2022 - Jan 8, 2022;Hokkaido, Japan;Jul 5, 2021;5/07/2021;1054;2021-07-05
105;1029;MDPI - Risk Management - Scopus 2021;Special Issue of Journal Applied System Innovation: Risk Management;N/A;N/A;Jul 31, 2021;31/07/2021;1055;2021-07-31
105;1029;ICT-DM 2021;The 7th International Conference on Information and Communication Technologies for Disaster Management;Dec 3, 2021 - Dec 5, 2021;Hangzhou, China;Jun 20, 2021 (Jun 15, 2021);20/06/2021;1056;2021-06-20
105;1029;BDSIC--EI, Scopus 2021;2021 3rd International Conference on Big-data Service and Intelligent Computation (BDSIC 2021)--Ei Compendex, Scopus;Nov 19, 2021 - Nov 21, 2021;HuaQiao University, Xiamen?China;Jul 5, 2021;5/07/2021;1057;2021-07-05
105;1029;Scopus-WSM 2021;The 3rd International Conference on Water Security and Management ( WSM 2021);Dec 9, 2021 - Dec 11, 2021;Tokyo, Japan;Jun 10, 2021;10/06/2021;1058;2021-06-10
105;1029;MEDES 2021;The 13th International ACM Conference on Management of Digital EcoSystems;Nov 1, 2021 - Nov 3, 2021;Hammamet - Tunisia;May 24, 2021;24/05/2021;1059;2021-05-24
105;1029;SKM 2021;International Conference on Secure Knowledge Management;Oct 8, 2021 - Oct 9, 2021;San Antonio;Jun 21, 2021;21/06/2021;1060;2021-06-21
105;1029;WSM-Scopus 2021;The 3rd International Conference on Water Security and Management ( WSM 2021);Dec 9, 2021 - Dec 11, 2021;Tokyo, Japan;Jun 10, 2021;10/06/2021;1061;2021-06-10
105;1029;EAI BODYNETS 2021;16th EAI International Conference on Body Area Networks: Smart IoT and big data for intelligent health management (Springer, Scopus, ISI, Ei, more);Oct 25, 2021 - Oct 26, 2021;Glasgow, Great Britain;May 13, 2021;13/05/2021;1062;2021-05-13
105;1029;CHIRA 2021;5th International Conference on Computer-Human Interaction Research and Applications;Oct 28, 2021 - Oct 29, 2021;Valletta, Malta;May 18, 2021;18/05/2021;1063;2021-05-18
105;1029;ICENT--EI, Scopus 2021;2021 3rd International Conference on Emerging Networks Technologies (ICENT 2021)--Ei Compendex, Scopus;Sep 22, 2021 - Sep 24, 2021;Okinawa, Japan;May 10, 2021;10/05/2021;1064;2021-05-10
105;1029;ICENT--EI Compendex, Scopus 2021;2021 3rd International Conference on Emerging Networks Technologies (ICENT 2021)--Ei Compendex, Scopus;Sep 22, 2021 - Sep 24, 2021;Okinawa, Japan;May 10, 2021;10/05/2021;1065;2021-05-10
105;1029;Matthew Arnold 2021;Culture and Anarchy. Reading Matthew Arnold Today 2;Apr 12, 2021 - Apr 13, 2021;Porto;Mar 5, 2021 (Mar 31, 2021);5/03/2021;1066;2021-03-05
105;1029;BSHDS 2021;4th International Conference on Business Sustainability, Human Resource Development and Social Responsibility;Jun 19, 2021 - Jun 20, 2021;Hotel Mystays Ochanomizu Conf Center;Jun 9, 2021;9/06/2021;1067;2021-06-09
105;1029;ICCPM 2021;2021 12th International Conference on Construction and Project Management (ICCPM 2021);Sep 27, 2021 - Sep 29, 2021;Macau, China;May 10, 2021;10/05/2021;1068;2021-05-10
105;1029;IEEE ICICSP--EI, Scopus 2021;2021 4th IEEE International Conference on Information Communication and Signal Processing (ICICSP 2021)--Ei Compendex, Scopus;Sep 24, 2021 - Sep 26, 2021;Shanghai, China;May 10, 2021;10/05/2021;1069;2021-05-10
105;1029;KEAS 2021;4th International Conference on Knowledge Economy, Artificial Intelligence & Social Sciences;May 22, 2021 - May 23, 2021;Hotel Mystays Ochanomizu Conf Center;May 12, 2021;12/05/2021;1070;2021-05-12
105;1029;SPBP 2021;The Fourth Workshop on Security and Privacy-enhanced Business Process Management;Sep 6, 2021 - Sep 6, 2021;Rome, Italy;May 24, 2021;24/05/2021;1071;2021-05-24
105;1029;CCIOT--ACM, EI Compendex, Scopus 2021;ACM--2021 6th International Conference on Cloud Computing and Internet of Things (CCIOT 2021)--Ei Compendex, Scopus;Sep 22, 2021 - Sep 24, 2021;Okinawa, Japan;May 10, 2021;10/05/2021;1072;2021-05-10
105;1029;MEDES 2021;The 13th International Conference on Management of Digital EcoSystems;Nov 1, 2021 - Nov 3, 2021;Hammamet - Tunisia;May 24, 2021;24/05/2021;1073;2021-05-24
105;1029;BPMS2 2021;14th Workshop on Social and Human Aspects of Business Process Management;Sep 6, 2021 - Sep 6, 2021;Rome, Italy;May 24, 2021;24/05/2021;1074;2021-05-24
105;1029;DREAMS-ONLINE 2021;4th DREAMS, PHANTASMS AND MEMORIES - International Interdisciplinary Conference ONLINE;Sep 28, 2020 - Sep 29, 2020;ONLINE;Sep 12, 2020;12/09/2020;1075;2020-09-12
105;1030;EI-CFAIS 2021;2021 International Conference on Frontiers of Artificial Intelligence and Statistics (CFAIS 2021);Dec 1, 2021 - Dec 3, 2021;Beijing, China;Oct 30, 2021;30/10/2021;1076;2021-10-30
105;1030;4th Rome ICSSH 2021;4th Rome – International Conference on Social Science & Humanities (ICSSH), 07-08 September 2021;Sep 7, 2021 - Sep 8, 2021;University of Washington – Rome Center (;Sep 5, 2021;5/09/2021;1077;2021-09-05
105;1030;6th London ICSSH September 2021;6th London – International Conference on Social Science & Humanities (ICSSH), 07-08 September 2021;Sep 7, 2021 - Sep 8, 2021;The Tomlinson Centre, Queensbridge Road,;Sep 6, 2021;6/09/2021;1078;2021-09-06
105;1030;2nd Amsterdam, ICSSH August 2021;2nd Amsterdam – International Conference on Social Science & Humanities (ICSSH), 03-04 August 2021;Aug 3, 2021 - Aug 4, 2021;NH Hotel Amsterdam-Zuid, Van Leijenbergh;Aug 2, 2021;2/08/2021;1079;2021-08-02
105;1030;SSHRA - Eurasia Research 2021;3rd Paris – International Conference on Social Science & Humanities (ICSSH), 26-27 November 2021;Nov 26, 2021 - Nov 27, 2021;FormaSquare-Docks de Paris, Paris, Franc;Nov 24, 2021;24/11/2021;1080;2021-11-24
105;1030;AIKE 2021;IEEE Artificial Intelligence & Knowledge Engineering 2021;Dec 1, 2021 - Dec 3, 2021;Laguna Hills, CA;Sep 15, 2021;15/09/2021;1081;2021-09-15
105;1030;ICRE--EI Compendex, Scopus 2021;2021 5th International Conference on Reliability Engineering (ICRE 2021)--EI Compendex, Scopus;Nov 24, 2021 - Nov 26, 2021;Palermo, Italy;Jul 5, 2021;5/07/2021;1082;2021-07-05
105;1030;SSHRA - Eurasia Research 2021;3rd Lisbon – International Conference on Social Science & Humanities (ICSSH), 12-13 October 2021;Oct 12, 2021 - Oct 13, 2021;Universidade Autónoma de Lisboa (UAL), L;Oct 11, 2021;11/10/2021;1083;2021-10-11
105;1030;3rd Athens ICSSH Sept 2021;3rd Athens – International Conference on Social Science & Humanities (ICSSH), 15-16 September 2021;Sep 15, 2021 - Sep 16, 2021;Novotel Athenes, Michail Voda 4, Athens,;Sep 14, 2021;14/09/2021;1084;2021-09-14
105;1030;ICSRS--Scopus & EI Compendex 2021;2021 5th International Conference on System Reliability and Safety (ICSRS 2021)--Scopus & EI Compendex;Nov 24, 2021 - Nov 26, 2021;Palermo, Italy;Jul 5, 2021;5/07/2021;1085;2021-07-05
105;1030;SSHRA - Eurasia Research 2021;8th Dubai – International Conference on Social Science & Humanities (ICSSH), 24-25 October 2021;Oct 24, 2021 - Oct 25, 2021;Flora Creek, Deira, Dubai, UAE;Oct 23, 2021;23/10/2021;1086;2021-10-23
105;1030;ICPE 2021;International Conference on Performance Engineering;Apr 19, 2021 - Apr 23, 2021;Rennes, France;Oct 23, 2021 (Oct 16, 2021);23/10/2021;1087;2021-10-23
105;1030;Spec.Issue on Social Informatics: Scopus 2021;Journal of Social and Business Informatics - Acta Informatica Pragensia;N/A;N/A;Jul 31, 2021;31/07/2021;1088;2021-07-31
105;1030;ICCAEE 2021;2021 4th International Conference on Civil, Architectural and Environmental Engineering(ICCAEE 2021);Dec 10, 2021 - Dec 12, 2021;Shanghai, China;Oct 31, 2021;31/10/2021;1089;2021-10-31
105;1030;EI-WBDC 2021;2021 3rd International Workshop on Big Data and Computing(WBDC 2021);Dec 3, 2021 - Dec 5, 2021;Beijing, China;Oct 31, 2021;31/10/2021;1090;2021-10-31
105;1030;SA-TTA 2021;The 9th track on Software Architecture: Theory, Technology, and Applications (SA-TTA) at the 36th ACM/SIGAPP Symposium On Applied Computing (SAC 2021);Mar 22, 2021 - Mar 26, 2021;Gwangju, Korea;Oct 28, 2021;28/10/2021;1091;2021-10-28
105;1030;SOFSEM 2021;47th International Conference on Current Trends in Theory and Practice of Computer Science;Jan 25, 2021 - Jan 28, 2021;Bozen-Bolzano, Italy;Aug 3, 2021 (Jul 27, 2021);3/08/2021;1092;2021-08-03
105;1030;Frontiers - Human-Media Interaction 2021;Frontiers Research Topic on Computational Commensality;N/A;N/A;Nov 30, 2021 (Mar 31, 2021);30/11/2021;1093;2021-11-30
105;1030;ISOPE 2021;31st International Ocean and Polar Engineering Conference;Jun 20, 2021 - Jun 25, 2021;Rhodes, Greece;Nov 20, 2021;20/11/2021;1094;2021-11-20
105;1030;FCSIT 2021;2021 3rd Euro-Asia Conference on Frontiers of Computer Science and Information Technology (FCSIT 2021);Dec 3, 2021 - Dec 5, 2021;Beijing, China;Oct 31, 2021;31/10/2021;1095;2021-10-31
105;1030;4th ICSTR Rome 2021;4th ICSTR Rome – International Conference on Science & Technology Research, 09-10 September 2021;Sep 9, 2021 - Sep 10, 2021;University of Washington – Rome Center (;Sep 8, 2021;8/09/2021;1096;2021-09-08
105;1030;AICCC--EI, Scopus 2021;2021 4th Artificial Intelligence and Cloud Computing Conference (AICCC 2021)--EI Compendex, Scopus;Dec 17, 2021 - Dec 19, 2021;Kyoto, Japan;Aug 5, 2021;5/08/2021;1097;2021-08-05
105;1030;NAOME 2021;2021 5th International Conference on Naval Architecture and Ocean&Marine Engineering(NAOME 2021);Dec 10, 2021 - Dec 12, 2021;Shanghai, China;Oct 31, 2021;31/10/2021;1098;2021-10-31
105;1030;ICSTTE 2021;2021 5th International Conference on SmartRail, Traffic and Transportation Engineering (ICSTTE 2021);Sep 17, 2021 - Sep 19, 2021;Frankfurt, Germany;Jul 31, 2021;31/07/2021;1099;2021-07-31
105;1030;ACE 2021;The 13th Asian Conference on Education (ACE2021);Nov 25, 2021 - Nov 28, 2021;Tokyo, Japan;Jul 1, 2021;1/07/2021;1100;2021-07-01
105;1030;IOP--PEIE--EI Compendex, Scopus 2021;IOP--2021 Internatonal Conference on Power, Energy and Industrial Engineering (PEIE 2021)--EI Compendex, Scopus;Nov 26, 2021 - Nov 28, 2021;Shenzhen, China;Jul 20, 2021;20/07/2021;1101;2021-07-20
105;1030;PEIE--IOP, EI, Scopus 2021;IOP--2021 Internatonal Conference on Power, Energy and Industrial Engineering (PEIE 2021)--EI Compendex, Scopus;Nov 26, 2021 - Nov 28, 2021;Shenzhen, China;Jul 20, 2021;20/07/2021;1102;2021-07-20
105;1030;CEVVE 2021;2021 International Conference on Electric Vehicle and Vehicle Engineering (CEVVE 2021);Sep 17, 2021 - Sep 19, 2021;Frankfurt, Germany;Jul 31, 2021;31/07/2021;1103;2021-07-31
105;1030;V MHGC Conference 2021;V International Conference Mental Health: global challenges of XXI century;Oct 21, 2021 - Oct 23, 2021;Agrigiento, Italy;Sep 15, 2021;15/09/2021;1104;2021-09-15
105;1030;ICPEE--Ei and Scopus 2021;2021 5th International Conference on Power and Energy Engineering (ICPEE 2021)--Ei Compendex, Scopus;Dec 2, 2021 - Dec 4, 2021;Xiamen, China;Aug 15, 2021;15/08/2021;1105;2021-08-15
105;1030;EI-MEAMT 2021;2021 5th International Conference on Material Engineering and Advanced Manufacturing Technology (MEAMT 2021);Oct 15, 2021 - Oct 17, 2021;Singapore;Aug 30, 2021;30/08/2021;1106;2021-08-30
105;1030;MEAMT 2021;2021 5th International Conference on Material Engineering and Advanced Manufacturing Technology (MEAMT 2021);Oct 15, 2021 - Oct 17, 2021;Singapore;Aug 30, 2021;30/08/2021;1107;2021-08-30
105;1030;ICMEIM 2021;2021 International Conference on Mechanical Engineering and Intelligent Manufacturing (ICMEIM 2021);Oct 27, 2021 - Oct 29, 2021;Sapporo, Japan;Aug 5, 2021 (Aug 30, 2021);5/08/2021;1108;2021-08-05
105;1030;CCISP-Scopus 2021;The 6th International Conference on Communication, Image and Signal Processing;Nov 19, 2021 - Nov 21, 2021;Chengdu, China;Jul 20, 2021;20/07/2021;1109;2021-07-20
105;1030;EJSD Journal 2021;European Journal of Sustainable Development;N/A;N/A;Jun 15, 2021;15/06/2021;1110;2021-06-15
105;1030;AI for People 2021;Special Issue on AI for People - AI & SOCIETY (Springer);N/A;N/A;Apr 30, 2021 (Mar 15, 2021);30/04/2021;1111;2021-04-30
105;1030;eTELEMED 2021;The Thirteenth International Conference on eHealth, Telemedicine, and Social Medicine;Jul 18, 2021 - Jul 22, 2021;Nice, France;Apr 19, 2021;19/04/2021;1112;2021-04-19
105;1030;ICRER--EI, Scopus 2021;2021 3rd International Conference on Resources and Environmental Research (ICRER 2021)--Ei Compendex, Scopus;Dec 2, 2021 - Dec 4, 2021;Xiamen, China;Aug 15, 2021;15/08/2021;1113;2021-08-15
105;1030;EI-CoEEPE 2021;2021 International Joint Conference on Energy, Electrical and Power Engineering (CoEEPE 2021);Sep 17, 2021 - Sep 19, 2021;Frankfurt, Germany;Jul 31, 2021;31/07/2021;1114;2021-07-31
105;1030;IOP--ICREC--EI Compendex, Scopus 2021;IOP--2021 the 6th International Conference on Renewable Energy and Conservation (ICREC 2021)--EI Compendex, Scopus;Nov 26, 2021 - Nov 28, 2021;Shenzhen, China;Jul 20, 2021;20/07/2021;1115;2021-07-20
105;1030;SOTICS 2021;The Eleventh International Conference on Social Media Technologies, Communication, and Informatics;Oct 3, 2021 - Oct 7, 2021;Barcelona, Spain;Jul 5, 2021;5/07/2021;1116;2021-07-05
105;1030;GESB 2021;Genome Engineering and Synthetic Biology (4th edition);Sep 23, 2021 - Sep 24, 2021;De Bijloke, Bijlokekaai 7, 9000 Gent;Jul 8, 2021;8/07/2021;1117;2021-07-08
105;1030;SPIE OP 2021;SPIE Optics + Photonics 2021;Aug 1, 2021 - Aug 5, 2021;San Diego, CA;Jul 7, 2021 (Jan 20, 2021);7/07/2021;1118;2021-07-07
105;1030;KEAS 2021;4th International Conference on Knowledge Economy, Artificial Intelligence & Social Sciences;May 22, 2021 - May 23, 2021;Hotel Mystays Ochanomizu Conf Center;May 12, 2021;12/05/2021;1119;2021-05-12
105;1030;ACM Hypertext 2021;ACM Hypertext and Social Media Conference;Aug 29, 2021 - Sep 1, 2021;Trinity College Dublin, Ireland;May 14, 2021;14/05/2021;1120;2021-05-14
105;1030;GoodIT 2021;ACM International Conference on Information Technology for Social Good;Sep 9, 2021 - Sep 11, 2021;Rome (Italy);May 1, 2021;1/05/2021;1121;2021-05-01
105;1030;PAAMS 2021;19th International Conference on Practical Applications of Agents and Multi-agent Systems;Oct 6, 2021 - Oct 8, 2021;Salamanca, Spain;Apr 23, 2021;23/04/2021;1122;2021-04-23
105;1030;eKNOW 2021;The Thirteenth International Conference on Information, Process, and Knowledge Management;Jul 18, 2021 - Jul 22, 2021;Nice, France;Apr 19, 2021;19/04/2021;1123;2021-04-19
105;1030;ICREC--IOP, EI, Scopus 2021;IOP--2021 the 6th International Conference on Renewable Energy and Conservation (ICREC 2021)--EI Compendex, Scopus;Nov 26, 2021 - Nov 28, 2021;Shenzhen, China;Jul 20, 2021;20/07/2021;1124;2021-07-20
105;1030;MDPI - Risk Management - Scopus 2021;Special Issue of Journal Applied System Innovation: Risk Management;N/A;N/A;Jul 31, 2021;31/07/2021;1125;2021-07-31
105;1030;BSHDS 2021;4th International Conference on Business Sustainability, Human Resource Development and Social Responsibility;Jun 19, 2021 - Jun 20, 2021;Hotel Mystays Ochanomizu Conf Center;Jun 9, 2021;9/06/2021;1126;2021-06-09
105;1031;Smart Health 2021;Special Issue - Systems, Applications and Services for Smart Health;N/A;N/A;Jun 25, 2021;25/06/2021;1127;2021-06-25
105;1031;ICERP--JA, Scopus 2021;2021 the 4th International Conference on Education Research and Policy (ICERP 2021)--JA, Scopus;May 21, 2021 - May 24, 2021;Shanghai, China;Mar 20, 2021;20/03/2021;1128;2021-03-20
105;1031;Virtual Environments for Cybersecurity 2021;SIMULATION MODELLING PRACTICE AND THEORY - Special Issue on ''Virtual Environments for Cybersecurity'';N/A;N/A;Dec 31, 2021;31/12/2021;1129;2021-12-31
105;1031;EICC 2021;European Interdisciplinary Cybersecurity Conference (EICC 2021);Nov 10, 2021 - Nov 11, 2021;Targu Mures, Romania;Jun 14, 2021;14/06/2021;1130;2021-06-14
105;1031;Signals (MDPI) 2021;Special Issue on Critical Infrastructures Cybersecurity and Resilience;N/A;N/A;Jun 15, 2021;15/06/2021;1131;2021-06-15
105;1031;COVELECT 2021;CfP: Elections in a Democratic Rule of Law State During a Pandemic Sanitary Regime as a Challenge for Public Policy;N/A;N/A;Jul 15, 2021;15/07/2021;1132;2021-07-15
105;1031;MARESEC 2021;European Workshop on Maritime Systems Resilience and Security;Jun 14, 2021 - Jun 14, 2021;Bremerhaven, Germany;Mar 12, 2021;12/03/2021;1133;2021-03-12
105;1031;Building accessible experiences 2021;axe-con 2021;Mar 10, 2021 - Mar 11, 2021;Online;Oct 23, 2020;23/10/2020;1134;2020-10-23
105;1031;JoWUA SI 2021;JoWUA Special Issue on Multidisciplinary Solutions to Modern Cybersecurity Challenges;Apr 15, 2020 - Feb 3, 2022;online;Apr 15, 2021;15/04/2021;1135;2021-04-15
105;1031;FI-CyberSec 2021;Feature Papers for Future Internet - Cybersecurity Section;N/A;N/A;Feb 28, 2021;28/02/2021;1136;2021-02-28
105;1031;CCCI 2021;International Conference on Communications, Computing, Cybersecurity, and Informatics;Oct 15, 2021 - Oct 17, 2021;Beijing, China;Jul 24, 2021;24/07/2021;1137;2021-07-24
105;1031;ACM BSCI 2021;The 3rd ACM International Symposium on Blockchain and Secure Critical Infrastructure;Jun 7, 2021 - Jun 11, 2021;Hong Kong, China;Mar 1, 2021;1/03/2021;1138;2021-03-01
105;1031;CSPPSG 2021;MDPI Sensors - Special Issue on 'Cybersecurity and Privacy-Preserving in Modern Smart Grid';N/A;N/A;Feb 28, 2021;28/02/2021;1139;2021-02-28
105;1031;OGEL Flaring 2021;OGEL Call for papers: Special Issue on Law and Policy for Gas Flaring in a Low-carbon Economy;Oct 1, 2020 - Apr 30, 2021;Online;Apr 30, 2021 (Mar 31, 2021);30/04/2021;1140;2021-04-30
105;1031;LA-CCI 2021;7th IEEE Latin American Conference on Computational Intelligence;Nov 2, 2021 - Nov 4, 2021;Temuco, Chile;Apr 30, 2021;30/04/2021;1141;2021-04-30
105;1031;ICEEEP--Scopus, Ei 2021;2021 5th International Conference on Energy Economics and Energy Policy (ICEEEP 2021)--Scopus, Ei Compendex;Apr 15, 2021 - Apr 17, 2021;Barcelona, Spain;Mar 5, 2021;5/03/2021;1142;2021-03-05
105;1031;ICEEEP--Scopus, Ei Compendex 2021;2021 5th International Conference on Energy Economics and Energy Policy (ICEEEP 2021)--Scopus, Ei Compendex;Apr 15, 2021 - Apr 17, 2021;Barcelona, Spain;Mar 5, 2021;5/03/2021;1143;2021-03-05
105;1031;SOTEHEINN 2021;CfP: Social, Technological and Health Innovation: Opportunities and Limitations for the Social Policy, Health Policy, and Environmental Policy;N/A;N/A;May 12, 2021;12/05/2021;1144;2021-05-12
105;1031;Call for Contributions 2021;Beyond the 2ºC: Business and Policy Trajectories to Climate Change Adaptation;Jun 30, 2020 - Feb 28, 2021;Edited book call;Nov 30, 2020 (Jun 30, 2020);30/11/2020;1145;2020-11-30
105;1031;SciSec 2021;3rd International Conference on Science of Cyber Security;Aug 13, 2021 - Aug 15, 2021;Shanghai, China;May 1, 2021;1/05/2021;1146;2021-05-01
105;1031;IJEL 2021;Ethical Leadership + Justice;Dec 4, 2020 - Mar 15, 2021;Case Western Reserve University;Mar 15, 2021;15/03/2021;1147;2021-03-15
105;1031;WTMC 2021;6th International Workshop on Traffic Measurements for Cybersecurity;May 27, 2021 - May 27, 2021;Virtual event;Jan 15, 2021;15/01/2021;1148;2021-01-15
105;1031;EAI CyDiP (virtual) 2021;EAI International Conference on Emerging Technologies of Cybersecurity and Digital Privacy (online conference);Oct 18, 2021 - Oct 19, 2021;Cyberspace;Apr 19, 2021;19/04/2021;1149;2021-04-19
105;1031;GPPR Spring Edition 2021;Georgetown Public Policy Review - Spring Edition;N/A;N/A;Jan 4, 2021;4/01/2021;1150;2021-01-04
105;1031;FREP 2021;Call for Papers - Fulbright Review of Economics and Policy;N/A;N/A;Mar 30, 2021;30/03/2021;1151;2021-03-30
105;1031;BSidesBUD 2021;BSides Budapest 2021 - Online IT Security Conference;May 27, 2021 - May 27, 2021;Online Stream;Apr 15, 2021;15/04/2021;1152;2021-04-15
105;1031;CfW EICC 2021;Call for Workshops: European Interdisciplinary Cybersecurity Conference (EICC 2021);Nov 10, 2021 - Nov 11, 2021;Targu Mures, Romania;Mar 15, 2021;15/03/2021;1153;2021-03-15
105;1031;GLOBALCYBER 2021;Call for Chapters: Cybersecurity Capabilities in Developing Nations and Its Impact on Global Security;Mar 21, 2021 - Mar 21, 2021;Virtual;Mar 21, 2021;21/03/2021;1154;2021-03-21
105;1031;SI-5G-SEC-SENSORS 2021;Special Issue on Advances in 5G Networks Security in Sensors journal;N/A;N/A;Mar 1, 2021;1/03/2021;1155;2021-03-01
105;1031;RHET 2021;Ethical Implications of Reshaping Healthcare with Emerging Technologies;N/A;N/A;Sep 14, 2020;14/09/2020;1156;2020-09-14
105;1031;ICIST 2021;International Conference on Information and Software Technologies;Oct 14, 2021 - Oct 16, 2021;Kaunas, Lithuania;Mar 16, 2021;16/03/2021;1157;2021-03-16
105;1031;ADRS-COVID 2021;Annals of Disaster Risk Sciences - Special edition on the COVID-19 pandemic;N/A;N/A;Mar 15, 2021;15/03/2021;1158;2021-03-15
105;1031;MWAIS 2021;16th Annual Conference of the Midwest Association for Information Systems (MWAIS);May 20, 2021 - May 21, 2021;Peoria, Illinois;Feb 26, 2021;26/02/2021;1159;2021-02-26
105;1031;AutoSec 2021;3rd International Workshop on Automotive and Autonomous Vehicle Security (AutoSec 2021) co-located with NDSS 2021;Feb 21, 2021 - Feb 21, 2021;Online;Jan 4, 2021;4/01/2021;1160;2021-01-04
105;1031;IEEE SafeThings 2021;5th IEEE Workshop on the Internet of Safe Things (SafeThings'21) Co-located with IEEE S&P 2021;May 27, 2021 - May 27, 2021;Remote;Jan 25, 2021;25/01/2021;1161;2021-01-25
105;1031;CM 2021;Call For Chapters on 'Advances in Cybersecurity Management' (Springer) (Dec. 31);N/A;N/A;Dec 31, 2020;31/12/2020;1162;2020-12-31
105;1031;ISJ Global Perspective 2021;Special Issue: COVID-19 Pandemic Crisis and its Implications on Cybersecurity, Information Security Journal: A Global Perspective;N/A;N/A;Nov 30, 2020;30/11/2020;1163;2020-11-30
105;1031;ET 2021;ENERGY TRANSITIONS 2021;Mar 11, 2021 - Mar 12, 2021;Joensuu, Finland;Nov 30, 2020;30/11/2020;1164;2020-11-30
105;1031;BACP 2021;BACP Research Conference 2021: Promoting collaboration in research, policy and practice;May 14, 2021 - May 15, 2021;Manchester UK;Nov 2, 2020;2/11/2020;1165;2020-11-02
105;1031;MLBDACP 2021;The Third International Symposium on Machine Learning and Big Data Analytics For Cybersecurity and Privacy;Mar 23, 2021 - Mar 26, 2021;Warsaw, Poland;Nov 10, 2020;10/11/2020;1166;2020-11-10
105;1031;ICSAC 2021;1st Workshop on Industrial infrastructures Cyber Security for Advancing Collaborative manufacturing;Jan 18, 2021 - Jan 18, 2021;Virtual;Nov 13, 2020;13/11/2020;1167;2020-11-13
105;1031;ITNG 2021;The 18th Int'l Conf. on Information Technology: New Generations;Apr 10, 2021 - Apr 14, 2021;Las Vegas;Oct 30, 2020;30/10/2020;1168;2020-10-30
105;1031;STP-CPS 2021;3rd INTL. WORKSHOP ON SECURITY TRUST AND PRIVACY FOR EMERGING CYBER PHYSICAL SYSTEMS;Jan 9, 2021 - Jan 12, 2021;Las Vegas, USA;Oct 16, 2020;16/10/2020;1169;2020-10-16
105;1031;HICSS Cybersecurity/Privacy in Govt 2021;HICSS 54 Cybersecurity and Privacy in Government;Jan 4, 2021 - Jan 8, 2021;Grand Hyatt Kauai;Jul 15, 2020;15/07/2020;1170;2020-07-15
105;1031;IEEE OJ-CS Special Section 2021;Special Section on Cybersecurity: Privacy, Attack, and Defense;N/A;N/A;Jul 31, 2020;31/07/2020;1171;2020-07-31
105;1031;IEEE PIMRC 2021;2021 IEEE International Symposium on Personal, Indoor and Mobile Radio Communications;Sep 13, 2021 - Sep 16, 2021;Helsinki;TBD;NULL;1172;NULL
105;1032;SI: Adaptive HAR in smart spaces 2022;Special issue : Adaptive Human Activity and Behaviour Recognition Models for Context Awareness in Intelligent Environments;N/A;N/A;Sep 5, 2021;5/09/2021;1173;2021-09-05
105;1032;SI : Multimodal Datasets in smart spaces 2021;Special Issue: Multisensor and Multimodal Datasets in Intelligent Home for Context-Awareness, Human Home Interaction and Dialogue;Nov 10, 2020 - Jun 1, 2021;Sensors journal;Mar 31, 2021;31/03/2021;1174;2021-03-31
105;1032;MIUA 2021;MEDICAL IMAGE UNDERSTANDING AND ANALYSIS;Jul 12, 2021 - Jul 14, 2021;Oxford, UK;Mar 19, 2021;19/03/2021;1175;2021-03-19
105;1032;TRECVID 2021;TREC Video Retrieval Evaluation;Dec 7, 2021 - Dec 10, 2021;In-person Or Virtual;May 3, 2021;3/05/2021;1176;2021-05-03
105;1032;CogSIMA 2021;2021 IEEE Conference on Cognitive and Computational Aspects of Situation Management;May 17, 2021 - May 20, 2021;(VIRTUAL CONFERENCE) Tallinn, Estonia;Jan 31, 2021;31/01/2021;1177;2021-01-31
105;1032;ICxS 2021;6th Special Session on Intelligent and Contextual Systems;Apr 7, 2021 - Apr 10, 2021;Phuket/online;Oct 30, 2020;30/10/2020;1178;2020-10-30
105;1032;Emoji2021;Emoji2021 - 4th? International Workshop on Emoji Understanding and Applications in Social Media;Jun 7, 2021 - Jun 7, 2021;Online;Mar 27, 2021;27/03/2021;1179;2021-03-27
105;1032;RAW 2021;International Robust Artificial Intelligence Workshop (RAW);Sep 8, 2021 - Sep 10, 2021;Szczecin, Poland;Apr 15, 2021;15/04/2021;1180;2021-04-15
105;1032;DigEx 2021;3rd International Workshop on Transforming the Digital Customer Experience;Jun 15, 2021 - Jun 17, 2021;Hannover, Germany;Apr 20, 2021;20/04/2021;1181;2021-04-20
105;1032;UDNNSC 2021;Understanding the Dynamics of New Normal for Supply Chains;Dec 9, 2020 - Jan 30, 2021;US;Jan 20, 2021;20/01/2021;1182;2021-01-20
105;1032;JDST 2021;JDST: Cyber Defence - Building a Rapid Response;N/A;N/A;Dec 31, 2020;31/12/2020;1183;2020-12-31
105;1032;EmotionAware 2021;5th International Workshop on Emotion Awareness for Pervasive Computing - Beyond traditional approaches;Mar 22, 2021 - Mar 26, 2021;Kassel, Germany;Nov 9, 2020;9/11/2020;1184;2020-11-09
105;1032;IWDS 2021;The 4th International Workshop on Dialog Systems;Jan 17, 2021 - Jan 17, 2021;Jeju Island, Korea (Online);Nov 10, 2020;10/11/2020;1185;2020-11-10
105;1032;Transgender India 2021;Transgender India: Understanding Hijras and Sadhins through the Social Sciences, Arts, and Humanities;Oct 1, 2020 - Oct 1, 2020;Publication;Oct 1, 2020;1/10/2020;1186;2020-10-01
105;1032;Transgender India 2021;Transgender India: Understanding Hijras and Sadhins through the Social Sciences, Arts, and Humanities;Oct 1, 2020 - Oct 1, 2020;Publication;Oct 1, 2020;1/10/2020;1187;2020-10-01
105;1032;Transgender India 2021;Transgender India: Understanding Hijras and Sadhins through the Social Sciences, Arts, and Humanities;Oct 1, 2020 - Oct 1, 2020;Publication;Oct 1, 2020;1/10/2020;1188;2020-10-01
105;1032;Transgender India 2021;Transgender India: Understanding Hijras and Sadhins through the Social Sciences, Arts, and Humanities;Oct 1, 2020 - Oct 1, 2020;Publication;Oct 1, 2020;1/10/2020;1189;2020-10-01
105;1033;CEVVE 2021;2021 International Conference on Electric Vehicle and Vehicle Engineering (CEVVE 2021);Sep 17, 2021 - Sep 19, 2021;Frankfurt, Germany;Jul 31, 2021;31/07/2021;1190;2021-07-31
105;1033;blockchain_ml_iot 2021;Network and Electronics (MDPI) Joint Special Issue - Blockchain and Machine Learning for IoT: Security and Privacy Challenges;N/A;N/A;Dec 31, 2021;31/12/2021;1191;2021-12-31
105;1033;CANS 2021;Cryptology and Network Security;Dec 13, 2021 - Dec 15, 2021;Vienna, Austria;Jun 1, 2021;1/06/2021;1192;2021-06-01
105;1033;EICC 2021;European Interdisciplinary Cybersecurity Conference (EICC 2021);Nov 10, 2021 - Nov 11, 2021;Targu Mures, Romania;Jun 14, 2021;14/06/2021;1193;2021-06-14
105;1033;SI on SPIHG 2022;IEEE S&P CfP: Special Issue on Security and Privacy Issues of Home Globalization;N/A;N/A;May 15, 2021;15/05/2021;1194;2021-05-15
105;1033;SPBP 2021;The Fourth Workshop on Security and Privacy-enhanced Business Process Management;Sep 6, 2021 - Sep 6, 2021;Rome, Italy;May 24, 2021;24/05/2021;1195;2021-05-24
105;1033;ICDM 2021;21st IEEE International Conference on Data Mining;Dec 7, 2021 - Dec 10, 2021;Auckland, New Zealand;Jun 11, 2021;11/06/2021;1196;2021-06-11
105;1033;Smart Health 2021;Special Issue - Systems, Applications and Services for Smart Health;N/A;N/A;Jun 25, 2021;25/06/2021;1197;2021-06-25
105;1033;MDPI-SI-BDHA 2021;Call for Papers: Special Issue “Big Data for eHealth Applications” (MDPI Applied Sciences, IF 2.474 – Indexed on Scopus, Web of Science);N/A;N/A;Sep 15, 2021;15/09/2021;1198;2021-09-15
105;1033;DATA ANALYTICS 2021;The Tenth International Conference on Data Analytics;Oct 3, 2021 - Oct 7, 2021;Barcelona, Spain;Jul 5, 2021;5/07/2021;1199;2021-07-05
105;1033;ML_BDA 2021;Special Issue on Machine Learning Technologies for Big Data Analytics;N/A;N/A;Aug 15, 2021;15/08/2021;1200;2021-08-15
105;1033;IEEE DSAA 2021;8th IEEE International Conference on Data Science and Advanced Analytics;Oct 6, 2021 - Oct 9, 2021;Porto, Portugal;May 23, 2021;23/05/2021;1201;2021-05-23
105;1033;BDIoT 2021;5th International Conference on Big Data and Internet of Things - BDIoT’21;Mar 17, 2021 - Mar 18, 2021;Rabat - Morocco;Dec 1, 2021;1/12/2021;1202;2021-12-01
105;1033;iDSC 2021;4th International Data Science Conference;Oct 20, 2021 - Oct 22, 2021;Vienna;Jun 20, 2021;20/06/2021;1203;2021-06-20
105;1033;SOUPS 2021;The Seventeenth Symposium on Usable Privacy and Security;Aug 8, 2021 - Aug 10, 2021;Vancouver, B.C., Canada;Feb 25, 2021 (Feb 18, 2021);25/02/2021;1204;2021-02-25
105;1033;CCNC 2021;IEEE Consumer Communications & Networking Conference;Jan 9, 2021 - Jan 12, 2021;Las Vegas, USA;Jul 10, 2021;10/07/2021;1205;2021-07-10
105;1033;ISC HPC 2021;ISC HIGH PERFORMANCE 2021 DIGITAL;Jun 24, 2021 - Jul 2, 2021;Digital;Dec 21, 2021 (Dec 14, 2020);21/12/2021;1206;2021-12-21
105;1033;IEEE SSCI 2021;2021 IEEE Symposium Series on Computational Intelligence;Dec 5, 2021 - Dec 8, 2021;Orlando, Florida, USA;Aug 6, 2021;6/08/2021;1207;2021-08-06
105;1033;ICSRS--Scopus & EI Compendex 2021;2021 5th International Conference on System Reliability and Safety (ICSRS 2021)--Scopus & EI Compendex;Nov 24, 2021 - Nov 26, 2021;Palermo, Italy;Jul 5, 2021;5/07/2021;1208;2021-07-05
105;1033;CRITIS 2021;The 16th International Conference on Critical Information Infrastructures Security;Sep 27, 2021 - Sep 29, 2021;EPFL SwissTech, Lausanne, Switzerland;May 14, 2021;14/05/2021;1209;2021-05-14
105;1033;EAI SecureComm 2021;17th EAI International Conference on Security and Privacy in Communication Networks (Springer, Scopus, ISI, Ei, more);Sep 6, 2021 - Sep 9, 2021;Canterbury, Great Britain;Mar 15, 2021;15/03/2021;1210;2021-03-15
105;1033;CSPPSG 2021;MDPI Sensors - Special Issue on 'Cybersecurity and Privacy-Preserving in Modern Smart Grid';N/A;N/A;Feb 28, 2021;28/02/2021;1211;2021-02-28
105;1033;ai4i 2021;Artificial Intelligence for Industries (ai4i 2021);Sep 20, 2021 - Sep 22, 2021;Laguna Hills, California, USA;Jul 1, 2021;1/07/2021;1212;2021-07-01
105;1033;SOFSEM 2021;47th International Conference on Current Trends in Theory and Practice of Computer Science;Jan 25, 2021 - Jan 28, 2021;Bozen-Bolzano, Italy;Aug 3, 2021 (Jul 27, 2021);3/08/2021;1213;2021-08-03
105;1033;NISecurity 2021;2021 International Conference on Network and Information Security (NISecurity 2021);Aug 13, 2021 - Aug 15, 2021;Stockholm, Sweden;Jun 30, 2021;30/06/2021;1214;2021-06-30
105;1033;Scopus-ICDPR 2022;The 6th International Conference on Data Processing and Robotics (ICDPR 2022);Jan 6, 2022 - Jan 8, 2022;Hokkaido, Japan;Jul 5, 2021;5/07/2021;1215;2021-07-05
105;1033;Mapping_Monitoring_Wetlands 2021;[Water] (IF: 2.544, ISSN 2073-4441) Special Issue: Mapping and Monitoring of Wetlands;N/A;N/A;Nov 30, 2021;30/11/2021;1216;2021-11-30
105;1033;ICBDB 2021;2021 3rd International Conference on Big Data and Blockchain(ICBDB 2021);Dec 3, 2021 - Dec 5, 2021;Beijing, China;Oct 30, 2021;30/10/2021;1217;2021-10-30
105;1033;EI-WBDC 2021;2021 3rd International Workshop on Big Data and Computing(WBDC 2021);Dec 3, 2021 - Dec 5, 2021;Beijing, China;Oct 31, 2021;31/10/2021;1218;2021-10-31
105;1033;SI: Advanced Technology for IE 2022;Special Issue: Secure and Advanced Technology for Intelligent Environments;Jan 1, 2021 - Jun 1, 2022;JAISE (IOS) journal;Sep 5, 2021;5/09/2021;1219;2021-09-05
105;1033;AICCC--EI, Scopus 2021;2021 4th Artificial Intelligence and Cloud Computing Conference (AICCC 2021)--EI Compendex, Scopus;Dec 17, 2021 - Dec 19, 2021;Kyoto, Japan;Aug 5, 2021;5/08/2021;1220;2021-08-05
105;1033;BigMM 2021;IEEE International Conference on Multimedia Big Data 2021;Nov 15, 2021 - Nov 17, 2021;Taichung, Taiwan;Aug 9, 2021;9/08/2021;1221;2021-08-09
105;1033;CLUSTER 2021;23rd IEEE Cluster Conference;Sep 7, 2021 - Sep 10, 2021;Portland, Oregon, USA;May 17, 2021 (May 10, 2021);17/05/2021;1222;2021-05-17
105;1033;SPTM 2021;9th International Conference of Security, Privacy and Trust Management;Apr 24, 2021 - Apr 25, 2021;Copenhagen, Denmark;Feb 20, 2021;20/02/2021;1223;2021-02-20
105;1033;ICBICC 2021;2021 3rd International Conference on Big Data, IoT, and Cloud Computing (ICBICC 2021);Nov 12, 2021 - Nov 14, 2021;Rome, Italy;Sep 30, 2021;30/09/2021;1224;2021-09-30
105;1033;BDSIC--EI Compendex, Scopus 2021;2021 3rd International Conference on Big-data Service and Intelligent Computation (BDSIC 2021)--Ei Compendex, Scopus;Nov 19, 2021 - Nov 21, 2021;HuaQiao University, Xiamen?China;Jul 5, 2021;5/07/2021;1225;2021-07-05
105;1033;BDSIC--EI, Scopus 2021;2021 3rd International Conference on Big-data Service and Intelligent Computation (BDSIC 2021)--Ei Compendex, Scopus;Nov 19, 2021 - Nov 21, 2021;HuaQiao University, Xiamen?China;Jul 5, 2021;5/07/2021;1226;2021-07-05
105;1033;ICSRS--Scopus & EI 2021;2021 5th International Conference on System Reliability and Safety (ICSRS 2021)--Scopus & EI Compendex;Nov 24, 2021 - Nov 26, 2021;Palermo, Italy;Jul 5, 2021;5/07/2021;1227;2021-07-05
105;1033;SNSA-SI-MDPI 2021;Sensor Networks Security and Applications;N/A;N/A;Jul 31, 2021;31/07/2021;1228;2021-07-31
105;1033;ICPM 2021;3rd International Conference on Process Mining;Oct 31, 2021 - Nov 4, 2021;Eindhoven;Jul 1, 2021 (Jun 15, 2021);1/07/2021;1229;2021-07-01
105;1033;CCEAI-Scopus 2022;The 6th International Conference on Control Engineering and Artificial Intelligence (CCEAI 2022);Jan 6, 2022 - Jan 8, 2022;Hokkaido, Japan;Jul 5, 2021;5/07/2021;1230;2021-07-05
105;1033;EMERGING 2021;The Thirteenth International Conference on Emerging Networks and Systems Intelligence;Oct 3, 2021 - Oct 7, 2021;Barcelona, Spain;Jul 5, 2021;5/07/2021;1231;2021-07-05
105;1033;NCAA 2022;Topical Collection on Deep Learning for Time Series Data for Neural Computing and Applications;N/A;N/A;Jun 30, 2021;30/06/2021;1232;2021-06-30
105;1033;IDEAS 2021;25th International Database Engineering & Applications Symposium;Jul 14, 2021 - Jul 16, 2021;Montreal;Apr 1, 2021;1/04/2021;1233;2021-04-01
105;1033;CCCI 2021;International Conference on Communications, Computing, Cybersecurity, and Informatics;Oct 15, 2021 - Oct 17, 2021;Beijing, China;Jul 24, 2021;24/07/2021;1234;2021-07-24
105;1033;Scopus-WSM 2021;The 3rd International Conference on Water Security and Management ( WSM 2021);Dec 9, 2021 - Dec 11, 2021;Tokyo, Japan;Jun 10, 2021;10/06/2021;1235;2021-06-10
105;1033;HOST 2021;IEEE International Symposium on Hardware Oriented Security and Trust (HOST);Dec 5, 2021 - Dec 8, 2021;Washington Dc, USA;May 4, 2021 (Apr 27, 2021);4/05/2021;1236;2021-05-04
105;1033;Elec-SI-IIDS 2021;Special Issue on Design of Intelligent Intrusion Detection Systems;N/A;N/A;May 31, 2021;31/05/2021;1237;2021-05-31
105;1033;PPML at INTERSPEECH 2021;Privacy-preserving Machine Learning for Audio & Speech Processing -- INTERSPEECH 2021 Special Session;Aug 30, 2021 - Sep 3, 2021;Brno, Czechia;Mar 26, 2021;26/03/2021;1238;2021-03-26
105;1033;MDPI - Risk Management - Scopus 2021;Special Issue of Journal Applied System Innovation: Risk Management;N/A;N/A;Jul 31, 2021;31/07/2021;1239;2021-07-31
105;1033;ICTS 2021;The 13th International Conference on Information & Communication Technology and System;Oct 20, 2021 - Oct 21, 2021;Virtual conference;Jul 8, 2021;8/07/2021;1240;2021-07-08
105;1034;SOUPS 2021;The Seventeenth Symposium on Usable Privacy and Security;Aug 8, 2021 - Aug 10, 2021;Vancouver, B.C., Canada;Feb 25, 2021 (Feb 18, 2021);25/02/2021;1241;2021-02-25
105;1034;CEVVE 2021;2021 International Conference on Electric Vehicle and Vehicle Engineering (CEVVE 2021);Sep 17, 2021 - Sep 19, 2021;Frankfurt, Germany;Jul 31, 2021;31/07/2021;1242;2021-07-31
105;1034;blockchain_ml_iot 2021;Network and Electronics (MDPI) Joint Special Issue - Blockchain and Machine Learning for IoT: Security and Privacy Challenges;N/A;N/A;Dec 31, 2021;31/12/2021;1243;2021-12-31
105;1034;CANS 2021;Cryptology and Network Security;Dec 13, 2021 - Dec 15, 2021;Vienna, Austria;Jun 1, 2021;1/06/2021;1244;2021-06-01
105;1034;EICC 2021;European Interdisciplinary Cybersecurity Conference (EICC 2021);Nov 10, 2021 - Nov 11, 2021;Targu Mures, Romania;Jun 14, 2021;14/06/2021;1245;2021-06-14
105;1034;SI on SPIHG 2022;IEEE S&P CfP: Special Issue on Security and Privacy Issues of Home Globalization;N/A;N/A;May 15, 2021;15/05/2021;1246;2021-05-15
105;1034;SPBP 2021;The Fourth Workshop on Security and Privacy-enhanced Business Process Management;Sep 6, 2021 - Sep 6, 2021;Rome, Italy;May 24, 2021;24/05/2021;1247;2021-05-24
105;1034;CCNC 2021;IEEE Consumer Communications & Networking Conference;Jan 9, 2021 - Jan 12, 2021;Las Vegas, USA;Jul 10, 2021;10/07/2021;1248;2021-07-10
105;1034;CRITIS 2021;The 16th International Conference on Critical Information Infrastructures Security;Sep 27, 2021 - Sep 29, 2021;EPFL SwissTech, Lausanne, Switzerland;May 14, 2021;14/05/2021;1249;2021-05-14
105;1034;EAI SecureComm 2021;17th EAI International Conference on Security and Privacy in Communication Networks (Springer, Scopus, ISI, Ei, more);Sep 6, 2021 - Sep 9, 2021;Canterbury, Great Britain;Mar 15, 2021;15/03/2021;1250;2021-03-15
105;1034;CSPPSG 2021;MDPI Sensors - Special Issue on 'Cybersecurity and Privacy-Preserving in Modern Smart Grid';N/A;N/A;Feb 28, 2021;28/02/2021;1251;2021-02-28
105;1034;NISecurity 2021;2021 International Conference on Network and Information Security (NISecurity 2021);Aug 13, 2021 - Aug 15, 2021;Stockholm, Sweden;Jun 30, 2021;30/06/2021;1252;2021-06-30
105;1034;SI: Advanced Technology for IE 2022;Special Issue: Secure and Advanced Technology for Intelligent Environments;Jan 1, 2021 - Jun 1, 2022;JAISE (IOS) journal;Sep 5, 2021;5/09/2021;1253;2021-09-05
105;1034;CLUSTER 2021;23rd IEEE Cluster Conference;Sep 7, 2021 - Sep 10, 2021;Portland, Oregon, USA;May 17, 2021 (May 10, 2021);17/05/2021;1254;2021-05-17
105;1034;SPTM 2021;9th International Conference of Security, Privacy and Trust Management;Apr 24, 2021 - Apr 25, 2021;Copenhagen, Denmark;Feb 20, 2021;20/02/2021;1255;2021-02-20
105;1034;SNSA-SI-MDPI 2021;Sensor Networks Security and Applications;N/A;N/A;Jul 31, 2021;31/07/2021;1256;2021-07-31
105;1034;ICSRS--Scopus & EI 2021;2021 5th International Conference on System Reliability and Safety (ICSRS 2021)--Scopus & EI Compendex;Nov 24, 2021 - Nov 26, 2021;Palermo, Italy;Jul 5, 2021;5/07/2021;1257;2021-07-05
105;1034;EMERGING 2021;The Thirteenth International Conference on Emerging Networks and Systems Intelligence;Oct 3, 2021 - Oct 7, 2021;Barcelona, Spain;Jul 5, 2021;5/07/2021;1258;2021-07-05
105;1034;IDEAS 2021;25th International Database Engineering & Applications Symposium;Jul 14, 2021 - Jul 16, 2021;Montreal;Apr 1, 2021;1/04/2021;1259;2021-04-01
105;1034;CCCI 2021;International Conference on Communications, Computing, Cybersecurity, and Informatics;Oct 15, 2021 - Oct 17, 2021;Beijing, China;Jul 24, 2021;24/07/2021;1260;2021-07-24
105;1034;Scopus-WSM 2021;The 3rd International Conference on Water Security and Management ( WSM 2021);Dec 9, 2021 - Dec 11, 2021;Tokyo, Japan;Jun 10, 2021;10/06/2021;1261;2021-06-10
105;1034;Elec-SI-IIDS 2021;Special Issue on Design of Intelligent Intrusion Detection Systems;N/A;N/A;May 31, 2021;31/05/2021;1262;2021-05-31
105;1034;HOST 2021;IEEE International Symposium on Hardware Oriented Security and Trust (HOST);Dec 5, 2021 - Dec 8, 2021;Washington Dc, USA;May 4, 2021 (Apr 27, 2021);4/05/2021;1263;2021-05-04
105;1034;PPML at INTERSPEECH 2021;Privacy-preserving Machine Learning for Audio & Speech Processing -- INTERSPEECH 2021 Special Session;Aug 30, 2021 - Sep 3, 2021;Brno, Czechia;Mar 26, 2021;26/03/2021;1264;2021-03-26
105;1034;CYBER 2021;The Sixth International Conference on Cyber-Technologies and Cyber-Systems;Oct 3, 2021 - Oct 7, 2021;Barcelona, Spain;Jul 5, 2021;5/07/2021;1265;2021-07-05
105;1034;CENTRIC 2021;The Fourteenth International Conference on Advances in Human-oriented and Personalized Mechanisms, Technologies, and Services;Oct 3, 2021 - Oct 7, 2021;Barcelona, Spain;Jul 5, 2021;5/07/2021;1266;2021-07-05
105;1034;MDPI - Risk Management - Scopus 2021;Special Issue of Journal Applied System Innovation: Risk Management;N/A;N/A;Jul 31, 2021;31/07/2021;1267;2021-07-31
105;1034;ICTS 2021;The 13th International Conference on Information & Communication Technology and System;Oct 20, 2021 - Oct 21, 2021;Virtual conference;Jul 8, 2021;8/07/2021;1268;2021-07-08
105;1034;WSM-Scopus 2021;The 3rd International Conference on Water Security and Management ( WSM 2021);Dec 9, 2021 - Dec 11, 2021;Tokyo, Japan;Jun 10, 2021;10/06/2021;1269;2021-06-10
105;1034;CSW 2021;2021 International Workshop on Cyber Security (CSW 2021);Aug 13, 2021 - Aug 15, 2021;Stockholm, Sweden;Jun 30, 2021;30/06/2021;1270;2021-06-30
105;1034;ICENT--EI Compendex, Scopus 2021;2021 3rd International Conference on Emerging Networks Technologies (ICENT 2021)--Ei Compendex, Scopus;Sep 22, 2021 - Sep 24, 2021;Okinawa, Japan;May 10, 2021;10/05/2021;1271;2021-05-10
105;1034;WoSCA 2021;WoSCA 2021 : 2nd International Workshop on Smart Contract Analysis;Jul 12, 2021 - Jul 16, 2021;Aarhus, Denmark;May 14, 2021;14/05/2021;1272;2021-05-14
105;1034;Scopus-WADCE 2021;7th International Workshop on Aircraft Design and Control Engineering (WADCE 2021);Dec 9, 2021 - Dec 12, 2021;Melbourne, Australia;Jun 10, 2021;10/06/2021;1273;2021-06-10
105;1034;SKM 2021;International Conference on Secure Knowledge Management;Oct 8, 2021 - Oct 9, 2021;San Antonio;Jun 21, 2021;21/06/2021;1274;2021-06-21
105;1034;EAI Qshine 2021;17th EAI International Conference on Heterogeneous Networking for Quality, Reliability, Security and Robustness (Springer, Scopus, ISI, Ei, more);Nov 29, 2021 - Nov 30, 2021;Melbourne, Australia;May 20, 2021;20/05/2021;1275;2021-05-20
105;1034;SciSec 2021;3rd International Conference on Science of Cyber Security;Aug 13, 2021 - Aug 15, 2021;Shanghai, China;May 1, 2021;1/05/2021;1276;2021-05-01
105;1034;STPSA 2021;The 15th IEEE International Workshop on Security, Trust, and Privacy for Software Applications;Jul 12, 2021 - Jul 16, 2021;Virtual;Apr 21, 2021;21/04/2021;1277;2021-04-21
105;1034;CLOUD S&P 2021;3rd Workshop on Cloud Security and Privacy;Jun 21, 2021 - Jun 24, 2021;Kamakura, Japan;Mar 20, 2021;20/03/2021;1278;2021-03-20
105;1034;ACM WiSec 2021;ACM Conference on Security and Privacy in Wireless and Mobile Networks;Jun 28, 2021 - Jul 1, 2021;Virtual;Mar 18, 2021;18/03/2021;1279;2021-03-18
105;1034;DSA 2021;The 8th International Conference on Dependable Systems and Their Applications;Aug 5, 2021 - Aug 6, 2021;Yinchuan, China;May 20, 2021;20/05/2021;1280;2021-05-20
105;1034;EAI CyDiP (virtual) 2021;EAI International Conference on Emerging Technologies of Cybersecurity and Digital Privacy (online conference);Oct 18, 2021 - Oct 19, 2021;Cyberspace;Apr 19, 2021;19/04/2021;1281;2021-04-19
105;1034;OID 2021;Open Identity Summit 2021;Jun 1, 2021 - Jun 2, 2021;Copenhagen, Denmark;Mar 1, 2021;1/03/2021;1282;2021-03-01
105;1034;ICISPP--Ei Compendex, Scopus 2021;2021 2nd International Conference on Information Security and Privacy Protection (ICISPP 2021)--Ei Compendex, Scopus;Jul 9, 2021 - Jul 11, 2021;Nanjing, China;Feb 20, 2021;20/02/2021;1283;2021-02-20
105;1034;FI-CyberSec 2021;Feature Papers for Future Internet - Cybersecurity Section;N/A;N/A;Feb 28, 2021;28/02/2021;1284;2021-02-28
105;1034;Sensors (MDPI) SI 2021;Sensors SI on Security, Trust and Privacy in New Computing Environments;N/A;N/A;Mar 31, 2021;31/03/2021;1285;2021-03-31
105;1034;PrivateNLP 2021;NAACL 2021 Workshop on Privacy and Natural Language Processing;Jun 11, 2021 - Jun 11, 2021;Virtual;Mar 15, 2021;15/03/2021;1286;2021-03-15
105;1034;PCEIoT 2021;Workshop on Privacy in the Cloud/Edge/IoT World 2021;Jul 5, 2021 - Jul 8, 2021;Cagliari (Italy) and Online;Mar 28, 2021;28/03/2021;1287;2021-03-28
105;1034;DBKDA 2021;The Thirteenth International Conference on Advances in Databases, Knowledge, and Data Applications;May 30, 2021 - Jun 3, 2021;Valencia, Spain;Mar 2, 2021;2/03/2021;1288;2021-03-02
105;1034;ICISPP--Ei, Scopus 2021;2021 2nd International Conference on Information Security and Privacy Protection (ICISPP 2021)--Ei Compendex, Scopus;Jul 9, 2021 - Jul 11, 2021;Nanjing, China;Feb 20, 2021;20/02/2021;1289;2021-02-20
105;1034;VSC @IEEE WETICE 2021;Track on Validating Software for Critical Systems (VSC) @IEEE WETICE 2021;Jun 23, 2021 - Jun 25, 2021;Basque Coast - Bayonne, France;Feb 28, 2021;28/02/2021;1290;2021-02-28
105;1034;CfW EICC 2021;Call for Workshops: European Interdisciplinary Cybersecurity Conference (EICC 2021);Nov 10, 2021 - Nov 11, 2021;Targu Mures, Romania;Mar 15, 2021;15/03/2021;1291;2021-03-15
106;1035;MDPI - Risk Management - Scopus 2021;Special Issue of Journal Applied System Innovation: Risk Management;N/A;N/A;Jul 31, 2021;31/07/2021;1292;2021-07-31
106;1035;17th ICTEL Rome 2021;17th ICTEL 2021 – International Conference on Teaching, Education & Learning, 06-07 September, Rome;Sep 6, 2021 - Sep 7, 2021;University of Washington – Rome Center (;Sep 6, 2021 (Sep 5, 2021);6/09/2021;1293;2021-09-06
106;1035;TERA - Eurasia Research 2021;19th ICTEL 2021 – International Conference on Teaching, Education & Learning, 11-12 October, Lisbon;Oct 11, 2021 - Oct 12, 2021;Universidade Autónoma de Lisboa (UAL), L;Oct 10, 2021;10/10/2021;1294;2021-10-10
106;1035;20th ICTEL October, Dubai 2021;20th ICTEL 2021 – International Conference on Teaching, Education & Learning, 23-24 October, Dubai;Oct 23, 2021 - Oct 24, 2021;Flora Creek, Deira, Dubai, UAE;Oct 22, 2021;22/10/2021;1295;2021-10-22
106;1035;TERA - Eurasia Research 2021;15th ICTEL 2021 – International Conference on Teaching, Education & Learning, 06-07 September, London;Sep 6, 2021 - Sep 5, 2021;The Tomlinson Centre, Queensbridge Road,;Sep 4, 2021;4/09/2021;1296;2021-09-04
106;1035;13th ICTEL August, Amsterdam 2021;13th ICTEL 2021 – International Conference on Teaching, Education & Learning, 02-03 August, Amsterdam;Aug 2, 2021 - Aug 3, 2021;NH Hotel Amsterdam-Zuid, Van Leijenbergh;Aug 1, 2021;1/08/2021;1297;2021-08-01
106;1035;PARMA-DITAM 2021;PARMA-DITAM: 12th Workshop on Parallel Programming and Run-Time Management Techniques for Many-core Architectures & 10th Workshop on Design Tools and Architectures for Multi-Core;Jan 19, 2021 - Jan 19, 2021;Virtual;Nov 13, 2021;13/11/2021;1298;2021-11-13
106;1035;16th ICTEL Sept, Athens 2021;16th ICTEL 2021 – International Conference on Teaching, Education & Learning, 14-15 September, Athens;Sep 14, 2021 - Sep 15, 2021;Novotel Athenes, Michail Voda 4, Athens,;Sep 13, 2021;13/09/2021;1299;2021-09-13
106;1035;KMIS 2021;13th International Conference on Knowledge Management and Information Systems;Oct 25, 2021 - Oct 27, 2021;Valletta, Malta;May 18, 2021;18/05/2021;1300;2021-05-18
106;1035;CNAIRS 2021;Special Session on Applying Complex Network Analysis to Industrial Risk Studies;Jul 6, 2021 - Jul 11, 2021;Washington;Feb 17, 2021;17/02/2021;1301;2021-02-17
106;1035;eRisk 2021;CFP eRisk @ CLEF 2021 - Early risk prediction on the Internet;Sep 21, 2021 - Sep 24, 2021;Bucharest;Feb 1, 2021;1/02/2021;1302;2021-02-01
106;1035;ICPM 2021;3rd International Conference on Process Mining;Oct 31, 2021 - Nov 4, 2021;Eindhoven;Jul 1, 2021 (Jun 15, 2021);1/07/2021;1303;2021-07-01
106;1035;IC3K 2021;13th International Joint Conference on Knowledge Discovery, Knowledge Engineering and Knowledge Management;Oct 25, 2021 - Oct 27, 2021;Valletta, Malta;May 18, 2021;18/05/2021;1304;2021-05-18
106;1035;Scopus-ICDPR 2022;The 6th International Conference on Data Processing and Robotics (ICDPR 2022);Jan 6, 2022 - Jan 8, 2022;Hokkaido, Japan;Jul 5, 2021;5/07/2021;1305;2021-07-05
106;1035;ICT-DM 2021;The 7th International Conference on Information and Communication Technologies for Disaster Management;Dec 3, 2021 - Dec 5, 2021;Hangzhou, China;Jun 20, 2021 (Jun 15, 2021);20/06/2021;1306;2021-06-20
106;1035;IJCI 2021;Call for Conference Proceedings – International Journal on Cybernetics & Informatics;N/A;N/A;Feb 20, 2021;20/02/2021;1307;2021-02-20
106;1035;BDSIC--EI, Scopus 2021;2021 3rd International Conference on Big-data Service and Intelligent Computation (BDSIC 2021)--Ei Compendex, Scopus;Nov 19, 2021 - Nov 21, 2021;HuaQiao University, Xiamen?China;Jul 5, 2021;5/07/2021;1308;2021-07-05
106;1035;Scopus-WSM 2021;The 3rd International Conference on Water Security and Management ( WSM 2021);Dec 9, 2021 - Dec 11, 2021;Tokyo, Japan;Jun 10, 2021;10/06/2021;1309;2021-06-10
106;1035;MEDES 2021;The 13th International ACM Conference on Management of Digital EcoSystems;Nov 1, 2021 - Nov 3, 2021;Hammamet - Tunisia;May 24, 2021;24/05/2021;1310;2021-05-24
106;1035;COMPLEXIS 2021;6th International Conference on Complexity, Future Information Systems and Risk;Apr 24, 2021 - Apr 25, 2021;Online Streaming;Jan 19, 2021;19/01/2021;1311;2021-01-19
106;1035;WSM-Scopus 2021;The 3rd International Conference on Water Security and Management ( WSM 2021);Dec 9, 2021 - Dec 11, 2021;Tokyo, Japan;Jun 10, 2021;10/06/2021;1312;2021-06-10
106;1035;SKM 2021;International Conference on Secure Knowledge Management;Oct 8, 2021 - Oct 9, 2021;San Antonio;Jun 21, 2021;21/06/2021;1313;2021-06-21
106;1035;CHIRA 2021;5th International Conference on Computer-Human Interaction Research and Applications;Oct 28, 2021 - Oct 29, 2021;Valletta, Malta;May 18, 2021;18/05/2021;1314;2021-05-18
106;1035;ICENT--EI, Scopus 2021;2021 3rd International Conference on Emerging Networks Technologies (ICENT 2021)--Ei Compendex, Scopus;Sep 22, 2021 - Sep 24, 2021;Okinawa, Japan;May 10, 2021;10/05/2021;1315;2021-05-10
106;1035;ICENT--EI Compendex, Scopus 2021;2021 3rd International Conference on Emerging Networks Technologies (ICENT 2021)--Ei Compendex, Scopus;Sep 22, 2021 - Sep 24, 2021;Okinawa, Japan;May 10, 2021;10/05/2021;1316;2021-05-10
106;1035;EAI BODYNETS 2021;16th EAI International Conference on Body Area Networks: Smart IoT and big data for intelligent health management (Springer, Scopus, ISI, Ei, more);Oct 25, 2021 - Oct 26, 2021;Glasgow, Great Britain;May 13, 2021;13/05/2021;1317;2021-05-13
106;1035;BSHDS 2021;4th International Conference on Business Sustainability, Human Resource Development and Social Responsibility;Jun 19, 2021 - Jun 20, 2021;Hotel Mystays Ochanomizu Conf Center;Jun 9, 2021;9/06/2021;1318;2021-06-09
106;1035;KEAS 2021;4th International Conference on Knowledge Economy, Artificial Intelligence & Social Sciences;May 22, 2021 - May 23, 2021;Hotel Mystays Ochanomizu Conf Center;May 12, 2021;12/05/2021;1319;2021-05-12
106;1035;ICCPM 2021;2021 12th International Conference on Construction and Project Management (ICCPM 2021);Sep 27, 2021 - Sep 29, 2021;Macau, China;May 10, 2021;10/05/2021;1320;2021-05-10
106;1035;IEEE ICICSP--EI, Scopus 2021;2021 4th IEEE International Conference on Information Communication and Signal Processing (ICICSP 2021)--Ei Compendex, Scopus;Sep 24, 2021 - Sep 26, 2021;Shanghai, China;May 10, 2021;10/05/2021;1321;2021-05-10
106;1035;CCIOT--ACM, EI Compendex, Scopus 2021;ACM--2021 6th International Conference on Cloud Computing and Internet of Things (CCIOT 2021)--Ei Compendex, Scopus;Sep 22, 2021 - Sep 24, 2021;Okinawa, Japan;May 10, 2021;10/05/2021;1322;2021-05-10
106;1035;MEDES 2021;The 13th International Conference on Management of Digital EcoSystems;Nov 1, 2021 - Nov 3, 2021;Hammamet - Tunisia;May 24, 2021;24/05/2021;1323;2021-05-24
106;1035;SPBP 2021;The Fourth Workshop on Security and Privacy-enhanced Business Process Management;Sep 6, 2021 - Sep 6, 2021;Rome, Italy;May 24, 2021;24/05/2021;1324;2021-05-24
106;1035;ARRC 2021;Asia Risk & Resilience Conference;Aug 18, 2021 - Aug 19, 2021;Hybrid (Singapore & Online);Feb 8, 2021;8/02/2021;1325;2021-02-08
106;1035;BPMS2 2021;14th Workshop on Social and Human Aspects of Business Process Management;Sep 6, 2021 - Sep 6, 2021;Rome, Italy;May 24, 2021;24/05/2021;1326;2021-05-24
106;1035;ADRS-COVID 2021;Annals of Disaster Risk Sciences - Special edition on the COVID-19 pandemic;N/A;N/A;Mar 15, 2021;15/03/2021;1327;2021-03-15
106;1035;M3E 2021;The 9th International Conference on Monitoring, Modeling & Management of Emergent Economy;May 26, 2021 - May 28, 2021;Odessa, Ukraine;Jan 10, 2021;10/01/2021;1328;2021-01-10
106;1035;IIOM Conference 2021;IIOM International Conference 2021- Obsolescence Management- The Key to Sustainability;May 25, 2021 - May 27, 2021;Munich;Sep 30, 2020;30/09/2020;1329;2020-09-30
106;1036;CEVVE 2021;2021 International Conference on Electric Vehicle and Vehicle Engineering (CEVVE 2021);Sep 17, 2021 - Sep 19, 2021;Frankfurt, Germany;Jul 31, 2021;31/07/2021;1330;2021-07-31
106;1036;CCNC 2021;IEEE Consumer Communications & Networking Conference;Jan 9, 2021 - Jan 12, 2021;Las Vegas, USA;Jul 10, 2021;10/07/2021;1331;2021-07-10
106;1036;ICBMG 2021;2021 The 9th International Conference on Business, Management and Governance (ICBMG 2021);Jul 12, 2021 - Jul 14, 2021;Perth, Australia;Mar 20, 2021;20/03/2021;1332;2021-03-20
106;1036;CRITIS 2021;The 16th International Conference on Critical Information Infrastructures Security;Sep 27, 2021 - Sep 29, 2021;EPFL SwissTech, Lausanne, Switzerland;May 14, 2021;14/05/2021;1333;2021-05-14
106;1036;blockchain_ml_iot 2021;Network and Electronics (MDPI) Joint Special Issue - Blockchain and Machine Learning for IoT: Security and Privacy Challenges;N/A;N/A;Dec 31, 2021;31/12/2021;1334;2021-12-31
106;1036;ICERP--JA, Scopus 2021;2021 the 4th International Conference on Education Research and Policy (ICERP 2021)--JA, Scopus;May 21, 2021 - May 24, 2021;Shanghai, China;Mar 20, 2021;20/03/2021;1335;2021-03-20
106;1036;NISecurity 2021;2021 International Conference on Network and Information Security (NISecurity 2021);Aug 13, 2021 - Aug 15, 2021;Stockholm, Sweden;Jun 30, 2021;30/06/2021;1336;2021-06-30
106;1036;SI: Advanced Technology for IE 2022;Special Issue: Secure and Advanced Technology for Intelligent Environments;Jan 1, 2021 - Jun 1, 2022;JAISE (IOS) journal;Sep 5, 2021;5/09/2021;1337;2021-09-05
106;1036;CANS 2021;Cryptology and Network Security;Dec 13, 2021 - Dec 15, 2021;Vienna, Austria;Jun 1, 2021;1/06/2021;1338;2021-06-01
106;1036;CLUSTER 2021;23rd IEEE Cluster Conference;Sep 7, 2021 - Sep 10, 2021;Portland, Oregon, USA;May 17, 2021 (May 10, 2021);17/05/2021;1339;2021-05-17
106;1036;COVELECT 2021;CfP: Elections in a Democratic Rule of Law State During a Pandemic Sanitary Regime as a Challenge for Public Policy;N/A;N/A;Jul 15, 2021;15/07/2021;1340;2021-07-15
106;1036;SNSA-SI-MDPI 2021;Sensor Networks Security and Applications;N/A;N/A;Jul 31, 2021;31/07/2021;1341;2021-07-31
106;1036;ICSRS--Scopus & EI 2021;2021 5th International Conference on System Reliability and Safety (ICSRS 2021)--Scopus & EI Compendex;Nov 24, 2021 - Nov 26, 2021;Palermo, Italy;Jul 5, 2021;5/07/2021;1342;2021-07-05
106;1036;Telecrisis 2021;“Telecrisis” Co-producing crisis and (tele-)communication technologies. Historical and STS perspectives on governance, design and use;Nov 30, 2020 - Jun 30, 2021;web-based workshop;Nov 30, 2020;30/11/2020;1343;2020-11-30
106;1036;EMERGING 2021;The Thirteenth International Conference on Emerging Networks and Systems Intelligence;Oct 3, 2021 - Oct 7, 2021;Barcelona, Spain;Jul 5, 2021;5/07/2021;1344;2021-07-05
106;1036;EICC 2021;European Interdisciplinary Cybersecurity Conference (EICC 2021);Nov 10, 2021 - Nov 11, 2021;Targu Mures, Romania;Jun 14, 2021;14/06/2021;1345;2021-06-14
106;1036;ECIAIR 2021;European Conference on the Impact of Artificial Intelligence and Robotics;Nov 8, 2021 - Nov 9, 2021;Instituto Universitário de Lisboa (ISCTE;Apr 28, 2021;28/04/2021;1346;2021-04-28
106;1036;ECMLG 2021;17th European Conference on Management Leadership and Governance;Nov 8, 2021 - Nov 9, 2021;Valletta, Malta;Apr 18, 2021;18/04/2021;1347;2021-04-18
106;1036;CCCI 2021;International Conference on Communications, Computing, Cybersecurity, and Informatics;Oct 15, 2021 - Oct 17, 2021;Beijing, China;Jul 24, 2021;24/07/2021;1348;2021-07-24
106;1036;Scopus-WSM 2021;The 3rd International Conference on Water Security and Management ( WSM 2021);Dec 9, 2021 - Dec 11, 2021;Tokyo, Japan;Jun 10, 2021;10/06/2021;1349;2021-06-10
106;1036;SI on SPIHG 2022;IEEE S&P CfP: Special Issue on Security and Privacy Issues of Home Globalization;N/A;N/A;May 15, 2021;15/05/2021;1350;2021-05-15
106;1036;Elec-SI-IIDS 2021;Special Issue on Design of Intelligent Intrusion Detection Systems;N/A;N/A;May 31, 2021;31/05/2021;1351;2021-05-31
106;1036;SPBP 2021;The Fourth Workshop on Security and Privacy-enhanced Business Process Management;Sep 6, 2021 - Sep 6, 2021;Rome, Italy;May 24, 2021;24/05/2021;1352;2021-05-24
106;1036;HOST 2021;IEEE International Symposium on Hardware Oriented Security and Trust (HOST);Dec 5, 2021 - Dec 8, 2021;Washington Dc, USA;May 4, 2021 (Apr 27, 2021);4/05/2021;1353;2021-05-04
106;1036;OGEL Flaring 2021;OGEL Call for papers: Special Issue on Law and Policy for Gas Flaring in a Low-carbon Economy;Oct 1, 2020 - Apr 30, 2021;Online;Apr 30, 2021 (Mar 31, 2021);30/04/2021;1354;2021-04-30
106;1036;CYBER 2021;The Sixth International Conference on Cyber-Technologies and Cyber-Systems;Oct 3, 2021 - Oct 7, 2021;Barcelona, Spain;Jul 5, 2021;5/07/2021;1355;2021-07-05
106;1036;MDPI - Risk Management - Scopus 2021;Special Issue of Journal Applied System Innovation: Risk Management;N/A;N/A;Jul 31, 2021;31/07/2021;1356;2021-07-31
106;1036;ICTS 2021;The 13th International Conference on Information & Communication Technology and System;Oct 20, 2021 - Oct 21, 2021;Virtual conference;Jul 8, 2021;8/07/2021;1357;2021-07-08
106;1036;WSM-Scopus 2021;The 3rd International Conference on Water Security and Management ( WSM 2021);Dec 9, 2021 - Dec 11, 2021;Tokyo, Japan;Jun 10, 2021;10/06/2021;1358;2021-06-10
106;1036;CSW 2021;2021 International Workshop on Cyber Security (CSW 2021);Aug 13, 2021 - Aug 15, 2021;Stockholm, Sweden;Jun 30, 2021;30/06/2021;1359;2021-06-30
106;1036;ICENT--EI Compendex, Scopus 2021;2021 3rd International Conference on Emerging Networks Technologies (ICENT 2021)--Ei Compendex, Scopus;Sep 22, 2021 - Sep 24, 2021;Okinawa, Japan;May 10, 2021;10/05/2021;1360;2021-05-10
106;1036;WoSCA 2021;WoSCA 2021 : 2nd International Workshop on Smart Contract Analysis;Jul 12, 2021 - Jul 16, 2021;Aarhus, Denmark;May 14, 2021;14/05/2021;1361;2021-05-14
106;1036;JSEP SI on Distributed Complex Systems 2021;Special Issue on “Distributed Complex Systems: Governance, Engineering, and Maintenance” - Journal of Software: Evolution and Process (Wiley);N/A;N/A;Feb 28, 2021;28/02/2021;1362;2021-02-28
106;1036;ICEEEP--Scopus, Ei 2021;2021 5th International Conference on Energy Economics and Energy Policy (ICEEEP 2021)--Scopus, Ei Compendex;Apr 15, 2021 - Apr 17, 2021;Barcelona, Spain;Mar 5, 2021;5/03/2021;1363;2021-03-05
106;1036;ICEEEP--Scopus, Ei Compendex 2021;2021 5th International Conference on Energy Economics and Energy Policy (ICEEEP 2021)--Scopus, Ei Compendex;Apr 15, 2021 - Apr 17, 2021;Barcelona, Spain;Mar 5, 2021;5/03/2021;1364;2021-03-05
106;1036;SOTEHEINN 2021;CfP: Social, Technological and Health Innovation: Opportunities and Limitations for the Social Policy, Health Policy, and Environmental Policy;N/A;N/A;May 12, 2021;12/05/2021;1365;2021-05-12
106;1036;Call for Contributions 2021;Beyond the 2ºC: Business and Policy Trajectories to Climate Change Adaptation;Jun 30, 2020 - Feb 28, 2021;Edited book call;Nov 30, 2020 (Jun 30, 2020);30/11/2020;1366;2020-11-30
106;1036;Scopus-WADCE 2021;7th International Workshop on Aircraft Design and Control Engineering (WADCE 2021);Dec 9, 2021 - Dec 12, 2021;Melbourne, Australia;Jun 10, 2021;10/06/2021;1367;2021-06-10
106;1036;SKM 2021;International Conference on Secure Knowledge Management;Oct 8, 2021 - Oct 9, 2021;San Antonio;Jun 21, 2021;21/06/2021;1368;2021-06-21
106;1036;EAI Qshine 2021;17th EAI International Conference on Heterogeneous Networking for Quality, Reliability, Security and Robustness (Springer, Scopus, ISI, Ei, more);Nov 29, 2021 - Nov 30, 2021;Melbourne, Australia;May 20, 2021;20/05/2021;1369;2021-05-20
106;1036;SciSec 2021;3rd International Conference on Science of Cyber Security;Aug 13, 2021 - Aug 15, 2021;Shanghai, China;May 1, 2021;1/05/2021;1370;2021-05-01
106;1036;DSA 2021;The 8th International Conference on Dependable Systems and Their Applications;Aug 5, 2021 - Aug 6, 2021;Yinchuan, China;May 20, 2021;20/05/2021;1371;2021-05-20
106;1036;EntSecGov 2021;Call for Book Chapter: Next-Generation Enterprise Security and Governance;Jan 31, 2021 - Jul 31, 2021;CRC Press USA;Mar 30, 2021 (Jan 31, 2021);30/03/2021;1372;2021-03-30
106;1036;GPPR Spring Edition 2021;Georgetown Public Policy Review - Spring Edition;N/A;N/A;Jan 4, 2021;4/01/2021;1373;2021-01-04
106;1036;FREP 2021;Call for Papers - Fulbright Review of Economics and Policy;N/A;N/A;Mar 30, 2021;30/03/2021;1374;2021-03-30
106;1036;ET 2021;ENERGY TRANSITIONS 2021;Mar 11, 2021 - Mar 12, 2021;Joensuu, Finland;Nov 30, 2020;30/11/2020;1375;2020-11-30
106;1036;BACP 2021;BACP Research Conference 2021: Promoting collaboration in research, policy and practice;May 14, 2021 - May 15, 2021;Manchester UK;Nov 2, 2020;2/11/2020;1376;2020-11-02
106;1036;13-ICGS3 2021;VIRTUAL 13th International Conference on Global Security, Safety & Sustainability, ICGS3-21;Jan 14, 2021 - Jan 15, 2021;London;Sep 3, 2020 (Jul 21, 2020);3/09/2020;1377;2020-09-03
106;1037;TACAS 2021;27th International Conference on Tools and Algorithms for the Construction and Analysis of Systems;Mar 27, 2021 - Apr 1, 2021;Luxembourg;Oct 15, 2020;15/10/2020;1378;2020-10-15
106;1037;PARMA-DITAM 2021;PARMA-DITAM: 12th Workshop on Parallel Programming and Run-Time Management Techniques for Many-core Architectures & 10th Workshop on Design Tools and Architectures for Multi-Core;Jan 19, 2021 - Jan 19, 2021;Virtual;Nov 13, 2021;13/11/2021;1379;2021-11-13
106;1037;Phenomenology and Literature 2021;PHAINOMENON JOURNAL OF PHENOMENOLOGICAL PHILOSOPHY;N/A;N/A;Mar 30, 2021;30/03/2021;1380;2021-03-30
106;1037;ARC 2021;Applied Reconfigurable Computing;Jun 29, 2021 - Jul 1, 2021;Rennes, France;Feb 22, 2021;22/02/2021;1381;2021-02-22
106;1037;TTSDP 2021;13th International Workshop on Tools and Techniques in Software Development Process;Jul 5, 2021 - Jul 8, 2021;Cagliari;Mar 28, 2021;28/03/2021;1382;2021-03-28
106;1037;EAI VALUETOOLS 2021;14th EAI International Conference on Performance Evaluation Methodologies and Tools (Springer, Scopus, ISI, Ei, more);Oct 29, 2021 - Oct 31, 2021;Guangzhou, People's Republic of China;May 13, 2021;13/05/2021;1383;2021-05-13
106;1037;DOLAP 2021;3rd International Workshop on Design, Optimization, Languages and Analytical Processing of Big Data;Mar 23, 2021 - Mar 23, 2021;Nicosia, Cyprus;Dec 8, 2020;8/12/2020;1384;2020-12-08
106;1037;COMPUTATION TOOLS 2021;The Twelfth International Conference on Computational Logics, Algebras, Programming, Tools, and Benchmarking;Apr 18, 2021 - Apr 22, 2021;Porto, Portugal;Feb 5, 2021;5/02/2021;1385;2021-02-05
106;1037;Reconfigurable Systems 2021;Design Methods and Tools Track @ DATE 2021;Feb 1, 2021 - Feb 5, 2021;Grenoble;Sep 21, 2020 (Sep 14, 2020);21/09/2020;1386;2020-09-21
106;1037;OPDEM 2021;Contribute a chapter to the Open Access book Demographic Analysis - Selected Concepts, Tools, and Applications;N/A;N/A;Jan 31, 2021;31/01/2021;1387;2021-01-31
106;1037;ACIIDS 2021;13th Asian Conference on Intelligent Information and Database Systems;Apr 7, 2021 - Apr 10, 2021;Phuket, Thailand;Dec 1, 2020;1/12/2020;1388;2020-12-01
106;1037;EAI TRIDENTCOM 2021;16th EAI International Conference on Tools for Design, Implementation and Verification of Emerging Information Technologies (Springer, Scopus, ISI, Ei, more);Nov 24, 2021 - Nov 26, 2021;Melbourne, Australia;May 3, 2020;3/05/2020;1389;2020-05-03
106;1037;ICTAI 2021;33rd International Conference on Tools with Artificial Intellignce;Nov 1, 2021 - Nov 3, 2021;Washington DC, USA;TBD;NULL;1390;NULL
106;1038;ICDM 2021;21st IEEE International Conference on Data Mining;Dec 7, 2021 - Dec 10, 2021;Auckland, New Zealand;Jun 11, 2021;11/06/2021;1391;2021-06-11
106;1038;ICSRS--Scopus & EI Compendex 2021;2021 5th International Conference on System Reliability and Safety (ICSRS 2021)--Scopus & EI Compendex;Nov 24, 2021 - Nov 26, 2021;Palermo, Italy;Jul 5, 2021;5/07/2021;1392;2021-07-05
106;1038;UVS-Oman 2022;The 2nd International Conference on Unmanned Vehicle Systems (UVS-Oman 2022) - IEEE;Feb 7, 2022 - Feb 9, 2022;Muscat, Oman;Oct 15, 2021;15/10/2021;1393;2021-10-15
106;1038;UBICOMM 2021;The Fifteenth International Conference on Mobile Ubiquitous Computing, Systems, Services and Technologies;Oct 3, 2021 - Oct 7, 2021;Barcelona, Spain;Jul 5, 2021;5/07/2021;1394;2021-07-05
106;1038;EMERGING 2021;The Thirteenth International Conference on Emerging Networks and Systems Intelligence;Oct 3, 2021 - Oct 7, 2021;Barcelona, Spain;Jul 5, 2021;5/07/2021;1395;2021-07-05
106;1038;ISCSIC 2021;2021 5th International Symposium on Computer Science and Intelligent Control;Nov 12, 2021 - Nov 14, 2021;Rome, Italy;Oct 15, 2021;15/10/2021;1396;2021-10-15
106;1038;SI: Advanced Technology for IE 2022;Special Issue: Secure and Advanced Technology for Intelligent Environments;Jan 1, 2021 - Jun 1, 2022;JAISE (IOS) journal;Sep 5, 2021;5/09/2021;1397;2021-09-05
106;1038;ICBA Spring 2021;2021 International Conference on Business Administration - Spring Session;May 7, 2021 - May 7, 2021;National Taipei University;Mar 22, 2021;22/03/2021;1398;2021-03-22
106;1038;AICCC--EI, Scopus 2021;2021 4th Artificial Intelligence and Cloud Computing Conference (AICCC 2021)--EI Compendex, Scopus;Dec 17, 2021 - Dec 19, 2021;Kyoto, Japan;Aug 5, 2021;5/08/2021;1399;2021-08-05
106;1038;CFMAI 2021;2021 3rd International Conference on Frontiers of Mathematics and Artificial Intelligence (CFMAI 2021);Dec 1, 2021 - Dec 3, 2021;Beijing, China;Oct 31, 2021;31/10/2021;1400;2021-10-31
106;1038;CPSIOT 2021;2021International Conference on Cyber Physical Systems and IoT(CPSIOT 2021);Nov 19, 2021 - Nov 21, 2021;Hangzhou, China;Sep 30, 2021;30/09/2021;1401;2021-09-30
106;1038;SI: IE for Health and Well-being 2022;Special issue: Intelligent Environments for Health and Well-being;Jan 1, 2021 - Jun 1, 2020;Applied human informatics (AHI) journal;Sep 5, 2021;5/09/2021;1402;2021-09-05
106;1038;ICRE--EI, Scopus 2021;2021 5th International Conference on Reliability Engineering (ICRE 2021)--EI Compendex, Scopus;Nov 24, 2021 - Nov 26, 2021;Palermo, Italy;Jul 5, 2021;5/07/2021;1403;2021-07-05
106;1038;APEEN 2021;APEEN2021 Conference: Energy Transition and Sustainability;Jan 20, 2021 - Jan 21, 2021;Online;Sep 10, 2021;10/09/2021;1404;2021-09-10
106;1038;CCEAI-Scopus 2022;The 6th International Conference on Control Engineering and Artificial Intelligence (CCEAI 2022);Jan 6, 2022 - Jan 8, 2022;Hokkaido, Japan;Jul 5, 2021;5/07/2021;1405;2021-07-05
106;1038;GLOBAL HEALTH 2021;The Tenth International Conference on Global Health Challenges;Oct 3, 2021 - Oct 7, 2021;Barcelona, Spain;Jul 5, 2021;5/07/2021;1406;2021-07-05
106;1038;Smart Health 2021;Special Issue - Systems, Applications and Services for Smart Health;N/A;N/A;Jun 25, 2021;25/06/2021;1407;2021-06-25
106;1038;ACM SenSys 2021;ACM Conference on Embedded Networked Sensor Systems;Nov 15, 2021 - Nov 17, 2021;Coimbra, Portugal;Jun 4, 2021 (May 28, 2021);4/06/2021;1408;2021-06-04
106;1038;IntelligentIoT 2021;Special Issue Embedded Intelligence in IoT Systems;N/A;N/A;Aug 31, 2021;31/08/2021;1409;2021-08-31
106;1038;CYBER 2021;The Sixth International Conference on Cyber-Technologies and Cyber-Systems;Oct 3, 2021 - Oct 7, 2021;Barcelona, Spain;Jul 5, 2021;5/07/2021;1410;2021-07-05
106;1038;ICSNC 2021;The Sixteenth International Conference on Systems and Networks Communications;Oct 3, 2021 - Oct 7, 2021;Barcelona, Spain;Jul 5, 2021;5/07/2021;1411;2021-07-05
106;1038;VALID 2021;The Thirteenth International Conference on Advances in System Testing and Validation Lifecycle;Oct 3, 2021 - Oct 7, 2021;Barcelona, Spain;Jul 5, 2021;5/07/2021;1412;2021-07-05
106;1038;MDPI Mathematics InSysModGraph 2021;Special Issue Information Systems Modeling Based on Graph Theory;N/A;N/A;Jul 31, 2021;31/07/2021;1413;2021-07-31
106;1038;BDSIC--EI Compendex, Scopus 2021;2021 3rd International Conference on Big-data Service and Intelligent Computation (BDSIC 2021)--Ei Compendex, Scopus;Nov 19, 2021 - Nov 21, 2021;HuaQiao University, Xiamen?China;Jul 5, 2021;5/07/2021;1414;2021-07-05
106;1038;Elec-SI-IIDS 2021;Special Issue on Design of Intelligent Intrusion Detection Systems;N/A;N/A;May 31, 2021;31/05/2021;1415;2021-05-31
106;1038;ICEMGD 2021;The 5th International Conference on Economic Management and Green Development (ICEMGD) Call for Papers;Aug 15, 2021 - Aug 15, 2021;Kennedy Commons Stanford;Apr 5, 2021;5/04/2021;1416;2021-04-05
106;1038;ICNISC 2021;7th Annual International Conference on Network and Information Systems for Computers;Jul 23, 2021 - Jul 25, 2021;Guiyang;Jul 19, 2021;19/07/2021;1417;2021-07-19
106;1038;ICCPR--ACM, Ei, Scopus 2021;ACM--2021 10th International Conference on Computing and Pattern Recognition (ICCPR 2021)--Ei Compendex, Scopus;Oct 15, 2021 - Oct 17, 2021;Shanghai, China;Jun 1, 2021;1/06/2021;1418;2021-06-01
106;1038;ICT-DM 2021;The 7th International Conference on Information and Communication Technologies for Disaster Management;Dec 3, 2021 - Dec 5, 2021;Hangzhou, China;Jun 20, 2021 (Jun 15, 2021);20/06/2021;1419;2021-06-20
106;1038;IEEE 14th MCSoC 2021;14th IEEE International Symposium on Embedded Multicore/Manycore (MCSoC 2021);Dec 20, 2021 - Dec 23, 2021;Singapore;May 31, 2021 (May 25, 2021);31/05/2021;1420;2021-05-31
106;1038;Scopus-WAT 2021;The 3rd International Workshop on Automation Technologies (WAT 2021);Dec 16, 2021 - Dec 18, 2021;Macau SAR, China;Jun 15, 2021;15/06/2021;1421;2021-06-15
106;1038;AES 2021;AES 2021, the 8th International Conference on Antennas and Electromagnetic Systems;Nov 16, 2021 - Nov 19, 2021;Marrakesh - Morocco;Jun 4, 2021;4/06/2021;1422;2021-06-04
106;1038;PLDT 2021;Pandemic, Lockdown and Digital Transformation: Challenges and Opportunities for Public Administration, NGOs and Businesses;N/A;N/A;TBD;NULL;1423;NULL
106;1039;Virtual Environments for Cybersecurity 2021;SIMULATION MODELLING PRACTICE AND THEORY - Special Issue on ''Virtual Environments for Cybersecurity'';N/A;N/A;Dec 31, 2021;31/12/2021;1424;2021-12-31
106;1039;EICC 2021;European Interdisciplinary Cybersecurity Conference (EICC 2021);Nov 10, 2021 - Nov 11, 2021;Targu Mures, Romania;Jun 14, 2021;14/06/2021;1425;2021-06-14
106;1039;Signals (MDPI) 2021;Special Issue on Critical Infrastructures Cybersecurity and Resilience;N/A;N/A;Jun 15, 2021;15/06/2021;1426;2021-06-15
106;1039;CiVEJ 2021;Civil Engineering and Urban Planning: An International Journal;N/A;N/A;Feb 20, 2021;20/02/2021;1427;2021-02-20
106;1039;JoWUA SI 2021;JoWUA Special Issue on Multidisciplinary Solutions to Modern Cybersecurity Challenges;Apr 15, 2020 - Feb 3, 2022;online;Apr 15, 2021;15/04/2021;1428;2021-04-15
106;1039;FI-CyberSec 2021;Feature Papers for Future Internet - Cybersecurity Section;N/A;N/A;Feb 28, 2021;28/02/2021;1429;2021-02-28
106;1039;ICCSA 2021;21st International Conference on Computational Science and its Applications;Jul 5, 2021 - Jul 8, 2021;Cagliari, Italy;Mar 28, 2021;28/03/2021;1430;2021-03-28
106;1039;CCCI 2021;International Conference on Communications, Computing, Cybersecurity, and Informatics;Oct 15, 2021 - Oct 17, 2021;Beijing, China;Jul 24, 2021;24/07/2021;1431;2021-07-24
106;1039;ACM BSCI 2021;The 3rd ACM International Symposium on Blockchain and Secure Critical Infrastructure;Jun 7, 2021 - Jun 11, 2021;Hong Kong, China;Mar 1, 2021;1/03/2021;1432;2021-03-01
106;1039;CSPPSG 2021;MDPI Sensors - Special Issue on 'Cybersecurity and Privacy-Preserving in Modern Smart Grid';N/A;N/A;Feb 28, 2021;28/02/2021;1433;2021-02-28
106;1039;ICRARE 2021;International Conference on Recent Advances in Railway Engineering;May 17, 2021 - May 18, 2021;Tehran, Iran;Feb 18, 2021;18/02/2021;1434;2021-02-18
106;1039;SciSec 2021;3rd International Conference on Science of Cyber Security;Aug 13, 2021 - Aug 15, 2021;Shanghai, China;May 1, 2021;1/05/2021;1435;2021-05-01
106;1039;WTMC 2021;6th International Workshop on Traffic Measurements for Cybersecurity;May 27, 2021 - May 27, 2021;Virtual event;Jan 15, 2021;15/01/2021;1436;2021-01-15
106;1039;HURBE 2021;Making healthy cities for people. Education, research, practice in planning, architecture and engineering;Oct 4, 2021 - Oct 5, 2021;Sarajevo, Bosnia Herzegovina;Mar 15, 2021;15/03/2021;1437;2021-03-15
106;1039;EAI CyDiP (virtual) 2021;EAI International Conference on Emerging Technologies of Cybersecurity and Digital Privacy (online conference);Oct 18, 2021 - Oct 19, 2021;Cyberspace;Apr 19, 2021;19/04/2021;1438;2021-04-19
106;1039;BSidesBUD 2021;BSides Budapest 2021 - Online IT Security Conference;May 27, 2021 - May 27, 2021;Online Stream;Apr 15, 2021;15/04/2021;1439;2021-04-15
106;1039;CfW EICC 2021;Call for Workshops: European Interdisciplinary Cybersecurity Conference (EICC 2021);Nov 10, 2021 - Nov 11, 2021;Targu Mures, Romania;Mar 15, 2021;15/03/2021;1440;2021-03-15
106;1039;SI-5G-SEC-SENSORS 2021;Special Issue on Advances in 5G Networks Security in Sensors journal;N/A;N/A;Mar 1, 2021;1/03/2021;1441;2021-03-01
106;1039;GLOBALCYBER 2021;Call for Chapters: Cybersecurity Capabilities in Developing Nations and Its Impact on Global Security;Mar 21, 2021 - Mar 21, 2021;Virtual;Mar 21, 2021;21/03/2021;1442;2021-03-21
106;1039;OPDEM 2021;Contribute a chapter to the Open Access book Demographic Analysis - Selected Concepts, Tools, and Applications;N/A;N/A;Jan 31, 2021;31/01/2021;1443;2021-01-31
106;1039;ICIST 2021;International Conference on Information and Software Technologies;Oct 14, 2021 - Oct 16, 2021;Kaunas, Lithuania;Mar 16, 2021;16/03/2021;1444;2021-03-16
106;1039;ADRS-COVID 2021;Annals of Disaster Risk Sciences - Special edition on the COVID-19 pandemic;N/A;N/A;Mar 15, 2021;15/03/2021;1445;2021-03-15
106;1039;MWAIS 2021;16th Annual Conference of the Midwest Association for Information Systems (MWAIS);May 20, 2021 - May 21, 2021;Peoria, Illinois;Feb 26, 2021;26/02/2021;1446;2021-02-26
106;1039;AutoSec 2021;3rd International Workshop on Automotive and Autonomous Vehicle Security (AutoSec 2021) co-located with NDSS 2021;Feb 21, 2021 - Feb 21, 2021;Online;Jan 4, 2021;4/01/2021;1447;2021-01-04
106;1039;IEEE SafeThings 2021;5th IEEE Workshop on the Internet of Safe Things (SafeThings'21) Co-located with IEEE S&P 2021;May 27, 2021 - May 27, 2021;Remote;Jan 25, 2021;25/01/2021;1448;2021-01-25
106;1039;CM 2021;Call For Chapters on 'Advances in Cybersecurity Management' (Springer) (Dec. 31);N/A;N/A;Dec 31, 2020;31/12/2020;1449;2020-12-31
106;1039;ISJ Global Perspective 2021;Special Issue: COVID-19 Pandemic Crisis and its Implications on Cybersecurity, Information Security Journal: A Global Perspective;N/A;N/A;Nov 30, 2020;30/11/2020;1450;2020-11-30
106;1039;MLBDACP 2021;The Third International Symposium on Machine Learning and Big Data Analytics For Cybersecurity and Privacy;Mar 23, 2021 - Mar 26, 2021;Warsaw, Poland;Nov 10, 2020;10/11/2020;1451;2020-11-10
106;1039;ICSAC 2021;1st Workshop on Industrial infrastructures Cyber Security for Advancing Collaborative manufacturing;Jan 18, 2021 - Jan 18, 2021;Virtual;Nov 13, 2020;13/11/2020;1452;2020-11-13
106;1039;STP-CPS 2021;3rd INTL. WORKSHOP ON SECURITY TRUST AND PRIVACY FOR EMERGING CYBER PHYSICAL SYSTEMS;Jan 9, 2021 - Jan 12, 2021;Las Vegas, USA;Oct 16, 2020;16/10/2020;1453;2020-10-16
106;1039;ITNG 2021;The 18th Int'l Conf. on Information Technology: New Generations;Apr 10, 2021 - Apr 14, 2021;Las Vegas;Oct 30, 2020;30/10/2020;1454;2020-10-30
106;1039;HICSS Cybersecurity/Privacy in Govt 2021;HICSS 54 Cybersecurity and Privacy in Government;Jan 4, 2021 - Jan 8, 2021;Grand Hyatt Kauai;Jul 15, 2020;15/07/2020;1455;2020-07-15
106;1039;IEEE OJ-CS Special Section 2021;Special Section on Cybersecurity: Privacy, Attack, and Defense;N/A;N/A;Jul 31, 2020;31/07/2020;1456;2020-07-31
106;1039;ICONARP 2021;ICONARP International Journal of Architecture and Planning;N/A;N/A;TBD;NULL;1457;NULL
106;1040;ARRC 2021;Asia Risk & Resilience Conference;Aug 18, 2021 - Aug 19, 2021;Hybrid (Singapore & Online);Feb 8, 2021;8/02/2021;1458;2021-02-08
106;1040;ICT-DM 2021;The 7th International Conference on Information and Communication Technologies for Disaster Management;Dec 3, 2021 - Dec 5, 2021;Hangzhou, China;Jun 20, 2021 (Jun 15, 2021);20/06/2021;1459;2021-06-20
106;1040;ICPM 2021;3rd International Conference on Process Mining;Oct 31, 2021 - Nov 4, 2021;Eindhoven;Jul 1, 2021 (Jun 15, 2021);1/07/2021;1460;2021-07-01
106;1040;SPBP 2021;The Fourth Workshop on Security and Privacy-enhanced Business Process Management;Sep 6, 2021 - Sep 6, 2021;Rome, Italy;May 24, 2021;24/05/2021;1461;2021-05-24
106;1040;BSHDS 2021;4th International Conference on Business Sustainability, Human Resource Development and Social Responsibility;Jun 19, 2021 - Jun 20, 2021;Hotel Mystays Ochanomizu Conf Center;Jun 9, 2021;9/06/2021;1462;2021-06-09
106;1040;BPMS2 2021;14th Workshop on Social and Human Aspects of Business Process Management;Sep 6, 2021 - Sep 6, 2021;Rome, Italy;May 24, 2021;24/05/2021;1463;2021-05-24
106;1040;17th ICTEL Rome 2021;17th ICTEL 2021 – International Conference on Teaching, Education & Learning, 06-07 September, Rome;Sep 6, 2021 - Sep 7, 2021;University of Washington – Rome Center (;Sep 6, 2021 (Sep 5, 2021);6/09/2021;1464;2021-09-06
106;1040;ICBELLP - Eurasia Research 2021;2021 – XIXth International Conference on Business, Education, Law, Language & Psychology (ICBELLP), 29-30 October, Abu Dhabi;Oct 29, 2021 - Oct 30, 2021;Abu Dhabi University (ADU), Abu Dhabi, U;Oct 28, 2021;28/10/2021;1465;2021-10-28
106;1040;TERA - Eurasia Research 2021;19th ICTEL 2021 – International Conference on Teaching, Education & Learning, 11-12 October, Lisbon;Oct 11, 2021 - Oct 12, 2021;Universidade Autónoma de Lisboa (UAL), L;Oct 10, 2021;10/10/2021;1466;2021-10-10
106;1040;2021 – XIIth ICBELLP August, Amsterdam 2021;2021 – XIIth International Conference on Business, Economics, Law, Language & Psychology (ICBELLP), 04-05 August, Amsterdam;Aug 4, 2021 - Aug 4, 2021;NH Hotel Amsterdam-Zuid, Van Leijenbergh;Aug 4, 2021;4/08/2021;1467;2021-08-04
106;1040;20th ICTEL October, Dubai 2021;20th ICTEL 2021 – International Conference on Teaching, Education & Learning, 23-24 October, Dubai;Oct 23, 2021 - Oct 24, 2021;Flora Creek, Deira, Dubai, UAE;Oct 22, 2021;22/10/2021;1468;2021-10-22
106;1040;XIVth ICBELLP September, London 2021;2021 – XIVth International Conference on Business, Economics, Law, Language & Psychology (ICBELLP), 08-09 September, London;Sep 8, 2021 - Sep 9, 2021;The Tomlinson Centre, Queensbridge Road,;Sep 7, 2021;7/09/2021;1469;2021-09-07
106;1040;XVth ICBELLP Sept, Athens 2021;2021 – XVth International Conference on Business, Economics, Law, Language & Psychology (ICBELLP), 16-17 September, Athens;Sep 16, 2021 - Sep 17, 2021;Novotel Athenes, Michail Voda 4, Athens,;Sep 15, 2021;15/09/2021;1470;2021-09-15
106;1040;BSCR 2021;Body-Soul-Crisis-Recovery: An Interdisciplinary Humanities Conference;Apr 23, 2021 - Apr 23, 2021;Virtual;Mar 1, 2021;1/03/2021;1471;2021-03-01
106;1040;TERA - Eurasia Research 2021;15th ICTEL 2021 – International Conference on Teaching, Education & Learning, 06-07 September, London;Sep 6, 2021 - Sep 5, 2021;The Tomlinson Centre, Queensbridge Road,;Sep 4, 2021;4/09/2021;1472;2021-09-04
106;1040;13th ICTEL August, Amsterdam 2021;13th ICTEL 2021 – International Conference on Teaching, Education & Learning, 02-03 August, Amsterdam;Aug 2, 2021 - Aug 3, 2021;NH Hotel Amsterdam-Zuid, Van Leijenbergh;Aug 1, 2021;1/08/2021;1473;2021-08-01
106;1040;PARMA-DITAM 2021;PARMA-DITAM: 12th Workshop on Parallel Programming and Run-Time Management Techniques for Many-core Architectures & 10th Workshop on Design Tools and Architectures for Multi-Core;Jan 19, 2021 - Jan 19, 2021;Virtual;Nov 13, 2021;13/11/2021;1474;2021-11-13
106;1040;16th ICTEL Sept, Athens 2021;16th ICTEL 2021 – International Conference on Teaching, Education & Learning, 14-15 September, Athens;Sep 14, 2021 - Sep 15, 2021;Novotel Athenes, Michail Voda 4, Athens,;Sep 13, 2021;13/09/2021;1475;2021-09-13
106;1040;KMIS 2021;13th International Conference on Knowledge Management and Information Systems;Oct 25, 2021 - Oct 27, 2021;Valletta, Malta;May 18, 2021;18/05/2021;1476;2021-05-18
106;1040;ICBMG 2021;2021 The 9th International Conference on Business, Management and Governance (ICBMG 2021);Jul 12, 2021 - Jul 14, 2021;Perth, Australia;Mar 20, 2021;20/03/2021;1477;2021-03-20
106;1040;ICBELLP - Eurasia Research 2021;2021 – XVIIIth International Conference on Business, Economics, Law, Language & Psychology (ICBELLP), 13-14 October, Lisbon;Oct 13, 2021 - Oct 14, 2021;Universidade Autónoma de Lisboa (UAL), L;Oct 12, 2021;12/10/2021;1478;2021-10-12
106;1040;XVIth ICBELLP Rome 2021;2021 – XVIth International Conference on Business, Economics, Law, Language & Psychology (ICBELLP), 08-09 September, Rome;Sep 8, 2021 - Sep 9, 2021;University of Washington – Rome Center (;Sep 7, 2021;7/09/2021;1479;2021-09-07
106;1040;COVID-19 Challenge 2021;KES International COVID-19 Challenge: A Transition to a more Resilient World- International Virtual Summit;Mar 29, 2021 - Mar 29, 2021;Virtual Summit;Mar 18, 2021 (Mar 1, 2021);18/03/2021;1480;2021-03-18
106;1040;IC3K 2021;13th International Joint Conference on Knowledge Discovery, Knowledge Engineering and Knowledge Management;Oct 25, 2021 - Oct 27, 2021;Valletta, Malta;May 18, 2021;18/05/2021;1481;2021-05-18
106;1040;ICAS 2021;9th International Conference on Asian Studies 2021;Oct 14, 2021 - Oct 15, 2021;Bali, Indonesia;Aug 30, 2021 (Sep 15, 2021);30/08/2021;1482;2021-08-30
106;1040;Spec.Issue on Social Informatics: Scopus 2021;Journal of Social and Business Informatics - Acta Informatica Pragensia;N/A;N/A;Jul 31, 2021;31/07/2021;1483;2021-07-31
106;1040;Scopus-ICDPR 2022;The 6th International Conference on Data Processing and Robotics (ICDPR 2022);Jan 6, 2022 - Jan 8, 2022;Hokkaido, Japan;Jul 5, 2021;5/07/2021;1484;2021-07-05
106;1040;MDPI - Risk Management - Scopus 2021;Special Issue of Journal Applied System Innovation: Risk Management;N/A;N/A;Jul 31, 2021;31/07/2021;1485;2021-07-31
106;1040;ICE-B 2021;18th International Conference on e-Business;Jul 7, 2021 - Jul 9, 2021;Online Streaming;Apr 1, 2021;1/04/2021;1486;2021-04-01
106;1040;BDSIC--EI, Scopus 2021;2021 3rd International Conference on Big-data Service and Intelligent Computation (BDSIC 2021)--Ei Compendex, Scopus;Nov 19, 2021 - Nov 21, 2021;HuaQiao University, Xiamen?China;Jul 5, 2021;5/07/2021;1487;2021-07-05
106;1040;Scopus-WSM 2021;The 3rd International Conference on Water Security and Management ( WSM 2021);Dec 9, 2021 - Dec 11, 2021;Tokyo, Japan;Jun 10, 2021;10/06/2021;1488;2021-06-10
106;1040;MEDES 2021;The 13th International ACM Conference on Management of Digital EcoSystems;Nov 1, 2021 - Nov 3, 2021;Hammamet - Tunisia;May 24, 2021;24/05/2021;1489;2021-05-24
106;1040;WSM-Scopus 2021;The 3rd International Conference on Water Security and Management ( WSM 2021);Dec 9, 2021 - Dec 11, 2021;Tokyo, Japan;Jun 10, 2021;10/06/2021;1490;2021-06-10
106;1040;SKM 2021;International Conference on Secure Knowledge Management;Oct 8, 2021 - Oct 9, 2021;San Antonio;Jun 21, 2021;21/06/2021;1491;2021-06-21
106;1040;CHIRA 2021;5th International Conference on Computer-Human Interaction Research and Applications;Oct 28, 2021 - Oct 29, 2021;Valletta, Malta;May 18, 2021;18/05/2021;1492;2021-05-18
106;1040;ICENT--EI, Scopus 2021;2021 3rd International Conference on Emerging Networks Technologies (ICENT 2021)--Ei Compendex, Scopus;Sep 22, 2021 - Sep 24, 2021;Okinawa, Japan;May 10, 2021;10/05/2021;1493;2021-05-10
106;1040;ICENT--EI Compendex, Scopus 2021;2021 3rd International Conference on Emerging Networks Technologies (ICENT 2021)--Ei Compendex, Scopus;Sep 22, 2021 - Sep 24, 2021;Okinawa, Japan;May 10, 2021;10/05/2021;1494;2021-05-10
106;1040;EAI BODYNETS 2021;16th EAI International Conference on Body Area Networks: Smart IoT and big data for intelligent health management (Springer, Scopus, ISI, Ei, more);Oct 25, 2021 - Oct 26, 2021;Glasgow, Great Britain;May 13, 2021;13/05/2021;1495;2021-05-13
106;1040;ECIE 2021;16th European Conference on Innovation and Entrepreneurship;Sep 16, 2021 - Sep 17, 2021;Lisbon, Portugal;Apr 15, 2021 (Feb 24, 2021);15/04/2021;1496;2021-04-15
106;1040;ICSET--EI Compendex and Scopus 2021;ACM--2021 5th International Conference on E-Society, E-Education and E-Technology (ICSET 2021)--Ei Compendex, Scopus;Aug 21, 2021 - Aug 23, 2021;Taipei, Taiwan;Mar 20, 2021;20/03/2021;1497;2021-03-20
106;1040;KEAS 2021;4th International Conference on Knowledge Economy, Artificial Intelligence & Social Sciences;May 22, 2021 - May 23, 2021;Hotel Mystays Ochanomizu Conf Center;May 12, 2021;12/05/2021;1498;2021-05-12
106;1040;ICCPM 2021;2021 12th International Conference on Construction and Project Management (ICCPM 2021);Sep 27, 2021 - Sep 29, 2021;Macau, China;May 10, 2021;10/05/2021;1499;2021-05-10
106;1040;ICIBE--EI and Scopus 2021;2021 7th International Conference on Industrial and Business Engineering (ICIBE 2021)--Ei Compendex, Scopus;Sep 27, 2021 - Sep 29, 2021;Macau, China;May 10, 2021;10/05/2021;1500;2021-05-10
106;1040;ICIBE--EI Compendex and Scopus 2021;2021 7th International Conference on Industrial and Business Engineering (ICIBE 2021)--Ei Compendex, Scopus;Sep 27, 2021 - Sep 29, 2021;Macau, China;May 10, 2021;10/05/2021;1501;2021-05-10
106;1040;IEEE ICICSP--EI, Scopus 2021;2021 4th IEEE International Conference on Information Communication and Signal Processing (ICICSP 2021)--Ei Compendex, Scopus;Sep 24, 2021 - Sep 26, 2021;Shanghai, China;May 10, 2021;10/05/2021;1502;2021-05-10
106;1040;CCIOT--ACM, EI Compendex, Scopus 2021;ACM--2021 6th International Conference on Cloud Computing and Internet of Things (CCIOT 2021)--Ei Compendex, Scopus;Sep 22, 2021 - Sep 24, 2021;Okinawa, Japan;May 10, 2021;10/05/2021;1503;2021-05-10
106;1040;MEDES 2021;The 13th International Conference on Management of Digital EcoSystems;Nov 1, 2021 - Nov 3, 2021;Hammamet - Tunisia;May 24, 2021;24/05/2021;1504;2021-05-24
106;1040;ADRS-COVID 2021;Annals of Disaster Risk Sciences - Special edition on the COVID-19 pandemic;N/A;N/A;Mar 15, 2021;15/03/2021;1505;2021-03-15
106;1040;ICAEB 2021;2021 5th International Conference on Applied Economics and Business (ICAEB 2021);Aug 28, 2021 - Aug 30, 2021;Stockholm, Sweden;Apr 10, 2021;10/04/2021;1506;2021-04-10
106;1040;IADSDTP 2021;Interdisciplinary Approaches in Data Science and Digital Transformation Practice / in the scope of KES 2021;Sep 8, 2021 - Sep 10, 2021;Szczecin, Poland;Apr 2, 2021;2/04/2021;1507;2021-04-02
106;1040;AIP Journal - Indexed in Scopus 2021;Journal of Social and Business Informatics - Acta Informatica Pragensia;N/A;N/A;Mar 31, 2021;31/03/2021;1508;2021-03-31
106;1041;MDPI - Risk Management - Scopus 2021;Special Issue of Journal Applied System Innovation: Risk Management;N/A;N/A;Jul 31, 2021;31/07/2021;1509;2021-07-31
106;1041;Scopus-WSM 2021;The 3rd International Conference on Water Security and Management ( WSM 2021);Dec 9, 2021 - Dec 11, 2021;Tokyo, Japan;Jun 10, 2021;10/06/2021;1510;2021-06-10
106;1041;WSM-Scopus 2021;The 3rd International Conference on Water Security and Management ( WSM 2021);Dec 9, 2021 - Dec 11, 2021;Tokyo, Japan;Jun 10, 2021;10/06/2021;1511;2021-06-10
106;1041;SPBP 2021;The Fourth Workshop on Security and Privacy-enhanced Business Process Management;Sep 6, 2021 - Sep 6, 2021;Rome, Italy;May 24, 2021;24/05/2021;1512;2021-05-24
106;1041;ICENT--EI Compendex, Scopus 2021;2021 3rd International Conference on Emerging Networks Technologies (ICENT 2021)--Ei Compendex, Scopus;Sep 22, 2021 - Sep 24, 2021;Okinawa, Japan;May 10, 2021;10/05/2021;1513;2021-05-10
106;1041;SKM 2021;International Conference on Secure Knowledge Management;Oct 8, 2021 - Oct 9, 2021;San Antonio;Jun 21, 2021;21/06/2021;1514;2021-06-21
106;1041;CEVVE 2021;2021 International Conference on Electric Vehicle and Vehicle Engineering (CEVVE 2021);Sep 17, 2021 - Sep 19, 2021;Frankfurt, Germany;Jul 31, 2021;31/07/2021;1515;2021-07-31
106;1041;ATVA 2021;The 19th International Symposium on Automated Technology for Verification and Analysis;Oct 18, 2021 - Oct 22, 2021;Gold Coast, Australia;Apr 9, 2021;9/04/2021;1516;2021-04-09
106;1041;ICPC 2021;29th IEEE/ACM International Conference on Program Comprehension;May 28, 2021 - May 29, 2021;Madrid, Spain;Jan 29, 2021 (Jan 22, 2021);29/01/2021;1517;2021-01-29
106;1041;17th ICTEL Rome 2021;17th ICTEL 2021 – International Conference on Teaching, Education & Learning, 06-07 September, Rome;Sep 6, 2021 - Sep 7, 2021;University of Washington – Rome Center (;Sep 6, 2021 (Sep 5, 2021);6/09/2021;1518;2021-09-06
106;1041;TERA - Eurasia Research 2021;19th ICTEL 2021 – International Conference on Teaching, Education & Learning, 11-12 October, Lisbon;Oct 11, 2021 - Oct 12, 2021;Universidade Autónoma de Lisboa (UAL), L;Oct 10, 2021;10/10/2021;1519;2021-10-10
106;1041;CCNC 2021;IEEE Consumer Communications & Networking Conference;Jan 9, 2021 - Jan 12, 2021;Las Vegas, USA;Jul 10, 2021;10/07/2021;1520;2021-07-10
106;1041;20th ICTEL October, Dubai 2021;20th ICTEL 2021 – International Conference on Teaching, Education & Learning, 23-24 October, Dubai;Oct 23, 2021 - Oct 24, 2021;Flora Creek, Deira, Dubai, UAE;Oct 22, 2021;22/10/2021;1521;2021-10-22
106;1041;CRITIS 2021;The 16th International Conference on Critical Information Infrastructures Security;Sep 27, 2021 - Sep 29, 2021;EPFL SwissTech, Lausanne, Switzerland;May 14, 2021;14/05/2021;1522;2021-05-14
106;1041;blockchain_ml_iot 2021;Network and Electronics (MDPI) Joint Special Issue - Blockchain and Machine Learning for IoT: Security and Privacy Challenges;N/A;N/A;Dec 31, 2021;31/12/2021;1523;2021-12-31
106;1041;TERA - Eurasia Research 2021;15th ICTEL 2021 – International Conference on Teaching, Education & Learning, 06-07 September, London;Sep 6, 2021 - Sep 5, 2021;The Tomlinson Centre, Queensbridge Road,;Sep 4, 2021;4/09/2021;1524;2021-09-04
106;1041;13th ICTEL August, Amsterdam 2021;13th ICTEL 2021 – International Conference on Teaching, Education & Learning, 02-03 August, Amsterdam;Aug 2, 2021 - Aug 3, 2021;NH Hotel Amsterdam-Zuid, Van Leijenbergh;Aug 1, 2021;1/08/2021;1525;2021-08-01
106;1041;PARMA-DITAM 2021;PARMA-DITAM: 12th Workshop on Parallel Programming and Run-Time Management Techniques for Many-core Architectures & 10th Workshop on Design Tools and Architectures for Multi-Core;Jan 19, 2021 - Jan 19, 2021;Virtual;Nov 13, 2021;13/11/2021;1526;2021-11-13
106;1041;16th ICTEL Sept, Athens 2021;16th ICTEL 2021 – International Conference on Teaching, Education & Learning, 14-15 September, Athens;Sep 14, 2021 - Sep 15, 2021;Novotel Athenes, Michail Voda 4, Athens,;Sep 13, 2021;13/09/2021;1527;2021-09-13
106;1041;KMIS 2021;13th International Conference on Knowledge Management and Information Systems;Oct 25, 2021 - Oct 27, 2021;Valletta, Malta;May 18, 2021;18/05/2021;1528;2021-05-18
106;1041;NISecurity 2021;2021 International Conference on Network and Information Security (NISecurity 2021);Aug 13, 2021 - Aug 15, 2021;Stockholm, Sweden;Jun 30, 2021;30/06/2021;1529;2021-06-30
106;1041;SI: Advanced Technology for IE 2022;Special Issue: Secure and Advanced Technology for Intelligent Environments;Jan 1, 2021 - Jun 1, 2022;JAISE (IOS) journal;Sep 5, 2021;5/09/2021;1530;2021-09-05
106;1041;CANS 2021;Cryptology and Network Security;Dec 13, 2021 - Dec 15, 2021;Vienna, Austria;Jun 1, 2021;1/06/2021;1531;2021-06-01
106;1041;CLUSTER 2021;23rd IEEE Cluster Conference;Sep 7, 2021 - Sep 10, 2021;Portland, Oregon, USA;May 17, 2021 (May 10, 2021);17/05/2021;1532;2021-05-17
106;1041;SNSA-SI-MDPI 2021;Sensor Networks Security and Applications;N/A;N/A;Jul 31, 2021;31/07/2021;1533;2021-07-31
106;1041;ICSRS--Scopus & EI 2021;2021 5th International Conference on System Reliability and Safety (ICSRS 2021)--Scopus & EI Compendex;Nov 24, 2021 - Nov 26, 2021;Palermo, Italy;Jul 5, 2021;5/07/2021;1534;2021-07-05
106;1041;ICPM 2021;3rd International Conference on Process Mining;Oct 31, 2021 - Nov 4, 2021;Eindhoven;Jul 1, 2021 (Jun 15, 2021);1/07/2021;1535;2021-07-01
106;1041;IC3K 2021;13th International Joint Conference on Knowledge Discovery, Knowledge Engineering and Knowledge Management;Oct 25, 2021 - Oct 27, 2021;Valletta, Malta;May 18, 2021;18/05/2021;1536;2021-05-18
106;1041;EMERGING 2021;The Thirteenth International Conference on Emerging Networks and Systems Intelligence;Oct 3, 2021 - Oct 7, 2021;Barcelona, Spain;Jul 5, 2021;5/07/2021;1537;2021-07-05
106;1041;Scopus-ICDPR 2022;The 6th International Conference on Data Processing and Robotics (ICDPR 2022);Jan 6, 2022 - Jan 8, 2022;Hokkaido, Japan;Jul 5, 2021;5/07/2021;1538;2021-07-05
106;1041;ICT-DM 2021;The 7th International Conference on Information and Communication Technologies for Disaster Management;Dec 3, 2021 - Dec 5, 2021;Hangzhou, China;Jun 20, 2021 (Jun 15, 2021);20/06/2021;1539;2021-06-20
106;1041;EICC 2021;European Interdisciplinary Cybersecurity Conference (EICC 2021);Nov 10, 2021 - Nov 11, 2021;Targu Mures, Romania;Jun 14, 2021;14/06/2021;1540;2021-06-14
106;1041;CCCI 2021;International Conference on Communications, Computing, Cybersecurity, and Informatics;Oct 15, 2021 - Oct 17, 2021;Beijing, China;Jul 24, 2021;24/07/2021;1541;2021-07-24
106;1041;BDSIC--EI, Scopus 2021;2021 3rd International Conference on Big-data Service and Intelligent Computation (BDSIC 2021)--Ei Compendex, Scopus;Nov 19, 2021 - Nov 21, 2021;HuaQiao University, Xiamen?China;Jul 5, 2021;5/07/2021;1542;2021-07-05
106;1041;SI on SPIHG 2022;IEEE S&P CfP: Special Issue on Security and Privacy Issues of Home Globalization;N/A;N/A;May 15, 2021;15/05/2021;1543;2021-05-15
106;1041;Elec-SI-IIDS 2021;Special Issue on Design of Intelligent Intrusion Detection Systems;N/A;N/A;May 31, 2021;31/05/2021;1544;2021-05-31
106;1041;MEDES 2021;The 13th International ACM Conference on Management of Digital EcoSystems;Nov 1, 2021 - Nov 3, 2021;Hammamet - Tunisia;May 24, 2021;24/05/2021;1545;2021-05-24
106;1041;HOST 2021;IEEE International Symposium on Hardware Oriented Security and Trust (HOST);Dec 5, 2021 - Dec 8, 2021;Washington Dc, USA;May 4, 2021 (Apr 27, 2021);4/05/2021;1546;2021-05-04
106;1041;CYBER 2021;The Sixth International Conference on Cyber-Technologies and Cyber-Systems;Oct 3, 2021 - Oct 7, 2021;Barcelona, Spain;Jul 5, 2021;5/07/2021;1547;2021-07-05
106;1041;ICTS 2021;The 13th International Conference on Information & Communication Technology and System;Oct 20, 2021 - Oct 21, 2021;Virtual conference;Jul 8, 2021;8/07/2021;1548;2021-07-08
106;1041;CSW 2021;2021 International Workshop on Cyber Security (CSW 2021);Aug 13, 2021 - Aug 15, 2021;Stockholm, Sweden;Jun 30, 2021;30/06/2021;1549;2021-06-30
106;1041;CHIRA 2021;5th International Conference on Computer-Human Interaction Research and Applications;Oct 28, 2021 - Oct 29, 2021;Valletta, Malta;May 18, 2021;18/05/2021;1550;2021-05-18
106;1041;ICENT--EI, Scopus 2021;2021 3rd International Conference on Emerging Networks Technologies (ICENT 2021)--Ei Compendex, Scopus;Sep 22, 2021 - Sep 24, 2021;Okinawa, Japan;May 10, 2021;10/05/2021;1551;2021-05-10
106;1041;WoSCA 2021;WoSCA 2021 : 2nd International Workshop on Smart Contract Analysis;Jul 12, 2021 - Jul 16, 2021;Aarhus, Denmark;May 14, 2021;14/05/2021;1552;2021-05-14
106;1041;EAI BODYNETS 2021;16th EAI International Conference on Body Area Networks: Smart IoT and big data for intelligent health management (Springer, Scopus, ISI, Ei, more);Oct 25, 2021 - Oct 26, 2021;Glasgow, Great Britain;May 13, 2021;13/05/2021;1553;2021-05-13
106;1041;BSHDS 2021;4th International Conference on Business Sustainability, Human Resource Development and Social Responsibility;Jun 19, 2021 - Jun 20, 2021;Hotel Mystays Ochanomizu Conf Center;Jun 9, 2021;9/06/2021;1554;2021-06-09
106;1041;Scopus-WADCE 2021;7th International Workshop on Aircraft Design and Control Engineering (WADCE 2021);Dec 9, 2021 - Dec 12, 2021;Melbourne, Australia;Jun 10, 2021;10/06/2021;1555;2021-06-10
106;1041;EAI Qshine 2021;17th EAI International Conference on Heterogeneous Networking for Quality, Reliability, Security and Robustness (Springer, Scopus, ISI, Ei, more);Nov 29, 2021 - Nov 30, 2021;Melbourne, Australia;May 20, 2021;20/05/2021;1556;2021-05-20
106;1041;SciSec 2021;3rd International Conference on Science of Cyber Security;Aug 13, 2021 - Aug 15, 2021;Shanghai, China;May 1, 2021;1/05/2021;1557;2021-05-01
106;1041;KEAS 2021;4th International Conference on Knowledge Economy, Artificial Intelligence & Social Sciences;May 22, 2021 - May 23, 2021;Hotel Mystays Ochanomizu Conf Center;May 12, 2021;12/05/2021;1558;2021-05-12
106;1041;ICCPM 2021;2021 12th International Conference on Construction and Project Management (ICCPM 2021);Sep 27, 2021 - Sep 29, 2021;Macau, China;May 10, 2021;10/05/2021;1559;2021-05-10
106;1042;CEVVE 2021;2021 International Conference on Electric Vehicle and Vehicle Engineering (CEVVE 2021);Sep 17, 2021 - Sep 19, 2021;Frankfurt, Germany;Jul 31, 2021;31/07/2021;1560;2021-07-31
106;1042;CCNC 2021;IEEE Consumer Communications & Networking Conference;Jan 9, 2021 - Jan 12, 2021;Las Vegas, USA;Jul 10, 2021;10/07/2021;1561;2021-07-10
106;1042;CRITIS 2021;The 16th International Conference on Critical Information Infrastructures Security;Sep 27, 2021 - Sep 29, 2021;EPFL SwissTech, Lausanne, Switzerland;May 14, 2021;14/05/2021;1562;2021-05-14
106;1042;blockchain_ml_iot 2021;Network and Electronics (MDPI) Joint Special Issue - Blockchain and Machine Learning for IoT: Security and Privacy Challenges;N/A;N/A;Dec 31, 2021;31/12/2021;1563;2021-12-31
106;1042;NISecurity 2021;2021 International Conference on Network and Information Security (NISecurity 2021);Aug 13, 2021 - Aug 15, 2021;Stockholm, Sweden;Jun 30, 2021;30/06/2021;1564;2021-06-30
106;1042;SI: Advanced Technology for IE 2022;Special Issue: Secure and Advanced Technology for Intelligent Environments;Jan 1, 2021 - Jun 1, 2022;JAISE (IOS) journal;Sep 5, 2021;5/09/2021;1565;2021-09-05
106;1042;CANS 2021;Cryptology and Network Security;Dec 13, 2021 - Dec 15, 2021;Vienna, Austria;Jun 1, 2021;1/06/2021;1566;2021-06-01
106;1042;CLUSTER 2021;23rd IEEE Cluster Conference;Sep 7, 2021 - Sep 10, 2021;Portland, Oregon, USA;May 17, 2021 (May 10, 2021);17/05/2021;1567;2021-05-17
106;1042;ICSRS--Scopus & EI 2021;2021 5th International Conference on System Reliability and Safety (ICSRS 2021)--Scopus & EI Compendex;Nov 24, 2021 - Nov 26, 2021;Palermo, Italy;Jul 5, 2021;5/07/2021;1568;2021-07-05
106;1042;SNSA-SI-MDPI 2021;Sensor Networks Security and Applications;N/A;N/A;Jul 31, 2021;31/07/2021;1569;2021-07-31
106;1042;EMERGING 2021;The Thirteenth International Conference on Emerging Networks and Systems Intelligence;Oct 3, 2021 - Oct 7, 2021;Barcelona, Spain;Jul 5, 2021;5/07/2021;1570;2021-07-05
106;1042;EICC 2021;European Interdisciplinary Cybersecurity Conference (EICC 2021);Nov 10, 2021 - Nov 11, 2021;Targu Mures, Romania;Jun 14, 2021;14/06/2021;1571;2021-06-14
106;1042;CCCI 2021;International Conference on Communications, Computing, Cybersecurity, and Informatics;Oct 15, 2021 - Oct 17, 2021;Beijing, China;Jul 24, 2021;24/07/2021;1572;2021-07-24
106;1042;Scopus-WSM 2021;The 3rd International Conference on Water Security and Management ( WSM 2021);Dec 9, 2021 - Dec 11, 2021;Tokyo, Japan;Jun 10, 2021;10/06/2021;1573;2021-06-10
106;1042;SI on SPIHG 2022;IEEE S&P CfP: Special Issue on Security and Privacy Issues of Home Globalization;N/A;N/A;May 15, 2021;15/05/2021;1574;2021-05-15
106;1042;HOST 2021;IEEE International Symposium on Hardware Oriented Security and Trust (HOST);Dec 5, 2021 - Dec 8, 2021;Washington Dc, USA;May 4, 2021 (Apr 27, 2021);4/05/2021;1575;2021-05-04
106;1042;SPBP 2021;The Fourth Workshop on Security and Privacy-enhanced Business Process Management;Sep 6, 2021 - Sep 6, 2021;Rome, Italy;May 24, 2021;24/05/2021;1576;2021-05-24
106;1042;Elec-SI-IIDS 2021;Special Issue on Design of Intelligent Intrusion Detection Systems;N/A;N/A;May 31, 2021;31/05/2021;1577;2021-05-31
106;1042;MDPI - Risk Management - Scopus 2021;Special Issue of Journal Applied System Innovation: Risk Management;N/A;N/A;Jul 31, 2021;31/07/2021;1578;2021-07-31
106;1042;ICTS 2021;The 13th International Conference on Information & Communication Technology and System;Oct 20, 2021 - Oct 21, 2021;Virtual conference;Jul 8, 2021;8/07/2021;1579;2021-07-08
106;1042;CYBER 2021;The Sixth International Conference on Cyber-Technologies and Cyber-Systems;Oct 3, 2021 - Oct 7, 2021;Barcelona, Spain;Jul 5, 2021;5/07/2021;1580;2021-07-05
106;1042;CSW 2021;2021 International Workshop on Cyber Security (CSW 2021);Aug 13, 2021 - Aug 15, 2021;Stockholm, Sweden;Jun 30, 2021;30/06/2021;1581;2021-06-30
106;1042;WSM-Scopus 2021;The 3rd International Conference on Water Security and Management ( WSM 2021);Dec 9, 2021 - Dec 11, 2021;Tokyo, Japan;Jun 10, 2021;10/06/2021;1582;2021-06-10
106;1042;WoSCA 2021;WoSCA 2021 : 2nd International Workshop on Smart Contract Analysis;Jul 12, 2021 - Jul 16, 2021;Aarhus, Denmark;May 14, 2021;14/05/2021;1583;2021-05-14
106;1042;ICENT--EI Compendex, Scopus 2021;2021 3rd International Conference on Emerging Networks Technologies (ICENT 2021)--Ei Compendex, Scopus;Sep 22, 2021 - Sep 24, 2021;Okinawa, Japan;May 10, 2021;10/05/2021;1584;2021-05-10
106;1042;SKM 2021;International Conference on Secure Knowledge Management;Oct 8, 2021 - Oct 9, 2021;San Antonio;Jun 21, 2021;21/06/2021;1585;2021-06-21
106;1042;Scopus-WADCE 2021;7th International Workshop on Aircraft Design and Control Engineering (WADCE 2021);Dec 9, 2021 - Dec 12, 2021;Melbourne, Australia;Jun 10, 2021;10/06/2021;1586;2021-06-10
106;1042;EAI Qshine 2021;17th EAI International Conference on Heterogeneous Networking for Quality, Reliability, Security and Robustness (Springer, Scopus, ISI, Ei, more);Nov 29, 2021 - Nov 30, 2021;Melbourne, Australia;May 20, 2021;20/05/2021;1587;2021-05-20
106;1042;SciSec 2021;3rd International Conference on Science of Cyber Security;Aug 13, 2021 - Aug 15, 2021;Shanghai, China;May 1, 2021;1/05/2021;1588;2021-05-01
106;1042;DSA 2021;The 8th International Conference on Dependable Systems and Their Applications;Aug 5, 2021 - Aug 6, 2021;Yinchuan, China;May 20, 2021;20/05/2021;1589;2021-05-20
107;1043;CYBER 2021;The Sixth International Conference on Cyber-Technologies and Cyber-Systems;Oct 3, 2021 - Oct 7, 2021;Barcelona, Spain;Jul 5, 2021;5/07/2021;1590;2021-07-05
107;1043;ADRW 2021;«Archives during rebellions and wars». From the age of Napoleon to the cyber war era;May 19, 2021 - May 21, 2021;Milan;Sep 30, 2029;30/09/2029;1591;2029-09-30
107;1043;ICDM 2021;21st IEEE International Conference on Data Mining;Dec 7, 2021 - Dec 10, 2021;Auckland, New Zealand;Jun 11, 2021;11/06/2021;1592;2021-06-11
107;1043;KR 2021;18th International Conference on Principles of Knowledge Representation and Reasoning;Nov 6, 2021 - Nov 12, 2021;Hanoi, Vietnam;Mar 31, 2021 (Mar 24, 2021);31/03/2021;1593;2021-03-31
107;1043;SE4ICPS 2021;The 1st IEEE International Workshop on Software Engineering for Industrial Cyber-Physical Systems;Jul 12, 2021 - Jul 16, 2021;Virtual;Apr 21, 2021;21/04/2021;1594;2021-04-21
107;1043;CPSIOT 2021;2021International Conference on Cyber Physical Systems and IoT(CPSIOT 2021);Nov 19, 2021 - Nov 21, 2021;Hangzhou, China;Sep 30, 2021;30/09/2021;1595;2021-09-30
107;1043;CRITIS 2021;The 16th International Conference on Critical Information Infrastructures Security;Sep 27, 2021 - Sep 29, 2021;EPFL SwissTech, Lausanne, Switzerland;May 14, 2021;14/05/2021;1596;2021-05-14
107;1043;QCW 2021;Questioning the Crime of Witchcraft: Definitions, Receptions and Realities (14th-16th Centuries);May 20, 2021 - May 21, 2021;Paris, France;Nov 30, 2020;30/11/2020;1597;2020-11-30
107;1043;IEEE CSR 2021;2021 IEEE International Conference on Cyber Security and Resilience;Jul 26, 2021 - Jul 28, 2021;Virtual;Mar 15, 2021;15/03/2021;1598;2021-03-15
107;1043;TRUECRIME 2021;True Crime: An Inclusive Interdisciplinary Conference;May 22, 2021 - May 22, 2021;Online;Feb 26, 2021;26/02/2021;1599;2021-02-26
107;1043;CSW 2021;2021 International Workshop on Cyber Security (CSW 2021);Aug 13, 2021 - Aug 15, 2021;Stockholm, Sweden;Jun 30, 2021;30/06/2021;1600;2021-06-30
107;1043;CIMSS 2021;International Workshop on Critical Infrastructure and Manufacturing System Security;Jun 21, 2021 - Jun 24, 2021;Kamakura, Japan;Mar 20, 2021;20/03/2021;1601;2021-03-20
107;1043;SciSec 2021;3rd International Conference on Science of Cyber Security;Aug 13, 2021 - Aug 15, 2021;Shanghai, China;May 1, 2021;1/05/2021;1602;2021-05-01
107;1043;CODES + ISSS 2021;International Conference on Hardware/Software Codesign and System Synthesis;Oct 10, 2021 - Oct 15, 2021;virtual?;Apr 9, 2021 (Apr 2, 2021);9/04/2021;1603;2021-04-09
107;1043;CPS-ANNSIM 2021;CPS Track in the ANNSIM Conference;Jul 19, 2021 - Jul 22, 2021;GEORGE MASON UNIVERSITY, FAIRFAX, VIRGIN;Mar 1, 2021;1/03/2021;1604;2021-03-01
107;1043;ICC-CCNCPS 2021;IEEE ICC'2021 workshop on Communication, Computing, and Networking in Cyber Physical Systems;Jun 14, 2021 - Jun 18, 2021;Montreal, Canada;Feb 19, 2021;19/02/2021;1605;2021-02-19
107;1043;IJASA 2021;The International Journal of Ambient Systems and applications;N/A;N/A;Feb 20, 2021;20/02/2021;1606;2021-02-20
107;1043;ISDFS 2021;9th International Symposium on Digital Forensics and Security;Jun 28, 2021 - Jun 29, 2021;Elazig, Turkey and Online;Apr 2, 2021;2/04/2021;1607;2021-04-02
107;1043;ANNSIM 2021;2021 Annual Modeling and Simulation Conference;Jul 19, 2021 - Jul 22, 2021;Fairfax, Virginia;Mar 1, 2021;1/03/2021;1608;2021-03-01
107;1043;ICIMP 2021;The Sixteenth International Conference on Internet Monitoring and Protection;May 30, 2021 - Jun 3, 2021;Valencia, Spain;Mar 2, 2021;2/03/2021;1609;2021-03-02
107;1043;JSys Mar 2021;Journal for Systems Research - March 2021;N/A;N/A;Mar 1, 2021;1/03/2021;1610;2021-03-01
107;1043;CPHS21;CFP: The First International Workshop on Cyber-Physical-Human System Design and Implementation;May 18, 2021 - May 18, 2021;Virtual;Feb 21, 2021;21/02/2021;1611;2021-02-21
107;1043;IEEE IDS 2021;The 6th IEEE International Conference on Intelligent Data and Security;May 15, 2021 - May 17, 2021;New York, USA;Feb 15, 2021;15/02/2021;1612;2021-02-15
107;1043;ICHST--Ei Compendex, Scopus 2021;2021 3rd International Conference on Hardware Security and Trust (ICHST 2021)--Ei Compendex, Scopus;Jul 9, 2021 - Jul 11, 2021;Nanjing, China;Feb 20, 2021;20/02/2021;1613;2021-02-20
107;1043;ECBS 2021;7th Conference on the Engineering of Computer Based Systems;May 26, 2021 - May 27, 2021;Novi Sad, Serbia;Feb 1, 2021;1/02/2021;1614;2021-02-01
107;1043;IJSPTM 2021;International Journal of Security, Privacy and Trust Management;N/A;N/A;Feb 20, 2021;20/02/2021;1615;2021-02-20
107;1043;JANT 2021;International Journal of Antennas;N/A;N/A;Feb 20, 2021;20/02/2021;1616;2021-02-20
107;1043;ARRC 2021;Asia Risk & Resilience Conference;Aug 18, 2021 - Aug 19, 2021;Hybrid (Singapore & Online);Feb 8, 2021;8/02/2021;1617;2021-02-08
107;1043;IoTDI 2021;ACM/IEEE IoTDI 2021: Call for Posters/Demos;May 18, 2021 - May 21, 2021;Nashville, Tennessee, USA;Jan 26, 2021;26/01/2021;1618;2021-01-26
107;1043;IoTDI 2021;ACM/IEEE IoTDI 2021: Call for Posters/Demos;May 18, 2021 - May 21, 2021;Nashville, Tennessee, USA;Jan 26, 2021;26/01/2021;1619;2021-01-26
107;1043;IoTDI 2021;ACM/IEEE IoTDI 2021: Call for Posters/Demos;May 18, 2021 - May 21, 2021;Nashville, Tennessee, USA;Jan 26, 2021;26/01/2021;1620;2021-01-26
107;1043;ICCCE Springer 2021;4th Edition of International Conference on Communications and Cyber Physical Engineering;Apr 9, 2021 - Apr 10, 2021;Pune;Jan 30, 2021;30/01/2021;1621;2021-01-30
107;1043;Prohibition 2021;Prohibition of criminal organizations.;N/A;N/A;TBD;NULL;1622;NULL
107;1044;ADRW 2021;«Archives during rebellions and wars». From the age of Napoleon to the cyber war era;May 19, 2021 - May 21, 2021;Milan;Sep 30, 2029;30/09/2029;1623;2029-09-30
107;1044;ICDM 2021;21st IEEE International Conference on Data Mining;Dec 7, 2021 - Dec 10, 2021;Auckland, New Zealand;Jun 11, 2021;11/06/2021;1624;2021-06-11
107;1044;2021 – XIIth ICBELLP August, Amsterdam 2021;2021 – XIIth International Conference on Business, Economics, Law, Language & Psychology (ICBELLP), 04-05 August, Amsterdam;Aug 4, 2021 - Aug 4, 2021;NH Hotel Amsterdam-Zuid, Van Leijenbergh;Aug 4, 2021;4/08/2021;1625;2021-08-04
107;1044;XIVth ICBELLP September, London 2021;2021 – XIVth International Conference on Business, Economics, Law, Language & Psychology (ICBELLP), 08-09 September, London;Sep 8, 2021 - Sep 9, 2021;The Tomlinson Centre, Queensbridge Road,;Sep 7, 2021;7/09/2021;1626;2021-09-07
107;1044;XVth ICBELLP Sept, Athens 2021;2021 – XVth International Conference on Business, Economics, Law, Language & Psychology (ICBELLP), 16-17 September, Athens;Sep 16, 2021 - Sep 17, 2021;Novotel Athenes, Michail Voda 4, Athens,;Sep 15, 2021;15/09/2021;1627;2021-09-15
107;1044;ICBELLP - Eurasia Research 2021;2021 – XIXth International Conference on Business, Education, Law, Language & Psychology (ICBELLP), 29-30 October, Abu Dhabi;Oct 29, 2021 - Oct 30, 2021;Abu Dhabi University (ADU), Abu Dhabi, U;Oct 28, 2021;28/10/2021;1628;2021-10-28
107;1044;KR 2021;18th International Conference on Principles of Knowledge Representation and Reasoning;Nov 6, 2021 - Nov 12, 2021;Hanoi, Vietnam;Mar 31, 2021 (Mar 24, 2021);31/03/2021;1629;2021-03-31
107;1044;ICBELLP - Eurasia Research 2021;2021 – XVIIIth International Conference on Business, Economics, Law, Language & Psychology (ICBELLP), 13-14 October, Lisbon;Oct 13, 2021 - Oct 14, 2021;Universidade Autónoma de Lisboa (UAL), L;Oct 12, 2021;12/10/2021;1630;2021-10-12
107;1044;SE4ICPS 2021;The 1st IEEE International Workshop on Software Engineering for Industrial Cyber-Physical Systems;Jul 12, 2021 - Jul 16, 2021;Virtual;Apr 21, 2021;21/04/2021;1631;2021-04-21
107;1044;XVIth ICBELLP Rome 2021;2021 – XVIth International Conference on Business, Economics, Law, Language & Psychology (ICBELLP), 08-09 September, Rome;Sep 8, 2021 - Sep 9, 2021;University of Washington – Rome Center (;Sep 7, 2021;7/09/2021;1632;2021-09-07
107;1044;CPSIOT 2021;2021International Conference on Cyber Physical Systems and IoT(CPSIOT 2021);Nov 19, 2021 - Nov 21, 2021;Hangzhou, China;Sep 30, 2021;30/09/2021;1633;2021-09-30
107;1044;CRITIS 2021;The 16th International Conference on Critical Information Infrastructures Security;Sep 27, 2021 - Sep 29, 2021;EPFL SwissTech, Lausanne, Switzerland;May 14, 2021;14/05/2021;1634;2021-05-14
107;1044;IEEE CSR 2021;2021 IEEE International Conference on Cyber Security and Resilience;Jul 26, 2021 - Jul 28, 2021;Virtual;Mar 15, 2021;15/03/2021;1635;2021-03-15
107;1044;CYBER 2021;The Sixth International Conference on Cyber-Technologies and Cyber-Systems;Oct 3, 2021 - Oct 7, 2021;Barcelona, Spain;Jul 5, 2021;5/07/2021;1636;2021-07-05
107;1044;COVELECT 2021;CfP: Elections in a Democratic Rule of Law State During a Pandemic Sanitary Regime as a Challenge for Public Policy;N/A;N/A;Jul 15, 2021;15/07/2021;1637;2021-07-15
107;1044;CSW 2021;2021 International Workshop on Cyber Security (CSW 2021);Aug 13, 2021 - Aug 15, 2021;Stockholm, Sweden;Jun 30, 2021;30/06/2021;1638;2021-06-30
107;1044;OGEL Flaring 2021;OGEL Call for papers: Special Issue on Law and Policy for Gas Flaring in a Low-carbon Economy;Oct 1, 2020 - Apr 30, 2021;Online;Apr 30, 2021 (Mar 31, 2021);30/04/2021;1639;2021-04-30
107;1044;CIMSS 2021;International Workshop on Critical Infrastructure and Manufacturing System Security;Jun 21, 2021 - Jun 24, 2021;Kamakura, Japan;Mar 20, 2021;20/03/2021;1640;2021-03-20
107;1044;OGEL CircularEconomy 2021;OGEL Call for Papers Special Issue on Circular Economy and the Energy Transition;Oct 1, 2020 - May 31, 2021;Online;May 31, 2021 (Apr 30, 2021);31/05/2021;1641;2021-05-31
107;1044;SciSec 2021;3rd International Conference on Science of Cyber Security;Aug 13, 2021 - Aug 15, 2021;Shanghai, China;May 1, 2021;1/05/2021;1642;2021-05-01
107;1044;CODES + ISSS 2021;International Conference on Hardware/Software Codesign and System Synthesis;Oct 10, 2021 - Oct 15, 2021;virtual?;Apr 9, 2021 (Apr 2, 2021);9/04/2021;1643;2021-04-09
107;1044;CPS-ANNSIM 2021;CPS Track in the ANNSIM Conference;Jul 19, 2021 - Jul 22, 2021;GEORGE MASON UNIVERSITY, FAIRFAX, VIRGIN;Mar 1, 2021;1/03/2021;1644;2021-03-01
107;1044;IJASA 2021;The International Journal of Ambient Systems and applications;N/A;N/A;Feb 20, 2021;20/02/2021;1645;2021-02-20
107;1044;ICC-CCNCPS 2021;IEEE ICC'2021 workshop on Communication, Computing, and Networking in Cyber Physical Systems;Jun 14, 2021 - Jun 18, 2021;Montreal, Canada;Feb 19, 2021;19/02/2021;1646;2021-02-19
107;1044;ISDFS 2021;9th International Symposium on Digital Forensics and Security;Jun 28, 2021 - Jun 29, 2021;Elazig, Turkey and Online;Apr 2, 2021;2/04/2021;1647;2021-04-02
107;1044;ANNSIM 2021;2021 Annual Modeling and Simulation Conference;Jul 19, 2021 - Jul 22, 2021;Fairfax, Virginia;Mar 1, 2021;1/03/2021;1648;2021-03-01
107;1044;IEEESSIT21CW 2021;IEEE SSIT 3rd Conference on Norbert Wiener in the 21st Century;Jul 22, 2021 - Jul 25, 2021;Chennai, India;Mar 1, 2021;1/03/2021;1649;2021-03-01
107;1044;SEMANTiCS 2021;SEMANTiCS 2021 : 17th International Conference on Semantic Systems - LegalTech Track;Sep 6, 2021 - Sep 9, 2021;Amsterdam;Mar 29, 2021 (Mar 22, 2021);29/03/2021;1650;2021-03-29
107;1044;JSys Mar 2021;Journal for Systems Research - March 2021;N/A;N/A;Mar 1, 2021;1/03/2021;1651;2021-03-01
107;1044;ICIMP 2021;The Sixteenth International Conference on Internet Monitoring and Protection;May 30, 2021 - Jun 3, 2021;Valencia, Spain;Mar 2, 2021;2/03/2021;1652;2021-03-02
107;1044;HLPaICL 2021;HEGEL’S LEGAL PHILOSOPHY AND INTERNATIONAL CONSTITUTIONAL LAW;N/A;N/A;Feb 28, 2021;28/02/2021;1653;2021-02-28
107;1044;ICHST--Ei Compendex, Scopus 2021;2021 3rd International Conference on Hardware Security and Trust (ICHST 2021)--Ei Compendex, Scopus;Jul 9, 2021 - Jul 11, 2021;Nanjing, China;Feb 20, 2021;20/02/2021;1654;2021-02-20
107;1044;IEEE IDS 2021;The 6th IEEE International Conference on Intelligent Data and Security;May 15, 2021 - May 17, 2021;New York, USA;Feb 15, 2021;15/02/2021;1655;2021-02-15
107;1044;CPHS21;CFP: The First International Workshop on Cyber-Physical-Human System Design and Implementation;May 18, 2021 - May 18, 2021;Virtual;Feb 21, 2021;21/02/2021;1656;2021-02-21
107;1044;CMET Volume 8 2021;Call for Papers for RMLNLU Journal on Communication, Media, Entertainment & Technology Law [Volume 8]: Submit by 16th February, 2021;N/A;N/A;Feb 16, 2021;16/02/2021;1657;2021-02-16
107;1044;IJSPTM 2021;International Journal of Security, Privacy and Trust Management;N/A;N/A;Feb 20, 2021;20/02/2021;1658;2021-02-20
107;1044;ARRC 2021;Asia Risk & Resilience Conference;Aug 18, 2021 - Aug 19, 2021;Hybrid (Singapore & Online);Feb 8, 2021;8/02/2021;1659;2021-02-08
107;1044;ECBS 2021;7th Conference on the Engineering of Computer Based Systems;May 26, 2021 - May 27, 2021;Novi Sad, Serbia;Feb 1, 2021;1/02/2021;1660;2021-02-01
107;1044;JANT 2021;International Journal of Antennas;N/A;N/A;Feb 20, 2021;20/02/2021;1661;2021-02-20
107;1044;IoTDI 2021;ACM/IEEE IoTDI 2021: Call for Posters/Demos;May 18, 2021 - May 21, 2021;Nashville, Tennessee, USA;Jan 26, 2021;26/01/2021;1662;2021-01-26
107;1044;ICCCE Springer 2021;4th Edition of International Conference on Communications and Cyber Physical Engineering;Apr 9, 2021 - Apr 10, 2021;Pune;Jan 30, 2021;30/01/2021;1663;2021-01-30
107;1044;IoTDI 2021;ACM/IEEE IoTDI 2021: Call for Posters/Demos;May 18, 2021 - May 21, 2021;Nashville, Tennessee, USA;Jan 26, 2021;26/01/2021;1664;2021-01-26
107;1044;IoTDI 2021;ACM/IEEE IoTDI 2021: Call for Posters/Demos;May 18, 2021 - May 21, 2021;Nashville, Tennessee, USA;Jan 26, 2021;26/01/2021;1665;2021-01-26
107;1044;Polizeiinformatik 2021;The sixth conference for lecturers and researchers in computer science and information technology in law enforcement;Apr 20, 2021 - Apr 20, 2021;Virtual;Dec 13, 2020;13/12/2020;1666;2020-12-13
107;1044;ET 2021;ENERGY TRANSITIONS 2021;Mar 11, 2021 - Mar 12, 2021;Joensuu, Finland;Nov 30, 2020;30/11/2020;1667;2020-11-30
107;1044;Transgender India 2021;Transgender India: Understanding Hijras and Sadhins through the Social Sciences, Arts, and Humanities;Oct 1, 2020 - Oct 1, 2020;Publication;Oct 1, 2020;1/10/2020;1668;2020-10-01
107;1044;TDM AfCFTA 2021;TDM Call for Papers: The African Continental Free Trade Agreement (AfCFTA);N/A;N/A;Oct 30, 2020 (Jun 30, 2020);30/10/2020;1669;2020-10-30
107;1044;HUMANRIGHTS 2021;Human Rights: An Inclusive Interdisciplinary Conference;Apr 18, 2021 - Apr 19, 2021;Vienna, Austria;Sep 25, 2020;25/09/2020;1670;2020-09-25
107;1044;PRISON 2021;Experiencing Prison: 7th Global Interdisciplinary Conference;Mar 14, 2021 - Mar 15, 2021;Lisbon, Portugal;Sep 4, 2020;4/09/2020;1671;2020-09-04
107;1044;SUSTAIN 2021;Sustainability in the Time of Covid-19: A Global Interdisciplinary Conference;Apr 18, 2021 - Apr 19, 2021;Vienna, Austria;Sep 25, 2020;25/09/2020;1672;2020-09-25
107;1044;WHISTLEBLOWING 2021;Whistleblowing: An Inclusive Interdisciplinary Conference;Mar 14, 2021 - Mar 15, 2021;Lisbon, Portugal;Sep 4, 2020;4/09/2020;1673;2020-09-04
107;1045;ADRW 2021;«Archives during rebellions and wars». From the age of Napoleon to the cyber war era;May 19, 2021 - May 21, 2021;Milan;Sep 30, 2029;30/09/2029;1674;2029-09-30
107;1045;ICDM 2021;21st IEEE International Conference on Data Mining;Dec 7, 2021 - Dec 10, 2021;Auckland, New Zealand;Jun 11, 2021;11/06/2021;1675;2021-06-11
107;1045;KR 2021;18th International Conference on Principles of Knowledge Representation and Reasoning;Nov 6, 2021 - Nov 12, 2021;Hanoi, Vietnam;Mar 31, 2021 (Mar 24, 2021);31/03/2021;1676;2021-03-31
107;1045;FATES 2021;3rd Workshop on Fairness, Accountability, Transparency, Ethics and Society on the Web;Apr 19, 2021 - Apr 23, 2021;Ljubljana, Slovenia;Jan 25, 2021;25/01/2021;1677;2021-01-25
107;1045;SE4ICPS 2021;The 1st IEEE International Workshop on Software Engineering for Industrial Cyber-Physical Systems;Jul 12, 2021 - Jul 16, 2021;Virtual;Apr 21, 2021;21/04/2021;1678;2021-04-21
107;1045;CPSIOT 2021;2021International Conference on Cyber Physical Systems and IoT(CPSIOT 2021);Nov 19, 2021 - Nov 21, 2021;Hangzhou, China;Sep 30, 2021;30/09/2021;1679;2021-09-30
107;1045;Engineering Ethics 2021;Special Issue on: Engineering Ethics: Bridging the Theory-Practice Gap;N/A;N/A;Dec 1, 2020;1/12/2020;1680;2020-12-01
107;1045;CRITIS 2021;The 16th International Conference on Critical Information Infrastructures Security;Sep 27, 2021 - Sep 29, 2021;EPFL SwissTech, Lausanne, Switzerland;May 14, 2021;14/05/2021;1681;2021-05-14
107;1045;IEEE CSR 2021;2021 IEEE International Conference on Cyber Security and Resilience;Jul 26, 2021 - Jul 28, 2021;Virtual;Mar 15, 2021;15/03/2021;1682;2021-03-15
107;1045;CYBER 2021;The Sixth International Conference on Cyber-Technologies and Cyber-Systems;Oct 3, 2021 - Oct 7, 2021;Barcelona, Spain;Jul 5, 2021;5/07/2021;1683;2021-07-05
107;1045;ACERP 2021;The 11th Asian Conference on Ethics, Religion & Philosophy;Mar 28, 2021 - Mar 31, 2021;Tokyo, Japan;Jan 15, 2021;15/01/2021;1684;2021-01-15
107;1045;CSW 2021;2021 International Workshop on Cyber Security (CSW 2021);Aug 13, 2021 - Aug 15, 2021;Stockholm, Sweden;Jun 30, 2021;30/06/2021;1685;2021-06-30
107;1045;CIMSS 2021;International Workshop on Critical Infrastructure and Manufacturing System Security;Jun 21, 2021 - Jun 24, 2021;Kamakura, Japan;Mar 20, 2021;20/03/2021;1686;2021-03-20
107;1045;SciSec 2021;3rd International Conference on Science of Cyber Security;Aug 13, 2021 - Aug 15, 2021;Shanghai, China;May 1, 2021;1/05/2021;1687;2021-05-01
107;1045;CODES + ISSS 2021;International Conference on Hardware/Software Codesign and System Synthesis;Oct 10, 2021 - Oct 15, 2021;virtual?;Apr 9, 2021 (Apr 2, 2021);9/04/2021;1688;2021-04-09
107;1045;LesserEthics 2021;Lesser Ethics: Retrieving the Good Life in the Franciscan Tradition;Jun 24, 2021 - Jun 25, 2021;Zoom;Mar 1, 2021;1/03/2021;1689;2021-03-01
107;1045;Romantic Ethics 2022;Romantic Ethics and the ‘Woke’ Romantics (Edited Volume, Anglistik und Englischunterricht);N/A;N/A;Nov 20, 2020;20/11/2020;1690;2020-11-20
107;1045;CPS-ANNSIM 2021;CPS Track in the ANNSIM Conference;Jul 19, 2021 - Jul 22, 2021;GEORGE MASON UNIVERSITY, FAIRFAX, VIRGIN;Mar 1, 2021;1/03/2021;1691;2021-03-01
107;1045;IJASA 2021;The International Journal of Ambient Systems and applications;N/A;N/A;Feb 20, 2021;20/02/2021;1692;2021-02-20
107;1045;ICC-CCNCPS 2021;IEEE ICC'2021 workshop on Communication, Computing, and Networking in Cyber Physical Systems;Jun 14, 2021 - Jun 18, 2021;Montreal, Canada;Feb 19, 2021;19/02/2021;1693;2021-02-19
107;1045;IJEL 2021;Inamori International Thesis Prize in Military Ethics;N/A;Case Western Reserve University;Feb 15, 2021;15/02/2021;1694;2021-02-15
107;1045;ISDFS 2021;9th International Symposium on Digital Forensics and Security;Jun 28, 2021 - Jun 29, 2021;Elazig, Turkey and Online;Apr 2, 2021;2/04/2021;1695;2021-04-02
107;1045;IEEESSIT21CW 2021;IEEE SSIT 3rd Conference on Norbert Wiener in the 21st Century;Jul 22, 2021 - Jul 25, 2021;Chennai, India;Mar 1, 2021;1/03/2021;1696;2021-03-01
107;1045;ANNSIM 2021;2021 Annual Modeling and Simulation Conference;Jul 19, 2021 - Jul 22, 2021;Fairfax, Virginia;Mar 1, 2021;1/03/2021;1697;2021-03-01
107;1045;IJEL 2021;Ethical Leadership + Justice;Dec 4, 2020 - Mar 15, 2021;Case Western Reserve University;Mar 15, 2021;15/03/2021;1698;2021-03-15
107;1045;SEthics 2021;Ethics in Software Engineering Research and Practice;Jun 4, 2021 - Jun 4, 2021;Virtual;Jan 19, 2021;19/01/2021;1699;2021-01-19
107;1045;EPTvS 2021;CFP: Ethics and Politics of TV Series;N/A;N/A;Jan 31, 2021;31/01/2021;1700;2021-01-31
107;1045;JSys Mar 2021;Journal for Systems Research - March 2021;N/A;N/A;Mar 1, 2021;1/03/2021;1701;2021-03-01
107;1045;ICIMP 2021;The Sixteenth International Conference on Internet Monitoring and Protection;May 30, 2021 - Jun 3, 2021;Valencia, Spain;Mar 2, 2021;2/03/2021;1702;2021-03-02
107;1045;ICHST--Ei Compendex, Scopus 2021;2021 3rd International Conference on Hardware Security and Trust (ICHST 2021)--Ei Compendex, Scopus;Jul 9, 2021 - Jul 11, 2021;Nanjing, China;Feb 20, 2021;20/02/2021;1703;2021-02-20
107;1045;IEEE IDS 2021;The 6th IEEE International Conference on Intelligent Data and Security;May 15, 2021 - May 17, 2021;New York, USA;Feb 15, 2021;15/02/2021;1704;2021-02-15
107;1045;CPHS21;CFP: The First International Workshop on Cyber-Physical-Human System Design and Implementation;May 18, 2021 - May 18, 2021;Virtual;Feb 21, 2021;21/02/2021;1705;2021-02-21
107;1045;IJSPTM 2021;International Journal of Security, Privacy and Trust Management;N/A;N/A;Feb 20, 2021;20/02/2021;1706;2021-02-20
107;1045;ARRC 2021;Asia Risk & Resilience Conference;Aug 18, 2021 - Aug 19, 2021;Hybrid (Singapore & Online);Feb 8, 2021;8/02/2021;1707;2021-02-08
107;1045;ECBS 2021;7th Conference on the Engineering of Computer Based Systems;May 26, 2021 - May 27, 2021;Novi Sad, Serbia;Feb 1, 2021;1/02/2021;1708;2021-02-01
107;1045;JANT 2021;International Journal of Antennas;N/A;N/A;Feb 20, 2021;20/02/2021;1709;2021-02-20
107;1045;IoTDI 2021;ACM/IEEE IoTDI 2021: Call for Posters/Demos;May 18, 2021 - May 21, 2021;Nashville, Tennessee, USA;Jan 26, 2021;26/01/2021;1710;2021-01-26
107;1045;ICCCE Springer 2021;4th Edition of International Conference on Communications and Cyber Physical Engineering;Apr 9, 2021 - Apr 10, 2021;Pune;Jan 30, 2021;30/01/2021;1711;2021-01-30
107;1045;IoTDI 2021;ACM/IEEE IoTDI 2021: Call for Posters/Demos;May 18, 2021 - May 21, 2021;Nashville, Tennessee, USA;Jan 26, 2021;26/01/2021;1712;2021-01-26
107;1045;IoTDI 2021;ACM/IEEE IoTDI 2021: Call for Posters/Demos;May 18, 2021 - May 21, 2021;Nashville, Tennessee, USA;Jan 26, 2021;26/01/2021;1713;2021-01-26
107;1045;CARE 2021;Care: 1st Global Interdisciplinary Conference;Mar 12, 2021 - Mar 13, 2021;Lisbon, Portugal;Sep 4, 2020;4/09/2020;1714;2020-09-04
107;1045;13-ICGS3 2021;VIRTUAL 13th International Conference on Global Security, Safety & Sustainability, ICGS3-21;Jan 14, 2021 - Jan 15, 2021;London;Sep 3, 2020 (Jul 21, 2020);3/09/2020;1715;2020-09-03
107;1045;MEAM 2021;CFP: Handbook of Research on Machine Ethics and Morality;N/A;N/A;Nov 2, 2019;2/11/2019;1716;2019-11-02
107;1046;ADRW 2021;«Archives during rebellions and wars». From the age of Napoleon to the cyber war era;May 19, 2021 - May 21, 2021;Milan;Sep 30, 2029;30/09/2029;1717;2029-09-30
107;1046;ICDM 2021;21st IEEE International Conference on Data Mining;Dec 7, 2021 - Dec 10, 2021;Auckland, New Zealand;Jun 11, 2021;11/06/2021;1718;2021-06-11
107;1046;ICERP--JA, Scopus 2021;2021 the 4th International Conference on Education Research and Policy (ICERP 2021)--JA, Scopus;May 21, 2021 - May 24, 2021;Shanghai, China;Mar 20, 2021;20/03/2021;1719;2021-03-20
107;1046;KR 2021;18th International Conference on Principles of Knowledge Representation and Reasoning;Nov 6, 2021 - Nov 12, 2021;Hanoi, Vietnam;Mar 31, 2021 (Mar 24, 2021);31/03/2021;1720;2021-03-31
107;1046;SE4ICPS 2021;The 1st IEEE International Workshop on Software Engineering for Industrial Cyber-Physical Systems;Jul 12, 2021 - Jul 16, 2021;Virtual;Apr 21, 2021;21/04/2021;1721;2021-04-21
107;1046;COVELECT 2021;CfP: Elections in a Democratic Rule of Law State During a Pandemic Sanitary Regime as a Challenge for Public Policy;N/A;N/A;Jul 15, 2021;15/07/2021;1722;2021-07-15
107;1046;CPSIOT 2021;2021International Conference on Cyber Physical Systems and IoT(CPSIOT 2021);Nov 19, 2021 - Nov 21, 2021;Hangzhou, China;Sep 30, 2021;30/09/2021;1723;2021-09-30
107;1046;CRITIS 2021;The 16th International Conference on Critical Information Infrastructures Security;Sep 27, 2021 - Sep 29, 2021;EPFL SwissTech, Lausanne, Switzerland;May 14, 2021;14/05/2021;1724;2021-05-14
107;1046;IEEE CSR 2021;2021 IEEE International Conference on Cyber Security and Resilience;Jul 26, 2021 - Jul 28, 2021;Virtual;Mar 15, 2021;15/03/2021;1725;2021-03-15
107;1046;CYBER 2021;The Sixth International Conference on Cyber-Technologies and Cyber-Systems;Oct 3, 2021 - Oct 7, 2021;Barcelona, Spain;Jul 5, 2021;5/07/2021;1726;2021-07-05
107;1046;OGEL Flaring 2021;OGEL Call for papers: Special Issue on Law and Policy for Gas Flaring in a Low-carbon Economy;Oct 1, 2020 - Apr 30, 2021;Online;Apr 30, 2021 (Mar 31, 2021);30/04/2021;1727;2021-04-30
107;1046;CSW 2021;2021 International Workshop on Cyber Security (CSW 2021);Aug 13, 2021 - Aug 15, 2021;Stockholm, Sweden;Jun 30, 2021;30/06/2021;1728;2021-06-30
107;1046;CIMSS 2021;International Workshop on Critical Infrastructure and Manufacturing System Security;Jun 21, 2021 - Jun 24, 2021;Kamakura, Japan;Mar 20, 2021;20/03/2021;1729;2021-03-20
107;1046;ICEEEP--Scopus, Ei 2021;2021 5th International Conference on Energy Economics and Energy Policy (ICEEEP 2021)--Scopus, Ei Compendex;Apr 15, 2021 - Apr 17, 2021;Barcelona, Spain;Mar 5, 2021;5/03/2021;1730;2021-03-05
107;1046;ICEEEP--Scopus, Ei Compendex 2021;2021 5th International Conference on Energy Economics and Energy Policy (ICEEEP 2021)--Scopus, Ei Compendex;Apr 15, 2021 - Apr 17, 2021;Barcelona, Spain;Mar 5, 2021;5/03/2021;1731;2021-03-05
107;1046;SOTEHEINN 2021;CfP: Social, Technological and Health Innovation: Opportunities and Limitations for the Social Policy, Health Policy, and Environmental Policy;N/A;N/A;May 12, 2021;12/05/2021;1732;2021-05-12
107;1046;Call for Contributions 2021;Beyond the 2ºC: Business and Policy Trajectories to Climate Change Adaptation;Jun 30, 2020 - Feb 28, 2021;Edited book call;Nov 30, 2020 (Jun 30, 2020);30/11/2020;1733;2020-11-30
107;1046;SciSec 2021;3rd International Conference on Science of Cyber Security;Aug 13, 2021 - Aug 15, 2021;Shanghai, China;May 1, 2021;1/05/2021;1734;2021-05-01
107;1046;CODES + ISSS 2021;International Conference on Hardware/Software Codesign and System Synthesis;Oct 10, 2021 - Oct 15, 2021;virtual?;Apr 9, 2021 (Apr 2, 2021);9/04/2021;1735;2021-04-09
107;1046;CPS-ANNSIM 2021;CPS Track in the ANNSIM Conference;Jul 19, 2021 - Jul 22, 2021;GEORGE MASON UNIVERSITY, FAIRFAX, VIRGIN;Mar 1, 2021;1/03/2021;1736;2021-03-01
107;1046;IJASA 2021;The International Journal of Ambient Systems and applications;N/A;N/A;Feb 20, 2021;20/02/2021;1737;2021-02-20
107;1046;ICC-CCNCPS 2021;IEEE ICC'2021 workshop on Communication, Computing, and Networking in Cyber Physical Systems;Jun 14, 2021 - Jun 18, 2021;Montreal, Canada;Feb 19, 2021;19/02/2021;1738;2021-02-19
107;1046;GPPR Spring Edition 2021;Georgetown Public Policy Review - Spring Edition;N/A;N/A;Jan 4, 2021;4/01/2021;1739;2021-01-04
107;1046;FREP 2021;Call for Papers - Fulbright Review of Economics and Policy;N/A;N/A;Mar 30, 2021;30/03/2021;1740;2021-03-30
107;1046;ISDFS 2021;9th International Symposium on Digital Forensics and Security;Jun 28, 2021 - Jun 29, 2021;Elazig, Turkey and Online;Apr 2, 2021;2/04/2021;1741;2021-04-02
107;1046;ANNSIM 2021;2021 Annual Modeling and Simulation Conference;Jul 19, 2021 - Jul 22, 2021;Fairfax, Virginia;Mar 1, 2021;1/03/2021;1742;2021-03-01
107;1046;JSys Mar 2021;Journal for Systems Research - March 2021;N/A;N/A;Mar 1, 2021;1/03/2021;1743;2021-03-01
107;1046;ICIMP 2021;The Sixteenth International Conference on Internet Monitoring and Protection;May 30, 2021 - Jun 3, 2021;Valencia, Spain;Mar 2, 2021;2/03/2021;1744;2021-03-02
107;1046;ICHST--Ei Compendex, Scopus 2021;2021 3rd International Conference on Hardware Security and Trust (ICHST 2021)--Ei Compendex, Scopus;Jul 9, 2021 - Jul 11, 2021;Nanjing, China;Feb 20, 2021;20/02/2021;1745;2021-02-20
107;1046;IEEE IDS 2021;The 6th IEEE International Conference on Intelligent Data and Security;May 15, 2021 - May 17, 2021;New York, USA;Feb 15, 2021;15/02/2021;1746;2021-02-15
107;1046;CPHS21;CFP: The First International Workshop on Cyber-Physical-Human System Design and Implementation;May 18, 2021 - May 18, 2021;Virtual;Feb 21, 2021;21/02/2021;1747;2021-02-21
107;1046;IJSPTM 2021;International Journal of Security, Privacy and Trust Management;N/A;N/A;Feb 20, 2021;20/02/2021;1748;2021-02-20
107;1046;ARRC 2021;Asia Risk & Resilience Conference;Aug 18, 2021 - Aug 19, 2021;Hybrid (Singapore & Online);Feb 8, 2021;8/02/2021;1749;2021-02-08
107;1046;ECBS 2021;7th Conference on the Engineering of Computer Based Systems;May 26, 2021 - May 27, 2021;Novi Sad, Serbia;Feb 1, 2021;1/02/2021;1750;2021-02-01
107;1046;JANT 2021;International Journal of Antennas;N/A;N/A;Feb 20, 2021;20/02/2021;1751;2021-02-20
107;1046;IoTDI 2021;ACM/IEEE IoTDI 2021: Call for Posters/Demos;May 18, 2021 - May 21, 2021;Nashville, Tennessee, USA;Jan 26, 2021;26/01/2021;1752;2021-01-26
107;1046;ICCCE Springer 2021;4th Edition of International Conference on Communications and Cyber Physical Engineering;Apr 9, 2021 - Apr 10, 2021;Pune;Jan 30, 2021;30/01/2021;1753;2021-01-30
107;1046;IoTDI 2021;ACM/IEEE IoTDI 2021: Call for Posters/Demos;May 18, 2021 - May 21, 2021;Nashville, Tennessee, USA;Jan 26, 2021;26/01/2021;1754;2021-01-26
107;1046;IoTDI 2021;ACM/IEEE IoTDI 2021: Call for Posters/Demos;May 18, 2021 - May 21, 2021;Nashville, Tennessee, USA;Jan 26, 2021;26/01/2021;1755;2021-01-26
107;1046;ET 2021;ENERGY TRANSITIONS 2021;Mar 11, 2021 - Mar 12, 2021;Joensuu, Finland;Nov 30, 2020;30/11/2020;1756;2020-11-30
107;1046;BACP 2021;BACP Research Conference 2021: Promoting collaboration in research, policy and practice;May 14, 2021 - May 15, 2021;Manchester UK;Nov 2, 2020;2/11/2020;1757;2020-11-02
107;1047;CEVVE 2021;2021 International Conference on Electric Vehicle and Vehicle Engineering (CEVVE 2021);Sep 17, 2021 - Sep 19, 2021;Frankfurt, Germany;Jul 31, 2021;31/07/2021;1758;2021-07-31
107;1047;SOUPS 2021;The Seventeenth Symposium on Usable Privacy and Security;Aug 8, 2021 - Aug 10, 2021;Vancouver, B.C., Canada;Feb 25, 2021 (Feb 18, 2021);25/02/2021;1759;2021-02-25
107;1047;blockchain_ml_iot 2021;Network and Electronics (MDPI) Joint Special Issue - Blockchain and Machine Learning for IoT: Security and Privacy Challenges;N/A;N/A;Dec 31, 2021;31/12/2021;1760;2021-12-31
107;1047;EAI SecureComm 2021;17th EAI International Conference on Security and Privacy in Communication Networks (Springer, Scopus, ISI, Ei, more);Sep 6, 2021 - Sep 9, 2021;Canterbury, Great Britain;Mar 15, 2021;15/03/2021;1761;2021-03-15
107;1047;CSPPSG 2021;MDPI Sensors - Special Issue on 'Cybersecurity and Privacy-Preserving in Modern Smart Grid';N/A;N/A;Feb 28, 2021;28/02/2021;1762;2021-02-28
107;1047;SPTM 2021;9th International Conference of Security, Privacy and Trust Management;Apr 24, 2021 - Apr 25, 2021;Copenhagen, Denmark;Feb 20, 2021;20/02/2021;1763;2021-02-20
107;1047;EICC 2021;European Interdisciplinary Cybersecurity Conference (EICC 2021);Nov 10, 2021 - Nov 11, 2021;Targu Mures, Romania;Jun 14, 2021;14/06/2021;1764;2021-06-14
107;1047;IDEAS 2021;25th International Database Engineering & Applications Symposium;Jul 14, 2021 - Jul 16, 2021;Montreal;Apr 1, 2021;1/04/2021;1765;2021-04-01
107;1047;CANS 2021;Cryptology and Network Security;Dec 13, 2021 - Dec 15, 2021;Vienna, Austria;Jun 1, 2021;1/06/2021;1766;2021-06-01
107;1047;SI on SPIHG 2022;IEEE S&P CfP: Special Issue on Security and Privacy Issues of Home Globalization;N/A;N/A;May 15, 2021;15/05/2021;1767;2021-05-15
107;1047;SPBP 2021;The Fourth Workshop on Security and Privacy-enhanced Business Process Management;Sep 6, 2021 - Sep 6, 2021;Rome, Italy;May 24, 2021;24/05/2021;1768;2021-05-24
107;1047;PPML at INTERSPEECH 2021;Privacy-preserving Machine Learning for Audio & Speech Processing -- INTERSPEECH 2021 Special Session;Aug 30, 2021 - Sep 3, 2021;Brno, Czechia;Mar 26, 2021;26/03/2021;1769;2021-03-26
107;1047;CENTRIC 2021;The Fourteenth International Conference on Advances in Human-oriented and Personalized Mechanisms, Technologies, and Services;Oct 3, 2021 - Oct 7, 2021;Barcelona, Spain;Jul 5, 2021;5/07/2021;1770;2021-07-05
107;1047;STPSA 2021;The 15th IEEE International Workshop on Security, Trust, and Privacy for Software Applications;Jul 12, 2021 - Jul 16, 2021;Virtual;Apr 21, 2021;21/04/2021;1771;2021-04-21
107;1047;CLOUD S&P 2021;3rd Workshop on Cloud Security and Privacy;Jun 21, 2021 - Jun 24, 2021;Kamakura, Japan;Mar 20, 2021;20/03/2021;1772;2021-03-20
107;1047;ACM WiSec 2021;ACM Conference on Security and Privacy in Wireless and Mobile Networks;Jun 28, 2021 - Jul 1, 2021;Virtual;Mar 18, 2021;18/03/2021;1773;2021-03-18
107;1047;EAI CyDiP (virtual) 2021;EAI International Conference on Emerging Technologies of Cybersecurity and Digital Privacy (online conference);Oct 18, 2021 - Oct 19, 2021;Cyberspace;Apr 19, 2021;19/04/2021;1774;2021-04-19
107;1047;OID 2021;Open Identity Summit 2021;Jun 1, 2021 - Jun 2, 2021;Copenhagen, Denmark;Mar 1, 2021;1/03/2021;1775;2021-03-01
107;1047;FI-CyberSec 2021;Feature Papers for Future Internet - Cybersecurity Section;N/A;N/A;Feb 28, 2021;28/02/2021;1776;2021-02-28
107;1047;ICISPP--Ei Compendex, Scopus 2021;2021 2nd International Conference on Information Security and Privacy Protection (ICISPP 2021)--Ei Compendex, Scopus;Jul 9, 2021 - Jul 11, 2021;Nanjing, China;Feb 20, 2021;20/02/2021;1777;2021-02-20
107;1047;PCEIoT 2021;Workshop on Privacy in the Cloud/Edge/IoT World 2021;Jul 5, 2021 - Jul 8, 2021;Cagliari (Italy) and Online;Mar 28, 2021;28/03/2021;1778;2021-03-28
107;1047;PrivateNLP 2021;NAACL 2021 Workshop on Privacy and Natural Language Processing;Jun 11, 2021 - Jun 11, 2021;Virtual;Mar 15, 2021;15/03/2021;1779;2021-03-15
107;1047;Sensors (MDPI) SI 2021;Sensors SI on Security, Trust and Privacy in New Computing Environments;N/A;N/A;Mar 31, 2021;31/03/2021;1780;2021-03-31
107;1047;DBKDA 2021;The Thirteenth International Conference on Advances in Databases, Knowledge, and Data Applications;May 30, 2021 - Jun 3, 2021;Valencia, Spain;Mar 2, 2021;2/03/2021;1781;2021-03-02
107;1047;ICISPP--Ei, Scopus 2021;2021 2nd International Conference on Information Security and Privacy Protection (ICISPP 2021)--Ei Compendex, Scopus;Jul 9, 2021 - Jul 11, 2021;Nanjing, China;Feb 20, 2021;20/02/2021;1782;2021-02-20
107;1047;VSC @IEEE WETICE 2021;Track on Validating Software for Critical Systems (VSC) @IEEE WETICE 2021;Jun 23, 2021 - Jun 25, 2021;Basque Coast - Bayonne, France;Feb 28, 2021;28/02/2021;1783;2021-02-28
107;1047;WCMC - Blockchain SI 2021;WCMC - Blockchain in Wireless Communications and Computing: Security Threats and Applications;N/A;N/A;Mar 12, 2021;12/03/2021;1784;2021-03-12
107;1047;CfW EICC 2021;Call for Workshops: European Interdisciplinary Cybersecurity Conference (EICC 2021);Nov 10, 2021 - Nov 11, 2021;Targu Mures, Romania;Mar 15, 2021;15/03/2021;1785;2021-03-15
107;1047;PETS 2021;21st Privacy Enhancing Technologies Symposium (Issue 4);Jul 19, 2021 - Jul 24, 2021;Sydney, Australia;Feb 28, 2021;28/02/2021;1786;2021-02-28
107;1047;EdgeSys 2021;The 4th International Workshop on Edge Systems, Analytics and Networking;Apr 26, 2021 - Apr 26, 2021;Edinburgh, Scotland, UK;Feb 26, 2021;26/02/2021;1787;2021-02-26
108;1048;BDIoT 2021;5th International Conference on Big Data and Internet of Things - BDIoT’21;Mar 17, 2021 - Mar 18, 2021;Rabat - Morocco;Dec 1, 2021;1/12/2021;1788;2021-12-01
108;1048;IEEE CIIoT 2021;IEEE Symposium on Computational Intelligence in IoT and Smart Cities;Dec 5, 2021 - Dec 8, 2021;Orlando, Florida, USA;Aug 6, 2021;6/08/2021;1789;2021-08-06
108;1048;IEEE COINS 2021;Internet of Things IoT | Artificial Intelligence | Machine Learning | Big Data | Blockchain | Edge & Cloud Computing | Security | Embedded Systems |;Aug 23, 2021 - Aug 25, 2021;Hybrid Mode (In-Person & Virtual);Apr 30, 2021;30/04/2021;1790;2021-04-30
108;1048;DSD 2021;Euromicro Conference on Digital System Design (DSD) 2021;Sep 6, 2021 - Sep 8, 2021;Palermo, Sicily, Italy;Apr 1, 2021;1/04/2021;1791;2021-04-01
108;1048;IEEE SmartIoT 2021;The 5th IEEE International Conference on Smart Internet of Things;Aug 13, 2021 - Aug 15, 2021;Jeju Island, South Korea;May 1, 2021;1/05/2021;1792;2021-05-01
108;1048;IEEE COINS 2021;International Conference on Omni-Layer Intelligent Systems Internet of Things IoT | Artificial Intelligence | Machine Learning | Big Data | Blockchain | Edge & Cloud Computing;Aug 23, 2021 - Aug 25, 2021;Barcelona, Spain;Apr 30, 2021;30/04/2021;1793;2021-04-30
108;1048;ACM--BDIOT--Ei and Scopus 2021;ACM--2021 the 5th International Conference on Big Data and Internet of Things (BDIOT 2021)--Ei Compendex, Scopus;Aug 13, 2021 - Aug 15, 2021;Singapore;Apr 1, 2021;1/04/2021;1794;2021-04-01
108;1048;ICT-DM 2021;The 7th International Conference on Information and Communication Technologies for Disaster Management;Dec 3, 2021 - Dec 5, 2021;Hangzhou, China;Jun 20, 2021 (Jun 15, 2021);20/06/2021;1795;2021-06-20
108;1048;CCIOT--ACM, EI Compendex, Scopus 2021;ACM--2021 6th International Conference on Cloud Computing and Internet of Things (CCIOT 2021)--Ei Compendex, Scopus;Sep 22, 2021 - Sep 24, 2021;Okinawa, Japan;May 10, 2021;10/05/2021;1796;2021-05-10
108;1048;SPIES--Ei, Scopus 2021;2021 3rd International Conference on Smart Power & Internet Energy Systems (SPIES 2021)--Ei Compendex, Scopus;Sep 25, 2021 - Sep 28, 2021;Shanghai, China;May 1, 2021;1/05/2021;1797;2021-05-01
108;1048;FiCloud 2021;The 8th International Conference on Future Internet of Things and Cloud;Aug 23, 2021 - Aug 25, 2021;Rome, Italy;Mar 10, 2021;10/03/2021;1798;2021-03-10
108;1048;ICBDT--ACM, EI Compendex, Scopus 2021;ACM--2021 4th International Conference on Big Data Technologies (ICBDT 2021)--EI Compendex, Scopus;Sep 24, 2021 - Sep 26, 2021;Zibo, China;May 10, 2021;10/05/2021;1799;2021-05-10
108;1048;ACM--CCIOT--EI, Scopus 2021;ACM--2021 6th International Conference on Cloud Computing and Internet of Things (CCIOT 2021)--Ei Compendex, Scopus;Sep 22, 2021 - Sep 24, 2021;Okinawa, Japan;May 10, 2021;10/05/2021;1800;2021-05-10
108;1048;IEEE COINS 2021;IEEE COINS | IoT , AI, and Big Data for Healthcare Track;Aug 23, 2021 - Aug 25, 2021;Barcelona, Spain;Apr 30, 2021;30/04/2021;1801;2021-04-30
108;1048;IN4PL 2021;2nd International Conference on Innovative Intelligent Industrial Production and Logistics;Oct 25, 2021 - Oct 27, 2021;Valletta, Malta;May 18, 2021;18/05/2021;1802;2021-05-18
108;1048;SI-DIEFIoT-JPDC 2021;Special Issue on Distributed Intelligence at the Edge for the Future Internet of Things - Journal of Parallel and Distributed Computing;N/A;N/A;May 31, 2021;31/05/2021;1803;2021-05-31
108;1048;IEEE COINS 2021;BCIOT - Special Track on Blockchain and Internet of Things (IoT);Aug 23, 2021 - Aug 25, 2021;Barcelona, Spain;Apr 30, 2021;30/04/2021;1804;2021-04-30
108;1048;BDIOT--ACM, Ei and Scopus 2021;ACM--2021 the 5th International Conference on Big Data and Internet of Things (BDIOT 2021)--Ei Compendex, Scopus;Aug 13, 2021 - Aug 15, 2021;Singapore;Apr 1, 2021;1/04/2021;1805;2021-04-01
108;1048;SMART ACCESSIBILITY 2021;The Sixth International Conference on Universal Accessibility in the Internet of Things and Smart Environments;Jul 18, 2021 - Jul 22, 2021;Nice, France;Apr 19, 2021;19/04/2021;1806;2021-04-19
108;1048;QUORS 2021;The 15th IEEE International Workshop on Quality Oriented Reuse of Software;Jul 13, 2021 - Jul 16, 2021;Virtual due to COVID, Madrid, Spain;Apr 21, 2021;21/04/2021;1807;2021-04-21
108;1048;IEEE COINS 2021;Hybrid Mode (In-Person & Virtual) | IoT | AI/ML | Big Data | Blockchain | Security | Edge & Cloud Computing | Security | Embedded Systems | EDA | VLSI;Aug 23, 2021 - Aug 25, 2021;In-Person & Virtual) | Barcelona, Spain;Apr 30, 2021;30/04/2021;1808;2021-04-30
108;1048;EAI BigIoT-EDU (virtual) 2021;EAI International Conference on Application of Big Data, Blockchain, and Internet of Things for Education Informatization (online conference);Aug 1, 2021 - Aug 3, 2021;Cyberspace;Mar 31, 2021;31/03/2021;1809;2021-03-31
108;1048;MobiSPC 2021;The 18th International Conference on Mobile Systems and Pervasive Computing;Aug 9, 2021 - Aug 12, 2021;Leuven, Belgium;Mar 19, 2021;19/03/2021;1810;2021-03-19
108;1048;WEEE 2021;2nd International Workshop on Energy-Efficient Learning at the Edge;Jun 28, 2021 - Jun 28, 2021;Virtual Torino;Mar 31, 2021;31/03/2021;1811;2021-03-31
108;1048;INTERNET 2021;The Thirteenth International Conference on Evolving Internet;Jul 18, 2021 - Jul 22, 2021;Nice, France;Apr 19, 2021;19/04/2021;1812;2021-04-19
108;1048;ACM--BIOTC--Ei and Scopus 2021;ACM--2021 3rd Blockchain and Internet of Things Conference (BIOTC 2021)--Ei Compendex, Scopus;Jul 8, 2021 - Jul 10, 2021;Ho Chi Minh City, Vietnam;Mar 1, 2021;1/03/2021;1813;2021-03-01
108;1048;WEBIST 2021;17th International Conference on Web Information Systems and Technologies;Oct 26, 2021 - Oct 28, 2021;Valletta, Malta;May 18, 2021;18/05/2021;1814;2021-05-18
108;1048;EAI Chinacom 2021;16th EAI International Conference on Communications and Networking in China (Springer, Scopus, ISI, Ei, more);Nov 21, 2021 - Nov 22, 2021;Beijing, People's Republic of China;May 29, 2021;29/05/2021;1815;2021-05-29
108;1048;SPIES--Ei Compendex, Scopus 2021;2021 3rd International Conference on Smart Power & Internet Energy Systems (SPIES 2021)--Ei Compendex, Scopus;Sep 25, 2021 - Sep 28, 2021;Shanghai, China;May 1, 2021;1/05/2021;1816;2021-05-01
108;1048;ITIOT--Ei, Scopus 2021;2021 2nd International Conference on Information Technology and Internet of Things (ITIOT 2021)--Ei Compendex, Scopus;Apr 23, 2021 - Apr 26, 2021;Chengdu, China;Mar 5, 2021;5/03/2021;1817;2021-03-05
108;1048;Smart World Congress 2021;2021 IEEE Smart World Congress;Oct 18, 2021 - Oct 21, 2021;Atlanta, USA;Apr 30, 2021;30/04/2021;1818;2021-04-30
108;1048;ITIOT--Ei Compendex, Scopus 2021;2021 2nd International Conference on Information Technology and Internet of Things (ITIOT 2021)--Ei Compendex, Scopus;Apr 23, 2021 - Apr 26, 2021;Chengdu, China;Mar 5, 2021;5/03/2021;1819;2021-03-05
108;1048;BIOTC--ACM, Ei and Scopus 2021;ACM--2021 3rd Blockchain and Internet of Things Conference (BIOTC 2021)--Ei Compendex, Scopus;Jul 8, 2021 - Jul 10, 2021;Ho Chi Minh City, Vietnam;Mar 1, 2021;1/03/2021;1820;2021-03-01
108;1048;IEEE SOSE 2021;The 15th IEEE International Conference On Service-Oriented System Engineering;Aug 23, 2021 - Aug 26, 2021;Online;Mar 1, 2021;1/03/2021;1821;2021-03-01
108;1048;AIOTT--Ei Compendex, Scopus 2021;2021 3rd Asia IoT Technologies Conference (AIOTT 2021)--Ei Compendex, Scopus;May 22, 2021 - May 24, 2021;Hong Kong;Mar 5, 2021;5/03/2021;1822;2021-03-05
108;1048;ICAISE--Ei, Scopus 2021;2021 The 3rd International Conference on Advanced Information Systems and Engineering (ICAISE 2021)--Ei Compendex, Scopus;May 28, 2021 - May 30, 2021;Beijing, China;Mar 10, 2021;10/03/2021;1823;2021-03-10
108;1049;CFMAI 2021;2021 3rd International Conference on Frontiers of Mathematics and Artificial Intelligence (CFMAI 2021);Dec 1, 2021 - Dec 3, 2021;Beijing, China;Oct 31, 2021;31/10/2021;1824;2021-10-31
108;1049;ISCAI 2021;2021 3rd International Symposium on Computing and Artificial Intelligence (ISCAI 2021);Dec 1, 2021 - Dec 3, 2021;Beijing, China;Oct 31, 2021;31/10/2021;1825;2021-10-31
108;1049;AIKE 2021;IEEE Artificial Intelligence & Knowledge Engineering 2021;Dec 1, 2021 - Dec 3, 2021;Laguna Hills, CA;Sep 15, 2021;15/09/2021;1826;2021-09-15
108;1049;EI-CFAIS 2021;2021 International Conference on Frontiers of Artificial Intelligence and Statistics (CFAIS 2021);Dec 1, 2021 - Dec 3, 2021;Beijing, China;Oct 30, 2021;30/10/2021;1827;2021-10-30
108;1049;MDPI-SI-BDHA 2021;Call for Papers: Special Issue “Big Data for eHealth Applications” (MDPI Applied Sciences, IF 2.474 – Indexed on Scopus, Web of Science);N/A;N/A;Sep 15, 2021;15/09/2021;1828;2021-09-15
108;1049;ICSRS--Scopus & EI Compendex 2021;2021 5th International Conference on System Reliability and Safety (ICSRS 2021)--Scopus & EI Compendex;Nov 24, 2021 - Nov 26, 2021;Palermo, Italy;Jul 5, 2021;5/07/2021;1829;2021-07-05
108;1049;AIHC 2021;Artificial Intelligence, Neurology and Aging;Nov 5, 2021 - Nov 7, 2021;Shanghai, China;Jul 16, 2021;16/07/2021;1830;2021-07-16
108;1049;JAAMAS MODeM SI 2021;Special Issue of JAAMAS on Multi-Objective Decision Making (MODeM);N/A;N/A;Oct 1, 2021;1/10/2021;1831;2021-10-01
108;1049;UVS-Oman 2022;The 2nd International Conference on Unmanned Vehicle Systems (UVS-Oman 2022) - IEEE;Feb 7, 2022 - Feb 9, 2022;Muscat, Oman;Oct 15, 2021;15/10/2021;1832;2021-10-15
108;1049;SI: Adaptive HAR in smart spaces 2022;Special issue : Adaptive Human Activity and Behaviour Recognition Models for Context Awareness in Intelligent Environments;N/A;N/A;Sep 5, 2021;5/09/2021;1833;2021-09-05
108;1049;AICCC--EI Compendex, Scopus 2021;2021 4th Artificial Intelligence and Cloud Computing Conference (AICCC 2021)--EI Compendex, Scopus;Dec 17, 2021 - Dec 19, 2021;Kyoto, Japan;Aug 5, 2021;5/08/2021;1834;2021-08-05
108;1049;AICCC--EI, Scopus 2021;2021 4th Artificial Intelligence and Cloud Computing Conference (AICCC 2021)--EI Compendex, Scopus;Dec 17, 2021 - Dec 19, 2021;Kyoto, Japan;Aug 5, 2021;5/08/2021;1835;2021-08-05
108;1049;ICRE--EI, Scopus 2021;2021 5th International Conference on Reliability Engineering (ICRE 2021)--EI Compendex, Scopus;Nov 24, 2021 - Nov 26, 2021;Palermo, Italy;Jul 5, 2021;5/07/2021;1836;2021-07-05
108;1049;IRC 2021;IEEE International Conference on Robotic Computing;Nov 15, 2021 - Nov 17, 2021;Taichung, Taiwan;Aug 9, 2021;9/08/2021;1837;2021-08-09
108;1049;BigMM 2021;IEEE International Conference on Multimedia Big Data 2021;Nov 15, 2021 - Nov 17, 2021;Taichung, Taiwan;Aug 9, 2021;9/08/2021;1838;2021-08-09
108;1049;Scopus-CCEAI 2022;The 6th International Conference on Control Engineering and Artificial Intelligence (CCEAI 2022);Jan 6, 2022 - Jan 8, 2022;Hokkaido, Japan;Jul 5, 2021;5/07/2021;1839;2021-07-05
108;1049;ICSED--EI Compendex, Scopus 2021;2021 3rd International Conference on Software Engineering and Development (ICSED 2021)--EI Compendex, Scopus;Nov 19, 2021 - Nov 21, 2021;HuaQiao University, Xiamen?China;Jul 5, 2021;5/07/2021;1840;2021-07-05
108;1049;CCEAI-Scopus 2022;The 6th International Conference on Control Engineering and Artificial Intelligence (CCEAI 2022);Jan 6, 2022 - Jan 8, 2022;Hokkaido, Japan;Jul 5, 2021;5/07/2021;1841;2021-07-05
108;1049;Scopus-ICDPR 2022;The 6th International Conference on Data Processing and Robotics (ICDPR 2022);Jan 6, 2022 - Jan 8, 2022;Hokkaido, Japan;Jul 5, 2021;5/07/2021;1842;2021-07-05
108;1049;ICTS 2021;The 13th International Conference on Information & Communication Technology and System;Oct 20, 2021 - Oct 21, 2021;Virtual conference;Jul 8, 2021;8/07/2021;1843;2021-07-08
108;1049;FAIML 2021;2021 International Conference on Frontiers of Artificial Intelligence and Machine Learning (FAIML 2021);Aug 13, 2021 - Aug 15, 2021;Stockholm, Sweden;Jun 30, 2021;30/06/2021;1844;2021-06-30
108;1049;IEEE SSCI 2021;2021 IEEE Symposium Series on Computational Intelligence;Dec 5, 2021 - Dec 8, 2021;Orlando, Florida, USA;Aug 6, 2021;6/08/2021;1845;2021-08-06
108;1049;IoT Edge Computing AI 2021;Edge Computing Optimization Using Artificial Intelligence Methods;N/A;N/A;Jun 30, 2021;30/06/2021;1846;2021-06-30
108;1049;IEEE CIIoT 2021;IEEE Symposium on Computational Intelligence in IoT and Smart Cities;Dec 5, 2021 - Dec 8, 2021;Orlando, Florida, USA;Aug 6, 2021;6/08/2021;1847;2021-08-06
108;1049;ISAIR 2021;The 6th International Symposium on Artificial Intelligence and Robotics;Aug 21, 2021 - Aug 22, 2021;Fukuoka, Japan;Jun 1, 2021 (Apr 1, 2021);1/06/2021;1848;2021-06-01
108;1049;IEEE WCCI 2022;IEEE World Congress on Computational Intelligence;Jul 18, 2022 - Jul 23, 2022;Padua, Italy;Jan 31, 2022;31/01/2022;1849;2022-01-31
108;1049;BDIoT 2021;5th International Conference on Big Data and Internet of Things - BDIoT’21;Mar 17, 2021 - Mar 18, 2021;Rabat - Morocco;Dec 1, 2021;1/12/2021;1850;2021-12-01
108;1049;ai4i 2021;Artificial Intelligence for Industries (ai4i 2021);Sep 20, 2021 - Sep 22, 2021;Laguna Hills, California, USA;Jul 1, 2021;1/07/2021;1851;2021-07-01
108;1049;AS-RLPMTM 2021;Applied Sciences special issue Rich Linguistic Processing for Multilingual Text Mining;N/A;N/A;Jun 30, 2021;30/06/2021;1852;2021-06-30
108;1049;Frontiers - Human-Media Interaction 2021;Frontiers Research Topic on Computational Commensality;N/A;N/A;Nov 30, 2021 (Mar 31, 2021);30/11/2021;1853;2021-11-30
108;1049;iDSC 2021;4th International Data Science Conference;Oct 20, 2021 - Oct 22, 2021;Vienna;Jun 20, 2021;20/06/2021;1854;2021-06-20
108;1049;NAOME 2021;2021 5th International Conference on Naval Architecture and Ocean&Marine Engineering(NAOME 2021);Dec 10, 2021 - Dec 12, 2021;Shanghai, China;Oct 31, 2021;31/10/2021;1855;2021-10-31
108;1049;ISCSIC 2021;2021 5th International Symposium on Computer Science and Intelligent Control;Nov 12, 2021 - Nov 14, 2021;Rome, Italy;Oct 15, 2021;15/10/2021;1856;2021-10-15
108;1049;TransAI 2021;Transdisciplinary AI 2021;Sep 20, 2021 - Sep 22, 2021;Laguna Hills, CA;Jul 1, 2021;1/07/2021;1857;2021-07-01
108;1049;EMERGING 2021;The Thirteenth International Conference on Emerging Networks and Systems Intelligence;Oct 3, 2021 - Oct 7, 2021;Barcelona, Spain;Jul 5, 2021;5/07/2021;1858;2021-07-05
108;1049;IntelligentIoT 2021;Special Issue Embedded Intelligence in IoT Systems;N/A;N/A;Aug 31, 2021;31/08/2021;1859;2021-08-31
108;1049;Computing4Human 2021;The 2nd International Conference on Human-centered Artificial Intelligence;Oct 28, 2021 - Oct 29, 2021;Da Nang, Vietnam;Jul 2, 2021;2/07/2021;1860;2021-07-02
108;1049;BDSIC--EI, Scopus 2021;2021 3rd International Conference on Big-data Service and Intelligent Computation (BDSIC 2021)--Ei Compendex, Scopus;Nov 19, 2021 - Nov 21, 2021;HuaQiao University, Xiamen?China;Jul 5, 2021;5/07/2021;1861;2021-07-05
108;1049;ACM--ICCPR--Ei, Scopus 2021;ACM--2021 10th International Conference on Computing and Pattern Recognition (ICCPR 2021)--Ei Compendex, Scopus;Oct 15, 2021 - Oct 17, 2021;Shanghai, China;Jun 1, 2021;1/06/2021;1862;2021-06-01
108;1049;ICMU 2021;The 13th International Conference on Mobile Computing and Ubiquitous Networking;Nov 17, 2021 - Nov 19, 2021;Tokyo, Japan;Jun 1, 2021 (May 25, 2021);1/06/2021;1863;2021-06-01
108;1050;SoCAV 2021;2021 International Symposium on Connected and Autonomous Vehicles (SoCAV 2021);Apr 19, 2021 - Apr 21, 2021;Singapore;Mar 20, 2021;20/03/2021;1864;2021-03-20
108;1050;blockchain_ml_iot 2021;Network and Electronics (MDPI) Joint Special Issue - Blockchain and Machine Learning for IoT: Security and Privacy Challenges;N/A;N/A;Dec 31, 2021;31/12/2021;1865;2021-12-31
108;1050;ACM BSCI 2021;The 3rd ACM International Symposium on Blockchain and Secure Critical Infrastructure;Jun 7, 2021 - Jun 11, 2021;Hong Kong, China;Mar 1, 2021;1/03/2021;1866;2021-03-01
108;1050;BDAB 2021;2nd International Conference on Big Data and Blockchain;Mar 20, 2021 - Mar 21, 2021;Vienna, Austria;Feb 20, 2021;20/02/2021;1867;2021-02-20
108;1050;ICBDB 2021;2021 3rd International Conference on Big Data and Blockchain(ICBDB 2021);Dec 3, 2021 - Dec 5, 2021;Beijing, China;Oct 30, 2021;30/10/2021;1868;2021-10-30
108;1050;DEEP-BDB 2021;The 2nd International Conference on Deep Learning, Big Data and Blockchain;Aug 23, 2021 - Aug 25, 2021;Rome, Italy;Mar 10, 2021;10/03/2021;1869;2021-03-10
108;1050;ICSESS 2021;2021 12th International Conference on Software Engineering and Service Science;Aug 20, 2021 - Aug 22, 2021;China;May 15, 2021;15/05/2021;1870;2021-05-15
108;1050;IEEE COINS 2021;Internet of Things IoT | Artificial Intelligence | Machine Learning | Big Data | Blockchain | Edge & Cloud Computing | Security | Embedded Systems |;Aug 23, 2021 - Aug 25, 2021;Hybrid Mode (In-Person & Virtual);Apr 30, 2021;30/04/2021;1871;2021-04-30
108;1050;ACM--BIOTC--Ei and Scopus 2021;ACM--2021 3rd Blockchain and Internet of Things Conference (BIOTC 2021)--Ei Compendex, Scopus;Jul 8, 2021 - Jul 10, 2021;Ho Chi Minh City, Vietnam;Mar 1, 2021;1/03/2021;1872;2021-03-01
108;1050;Call for Book Chapter 2021;Blockchain and Deep Learning - Future Trends and Enabling Technologies;Feb 1, 2021 - Apr 30, 2022;Book Chapter;Jun 4, 2021 (Mar 15, 2021);4/06/2021;1873;2021-06-04
108;1050;IEEE SmartIoT 2021;The 5th IEEE International Conference on Smart Internet of Things;Aug 13, 2021 - Aug 15, 2021;Jeju Island, South Korea;May 1, 2021;1/05/2021;1874;2021-05-01
108;1050;WoSCA 2021;WoSCA 2021 : 2nd International Workshop on Smart Contract Analysis;Jul 12, 2021 - Jul 16, 2021;Aarhus, Denmark;May 14, 2021;14/05/2021;1875;2021-05-14
108;1050;ICEIEC 2021;2021 11th IEEE International Conference on Electronics Information and Emergency Communication;Jun 18, 2021 - Jun 20, 2021;China Hall of Science and Technology;Feb 28, 2021;28/02/2021;1876;2021-02-28
108;1050;SPBP 2021;The Fourth Workshop on Security and Privacy-enhanced Business Process Management;Sep 6, 2021 - Sep 6, 2021;Rome, Italy;May 24, 2021;24/05/2021;1877;2021-05-24
108;1050;BCRE 2021;Blockchain and Renewable Energy (Blockchain for Good);N/A;N/A;May 24, 2021 (Jan 24, 2021);24/05/2021;1878;2021-05-24
108;1050;IEEE COINS 2021;International Conference on Omni-Layer Intelligent Systems Internet of Things IoT | Artificial Intelligence | Machine Learning | Big Data | Blockchain | Edge & Cloud Computing;Aug 23, 2021 - Aug 25, 2021;Barcelona, Spain;Apr 30, 2021;30/04/2021;1879;2021-04-30
108;1050;EAI BigIoT-EDU (virtual) 2021;EAI International Conference on Application of Big Data, Blockchain, and Internet of Things for Education Informatization (online conference);Aug 1, 2021 - Aug 3, 2021;Cyberspace;Mar 31, 2021;31/03/2021;1880;2021-03-31
108;1050;BAHIP 2021;Blockchain Applications in Healthcare: Innovations and Practices;N/A;N/A;Apr 15, 2021;15/04/2021;1881;2021-04-15
108;1050;IEEE COINS 2021;BCIOT - Special Track on Blockchain and Internet of Things (IoT);Aug 23, 2021 - Aug 25, 2021;Barcelona, Spain;Apr 30, 2021;30/04/2021;1882;2021-04-30
108;1050;WCMC - Blockchain SI 2021;WCMC - Blockchain in Wireless Communications and Computing: Security Threats and Applications;N/A;N/A;Mar 12, 2021;12/03/2021;1883;2021-03-12
108;1050;ChainTech @IEEE WETICE 2021;WETICE TRACK on Advances in Blockchain Technologies & Applications;Jun 24, 2021 - Jun 26, 2021;France;Feb 28, 2021;28/02/2021;1884;2021-02-28
108;1050;BIoT 2021;2nd International Conference on Blockchain and Internet of Things;Jun 19, 2021 - Jun 20, 2021;Copenhagen, Denmark;Feb 27, 2021;27/02/2021;1885;2021-02-27
108;1050;IEEE COINS 2021;Hybrid Mode (In-Person & Virtual) | IoT | AI/ML | Big Data | Blockchain | Security | Edge & Cloud Computing | Security | Embedded Systems | EDA | VLSI;Aug 23, 2021 - Aug 25, 2021;In-Person & Virtual) | Barcelona, Spain;Apr 30, 2021;30/04/2021;1886;2021-04-30
108;1050;BlockSys 2021;2021 International Conference on Blockchain and Trustworthy Systems;Aug 5, 2021 - Aug 6, 2021;China;Mar 20, 2021;20/03/2021;1887;2021-03-20
108;1050;IBCOM 2021;2nd International Conference on IoT, Blockchain & Cloud Computing;Nov 20, 2021 - Nov 21, 2021;Zurich, Switzerland;Mar 6, 2021;6/03/2021;1888;2021-03-06
108;1050;BRAINS 2021;3rd Conference on Blockchain Research & Applications for Innovative Networks and Services;Sep 27, 2021 - Sep 30, 2021;Paris, France;Mar 31, 2021;31/03/2021;1889;2021-03-31
108;1050;BIOTC--ACM, Ei and Scopus 2021;ACM--2021 3rd Blockchain and Internet of Things Conference (BIOTC 2021)--Ei Compendex, Scopus;Jul 8, 2021 - Jul 10, 2021;Ho Chi Minh City, Vietnam;Mar 1, 2021;1/03/2021;1890;2021-03-01
108;1050;CRYPIS 2021;10th International Conference on Cryptography and Information Security;Jun 26, 2021 - Jun 27, 2021;Sydney, Australia;Feb 27, 2021;27/02/2021;1891;2021-02-27
108;1050;ICDIPV 2021;10th International Conference on Digital Image Processing and Vision;Jun 26, 2021 - Jun 27, 2021;Sydney, Australia;Feb 27, 2021;27/02/2021;1892;2021-02-27
108;1050;ICEIEC 2021;2021 11th IEEE International Conference on Electronics Information and Emergency Communication;Jun 18, 2021 - Jun 20, 2021;China Hall of Science and Technology;Feb 28, 2021;28/02/2021;1893;2021-02-28
108;1051;ICMLA 2021;20th IEEE International Conference on Machine Learning and Applications;Dec 13, 2021 - Dec 16, 2021;Pasadena, California, USA;Jul 3, 2021;3/07/2021;1894;2021-07-03
108;1051;FAIML 2021;2021 International Conference on Frontiers of Artificial Intelligence and Machine Learning (FAIML 2021);Aug 13, 2021 - Aug 15, 2021;Stockholm, Sweden;Jun 30, 2021;30/06/2021;1895;2021-06-30
108;1051;ML_BDA 2021;Special Issue on Machine Learning Technologies for Big Data Analytics;N/A;N/A;Aug 15, 2021;15/08/2021;1896;2021-08-15
108;1051;ISC HPC 2021;ISC HIGH PERFORMANCE 2021 DIGITAL;Jun 24, 2021 - Jul 2, 2021;Digital;Dec 21, 2021 (Dec 14, 2020);21/12/2021;1897;2021-12-21
108;1051;blockchain_ml_iot 2021;Network and Electronics (MDPI) Joint Special Issue - Blockchain and Machine Learning for IoT: Security and Privacy Challenges;N/A;N/A;Dec 31, 2021;31/12/2021;1898;2021-12-31
108;1051;MDPI mathematics 2021;MDPI mathematics - Special Issue on Computational Optimizations for Machine Learning;N/A;N/A;Sep 30, 2021;30/09/2021;1899;2021-09-30
108;1051;ai4i 2021;Artificial Intelligence for Industries (ai4i 2021);Sep 20, 2021 - Sep 22, 2021;Laguna Hills, California, USA;Jul 1, 2021;1/07/2021;1900;2021-07-01
108;1051;WSPML 2021;2021 3rd International Workshop on Signal Processing and Machine Learning (WSPML 2021);Dec 1, 2021 - Dec 3, 2021;Beijing, China;Oct 31, 2021;31/10/2021;1901;2021-10-31
108;1051;IEEE CIIoT 2021;IEEE Symposium on Computational Intelligence in IoT and Smart Cities;Dec 5, 2021 - Dec 8, 2021;Orlando, Florida, USA;Aug 6, 2021;6/08/2021;1902;2021-08-06
108;1051;iDSC 2021;4th International Data Science Conference;Oct 20, 2021 - Oct 22, 2021;Vienna;Jun 20, 2021;20/06/2021;1903;2021-06-20
108;1051;MAES special issue 2021;"Elsevier Journal of ""Environmental Modelling & Software"", special Issue on ""Machine Learning Advances Environmental Science""";N/A;N/A;Jul 1, 2021;1/07/2021;1904;2021-07-01
108;1051;CCISP-Scopus 2021;The 6th International Conference on Communication, Image and Signal Processing;Nov 19, 2021 - Nov 21, 2021;Chengdu, China;Jul 20, 2021;20/07/2021;1905;2021-07-20
108;1051;Scopus-CCEAI 2022;The 6th International Conference on Control Engineering and Artificial Intelligence (CCEAI 2022);Jan 6, 2022 - Jan 8, 2022;Hokkaido, Japan;Jul 5, 2021;5/07/2021;1906;2021-07-05
108;1051;DAGM GCPR 2021;DAGM German Conference on Pattern Recognition;Sep 28, 2021 - Oct 1, 2021;Bonn;Jun 17, 2021;17/06/2021;1907;2021-06-17
108;1051;CP 2021;Twenty-Seventh Conference on Principles and Practice of Constraint Programming;Oct 25, 2021 - Oct 29, 2021;Montpellier (France);Jun 21, 2021 (May 14, 2021);21/06/2021;1908;2021-06-21
108;1051;IARCE 2021-Ei Compendex & Scopus 2021;2021 5th International Conference on Industrial Automation, Robotics and Control Engineering (IARCE 2021);Jun 18, 2021 - Jun 20, 2021;Chengdu, China;May 20, 2021;20/05/2021;1909;2021-05-20
108;1051;ECML PKDD 2021;European Conference on Machine Learning and Principles and Practice of Knowledge Discovery in Databases;Sep 13, 2021 - Sep 17, 2021;Bilbao, Spain;May 2, 2021;2/05/2021;1910;2021-05-02
108;1051;17th ICTEL Rome 2021;17th ICTEL 2021 – International Conference on Teaching, Education & Learning, 06-07 September, Rome;Sep 6, 2021 - Sep 7, 2021;University of Washington – Rome Center (;Sep 6, 2021 (Sep 5, 2021);6/09/2021;1911;2021-09-06
108;1051;PRICAI 2021;The 18th Pacific Rim International Conference on Artificial Intelligence;Nov 8, 2021 - Nov 12, 2021;Hanoi, Vietnam;May 23, 2021;23/05/2021;1912;2021-05-23
108;1051;TERA - Eurasia Research 2021;19th ICTEL 2021 – International Conference on Teaching, Education & Learning, 11-12 October, Lisbon;Oct 11, 2021 - Oct 12, 2021;Universidade Autónoma de Lisboa (UAL), L;Oct 10, 2021;10/10/2021;1913;2021-10-10
108;1051;20th ICTEL October, Dubai 2021;20th ICTEL 2021 – International Conference on Teaching, Education & Learning, 23-24 October, Dubai;Oct 23, 2021 - Oct 24, 2021;Flora Creek, Deira, Dubai, UAE;Oct 22, 2021;22/10/2021;1914;2021-10-22
108;1051;TERA - Eurasia Research 2021;15th ICTEL 2021 – International Conference on Teaching, Education & Learning, 06-07 September, London;Sep 6, 2021 - Sep 5, 2021;The Tomlinson Centre, Queensbridge Road,;Sep 4, 2021;4/09/2021;1915;2021-09-04
108;1051;13th ICTEL August, Amsterdam 2021;13th ICTEL 2021 – International Conference on Teaching, Education & Learning, 02-03 August, Amsterdam;Aug 2, 2021 - Aug 3, 2021;NH Hotel Amsterdam-Zuid, Van Leijenbergh;Aug 1, 2021;1/08/2021;1916;2021-08-01
108;1051;16th ICTEL Sept, Athens 2021;16th ICTEL 2021 – International Conference on Teaching, Education & Learning, 14-15 September, Athens;Sep 14, 2021 - Sep 15, 2021;Novotel Athenes, Michail Voda 4, Athens,;Sep 13, 2021;13/09/2021;1917;2021-09-13
108;1051;Scoups-FMVIP 2021;2021 International Conference on Frontiers of Machine Vision and Image Processing;Nov 19, 2021 - Nov 21, 2021;Chengdu?China;Jul 20, 2021;20/07/2021;1918;2021-07-20
108;1051;NCAA 2022;Topical Collection on Deep Learning for Time Series Data for Neural Computing and Applications;N/A;N/A;Jun 30, 2021;30/06/2021;1919;2021-06-30
108;1051;IEEE COINS 2021;Internet of Things IoT | Artificial Intelligence | Machine Learning | Big Data | Blockchain | Edge & Cloud Computing | Security | Embedded Systems |;Aug 23, 2021 - Aug 25, 2021;Hybrid Mode (In-Person & Virtual);Apr 30, 2021;30/04/2021;1920;2021-04-30
108;1051;IEEE COINS 2021;AI ML Big Data Vision Track | Artificial Intelligence | Machine Learning | Deep Learning | Machine Vision | Big Data Analytics | Video Analytics;Aug 23, 2021 - Aug 25, 2021;Barcelona, Spain;Apr 30, 2021;30/04/2021;1921;2021-04-30
108;1051;EAI MLICOM 2021;6th EAI International Conference on Machine Learning and Intelligent Communications (Springer, Scopus, ISI, Ei, more);Oct 23, 2021 - Oct 24, 2021;Wuzhou, People's Republic of China;Apr 30, 2021;30/04/2021;1922;2021-04-30
108;1051;XSA 2021;Explainable Deep Learning for Sentiment Analysis;N/A;N/A;Jun 30, 2021;30/06/2021;1923;2021-06-30
108;1051;Identifying Deep Fakes 2021;Deep Learning Algorithms and Techniques to Identify Deepfakes;Feb 15, 2021 - Sep 2, 2021;International;Sep 2, 2021;2/09/2021;1924;2021-09-02
108;1051;ACE 2021;The 13th Asian Conference on Education (ACE2021);Nov 25, 2021 - Nov 28, 2021;Tokyo, Japan;Jul 1, 2021;1/07/2021;1925;2021-07-01
108;1051;ILL 2021;Innovation in Language Learning International Conference – Hybrid Event;Nov 11, 2021 - Nov 12, 2021;Grand Hotel Mediterraneo - Florence, Ita;Sep 19, 2021 (Jun 7, 2021);19/09/2021;1926;2021-09-19
108;1051;AMTA 2021;Association for Machine Translation in the Amercias;Aug 16, 2021 - Aug 20, 2021;Online;May 10, 2021;10/05/2021;1927;2021-05-10
108;1051;MaLeNe 2021;1st International Workshop on Machine Learning in Networking;Sep 13, 2021 - Sep 14, 2021;Lübeck, Germany;May 30, 2021;30/05/2021;1928;2021-05-30
108;1051;ICTSTEM 2021;2021 International Conference on Technologies in STEM ‘LIVE’;Dec 14, 2021 - Dec 15, 2021;Singapore;Jun 16, 2021;16/06/2021;1929;2021-06-16
108;1051;Call for Book Chapter 2021;Blockchain and Deep Learning - Future Trends and Enabling Technologies;Feb 1, 2021 - Apr 30, 2022;Book Chapter;Jun 4, 2021 (Mar 15, 2021);4/06/2021;1930;2021-06-04
108;1051;FUSION 2021;24th International Conference on Information Fusion;Nov 1, 2021 - Nov 4, 2021;Sun City, South Africa;May 15, 2021;15/05/2021;1931;2021-05-15
108;1051;IWAIPR 2021;VII International Workshop on Artificial Intelligence and Pattern Recognition;Oct 5, 2021 - Oct 7, 2021;La Habana, Cuba;May 10, 2021;10/05/2021;1932;2021-05-10
108;1051;SOCIOINT 2021;SOCIOINT 2021- 8th International Conference on Education and Education of Social Sciences;Jun 14, 2021 - Jun 15, 2021;Virtual-Online;Jun 14, 2021;14/06/2021;1933;2021-06-14
108;1051;SciSec 2021;3rd International Conference on Science of Cyber Security;Aug 13, 2021 - Aug 15, 2021;Shanghai, China;May 1, 2021;1/05/2021;1934;2021-05-01
108;1051;NCTA 2021;13th International Conference on Neural Computation Theory and Applications;Oct 25, 2021 - Oct 27, 2021;Valletta, Malta;May 18, 2021;18/05/2021;1935;2021-05-18
108;1051;ICRV--ACM, EI, Scopus 2021;ACM--2021 The 6th International Conference on Robotics and Vision (ICRV 2021)--Ei Compendex, SCOPUS;Sep 18, 2021 - Sep 20, 2021;Lanzhou, China;May 5, 2021;5/05/2021;1936;2021-05-05
108;1051;CP 2021;International Conference on Principles and Practice of Constraint Programming;Oct 25, 2021 - Oct 29, 2021;Montpellier;May 14, 2021;14/05/2021;1937;2021-05-14
108;1051;Hybrid LIYSF 2021;62nd Hybrid LIYSF 2021 STEM programme;Jul 28, 2021 - Aug 11, 2021;LONDON;May 31, 2021;31/05/2021;1938;2021-05-31
108;1052;AICCC--EI, Scopus 2021;2021 4th Artificial Intelligence and Cloud Computing Conference (AICCC 2021)--EI Compendex, Scopus;Dec 17, 2021 - Dec 19, 2021;Kyoto, Japan;Aug 5, 2021;5/08/2021;1939;2021-08-05
108;1052;ICBICC 2021;2021 3rd International Conference on Big Data, IoT, and Cloud Computing (ICBICC 2021);Nov 12, 2021 - Nov 14, 2021;Rome, Italy;Sep 30, 2021;30/09/2021;1940;2021-09-30
108;1052;AICCC--EI Compendex, Scopus 2021;2021 4th Artificial Intelligence and Cloud Computing Conference (AICCC 2021)--EI Compendex, Scopus;Dec 17, 2021 - Dec 19, 2021;Kyoto, Japan;Aug 5, 2021;5/08/2021;1941;2021-08-05
108;1052;ADVCOMP 2021;The Fifteenth International Conference on Advanced Engineering Computing and Applications in Sciences;Oct 3, 2021 - Oct 7, 2021;Barcelona, Spain;Jul 5, 2021;5/07/2021;1942;2021-07-05
108;1052;ICSED--EI, Scopus 2021;2021 3rd International Conference on Software Engineering and Development (ICSED 2021)--EI Compendex, Scopus;Nov 19, 2021 - Nov 21, 2021;HuaQiao University, Xiamen?China;Jul 5, 2021;5/07/2021;1943;2021-07-05
108;1052;BDSIC--EI, Scopus 2021;2021 3rd International Conference on Big-data Service and Intelligent Computation (BDSIC 2021)--Ei Compendex, Scopus;Nov 19, 2021 - Nov 21, 2021;HuaQiao University, Xiamen?China;Jul 5, 2021;5/07/2021;1944;2021-07-05
108;1052;CFMAI 2021;2021 3rd International Conference on Frontiers of Mathematics and Artificial Intelligence (CFMAI 2021);Dec 1, 2021 - Dec 3, 2021;Beijing, China;Oct 31, 2021;31/10/2021;1945;2021-10-31
108;1052;ICONIP 2021;The 28th International Conference on Neural Information Processing (ICONIP2021);Dec 8, 2021 - Dec 12, 2021;Bali, Indonesia;Jun 30, 2021;30/06/2021;1946;2021-06-30
108;1052;IoT Edge Computing AI 2021;Edge Computing Optimization Using Artificial Intelligence Methods;N/A;N/A;Jun 30, 2021;30/06/2021;1947;2021-06-30
108;1052;ISC HPC 2021;ISC HIGH PERFORMANCE 2021 DIGITAL;Jun 24, 2021 - Jul 2, 2021;Digital;Dec 21, 2021 (Dec 14, 2020);21/12/2021;1948;2021-12-21
108;1052;JCC-BD&ET 2021;9th Conference on Cloud Computing, Big Data & Emerging Topics--Springer CCIS (Ei Compendex & Scopus);Jun 21, 2021 - Jun 24, 2021;La Plata, Argentina;Mar 31, 2021;31/03/2021;1949;2021-03-31
108;1052;CCBD--Ei & Scopus 2021;2021 The 8th International Conference on Cloud Computing and Big Data (CCBD 2021)--Ei Compendex & Scopus;Aug 21, 2021 - Aug 23, 2021;Xi'an, China;Mar 25, 2021;25/03/2021;1950;2021-03-25
108;1052;SA-TTA 2021;The 9th track on Software Architecture: Theory, Technology, and Applications (SA-TTA) at the 36th ACM/SIGAPP Symposium On Applied Computing (SAC 2021);Mar 22, 2021 - Mar 26, 2021;Gwangju, Korea;Oct 28, 2021;28/10/2021;1951;2021-10-28
108;1052;PARMA-DITAM 2021;PARMA-DITAM: 12th Workshop on Parallel Programming and Run-Time Management Techniques for Many-core Architectures & 10th Workshop on Design Tools and Architectures for Multi-Core;Jan 19, 2021 - Jan 19, 2021;Virtual;Nov 13, 2021;13/11/2021;1952;2021-11-13
108;1052;CLNLP 2021;2021 2nd International Conference on Computational Linguistics and Natural Language Processing (CLNLP 2021);Dec 3, 2021 - Dec 5, 2021;Beijing, China;Oct 30, 2021;30/10/2021;1953;2021-10-30
108;1052;SI: Adaptive HAR in smart spaces 2022;Special issue : Adaptive Human Activity and Behaviour Recognition Models for Context Awareness in Intelligent Environments;N/A;N/A;Sep 5, 2021;5/09/2021;1954;2021-09-05
108;1052;ICRE--EI Compendex, Scopus 2021;2021 5th International Conference on Reliability Engineering (ICRE 2021)--EI Compendex, Scopus;Nov 24, 2021 - Nov 26, 2021;Palermo, Italy;Jul 5, 2021;5/07/2021;1955;2021-07-05
108;1052;ITAS--EI Compendex, Scopus 2021;2021 Information Technology & Applications Symposium (ITAS 2021)--EI Compendex, Scopus;Aug 21, 2021 - Aug 23, 2021;Xi'an, China;Mar 25, 2021;25/03/2021;1956;2021-03-25
108;1052;ISCAI 2021;2021 3rd International Symposium on Computing and Artificial Intelligence (ISCAI 2021);Dec 1, 2021 - Dec 3, 2021;Beijing, China;Oct 31, 2021;31/10/2021;1957;2021-10-31
108;1052;EI-WBDC 2021;2021 3rd International Workshop on Big Data and Computing(WBDC 2021);Dec 3, 2021 - Dec 5, 2021;Beijing, China;Oct 31, 2021;31/10/2021;1958;2021-10-31
108;1052;ISAIC 2021;The 2nd International Symposium on Automation, Information and Computing (ISAIC 2021);Dec 3, 2021 - Dec 6, 2021;Beijing Jiaotong University, China;Oct 15, 2021;15/10/2021;1959;2021-10-15
108;1052;SI: Advanced Technology for IE 2022;Special Issue: Secure and Advanced Technology for Intelligent Environments;Jan 1, 2021 - Jun 1, 2022;JAISE (IOS) journal;Sep 5, 2021;5/09/2021;1960;2021-09-05
108;1052;SI: IE for Health and Well-being 2022;Special issue: Intelligent Environments for Health and Well-being;Jan 1, 2021 - Jun 1, 2020;Applied human informatics (AHI) journal;Sep 5, 2021;5/09/2021;1961;2021-09-05
108;1052;EI-CoEEPE 2021;2021 International Joint Conference on Energy, Electrical and Power Engineering (CoEEPE 2021);Sep 17, 2021 - Sep 19, 2021;Frankfurt, Germany;Jul 31, 2021;31/07/2021;1962;2021-07-31
108;1052;ICSRS--Scopus & EI 2021;2021 5th International Conference on System Reliability and Safety (ICSRS 2021)--Scopus & EI Compendex;Nov 24, 2021 - Nov 26, 2021;Palermo, Italy;Jul 5, 2021;5/07/2021;1963;2021-07-05
108;1052;CCCI 2021;International Conference on Communications, Computing, Cybersecurity, and Informatics;Oct 15, 2021 - Oct 17, 2021;Beijing, China;Jul 24, 2021;24/07/2021;1964;2021-07-24
108;1052;UBICOMM 2021;The Fifteenth International Conference on Mobile Ubiquitous Computing, Systems, Services and Technologies;Oct 3, 2021 - Oct 7, 2021;Barcelona, Spain;Jul 5, 2021;5/07/2021;1965;2021-07-05
108;1052;ACM MIDDLEWARE 2021;22nd ACM/IFIP International Conference;Dec 6, 2021 - Dec 10, 2021;Québec City, Canada;May 22, 2021 (May 15, 2021);22/05/2021;1966;2021-05-22
108;1052;IRC 2021;IEEE International Conference on Robotic Computing;Nov 15, 2021 - Nov 17, 2021;Taichung, Taiwan;Aug 9, 2021;9/08/2021;1967;2021-08-09
108;1052;ICSED--EI Compendex, Scopus 2021;2021 3rd International Conference on Software Engineering and Development (ICSED 2021)--EI Compendex, Scopus;Nov 19, 2021 - Nov 21, 2021;HuaQiao University, Xiamen?China;Jul 5, 2021;5/07/2021;1968;2021-07-05
108;1052;INNOV 2021;The Tenth International Conference on Communications, Computation, Networks and Technologies;Oct 3, 2021 - Oct 7, 2021;Barcelona, Spain;Jul 5, 2021;5/07/2021;1969;2021-07-05
108;1052;JCC 2021;The Second IEEE International Conference on JointCloud Computing;Aug 23, 2021 - Aug 26, 2021;onlin;May 1, 2021 (Apr 24, 2021);1/05/2021;1970;2021-05-01
108;1052;IntelligentIoT 2021;Special Issue Embedded Intelligence in IoT Systems;N/A;N/A;Aug 31, 2021;31/08/2021;1971;2021-08-31
108;1052;AMBIENT 2021;The Eleventh International Conference on Ambient Computing, Applications, Services and Technologies;Oct 3, 2021 - Oct 7, 2021;Barcelona, Spain;Jul 5, 2021;5/07/2021;1972;2021-07-05
108;1052;ICSEA 2021;The Sixteenth International Conference on Software Engineering Advances;Oct 3, 2021 - Oct 7, 2021;Barcelona, Spain;Jul 5, 2021;5/07/2021;1973;2021-07-05
108;1052;BDSIC--EI Compendex, Scopus 2021;2021 3rd International Conference on Big-data Service and Intelligent Computation (BDSIC 2021)--Ei Compendex, Scopus;Nov 19, 2021 - Nov 21, 2021;HuaQiao University, Xiamen?China;Jul 5, 2021;5/07/2021;1974;2021-07-05
108;1052;ACM--CCIOT--EI, Scopus 2021;ACM--2021 6th International Conference on Cloud Computing and Internet of Things (CCIOT 2021)--Ei Compendex, Scopus;Sep 22, 2021 - Sep 24, 2021;Okinawa, Japan;May 10, 2021;10/05/2021;1975;2021-05-10
108;1052;IEEE COINS 2021;Internet of Things IoT | Artificial Intelligence | Machine Learning | Big Data | Blockchain | Edge & Cloud Computing | Security | Embedded Systems |;Aug 23, 2021 - Aug 25, 2021;Hybrid Mode (In-Person & Virtual);Apr 30, 2021;30/04/2021;1976;2021-04-30
108;1052;ICCPR--ACM, Ei, Scopus 2021;ACM--2021 10th International Conference on Computing and Pattern Recognition (ICCPR 2021)--Ei Compendex, Scopus;Oct 15, 2021 - Oct 17, 2021;Shanghai, China;Jun 1, 2021;1/06/2021;1977;2021-06-01
108;1052;CCIOT--ACM, EI Compendex, Scopus 2021;ACM--2021 6th International Conference on Cloud Computing and Internet of Things (CCIOT 2021)--Ei Compendex, Scopus;Sep 22, 2021 - Sep 24, 2021;Okinawa, Japan;May 10, 2021;10/05/2021;1978;2021-05-10
108;1052;WSSE--ACM, Ei, Scopus 2021;ACM--2021 The 3rd World Symposium on Software Engineering (WSSE 2021)--EI Compendex, Scopus;Sep 24, 2021 - Sep 26, 2021;Xiamen, China;Apr 10, 2021;10/04/2021;1979;2021-04-10
108;1052;IEEE COINS 2021;International Conference on Omni-Layer Intelligent Systems Internet of Things IoT | Artificial Intelligence | Machine Learning | Big Data | Blockchain | Edge & Cloud Computing;Aug 23, 2021 - Aug 25, 2021;Barcelona, Spain;Apr 30, 2021;30/04/2021;1980;2021-04-30
108;1052;ACM--ICBDT--EI, Scopus 2021;ACM--2021 4th International Conference on Big Data Technologies (ICBDT 2021)--EI Compendex, Scopus;Sep 24, 2021 - Sep 26, 2021;Zibo, China;May 10, 2021;10/05/2021;1981;2021-05-10
108;1052;ICI 2021;The 7th International Symposium on Intercloud and IoT;Aug 23, 2021 - Aug 25, 2021;Rome, Italy;May 20, 2021;20/05/2021;1982;2021-05-20
108;1052;ICCBDC--ACM, Ei Compendex and Scopus 2021;ACM--2021 5th International Conference on Cloud and Big Data Computing (ICCBDC 2021)--Ei Compendex, Scopus;Aug 20, 2021 - Aug 22, 2021;Liverpool, United Kingdom;Apr 10, 2021;10/04/2021;1983;2021-04-10
108;1052;Scopus-DIKW-RA 2021;2021 Future Data, Information and Knowledge Research and Applications Conference (DIKW-RA 2021);Oct 28, 2021 - Oct 30, 2021;Sanya, China;Apr 30, 2021;30/04/2021;1984;2021-04-30
108;1052;ICBDR--ACM, Ei, Scopus 2021;ACM--2021 The 5th International Conference on Big Data Research (ICBDR 2021)--Ei Compendex, Scopus;Sep 25, 2021 - Sep 27, 2021;Tokyo, Japan;Apr 10, 2021;10/04/2021;1985;2021-04-10
108;1052;BDIOT--ACM, Ei and Scopus 2021;ACM--2021 the 5th International Conference on Big Data and Internet of Things (BDIOT 2021)--Ei Compendex, Scopus;Aug 13, 2021 - Aug 15, 2021;Singapore;Apr 1, 2021;1/04/2021;1986;2021-04-01
108;1052;QUORS 2021;The 15th IEEE International Workshop on Quality Oriented Reuse of Software;Jul 13, 2021 - Jul 16, 2021;Virtual due to COVID, Madrid, Spain;Apr 21, 2021;21/04/2021;1987;2021-04-21
108;1052;ACM--ICCBDC--Ei and Scopus 2021;ACM--2021 5th International Conference on Cloud and Big Data Computing (ICCBDC 2021)--Ei Compendex, Scopus;Aug 20, 2021 - Aug 22, 2021;Liverpool, United Kingdom;Apr 10, 2021;10/04/2021;1988;2021-04-10
108;1052;VHPC 2021;16th Workshop on Virtualization in High-Performance Cloud Computing;Jul 2, 2021 - Jul 2, 2021;Zoom;Apr 5, 2021 (Feb 15, 2021);5/04/2021;1989;2021-04-05
